Dialog_ID,Type,Actor,Text,Label
hit:10058_conv:20117,utterance,speaker,My boyfriend want to buy a house but I think the housing bubble is going to burst again.,apprehensive
hit:10058_conv:20117,utterance,listener,you know sometimes it is hard to predict something like that,agreeing
hit:10058_conv:20117,utterance,speaker,"yeah, I just don't want to be one of the unlucky one's",agreeing
hit:10058_conv:20117,utterance,listener,"but if you don't buy now, as the prices go higher, you will regret it",neutral
hit:10058_conv:20117,utterance,speaker,You are right. Thanks!,agreeing
hit:12382_conv:24764,situation,none,I'm not sure if my boyfriend wants to get married yet. I won't rush him though.,apprehensive
hit:12382_conv:24764,utterance,speaker,I'm not sure if my boyfriend wants to get married yet. I won't rush him though.,apprehensive
hit:12382_conv:24764,utterance,listener,"Communication is key, have you talked to him about it?",questioning
hit:12382_conv:24764,utterance,speaker,"Yeah, but it doesn't seem like he's in a rush. He's 35 though....",neutral
hit:12382_conv:24764,utterance,listener,"Age doesn't amtter, show him you are ready.",neutral
hit:7385_conv:14770,situation,none,Starting some new herbs and I am a bit scared I might have bad effects. I have SUCH a sensitive digestive system.,apprehensive
hit:7385_conv:14770,utterance,speaker,Starting some new herbs and I am a bit scared I might have bad effects.,apprehensive
hit:7385_conv:14770,utterance,listener,"Just be careful, I am sure you know what you are doing",trusting
hit:7385_conv:14770,utterance,speaker,"Oh yes, I research everything a LOT but I have such a sensitive system and I'm allergic to so many things..So I hope they help instead of hurt",encouraging
hit:7385_conv:14770,utterance,listener,I am sure you will be okay,confident
hit:11010_conv:22021,situation,none,My son is getting ready for his senior year. I'm nervous about him leaving home next year.,apprehensive
hit:11010_conv:22021,utterance,speaker,My son is getting ready for his senior year in high school. I have mixed feelings about it!,apprehensive
hit:11010_conv:22021,utterance,listener,your are torn between him being a man but you still think of him being your little boy,neutral
hit:11010_conv:22021,utterance,speaker,"Yes. I'm so excited for him, but also I am so nervous. I'm worried about getting through the application process, and also worried about him leaving home.",anxious
hit:11010_conv:22021,utterance,listener,you will enjoy it as he grows older because you had a hand in it and know that he will be prepared for it,neutral
hit:11010_conv:22021,utterance,speaker,"Oh, I hope you are right! Right now I'm losing more sleep than I should!",agreeing
hit:8952_conv:17904,situation,none,"I am making my wife dinner with this new rub I just bought.  I think I""m gonna love it, but I'm pretty sure she's gonna hate it.",apprehensive
hit:8952_conv:17904,utterance,speaker,I am making my wife dinner with this new rub I bought for the chicken.  It,confident
hit:8952_conv:17904,utterance,listener,That sounds so good!,acknowledging
hit:8952_conv:17904,utterance,speaker,Yeah it's got coffee grounds in it... I'm pretty sure she's gonna hate it though.  Wish me luck!,wishing
hit:8952_conv:17904,utterance,listener,"Oh no, I bet she ends up loving it!  Best of luck!",encouraging
hit:10427_conv:20854,situation,none,"I was scared to go on the new roller coaster at Six Flags, because it is so high and fast. I felt sick to my stomach while I was waiting in line.",apprehensive
hit:10427_conv:20854,utterance,speaker,I felt sick to my stomach waiting in line for a new roller coaster.,apprehensive
hit:10427_conv:20854,utterance,listener,I would have felt the same way. I am really afraid to get on any roller coaster. How was it?,terrified
hit:10427_conv:20854,utterance,speaker,"Well, my fear didn't get any better as it started moving. But by the end I loved it!",neutral
hit:10427_conv:20854,utterance,listener,That's awesome. Glad you had fun! That's what's important,acknowledging
hit:10427_conv:20854,utterance,speaker,Somehow I remember them being less scary when I was a kid,nostalgic
hit:5442_conv:10885,situation,none,"The first time I donated blood, I instantly regretted signing up. I was so nervous of the big needle, but when I finally donated it was totally nothing.",apprehensive
hit:5442_conv:10885,utterance,speaker,"So the first time I ever went to donate blood, after I signed up I instantly regretted it. I was soo worried about that big needle, and when it finally came time? It wasn't even a big deal, it was soo easy.",apprehensive
hit:5442_conv:10885,utterance,listener,Everything is harder until we do it. And am proud of you for donating blood. It is one of the good habit of this human race i would say.,neutral
hit:5442_conv:10885,utterance,speaker,"Thank you! I felt a lot better after having done it. Do you know what blood type you are? I'm O+, so I feel like I really aught to donate more.",grateful
hit:5442_conv:10885,utterance,listener,"yeah am B+, O+ is quite common and it can match for other blood group and O-ve is the opposite",agreeing
hit:6717_conv:13434,situation,none,I am weary about ordering chicken now. It made me really sick once,apprehensive
hit:6717_conv:13434,utterance,speaker,I don't order chicken anymore from restaurants,apprehensive
hit:6717_conv:13434,utterance,listener,Why not? I LOVE chicken!,joyful
hit:6717_conv:13434,utterance,speaker,I got sick the ;ast time and i am too scared,afraid
hit:6717_conv:13434,utterance,listener,Oh no! Maybe the restaurant you ate from wasn't clean?,suggesting
hit:6717_conv:13434,utterance,speaker,I think so but I am just too scared now,afraid
hit:10715_conv:21430,situation,none,"There was a time when I finally dredged up the courage to visit my neighbor's chickens. I was really scared that they would peck at me, because I've heard that the roosters are very angsty and territorial.",apprehensive
hit:10715_conv:21430,utterance,speaker,"When I stepped into the chicken coup, I was rushed by a bunch of hungry chickens! They apparently are fed someone comes in and opens a bucket.",disgusted
hit:10715_conv:21430,utterance,listener,whoa that's nuts. how many did you have to kick to get out alive?,questioning
hit:10715_conv:21430,utterance,speaker,"There were around 20 at the time. However, I soon learned that they didn't want to eat me.",neutral
hit:10715_conv:21430,utterance,listener,oh good. well what did they end up wanting?,questioning
hit:10715_conv:21430,utterance,speaker,"The chicken feed, apparently. The neighbors usually feed them every morning, and they were waiting expectantly.",surprised
hit:10715_conv:21430,utterance,listener,well I hope you're ok now,consoling
hit:10715_conv:21430,utterance,speaker,"I has cured my fear of chickens, actually!",excited
hit:10715_conv:21430,utterance,listener,"oh sweet, how many do you own now?",questioning
hit:11075_conv:22150,situation,none,This guy on the phone kept asking for info and i was worried it was a scam,apprehensive
hit:11075_conv:22150,utterance,speaker,I got a call and the guy kept asking for all my info like my social it was kinda unerving,apprehensive
hit:11075_conv:22150,utterance,listener,"That is very odd, I wouldn't give them any of that information. He is up to no good!",surprised
hit:11075_conv:22150,utterance,speaker,Yeah i hung up and reported the call,guilty
hit:11075_conv:22150,utterance,listener,Good call! I would of done the same thing. You can never be too careful!,acknowledging
hit:3021_conv:6042,situation,none,Well someone I am thinking of working things out with talked about coming over on Sunday. I felt really uncomfortable with that because they haven't done enough to build back enough trust with me yet. And lo and behold..they acted up and made the decision for me anyway.,apprehensive
hit:3021_conv:6042,utterance,speaker,Well someone I am thinking of working things out with talked about coming over on Sunday. I felt really uncomfortable with that because they haven't done enough to build back enough trust with me yet.,apprehensive
hit:3021_conv:6042,utterance,listener,Maybe you should be straight with him?  Thats the only thing that will make it good in my opinion.,suggesting
hit:3021_conv:6042,utterance,speaker,I always am but I just have to word things in a good way..however lo and behold..they acted up and made the decision for me anyway.,neutral
hit:3021_conv:6042,utterance,listener,I know the type.  There are better people out there that you just have to be patient for.,agreeing
hit:7838_conv:15676,situation,none,My friend invited me on a cruise but I wasn't sure about it because I get seasick easily.,apprehensive
hit:7838_conv:15676,utterance,speaker,My friend invited me to go on a cruise,excited
hit:7838_conv:15676,utterance,listener,"Wow, how exciting. Are you going to go?",questioning
hit:7838_conv:15676,utterance,speaker,I'm not sure about it to be honest. I get very seasick.,apprehensive
hit:7838_conv:15676,utterance,listener,"You can get the pills, the patch or that bracelet to help.",acknowledging
hit:10364_conv:20728,situation,none,"I've gotten this job opportunity but, I don't think it will be a good fit",apprehensive
hit:10364_conv:20728,utterance,speaker,"I've gotten this job opportunity but, I don't think it will be a good fit",apprehensive
hit:10364_conv:20728,utterance,listener,Why don't you think it will be a good fit? You might be underestimating yourself,hopeful
hit:10364_conv:20728,utterance,speaker,"Well, it's a factory job and I'm afraid that the monotony will be too soul-crushing",apprehensive
hit:10364_conv:20728,utterance,listener,You do have a good point. You really should do what will make you happy because life is just too short,agreeing
hit:10326_conv:20653,situation,none,"Started a new job.  In an industry i have never worked in, with people from all over and a physically demanding job.",apprehensive
hit:10326_conv:20653,utterance,speaker,"Started a new job, it's so different from what I always have done.",apprehensive
hit:10326_conv:20653,utterance,listener,Do you at least enjoy the new job?,questioning
hit:10326_conv:20653,utterance,speaker,"I do, just hard work, used to sitting at a desk.",confident
hit:10326_conv:20653,utterance,listener,"Hopefully the more you warm up to the new job, it will become easier.",consoling
hit:10326_conv:20653,utterance,speaker,"Hope so, my muscles are sore right now.",encouraging
hit:10161_conv:20323,situation,none,All my friends signed up for horse back riding lessons but I had never been before.  I wasn't sure I wanted to go with them but they convinced me to sign up and go even though I was very scared!,apprehensive
hit:10161_conv:20323,utterance,speaker,All my friends signed up for horse back riding lessons but I'd never been before and was scared.  They convinced me to sign up and take them!,trusting
hit:10161_conv:20323,utterance,listener,"It does sound like fun, though. Did you have a good time?",questioning
hit:10161_conv:20323,utterance,speaker,I wouldn't say it was a good time but I'm glad I tried it!,neutral
hit:10161_conv:20323,utterance,listener,Are you ever going to do it again or are you done? I went when I was a child.,questioning
hit:6242_conv:12484,situation,none,I am feeling quite a lot of trepidation about the weekend coming up. It might involve seeing someone I am kind of involved with and I am not ready to see them again.,apprehensive
hit:6242_conv:12484,utterance,speaker,I am feeling quite a lot of trepidation about the weekend coming up.,apprehensive
hit:6242_conv:12484,utterance,listener,why whats going on?,questioning
hit:6242_conv:12484,utterance,speaker,It might involve seeing someone I am kind of involved with and I am not ready to see them again.,apprehensive
hit:6242_conv:12484,utterance,listener,ahh thats not good! hopefully it works out for you,consoling
hit:1920_conv:3840,situation,none,"I went to Disney World in March.  I was in line for a roller coaster, and started feeling very nervous about it.",apprehensive
hit:1920_conv:3840,utterance,speaker,"Hi, at march break I went to Disney World with my family.",joyful
hit:1920_conv:3840,utterance,listener,sounds fun how long were you there,acknowledging
hit:1920_conv:3840,utterance,speaker,We were there for a week.  A lot of the roller coasters made me nervous though.,anxious
hit:1920_conv:3840,utterance,listener,aw what was your favorite things to do while there,questioning
hit:11017_conv:22035,situation,none,"I recently joined a new team of people at work (a new work group), and I was feeling unsure about the goals of the project we were working on or whether the project was even a good idea or not.",apprehensive
hit:11017_conv:22035,utterance,speaker,"I was recently added to a team of people to work on a new project at my job.  I'm not really sure the goal of the project is a good idea, so I've been reluctant to really jump into the project fully.",apprehensive
hit:11017_conv:22035,utterance,listener,Why do you feel that way?,questioning
hit:11017_conv:22035,utterance,speaker,"I'm very pragmatic, and like to focus on the specific outcomes and logistics.  Everyone else on this team has more of a big-picture view and is concerned with how this will make our organization look good at a national scale.  It's a difference of priorities, I suppose.",jealous
hit:11017_conv:22035,utterance,listener,You sound a bit like me. I get lost in the details of things myself sometimes. I'm sure after you weigh the pros and cons of the situation you'll come to the right conclusion for yourself.,trusting
hit:5809_conv:11618,situation,none,"Last month, I had to give a presentation at a big research convention. I was really nervous!",apprehensive
hit:5809_conv:11618,utterance,speaker,I had to give a presentation at a big convention last month. I'm not used to presenting and I was really nervous!,anxious
hit:5809_conv:11618,utterance,listener,How did it go than?,questioning
hit:5809_conv:11618,utterance,speaker,It turned out all right. But my stomach was in knots the whole time.,neutral
hit:5809_conv:11618,utterance,listener,"Of course it was, but next time you'll handle it better.",neutral
hit:9054_conv:18108,situation,none,A bit worried about the future today. There is so much to get done before winter comes and I only have so many hours in the day,apprehensive
hit:9054_conv:18108,utterance,speaker,A bit worried about the future today.,apprehensive
hit:9054_conv:18108,utterance,listener,why what happened,questioning
hit:9054_conv:18108,utterance,speaker,I just have a lot to get done before winter comes and I only have so many hours in the day. It can be overwintering as I work 2 jobs and run a business on top of it.,anxious
hit:9054_conv:18108,utterance,listener,hopefully it works out for you,consoling
hit:338_conv:677,situation,none,"Buying my first home, and I'm worried about all the expenses that might happen besides the mortgage.",apprehensive
hit:338_conv:677,utterance,speaker,"so I'm buying my first home, and I'm worried about all the expenses that might happen besides the mortgage.",apprehensive
hit:338_conv:677,utterance,listener,"Oh, that is exciting. How big is your house?",questioning
hit:338_conv:677,utterance,speaker,"It's a small 3 bedroom home, 1 level. It's just me and my elderly mom.",lonely
hit:338_conv:677,utterance,listener,"Oh, that sounds nice. What's your occupation?",questioning
hit:12421_conv:24843,situation,none,I have an overseas trip coming up. I have never been and I am feeling a little scared right now about going.,apprehensive
hit:12421_conv:24843,utterance,speaker,I have an overseas trip coming up. I have never been and I am feeling a little scared right now about going.,apprehensive
hit:12421_conv:24843,utterance,listener,that is exciting@,acknowledging
hit:12421_conv:24843,utterance,speaker,Yea but I have never been in a foreign country before.,neutral
hit:12421_conv:24843,utterance,listener,yeah same but it can be fun,neutral
hit:11427_conv:22854,situation,none,My sister wants me to come out for drinks with her. I don't really drink nor do I like her friends. I don't think I want to go.,apprehensive
hit:11427_conv:22854,utterance,speaker,"My sister asked me to go out for drinks with her, but I don't drink",apprehensive
hit:11427_conv:22854,utterance,listener,Did you go with her anyway?,questioning
hit:11427_conv:22854,utterance,speaker,I don't think I want to. It makes me feel weird.,apprehensive
hit:11427_conv:22854,utterance,listener,I understand that.,agreeing
hit:11934_conv:23868,situation,none,Sometimes I'm afraid to ride the city bus because you never know what kind of drama will unfold.,apprehensive
hit:11934_conv:23868,utterance,speaker,Once I rode the city bus and a guy tried to get a free ride and an argument broke out between him and the driver.,angry
hit:11934_conv:23868,utterance,listener,"Oh, it's crazy what some people will try. But, sometimes an argument can get very interesting to watch!",neutral
hit:11934_conv:23868,utterance,speaker,"Yeah, it ended with the driver threatening to call the police because the guy was getting really loud about it. Held us up for about 10 minutes.",neutral
hit:11934_conv:23868,utterance,listener,"I don't really blame the driver. Plus, that's annoying delay in everybody's busy day.",lonely
hit:10464_conv:20928,situation,none,The building where I work is under construction and senior leadership was recently offering tours to staff members. I was a little nervous about having to walk through a live construction zone and thought I might trip on something.,apprehensive
hit:10464_conv:20928,utterance,speaker,I work in a building that has parts of it under construction and our senior staff is offering tours. I'm a little worried about tripping and falling on something if I take a tour through the live construction zone.,apprehensive
hit:10464_conv:20928,utterance,listener,"I can certainly relate to you, it could be a safety hazard.",agreeing
hit:10464_conv:20928,utterance,speaker,"I agree! I think if I do it, i need to buy some closed-toe shoes and make sure I'm wearing the correct clothing.",agreeing
hit:10464_conv:20928,utterance,listener,"That's a smart move, that would reduce the risk of injury.",acknowledging
hit:10305_conv:20610,situation,none,"About a year ago, my doctor asked me about an unusual mole on my shoulder.  She got out this special light and said she didn't like the look of it.  She sent me down to a dermatologist and I waited around for a couple hours.  He took a biopsy and I had to wait a week for the results.  It was a long wait.",apprehensive
hit:10305_conv:20610,utterance,speaker,I had a cancer scare last year.  My doctor found a strange mole. I had to wait a week for the biopsy to come back.  It was a long wait!,anxious
hit:10305_conv:20610,utterance,listener,I can't imagine what that must have felt like. What helped you get through it?,acknowledging
hit:10305_conv:20610,utterance,speaker,Xanax!  Just kidding.  I didn't have much help dealing with it because I didn't tell anyone.,lonely
hit:10305_conv:20610,utterance,listener,At least you kept your sense of humor!,neutral
hit:10305_conv:20610,utterance,speaker,"In retrospect!  I was pretty freaked out.  My family was mad at me for not telling them, but I didn't want them to worry.",afraid
hit:10269_conv:20538,situation,none,I've been anxious because I think my new landlords don't approve of dogs in the house I'm renting and I have a dog!,apprehensive
hit:10269_conv:20538,utterance,speaker,I've been anxious because I think my new landlords don't approve of dogs in the house I'm renting and I have a dog!,apprehensive
hit:10269_conv:20538,utterance,listener,Oh no that is awful! It is against the law where I live to ban animals from the house. So legally I am allowed to have a pet even if the contract says no pets allowed.,angry
hit:10269_conv:20538,utterance,speaker,Really? I did not know such laws exist but it's awesome. Where do you live?,questioning
hit:10269_conv:20538,utterance,listener,Canada! You should check the laws in your area to see whether or not you are legally allowed to have a pet even if the land lords do not approve.,suggesting
hit:3000_conv:6001,situation,none,I am reluctant to confront my my best friend's girlfriend. I think my best friend is cheating on her...,apprehensive
hit:3000_conv:6001,utterance,speaker,I am reluctant to confront my my best friend's girlfriend. I think my best friend is cheating on her...,apprehensive
hit:3000_conv:6001,utterance,listener,You should definitely first talk to your friend and clear out the concerns with him before talking to his partner,agreeing
hit:3000_conv:6001,utterance,speaker,I don't know what to do but I'm apprehensive. Should I tell her?,apprehensive
hit:3000_conv:6001,utterance,listener,"As I said, first ask your friend why is he behaving in such an unacceptable way",disgusted
hit:6117_conv:12235,situation,none,I was nervous going on a first date last weekend. I thought about not going,apprehensive
hit:6117_conv:12235,utterance,speaker,I was nervous going on a first date last weekend. I thought about not going,apprehensive
hit:6117_conv:12235,utterance,listener,That is understandable.  Did you end up going?,questioning
hit:6117_conv:12235,utterance,speaker,"I did and it was fine, nothing to be nervous about",content
hit:6117_conv:12235,utterance,listener,Are you going out again?,questioning
hit:10176_conv:20352,situation,none,"Working as a nurse, there are many times when I have been worried about my patients. Sometimes when a patient is just starting to get seriously ill, there are not any obvious signs, but my intuition is almost always correct.",apprehensive
hit:10176_conv:20352,utterance,speaker,Intuition can be a key tool to a seasoned nurse.,trusting
hit:10176_conv:20352,utterance,listener,"I suppose, but research and concrete knowledge is more beneficial as it is a very hands on and physical occupation, especially when the health of others are in their hands.",neutral
hit:10176_conv:20352,utterance,speaker,Those are very beneficial tools as well but sometimes experience plays a large part in patient outcomes.,neutral
hit:10176_conv:20352,utterance,listener,That is true. There are many situations where experience can strengthen your skills compared to just learning it from a book.,agreeing
hit:10176_conv:20352,utterance,speaker,Skills can be difficult to learn from a book. Hands-on practice is what it takes to perfect those skills.,prepared
hit:11017_conv:22034,situation,none,"I got a call about a job offer back in late May this year. I wasn't sure if I wanted to try and interview for it it since seemed like just another in a long list of jobs I'd applied to. But in the end I decided that it was better than being unemployed, so I went for it. I won over the recruiter in the phone interview, and was hired the same day!",apprehensive
hit:11017_conv:22034,utterance,speaker,"I had been unemployed for a long time until earlier this year. I originally wasn't sure if I was going to even interview for the position I did, but I'm glad I decided to. I got a call in late may from a merchandising company. I went back and forth in my mind after being rejected from many interviews over the past couple years. In the end I went for it, the interviewer liked what I had to say, and I was hired the same day! I've been working there ever since.",apprehensive
hit:11017_conv:22034,utterance,listener,"Congratulations!  That's awesome.  Sometimes it's scary to risk rejection, but it sounds like it totally paid off in this case.",wishing
hit:11017_conv:22034,utterance,speaker,Yeah I'm happy I kept at it :),proud
hit:11017_conv:22034,utterance,listener,"I'm about to switch careers, so I'll be doing the interviewing thing soon. It's scary.",apprehensive
hit:11017_conv:22034,utterance,speaker,Good luck!,wishing
hit:6245_conv:12490,situation,none,I'm going sky diving and kind of terrified.,apprehensive
hit:6245_conv:12490,utterance,speaker,I'm going sky diving and kind of terrified.,apprehensive
hit:6245_conv:12490,utterance,listener,I would be too,acknowledging
hit:6245_conv:12490,utterance,speaker,Are you also afraid of heights?,questioning
hit:6245_conv:12490,utterance,listener,yes. I cant even drive over a bridge,agreeing
hit:10405_conv:20811,situation,none,I was worried about going out with a person I met at the grocery store.  It was my first date in a long time.,apprehensive
hit:10405_conv:20811,utterance,speaker,So I met a person at the grocery store and they asked me on a date!,surprised
hit:10405_conv:20811,utterance,listener,That's awesome! Are you going to go on the date with them?,questioning
hit:10405_conv:20811,utterance,speaker,I was worried about it but went to lunch with him.  It was awkward lol.,apprehensive
hit:10405_conv:20811,utterance,listener,"Oh, didn't work out, huh?",questioning
hit:10405_conv:20811,utterance,speaker,"Well, we are going to do it again.  I'm less worried this time.  I suppose it was just awkward for me since he asked me to do it again.",apprehensive
hit:2304_conv:4608,situation,none,"I'm thinking about becoming a vegan, but I'm not so sure I can do it.",apprehensive
hit:2304_conv:4608,utterance,speaker,"I considered becoming a vegan, but I'm not so sure if it'll work out.",apprehensive
hit:2304_conv:4608,utterance,listener,I have never tried and never will lol,faithful
hit:2304_conv:4608,utterance,speaker,"I like the idea of it, for moral reasons, but I can't imagine I'd like any of the food.",disgusted
hit:2304_conv:4608,utterance,listener,That's what I think. Plus I'd miss bacon too much.,suggesting
hit:1637_conv:3274,situation,none,"I got a speeding ticket today on my way back from work. I did not believe it so I tried to argue with the cop, still got the the ticket.",apprehensive
