Dialog_ID,Type,Actor,Text,Label
hit:2611_conv:5222,utterance,speaker,I am not so sure how I feel about buying a used car.,apprehensive
hit:2611_conv:5222,utterance,listener,"Well, if the milleage is not too much and the car is clean go for it",neutral
hit:2611_conv:5222,utterance,speaker,Yeah I just don't know enough about cars.,agreeing
hit:2611_conv:5222,utterance,listener,"I think in situations like this, you can take someone that knows about cars along",trusting
hit:4133_conv:8266,situation,none,When selling my house and the buyer wanted to move in prior to closing date.,apprehensive
hit:4133_conv:8266,utterance,speaker,The person buying my house wanted to move in before closing date.,apprehensive
hit:4133_conv:8266,utterance,listener,Is that something they can do?,questioning
hit:4133_conv:8266,utterance,speaker,"If you let them yes, just worrisome.",neutral
hit:4133_conv:8266,utterance,listener,Can they move in and then not actually buy the house?,apprehensive
hit:3872_conv:7745,situation,none,My friend said they wanted to talk to me and didn't sound like their usual on the phone.,apprehensive
hit:3872_conv:7745,utterance,speaker,My friend said they wanted to talk to me and didn't sound like their usual on the phone.,apprehensive
hit:3872_conv:7745,utterance,listener,what did they want to talk about,questioning
hit:3872_conv:7745,utterance,speaker,I don't know. I'm kinda worried.,apprehensive
hit:3872_conv:7745,utterance,listener,ah i hope it turns out well for you,consoling
hit:9657_conv:19314,situation,none,I just applied for a job. I'm really nervious about them not hiring me.,apprehensive
hit:9657_conv:19314,utterance,speaker,I just applied for a job.,hopeful
hit:9657_conv:19314,utterance,listener,"Good luck with that, its rough out there.",wishing
hit:9657_conv:19314,utterance,speaker,"Yeah, I'm really nervous that they won't hire me.",apprehensive
hit:9657_conv:19314,utterance,listener,I hear ya. Perhaps they will though? gotta stay positive.,suggesting
hit:9657_conv:19314,utterance,speaker,I will try.,hopeful
hit:10745_conv:21491,situation,none,One day I walked into a room full of smoke.  My father use to smoke and he was not always nice so it reminded me of him.  As i walked into the room I thought of all the mean things he had done.,disgusted
hit:10745_conv:21491,utterance,speaker,maybe you shouldn't have gone in that room.,suggesting
hit:10745_conv:21491,utterance,listener,Why? what is in that room?,questioning
hit:10745_conv:21491,utterance,speaker,The smoke you did not like because it reminded you of you're fathers smoking habit.,neutral
hit:10745_conv:21491,utterance,listener,The same habit that I took up,neutral
hit:10745_conv:21491,utterance,speaker,It's a very hard habit to quit.,neutral
hit:11953_conv:23907,situation,none,I am enrolled in a motorcycle class tomorrow!  I am a little nervous though!,apprehensive
hit:11953_conv:23907,utterance,speaker,I am enrolled in a motorcycle class tomorrow! I am a little nervous though!,apprehensive
hit:11953_conv:23907,utterance,listener,Wow. That sounds exciting. You should do fine.,acknowledging
hit:11953_conv:23907,utterance,speaker,"I hope so, because I already bought a motorcycle!  If I am no good at it, I will lose money reselling it!",encouraging
hit:11953_conv:23907,utterance,listener,What kind of motorcycle did you buy?,questioning
hit:5924_conv:11848,situation,none,I've been feeling nervous lately.,anxious
hit:5924_conv:11848,utterance,speaker,I've been a little nervous lately and I don't know why exactly.,anxious
hit:5924_conv:11848,utterance,listener,Nervous? That's interesting. Has anything changed recently? What are your thoughts on why it's happening?,questioning
hit:5924_conv:11848,utterance,speaker,"I'm really not sure, it's just a general type of thing.",neutral
hit:5924_conv:11848,utterance,listener,"I see. I'm sorry you're having trouble with that. Have you thought about therapy? Maybe your health insurance will cover a free consultation or something. Or perhaps you just need a simple routine change, with some exercise and more time outside. I hope you find the answer, whatever it is.",sympathizing
hit:10336_conv:20673,situation,none,I am very anxious socially and don't like to go out with large crowds. Tomorrow I am going to a MLB game with my best friend and her parents. I am apprehensive because this will be my first in a large crowd in over 8 years.,apprehensive
hit:10336_conv:20673,utterance,speaker,I'm going to a Braves game tomorrow for the first time and I'm a little apprehensive.,apprehensive
hit:10336_conv:20673,utterance,listener,It should be fun! Do you like baseball?,questioning
hit:10336_conv:20673,utterance,speaker,"I love baseball, I just have social anxiety and I'm a little concerned with how I will react being in such a large crowd.",anxious
hit:10336_conv:20673,utterance,listener,"I think you will be fine. If you need some alcohol to take the edge off, go for it.",trusting
hit:6372_conv:12745,situation,none,I am not so sure about my daughters new school. They don't even have to wear backpacks,apprehensive
hit:6372_conv:12745,utterance,speaker,I am not so sure about my daughters new school,apprehensive
hit:6372_conv:12745,utterance,listener,Oh really? What's bothering you about it?,questioning
hit:6372_conv:12745,utterance,speaker,they dont have to wear backpacks. I know its pre k but still,neutral
hit:6372_conv:12745,utterance,listener,"Ah, that is different. I can't remember a time in school that I didn't have a backpack on me.",neutral
hit:6372_conv:12745,utterance,speaker,i know rigt,agreeing
hit:11726_conv:23453,situation,none,A homeless man asked me to roll down my window in my car.,apprehensive
hit:11726_conv:23453,utterance,speaker,One day a homeless man came up to my car and asked me to roll down my window.,apprehensive
hit:11726_conv:23453,utterance,listener,I never know what to do in that situation.,apprehensive
hit:11726_conv:23453,utterance,speaker,Same here. It was scary.,acknowledging
hit:11726_conv:23453,utterance,listener,I bet. you never know if they are the crazy type or just down on their luck.,encouraging
hit:9214_conv:18428,situation,none,"I am going sky diving this Sunday, but I am a little scared about it.",apprehensive
hit:9214_conv:18428,utterance,speaker,I'm going sky diving this Sunday but I am a little scared,apprehensive
hit:9214_conv:18428,utterance,listener,"Wow, that's amazing! I'm insanely jealous! I think it's pretty normal to be scared of that though. After all, it wouldn't be nearly as much fun if it didn't terrify you, right?",acknowledging
hit:9214_conv:18428,utterance,speaker,Yeah that is a really good point actually! Being kind of scared could be a good thing for me.,agreeing
hit:9214_conv:18428,utterance,listener,"Exactly! Embrace the danger. Become the danger. Do like 800 flips while you're falling through the air, but do yourself a favor and don't vomit okay?",agreeing
hit:9214_conv:18428,utterance,speaker,Haha I hope I can! And I'll try my best not to puke.,consoling
hit:3039_conv:6079,situation,none,I was very apprehensive about someone coming to my house this weekend. I felt very uncomfortable and like I would be stepping back in too old patterns,apprehensive
hit:3039_conv:6079,utterance,speaker,I was very apprehensive about someone coming to my house this weekend.,apprehensive
hit:3039_conv:6079,utterance,listener,How come you were worried about it?,questioning
hit:3039_conv:6079,utterance,speaker,"Because I have been working on trust with this person and it's just at the beginning. I felt very uncomfortable and like I would be stepping back in too old patterns"".",trusting
hit:3039_conv:6079,utterance,listener,It sounds like it might be time to consider moving on without them,acknowledging
hit:8343_conv:16687,situation,none,I am not sure about my new job. I was excited but I dont think its right for me,apprehensive
hit:8343_conv:16687,utterance,speaker,I ve been at my new job for weeks,confident
hit:8343_conv:16687,utterance,listener,"Oh wow thats great, how do you like it so far?",questioning
hit:8343_conv:16687,utterance,speaker,I don't. Thats the problem/ I don't think its the right fit for me.,apprehensive
hit:8343_conv:16687,utterance,listener,"Gosh, that's too bad! Maybe continue to work there but looks apply for new jobs. Good Luck!",suggesting
hit:8343_conv:16687,utterance,speaker,I think thats what I will do,confident
hit:6140_conv:12281,situation,none,I feel a bit nervous to return to Florida.,apprehensive
hit:6140_conv:12281,utterance,speaker,"I'm feeling pretty nervous to return to Florida. I don't know if I have many options if I go back, or if it will turn out well or not.",apprehensive
hit:6140_conv:12281,utterance,listener,Just thinking positive thoughts,joyful
hit:6140_conv:12281,utterance,speaker,"Yeah, hopefully that type of positive thoughts stuff works. I am more faith-based...",encouraging
hit:6140_conv:12281,utterance,listener,Its good to have faith,trusting
hit:9482_conv:18965,situation,none,I was invited to a party last week to a pretty shady area. I didnt know if I should go or not,apprehensive
hit:9482_conv:18965,utterance,speaker,I was invited to a party last week to a pretty shady area.,apprehensive
hit:9482_conv:18965,utterance,listener,Why would anyone make a party in a shady area? Was it your friend's party?,questioning
hit:9482_conv:18965,utterance,speaker,"It was a work friend, I was not sure if I should go or not for fear of my safety",apprehensive
hit:9482_conv:18965,utterance,listener,Probably it is just the theme of his party. He wanted to have some fun in the form of cautious excitement,suggesting
hit:12211_conv:24423,situation,none,We just bought a used car and we've already had to take it to the shop,apprehensive
hit:12211_conv:24423,utterance,speaker,We just bought a used car and we've already had to take it to the shop,apprehensive
hit:12211_conv:24423,utterance,listener,That's unfortunate. Sometimes used cars can be tough to deal with,disappointed
hit:12211_conv:24423,utterance,speaker,"Yeah, it's annoying. Hopefully nothing else goes wrong with it.",consoling
hit:12211_conv:24423,utterance,listener,I hope not. I have a feeling things will get better,consoling
hit:11960_conv:23921,situation,none,I'm edgy about the last half of this year. I'm having rough financial times.,apprehensive
hit:11960_conv:23921,utterance,speaker,"I'm nervous about the last half of the year. I've been having rough financial times. They'll get better in February, but it's a long time till then.",apprehensive
hit:11960_conv:23921,utterance,listener,I am sorry to hear that. I am sure you be fine.,sympathizing
hit:11960_conv:23921,utterance,speaker,"I hope so, but I'll be sweating bullets until then.",encouraging
hit:11960_conv:23921,utterance,listener,We all go through tough times. It will work out for you in the end.,consoling
hit:5322_conv:10644,situation,none,"I'm going to my favorite restaurant tonight. I'm thinking about ordering something that I haven't eaten before, but I'm not sure if I should.",apprehensive
hit:5322_conv:10644,utterance,speaker,My wife and I are going out to one of my favorite restaurants tonight.,joyful
hit:5322_conv:10644,utterance,listener,That sounds fun. Is it a special occasion?,questioning
hit:5322_conv:10644,utterance,speaker,"Not really, just felt like going out. I'm thinking about ordering something I haven't had before, but.... I don't know. I'm weird about trying new foods.",apprehensive
hit:5322_conv:10644,utterance,listener,I understand. Sticking with what you know seems safer.,agreeing
hit:9473_conv:18946,situation,none,My ex took me to six flags and wanted me to ride a really high roller coaster. I hate heights so I really wasn't sure about it.,apprehensive
hit:9473_conv:18946,utterance,speaker,My ex took me to six flags and wanted me to ride on a very high roller coaster.,terrified
hit:9473_conv:18946,utterance,listener,Interesting....did you do it,questioning
hit:9473_conv:18946,utterance,speaker,"Yeah, but only because he was getting mad at me. I hate heights and I was very unsure about it.",neutral
hit:9473_conv:18946,utterance,listener,lol why would he get mad...but did you have fun in the end,neutral
hit:974_conv:1948,situation,none,I was scared to drive for the first time.,apprehensive
hit:974_conv:1948,utterance,speaker,I was very anxious to start driving at 16.,anxious
hit:974_conv:1948,utterance,listener,I know that feeling. It's nerve racking trying to incorporate everything you learned at the DMV in real time.,agreeing
hit:974_conv:1948,utterance,speaker,It really is. It's like I can't remember all the rules of the road.,prepared
hit:974_conv:1948,utterance,listener,"It's also scary thinking about getting in a car accident the whole time, that would definitely get me nervous.",acknowledging
hit:7891_conv:15783,situation,none,I am not sure I may see about chaning my son's teacher.,apprehensive
hit:7891_conv:15783,utterance,speaker,My sons teacher isn't very nice to the young kindergartners.,annoyed
hit:7891_conv:15783,utterance,listener,Oh no! Why not?!,questioning
hit:7891_conv:15783,utterance,speaker,"Not, sure, but she is not very nice at all.",neutral
hit:7891_conv:15783,utterance,listener,I would make a complaint to the principal if I were you!,neutral
hit:5546_conv:11092,situation,none,"I was really apprehensive when I went to university at the age of 30. I was scared that I wouldn't be able to connect with the younger students, and that I wouldn't be smart enough to do well. I was also unsure if it would advance my career.",apprehensive
hit:5546_conv:11092,utterance,speaker,I was really apprehensive about going to university at the age of 30.,apprehensive
hit:5546_conv:11092,utterance,listener,"That's okay, I'm 25 and still in college. How did it go for you?",questioning
hit:5546_conv:11092,utterance,speaker,It went pretty well! I got great grades and made friends despite the age difference.,proud
hit:5546_conv:11092,utterance,listener,That's awesome. I'm glad it worked out well for you. :),acknowledging
hit:5546_conv:11092,utterance,speaker,Thank you! In the end I had no reason to worry about it.,content
hit:11757_conv:23515,situation,none,Several co-workers said they wouldn't be able to come to work.  I hope we don't have any major assignments to do,apprehensive
hit:11757_conv:23515,utterance,speaker,A few of my co-workers said they'd be absent next week,lonely
hit:11757_conv:23515,utterance,listener,"Oh my, I hope that doesn't mean more workload for you.",consoling
hit:11757_conv:23515,utterance,speaker,"Yeah, I hope we don't get a ton of work while they're gone",encouraging
hit:11757_conv:23515,utterance,listener,Maybe you should ask for overtime pay just in case you do get more work!,suggesting
hit:3639_conv:7279,situation,none,Going to the dentist,apprehensive
hit:3639_conv:7279,utterance,speaker,I have a dentist appointment tomorrow. I think I have a cavity.,anxious
hit:3639_conv:7279,utterance,listener,"Oh no, I hate cavities. Are you brushing your teeth eVeryday?",questioning
hit:3639_conv:7279,utterance,speaker,"Yes, but I think I'm genetically hosed when it comes to teeth. I really hate it.",afraid
hit:3639_conv:7279,utterance,listener,"Dang, that sucks. I hope you can find a solution for that",consoling
hit:9659_conv:19318,situation,none,going into a dark alleyway to get home from school,apprehensive
hit:9659_conv:19318,utterance,speaker,"I decided to go a new route home from school today, but it didn't turn out as planned.",disappointed
hit:9659_conv:19318,utterance,listener,"uhoh, did you get lost?",questioning
hit:9659_conv:19318,utterance,speaker,"No, it just took me somewhere dodgy.",neutral
hit:9659_conv:19318,utterance,listener,oh that is scary.  I hope you were ok.  make sure your doors are locked,consoling
hit:9659_conv:19318,utterance,speaker,"Good idea, I won't be stumbling down that dark alleyway again!",terrified
hit:10068_conv:20136,situation,none,"My friends wanted to bring me to laser quest for my birthday. I wasn't sure if I'd like it, but we ended up just staying at his place and had fun nonetheless.",apprehensive
hit:10068_conv:20136,utterance,speaker,My friends wanted to bring me to laser quest for my birthday.,surprised
hit:10068_conv:20136,utterance,listener,Is that like a laser tag place? That sounds like a lot of fun! What do you think?,questioning
hit:10068_conv:20136,utterance,speaker,Yeah exactly. I wasn't sure if I'd like it or not and I was a little unwilling to try it out.,apprehensive
hit:10068_conv:20136,utterance,listener,I've played laser tag a few times. I think you will have a great time! It's very high paced and noisy but that's half the fun.,confident
hit:12078_conv:24157,situation,none,"I went biking on a new bike trail the other day. It was a lot of fun but I didn't know the route or the hills, so I was really reluctant to go too fast lest I wipe out on a curve.",apprehensive
hit:12078_conv:24157,utterance,speaker,"I went on a new bike trail the other day, it was super fun but also a little scary.",afraid
hit:12078_conv:24157,utterance,listener,Ooh how so? Were there a lot of hills and sharp turns?,questioning
hit:12078_conv:24157,utterance,speaker,"Yep, exactly. I also have a new bike so between the new route and the new bike, I was totally terrified of wiping out. So I took it slow.",prepared
hit:12078_conv:24157,utterance,listener,I see. Do you think you'll be going back on that bike trail?,questioning
hit:12078_conv:24157,utterance,speaker,"Absolutely! And now that I know it better, I won't be so scared. I'm heading back out there Tuesday, can't wait!",agreeing
hit:12078_conv:24157,utterance,listener,I hope you have tons of fun and enjoy a safe trip!,encouraging
hit:4218_conv:8436,situation,none,My daughter asked to borrow my car. I'm not sure it's a good idea.,apprehensive
hit:4218_conv:8436,utterance,speaker,My daughter asked to borrow my car to go out tonight...,apprehensive
hit:4218_conv:8436,utterance,listener,Did you say yes?,questioning
hit:4218_conv:8436,utterance,speaker,I haven't given an answer yet. I'm just not sure if it's a wise idea or not.,apprehensive
hit:4218_conv:8436,utterance,listener,Where does she plan to go?,questioning
hit:4218_conv:8436,utterance,speaker,"She says she's just going to meet some friends at the movies, but you know how teenagers are.",surprised
hit:4482_conv:8964,situation,none,my dad is going to get his heart checked tomorrow. i am so nervous about it.,anxious
hit:4482_conv:8964,utterance,speaker,my dad is going to get his heart checked tomorrow,hopeful
hit:4482_conv:8964,utterance,listener,is he sick?,questioning
hit:4482_conv:8964,utterance,speaker,He was not feeling well last week.. i am really hoping his heart is fine,hopeful
hit:4482_conv:8964,utterance,listener,Does he has any record with heart problems?,questioning
hit:250_conv:500,situation,none,"I am always more cautious when driving at night, and when it's raining.",apprehensive
hit:250_conv:500,utterance,speaker,Do you ever find it hard to see at night when it's raining?,questioning
hit:250_conv:500,utterance,listener,"Yes I do actually, I was almost in an accident because of rain at night once.",agreeing
hit:250_conv:500,utterance,speaker,That's so scary! I am always on edge in those cases. I hydroplaned really bad last time.,terrified
hit:250_conv:500,utterance,listener,I'm glad you were okay and nothing bad happened.,neutral
hit:250_conv:500,utterance,speaker,Thank you. I've never been in a traffic accident. Thank goodness for that.,grateful
hit:10196_conv:20393,situation,none,When I started college I moved to a new state where I didn't know anyone.,apprehensive
hit:10196_conv:20393,utterance,speaker,I remember back when I started college. I moved to a new state where I didn't know anyone and I had no idea what to expect.,apprehensive
hit:10196_conv:20393,utterance,listener,Wow that sounds scary. Did you make good friends?,questioning
hit:10196_conv:20393,utterance,speaker,"Yes, I did eventually. There's something to be said for living in a dorm at a time when you want to meet new people and fit in.",neutral
hit:10196_conv:20393,utterance,listener,Yes it can be really helpful! I went to school 3 hours from my home and it was still hard to meet new people,agreeing
hit:9450_conv:18900,situation,none,I was getting ready to fly to Dallas for a meeting with a client when I heard there were bad storms on the flight path.  I ended up renting  a car because I hate flying so much.,apprehensive
hit:9450_conv:18900,utterance,speaker,"I had a client meeting in Dallas, and as I was driving to the airport I heard there was going to be a lot of storms we'd be flying through. I ended up renting a car because I hate flying so much in just calm weather.",apprehensive
hit:9450_conv:18900,utterance,listener,"That is a lot of extra money to spen, but it is completely understandable it you are that nervous about it.  Have you ever looked into calming medications, or meditation to help your nerves?",questioning
hit:9450_conv:18900,utterance,speaker,"I have, but they only cut down the anxiety instead of making it go away completely. Something about hurdling towards earth at a rapid pace in a large metal box alarms me.",apprehensive
hit:9450_conv:18900,utterance,listener,"I completely understand that.  My mother in law used to have really bad anxiety about flying, but she did hypnosis and it really helped.",agreeing
hit:5587_conv:11175,situation,none,I started a new job last month I was very nervous on my first day.,apprehensive
hit:5587_conv:11175,utterance,speaker,Starting a new job can be different on my first day last month I can say that was me.,confident
hit:5587_conv:11175,utterance,listener,"Yea, a new job is useless pretty stressful.",acknowledging
hit:5587_conv:11175,utterance,speaker,I would say I was more nervous then anything I think the new setting was over whelming but a month later I feel a lot better now.,anxious
hit:5587_conv:11175,utterance,listener,It will be ok in the end.,consoling
hit:10711_conv:21423,situation,none,I was nervous for my first day of college.,apprehensive
hit:10711_conv:21423,utterance,speaker,I was nervous for my first day of college,apprehensive
hit:10711_conv:21423,utterance,listener,What about it made you feel nervous?,questioning
hit:10711_conv:21423,utterance,speaker,just nervous for a new start in life,apprehensive
hit:10711_conv:21423,utterance,listener,Yeah I understand. Big life changes make me feel uneasy sometimes too.,agreeing
hit:10711_conv:21423,utterance,speaker,just nervous for a new start,apprehensive
hit:5049_conv:10099,situation,none,My car has been having problems.  I'm worried it won't make it in the future,apprehensive
hit:5049_conv:10099,utterance,speaker,My car has been having issues lately,annoyed
hit:5049_conv:10099,utterance,listener,what's wrong with it?,questioning
hit:5049_conv:10099,utterance,speaker,"Engine issues I think, not sure if the car will make it",apprehensive
hit:5049_conv:10099,utterance,listener,can you fix it?,questioning
hit:10414_conv:20829,situation,none,im scared and anxious about the future,apprehensive
hit:10414_conv:20829,utterance,speaker,the future is so uncertain and yet so certain i am so not ready for what's about to come it fills mee with anxiety and depression just thinking about it,anxious
hit:10414_conv:20829,utterance,listener,Everything is going to be okay. Try to relax.,content
hit:10414_conv:20829,utterance,speaker,i hope so,encouraging
hit:10414_conv:20829,utterance,listener,"If there is something in particular, try to deal with it head on.",agreeing
hit:4668_conv:9337,situation,none,I am feeling so nervous about my dad going to check his heart tomorrow. I really hope no bad news comes off it.,apprehensive
hit:4668_conv:9337,utterance,speaker,I am feeling so nervous about my dad getting his heart checked tomorrow,apprehensive
hit:4668_conv:9337,utterance,listener,"I understand that, I will pray for you",agreeing
hit:4668_conv:9337,utterance,speaker,Thank you so much.. I am just hoping not to get any bad news,encouraging
hit:4668_conv:9337,utterance,listener,"That makes sense, I wish you both the best of luck and health!",wishing
hit:9360_conv:18720,situation,none,I am suppose to start a new job tomorrow.  I am not sure I am going to like it.,apprehensive
hit:9360_conv:18720,utterance,speaker,I am suppose to start a new job tomorrow. I am not sure I am going to like it,apprehensive
hit:9360_conv:18720,utterance,listener,What job is it?,questioning
hit:9360_conv:18720,utterance,speaker,"i will be working at a daycare. i love kids, but i am not sure i will like working with so many at once.",neutral
hit:9360_conv:18720,utterance,listener,Only one way to find out.,anticipating
hit:10057_conv:20114,situation,none,I had a septic tank issue and called a guy that I found a business card from and had him come out. He didn't have hardly any equipment with him and sounded like he didn't know what to do.,apprehensive
hit:10057_conv:20114,utterance,speaker,I had a septic tank issue and called a guy that I found a business card from and had him come out. He didn't have hardly any equipment with him and sounded like he didn't know what to do.,apprehensive
hit:10057_conv:20114,utterance,listener,Oh my goodness that sounds so bad! Did they charge you for the visit?,questioning
hit:10057_conv:20114,utterance,speaker,No. I just asked what it would cost to fix then told him I couldn't afford it to get him to leave.,ashamed
hit:10057_conv:20114,utterance,listener,You made the right move. They at least have to show up with that giant truck that sucks the tank dry.,agreeing
hit:1769_conv:3539,situation,none,I was going to fly alone. I felt a bit wary.,apprehensive
hit:1769_conv:3539,utterance,speaker,"I was flying alone, even though I had before, this particular time I felt wary.",apprehensive
