Dialog_ID,Type,Actor,Text,Label
hit:11107_conv:22214,situation,none,"One night, a few years ago, back when I used to smoke, we had a party at my house. My brother and I were out of cigarettes, so we decided to walk to a semi-nearby gas station to get some. It was past midnight, and a kind of sketchy area, so I was a bit scared.",apprehensive
hit:11107_conv:22214,utterance,speaker,"One night, after drinking with my brother, we decided to walk to a gas station to get some more cigarettes.",guilty
hit:11107_conv:22214,utterance,listener,"Oh no, I hope that you guys were sober enough to make it there safely!",consoling
hit:11107_conv:22214,utterance,speaker,"We were, but it was a pretty sketchy area, so I was scared the whole time.",afraid
hit:11107_conv:22214,utterance,listener,"Wow, I am really glad that you two made it back safely.",sympathizing
hit:11107_conv:22214,utterance,speaker,"Thanks, me too!",agreeing
hit:12398_conv:24796,situation,none,"I'm going to eat sushi for the first time this weekend, but I am a little nervous.",apprehensive
hit:12398_conv:24796,utterance,speaker,I'm going to eat sushi for the first time this coming weekend.,apprehensive
hit:12398_conv:24796,utterance,listener,"Yum! Sushi is so good, I'm sure you'll enjoy it! I like the eel roll and spicy tuna roll.",content
hit:12398_conv:24796,utterance,speaker,"Thanks for the recommendations! I'm a bit nervous about it, but I hope I will enjoy it.",encouraging
hit:12398_conv:24796,utterance,listener,I'm sure you will! Maybe start with a simple roll like the california roll or ask the waitress for recomendations.,suggesting
hit:4234_conv:8468,situation,none,well I started my new job this week... It is weird to be with people who don't know me,apprehensive
hit:4234_conv:8468,utterance,speaker,well I started my new job this week... It is weird to be with people who don't know me,apprehensive
hit:4234_conv:8468,utterance,listener,I'm sure. But it's a fresh start. Your the new person you can make people think any thing about you that you want.,confident
hit:4234_conv:8468,utterance,speaker,Thats the hard part!  I feel like I don't know who I am.. or that like I am holding back from being me 100% while I decide.,apprehensive
hit:4234_conv:8468,utterance,listener,Just be your self then. Who cares what they think.,neutral
hit:11391_conv:22782,situation,none,I rode on my boyfriend's motorcycle for the first time on the highway and I was a little anxious about it,apprehensive
hit:11391_conv:22782,utterance,speaker,I rode on my boyfriend's motorcycle for the first time on the highway and I was a little anxious about it,apprehensive
hit:11391_conv:22782,utterance,listener,"Haha bikes can be very scary. Did you lean the wrong why, i did that my first time.",acknowledging
hit:11391_conv:22782,utterance,speaker,"Yeah, I had a bad feeling about it, but he reassured me. No, I did! He has a backrest installed so I just lean back and relax!",trusting
hit:11391_conv:22782,utterance,listener,Oh nice! He sounds like a cool dude. haha,acknowledging
hit:11391_conv:22782,utterance,speaker,"Yeah, he totally is. He likes all that type of hardcore biker stuff.",agreeing
hit:11391_conv:22782,utterance,listener,Bike's are a lot of fun i can see why he would be into them.,acknowledging
hit:11933_conv:23867,situation,none,"I've been applying for jobs lately, and though I want a new career, I also have to apply for anything I'm close to qualified for to get paid even though I don't want to in case I get stuck there.",apprehensive
hit:11933_conv:23867,utterance,speaker,I've been looking for a job. I want to do something fun but also need to apply for boring ones just so I can get paid.,disappointed
hit:11933_conv:23867,utterance,listener,fun jobs with good pay do exist,acknowledging
hit:11933_conv:23867,utterance,speaker,"Yes, but being qualified for them is where the problem lies",neutral
hit:11933_conv:23867,utterance,listener,that does make sense,acknowledging
hit:4860_conv:9720,situation,none,I am going to do scuba lessons in a couple weeks.  For some reason I am really nervous about it.,apprehensive
hit:4860_conv:9720,utterance,speaker,I am going to do scuba lessons in a couple weeks.  For some reason I am really nervous about it.,apprehensive
hit:4860_conv:9720,utterance,listener,"dont be nervous, your instructors will not put you in danger",questioning
hit:4860_conv:9720,utterance,speaker,I hope so!  Drowning is the worst way to die in my opinion!,consoling
hit:4860_conv:9720,utterance,listener,i cant argue with that lol,acknowledging
hit:2427_conv:4854,situation,none,I always get a little scared when moving into a new neighbor hood. I didn't have any problems the last time though.,apprehensive
hit:2427_conv:4854,utterance,speaker,I get scared when moving to a new neighborhood.,afraid
hit:2427_conv:4854,utterance,listener,That's typically a nerve wracking experience. Did you meet any kind people?,questioning
hit:2427_conv:4854,utterance,speaker,Well sometimes I think new people are targets for crazy things.,afraid
hit:2427_conv:4854,utterance,listener,"Yeah, if it is a bad neighborhood I suppose.",agreeing
hit:2427_conv:4854,utterance,speaker,Yeah. Im weird.,acknowledging
hit:3865_conv:7731,situation,none,I was not sure whether I should date this girl. She was too good to be true,apprehensive
hit:3865_conv:7731,utterance,speaker,I was not sure whether I should date this girl. She seemed too good to be true,apprehensive
hit:3865_conv:7731,utterance,listener,was she?,questioning
hit:3865_conv:7731,utterance,speaker,"No, we are still dating",agreeing
hit:3865_conv:7731,utterance,listener,ah thats good.. good luck,wishing
hit:7808_conv:15616,situation,none,Maybe my paycheck wont come in the mail this month.,apprehensive
hit:7808_conv:15616,utterance,speaker,Maybe my paycheck wont come in the mail this month.,apprehensive
hit:7808_conv:15616,utterance,listener,That is not good.  Why do you think it won't come?,questioning
hit:7808_conv:15616,utterance,speaker,Anything could happen with the mail system.,suggesting
hit:7808_conv:15616,utterance,listener,That is true.  I have lost packages in the past.,agreeing
hit:9501_conv:19002,situation,none,I start my new job on Monday. I almost feel like I am having second thoughts about it though.,apprehensive
hit:9501_conv:19002,utterance,speaker,I start my new job on Monday. I almost feel like I am having second thoughts about it though.,apprehensive
hit:9501_conv:19002,utterance,listener,Why are you having second thoughts? I have been there.,questioning
hit:9501_conv:19002,utterance,speaker,I am just always a little hesitant about starting something new.,apprehensive
hit:9501_conv:19002,utterance,listener,I'm sure you will be great!,confident
hit:2628_conv:5257,situation,none,"I start a new job tomorrow and I can't sleep. I'm so nervous about it, and I feel a bit ill",anxious
hit:2628_conv:5257,utterance,speaker,"Speaking of, I start a new job tomorrow and I can't sleep. It makes me nervous",anxious
hit:2628_conv:5257,utterance,listener,"You will be alright, it's always like that",consoling
hit:2628_conv:5257,utterance,speaker,"Yes, and I hate it. I wish I could just turn that off sometimes.",annoyed
hit:2628_conv:5257,utterance,listener,"Think about the positive aspects of this, you are moving forward",hopeful
hit:3947_conv:7895,situation,none,My friend has a habit of going nuts every vacation and I want to cancel ours.,apprehensive
hit:3947_conv:7895,utterance,speaker,My friend has this habit of getting too drunk and losing her mind on every vacation we go on. I'm thinking about canceling the one we have planned in a few weeks.,annoyed
hit:3947_conv:7895,utterance,listener,You should to them before you do that,questioning
hit:3947_conv:7895,utterance,speaker,Maybe but it will turn into a fight,suggesting
hit:3947_conv:7895,utterance,listener,Well maybe should be civil,suggesting
hit:2380_conv:4760,situation,none,"My dog wants to play tug of war with me with this little rope toy she has. But when we played last night, she got so wild and energetic, that she started attacking my other dog! Not sure if I should do it again...",apprehensive
hit:2380_conv:4760,utterance,speaker,"My dog wants to play tug of war with me with this little rope toy she has. But when we played last night, she got so wild and energetic, that she started attacking my other dog! Not sure if I should do it again..",apprehensive
hit:2380_conv:4760,utterance,listener,Oh no! maybe she needs a break for a wahile,suggesting
hit:2380_conv:4760,utterance,speaker,"I thought so too. Didn't think she'd want to rough-house today. I was just trying to get some work done and she keeps dropping the toy at my feet and whining, and it makes me feel so guilty to ignore her! But she drew blood last night on my other dog, so I'm not sure.",guilty
hit:2380_conv:4760,utterance,listener,That's no good. I guess you'll have to find a nicer game.,consoling
hit:12344_conv:24689,situation,none,"This girl just invited me out on a date. She seems sweet and I'm interested.. more interested in her than I am this other girl I've been seeing for a few weeks. But I feel bad just dropping this girl I've been seeing recently. Like, wouldn't that be rude?",apprehensive
hit:12344_conv:24689,utterance,speaker,"This girl just invited me out on a date. She seems sweet and I'm interested.. more interested in her than I am this other girl I've been seeing for a few weeks. But I feel bad just dropping this girl I've been seeing recently. Like, wouldn't that be rude?",apprehensive
hit:12344_conv:24689,utterance,listener,"I think if it's done without care then yes, care for what she would feel that is. Maybe you just have to tell the truth about what you're feeling, but it's up to you!",suggesting
hit:12344_conv:24689,utterance,speaker,"That's some good advice. I think my main problem is I don't know if it's just a ""grass is greener"" type situation. I've enjoyed my time with the first girl, but there's not a big ""spark."" But who knows if there actually has to be one? Guess I'll have to think on it more.",apprehensive
hit:12344_conv:24689,utterance,listener,"Right, but deep down I'm sure you know that you don't need a relationship to feel content!",neutral
hit:4788_conv:9577,situation,none,I am scared of Trump.,terrified
hit:4788_conv:9577,utterance,speaker,I am scared of Trump. He is on his way to create a civil war in the USA.,terrified
hit:4788_conv:9577,utterance,listener,"That is interesting, why do you say that?",questioning
hit:4788_conv:9577,utterance,speaker,"Because Trump is a liar, egomaniac and manipulative lunatic",disgusted
hit:4788_conv:9577,utterance,listener,I think a good amount of people feel the same,agreeing
hit:12021_conv:24042,situation,none,I met a stranger once. He asked me for a ride.,apprehensive
hit:12021_conv:24042,utterance,speaker,I met a stranger once. He asked me for a ride to the store.,apprehensive
hit:12021_conv:24042,utterance,listener,That could be creepy depending on the person. I'm extra paranoid though.,afraid
hit:12021_conv:24042,utterance,speaker,"Yes, I was very skeptical. He didn't appear trustworthy at all.",trusting
hit:12021_conv:24042,utterance,listener,"That's understandable, there's just no way to be sure what a stranger's intentions are.",agreeing
hit:1069_conv:2138,situation,none,"thinking about a career change, but I'm not sure what to do about it yet...",apprehensive
hit:1069_conv:2138,utterance,speaker,"thinking about a career change, but I'm not sure what to do about it yet...",apprehensive
hit:1069_conv:2138,utterance,listener,What are you most interested in doing?,questioning
hit:1069_conv:2138,utterance,speaker,I love cooking. Thinking about becoming a chef. I love the way food brings people together.,hopeful
hit:1069_conv:2138,utterance,listener,You are absolutely right there.  If its truly a passion then you should go for it.  Life is too short to be stuck in a rut.,agreeing
hit:12085_conv:24171,situation,none,I heard a coworker talking about welfare and other social support in a very negative light. I was offended  but decided to hold my tongue.,apprehensive
hit:12085_conv:24171,utterance,speaker,I heard a coworker talking down on welfare and other social support. I was offended but decided to hold my tongue.,apprehensive
hit:12085_conv:24171,utterance,listener,"Pro's and Con's.  Those systems are abuse prone but, some people need them.",neutral
hit:12085_conv:24171,utterance,speaker,"Yea that is true, I just have met a few people in need before so I always think of them. That's part of why I didn't speak on it though, it would take all day discussing factors or something.",neutral
hit:12085_conv:24171,utterance,listener,"It can be infuriating.  For example, over a 3 year period in my own state, there was about ~20 million dollars worth of food stamps spent in major vacation hot spots (florida, hawaii, california, virgin islands)",furious
hit:5682_conv:11365,situation,none,I was going out on a blind date and just wasn't sure if it was a good idea or not.,apprehensive
hit:5682_conv:11365,utterance,speaker,I was going out on a blind date and just wasn't sure if it was a good idea or not.,apprehensive
hit:5682_conv:11365,utterance,listener,How did it go?,questioning
hit:5682_conv:11365,utterance,speaker,Certainly not worth all the worrying I did about it beforehand.,agreeing
hit:5682_conv:11365,utterance,listener,Im not sure if that's good or bad.,neutral
hit:2154_conv:4309,situation,none,drinking on lunch break,apprehensive
hit:2154_conv:4309,utterance,speaker,I drank yesterday on my lunch break and was nervous to come back into the office afterwards.,apprehensive
hit:2154_conv:4309,utterance,listener,Why were you nervous,questioning
hit:2154_conv:4309,utterance,speaker,I was a little buzzed but it was definitely worth it as I got to try a few new-to-me sour beers,excited
hit:2154_conv:4309,utterance,listener,I do love a good sour,nostalgic
hit:2154_conv:4309,utterance,speaker,What is your favorite? Mine is Prairie Vape Tricks!,questioning
hit:2155_conv:4311,situation,none,I was not sure what to think when I changed schools. I was just not sure how it would go,apprehensive
hit:2155_conv:4311,utterance,speaker,I was a little unsure when I changed schools. I was not sure how it would go.,apprehensive
hit:2155_conv:4311,utterance,listener,How did it go?,questioning
hit:2155_conv:4311,utterance,speaker,It went well but I did not know that going in,neutral
hit:2155_conv:4311,utterance,listener,We all get nervous about changing our surroundings,anxious
hit:11591_conv:23182,situation,none,"My roommate wants to get a cat. But he's already irresponsible enough as it is, and can't clean up after himself. How can he clean up after a cat, too? But I don't want to be the person to say no...",apprehensive
hit:11591_conv:23182,utterance,speaker,"My roommate wants to get a cat. But he's already irresponsible enough as it is, and can't clean up after himself. How can he clean up after a cat, too? But I don't want to be the person to say no..",apprehensive
hit:11591_conv:23182,utterance,listener,I think you will need to tell him how you feel about this. Otherwise you may end up taking more care of the cat than him.,suggesting
hit:11591_conv:23182,utterance,speaker,"Yeah, you're right. I'm not good at confrontation, however. But yeah, I've already decided I don't want to take care of the cat myself, so if he can't do it, then it shouldn't be here. I just think he's kind of childish in the sense that he'll assume he can do it just so he can have the cat in the beginning, but later on he will get lazy.",agreeing
hit:11591_conv:23182,utterance,listener,Yea it will be unfair for the cat too who may feel lonely and unloved. You should tell him to be more responsible before he can get a pet.,acknowledging
hit:10045_conv:20090,situation,none,I'm feeling a little nervous today. I'm selling an appliance on Craigslist and I have someone coming over to look at it.,apprehensive
hit:10045_conv:20090,utterance,speaker,I'm feeling a bit nervous today. I'm selling an appliance on Craigslist and I have someone coming over to look at it.,apprehensive
hit:10045_conv:20090,utterance,listener,Nervous about the person or nervous that they won't take it?,apprehensive
hit:10045_conv:20090,utterance,speaker,Nervous about the person! It's always a risk having a stranger come to your home!,apprehensive
hit:10045_conv:20090,utterance,listener,You should have someone with you. An intimidating person. Like your mother in law.,afraid
hit:2383_conv:4767,situation,none,I haven't heard back from my mom yet. Wonder if she's ok.,apprehensive
hit:2383_conv:4767,utterance,speaker,I haven't heard back from my mom yet. Wonder if she's ok,apprehensive
hit:2383_conv:4767,utterance,listener,I hope she is okay also.,encouraging
hit:2383_conv:4767,utterance,speaker,She's at Best Buy trying to get her computer fixed. I hope they don't take advantage of her.,hopeful
hit:2383_conv:4767,utterance,listener,You should go with her next time so that doesn't happen.,suggesting
hit:12396_conv:24793,situation,none,I have this feeling because I am applying to graduate school and I am anxious.,apprehensive
hit:12396_conv:24793,utterance,speaker,I am applying to graduate school and I am a little anxious about it!,hopeful
hit:12396_conv:24793,utterance,listener,"Oh, don't be! Just have faith in yourself and be confident that you can make it in.",neutral
hit:12396_conv:24793,utterance,speaker,The interview is what is making me nervous!,anxious
hit:12396_conv:24793,utterance,listener,"I see, think of it as having a conversation with a friend. It will make it easier!",hopeful
hit:5740_conv:11481,situation,none,I got asked if I wanted to go to this party in a shady part of town. I went anyway and it was a great time!,apprehensive
hit:5740_conv:11481,utterance,speaker,"I got asked if I wanted to go to this party, but it was in a really shady part of town.",apprehensive
hit:5740_conv:11481,utterance,listener,Was it with close friends?,questioning
hit:5740_conv:11481,utterance,speaker,I ended up going with some friends and it was great either way.,joyful
hit:5740_conv:11481,utterance,listener,And nothing bad happened?,questioning
hit:11148_conv:22297,situation,none,"I was at the dog rescue and I wanted only 1 dog but I ended up getting 3, I hope I can afford them.",apprehensive
hit:11148_conv:22297,utterance,speaker,I went to the dog rescue shelter the other day to get a dog.,caring
hit:11148_conv:22297,utterance,listener,I love dogs!  Did you find one?,questioning
hit:11148_conv:22297,utterance,speaker,"Oh my goodness, I found 3, I hope I can manage them all.",encouraging
hit:11148_conv:22297,utterance,listener,Oh man!  You must have your hands full!  I bet you're having a ton of fun though,acknowledging
hit:6081_conv:12163,situation,none,I was nervous going to the doctor today. It had been awhile,apprehensive
hit:6081_conv:12163,utterance,speaker,I was unsure going to the doctor today. It had been awhile,apprehensive
hit:6081_conv:12163,utterance,listener,"Yeah, I don't think anyone likes going. How did it go?",questioning
hit:6081_conv:12163,utterance,speaker,I got some medicine so we will see,hopeful
hit:6081_conv:12163,utterance,listener,"I am glad you got the help you needed, and I hope you get better soon.",consoling
hit:5517_conv:11035,situation,none,I'm trying to be more careful with my money these days.,apprehensive
hit:5517_conv:11035,utterance,speaker,I'm focusing on being more financially wise these days.,hopeful
hit:5517_conv:11035,utterance,listener,"That is smart, money is tight these days",acknowledging
hit:5517_conv:11035,utterance,speaker,"Yes, it is and I'm trying to stay afloat by not making mistakes.",agreeing
hit:5517_conv:11035,utterance,listener,"That can be tough to do, but will pay off in the long run!",neutral
hit:3274_conv:6549,situation,none,My husband wants to have another child. I am just not sure that it is the best idea right now. I just cannot decide.,apprehensive
hit:3274_conv:6549,utterance,speaker,My husband thinks we should have another baby.,apprehensive
hit:3274_conv:6549,utterance,listener,What do you think?,questioning
hit:3274_conv:6549,utterance,speaker,I just can't decide. I don't know if now is a very good time. I also wouldn't want to do it if I were any older thougj.,apprehensive
hit:3274_conv:6549,utterance,listener,I can understand that,acknowledging
hit:2816_conv:5632,situation,none,I was in one of those rent to buy furniture stores the other day and of course I got hounded by a salesman. He was pitching me some unrealistic sounding deal on a kitchen table that I totally didn't believe. It was so hard to get him to leave me alone.,apprehensive
hit:2816_conv:5632,utterance,speaker,"""I was in one of those rent to buy furniture stores the other day and of course I got hounded by a salesman. He was pitching me some unrealistic sounding deal on a kitchen table that I totally didn't believe. It was so hard to get him to leave me alone.",apprehensive
hit:2816_conv:5632,utterance,listener,I hate it when salespeople do that. Did you buy something or leave?,annoyed
hit:2816_conv:5632,utterance,speaker,I pretended to get a phone call and then left. They wont walk up to you if your on the phone lol,ashamed
hit:2816_conv:5632,utterance,listener,ha That's a good strategy.,acknowledging
hit:4946_conv:9892,situation,none,I was informed by my doctor that I had to have a biopsy of a suspicious mass. The whole process of waiting for the test and results caused a lot of anxiety.,apprehensive
hit:4946_conv:9892,utterance,speaker,"Earlier this summer I had to have a biopsy of a suspicious mass, to determine if it was cancerous or not. There was a lot of waiting involved which made me very nervous.",apprehensive
hit:4946_conv:9892,utterance,listener,"Oh, man!  That is my nightmare!  You must have been so worried!  Are you OK?",questioning
hit:4946_conv:9892,utterance,speaker,"Thankfully yes! It was totally benign. When they called me and told me that, that was the best phone call I've ever got!",neutral
hit:4946_conv:9892,utterance,listener,I would imagine!  That is great news!  I am sure you had a nice sigh of relief!,acknowledging
hit:8259_conv:16518,situation,none,"I'm not really sure what I'm supposed to be doing with my life right now, but I'm trying to at least get back home.",apprehensive
hit:8259_conv:16518,utterance,speaker,"I don't really have much direction in my life right now, I'm just trying to keep my head above water because I don't really have any other option.",faithful
hit:8259_conv:16518,utterance,listener,Oh no that is terrible. Is there anyone near you that could be of help? Maybe a family member or someone that can lend a hand or ear? I'm so sorry to hear this.,sympathizing
hit:8259_conv:16518,utterance,speaker,"I've asked pretty much everyone in my family for help, and it seems the answer from all of them is that they can't afford it financially right now.",disappointed
hit:8259_conv:16518,utterance,listener,"I know it means swallowing some pride, but if it's financial help you need, perhaps you could go the route of Gofundme? or maybe government services? I know it might be embarrassing to some people, but sometimes your back is against the wall you have nothing to lose.",suggesting
hit:8259_conv:16518,utterance,speaker,"Yeah, I've applied for government assistance, but haven't received an answer. I think I will try GoFundMe soon.",apprehensive
hit:10973_conv:21947,situation,none,"I've been thinking about applying for a job that looks really great. However, I'm not sure if I'm qualified for it.",apprehensive
hit:10973_conv:21947,utterance,speaker,"I've been thinking about applying to this job that looks great, but I'm not sure if I'm qualified for it.",apprehensive
hit:10973_conv:21947,utterance,listener,"It can't hurt to try, might as well give it a shot, right?",suggesting
hit:10973_conv:21947,utterance,speaker,"Yeah, I think I will. I'm still a little nervous, but it can't hurt to try.",confident
hit:10973_conv:21947,utterance,listener,"The worse they can do is not hire you, gotta put yourself out there. best of luck!",wishing
hit:10619_conv:21239,situation,none,The other day I wasn't too sure about letting my dog off his leash but he seemed to be doing really well recently so I let him off and he was quite obedient and never strayed too far away from me!,apprehensive
hit:10619_conv:21239,utterance,speaker,The other day I wasn't too sure about letting my dog off his leash but he seemed to be doing really well recently so I let him off and he was quite obedient and never strayed too far away from me!,apprehensive
hit:10619_conv:21239,utterance,listener,You are so lucky ! I still keep my 9 month old fur baby on a leash. What breed is your dog ?,questioning
hit:10619_conv:21239,utterance,speaker,He is a lab.,surprised
hit:10619_conv:21239,utterance,listener,"Mine is a German Shepherd.  It is amazing how they walk so close to us, almost tripping over us in our path !",surprised
hit:989_conv:1979,situation,none,I was approached by a man that I did not know while walking in the park.,apprehensive
hit:989_conv:1979,utterance,speaker,I was approached by a man that I did not know while walking in the park,apprehensive
hit:989_conv:1979,utterance,listener,What did you do?,questioning
hit:989_conv:1979,utterance,speaker,He wanted money. I told him I didn't have any and kept walking. I think my dog might have scared him off.,ashamed
hit:989_conv:1979,utterance,listener,Did the dog bark at him?,questioning
hit:8832_conv:17665,situation,none,I was not sure about going to this new mechanic. I had heard good and bad things,apprehensive
hit:8832_conv:17665,utterance,speaker,I am not sure about going to this new mechanic. I have good and bad things,apprehensive
hit:8832_conv:17665,utterance,listener,well what are some things that are bad from him,questioning
