Dialog_ID,Type,Actor,Text,Label
hit:794_conv:1588,utterance,speaker,"No, He probably saw it as a sign because he asked me to play months later. He got really good i was really in awe about it.",neutral
hit:11384_conv:22768,situation,none,I went to an auction last week and saw someone spend one million dollars.,impressed
hit:11384_conv:22768,utterance,speaker,I went to an auction last week and saw this guy spend so much money!,impressed
hit:11384_conv:22768,utterance,listener,Did anyone try to bid against him?,questioning
hit:11384_conv:22768,utterance,speaker,Yea some other guy but no one else.,jealous
hit:11384_conv:22768,utterance,listener,"Wow, did he buy anything cool?",questioning
hit:11384_conv:22768,utterance,speaker,An old school car and three other newer cars.,sentimental
hit:3615_conv:7230,situation,none,"My daughter got straight As in her last semester result, im happy with her",proud
hit:3615_conv:7230,utterance,speaker,"I have spent alot of effort grooming my daughter to be a smart girl, she did well last semester with straight As and I am very proud of her",proud
hit:3615_conv:7230,utterance,listener,woow that is good of her. encourage her to keep shinning,acknowledging
hit:3615_conv:7230,utterance,speaker,"I will she already knows what she wants to become, she wants to be a lawyer",confident
hit:3615_conv:7230,utterance,listener,i love lawyers too especially the serious ones as they know how to bring back justice,agreeing
hit:5550_conv:11100,situation,none,When we visited Gulf Shore on Vacation I felt this way.,impressed
hit:5550_conv:11100,utterance,speaker,We went to Gulf Shores on vacation for the first time and it was so nice.,content
hit:5550_conv:11100,utterance,listener,"wow, it sounds like a very exotic holiday",acknowledging
hit:5550_conv:11100,utterance,speaker,"It was nice, but not quite exotic.",neutral
hit:5550_conv:11100,utterance,listener,"Ok, but at least you got to do something you have always wanted right? visit gulf shores",neutral
hit:11674_conv:23348,situation,none,My Gf baked me a cake and i had no idea she could cook',impressed
hit:11674_conv:23348,utterance,speaker,So my Girlfriend randomly baked me a cake last night and it was super good,surprised
hit:11674_conv:23348,utterance,listener,Surprise cake is the best.  What flavor was it?,questioning
hit:11674_conv:23348,utterance,speaker,It was chocolate and she made it from scratch,impressed
hit:11674_conv:23348,utterance,listener,"Very nice, you should hold onto that girl.  Did you ask her to marry you on the spot?",questioning
hit:2555_conv:5111,situation,none,"I got a new car, a Volkswagen Jetta, and the gas mileage is great! Totally beats the Inifiniti I had previously.",impressed
hit:2555_conv:5111,utterance,speaker,I got a new car and it's great on gas mileage,joyful
hit:2555_conv:5111,utterance,listener,Ooh how fun you must have many adventures planned.,acknowledging
hit:2555_conv:5111,utterance,speaker,"Yes I do, first one will be in two weeks",agreeing
hit:2555_conv:5111,utterance,listener,Well I hope it is super awesome!,encouraging
hit:11904_conv:23809,situation,none,i saw a guy lie his way through taking a test,impressed
hit:11904_conv:23809,utterance,speaker,i saw a guy lie his way through taking a test,impressed
hit:11904_conv:23809,utterance,listener,oh no! why didn't you do anything about it?,questioning
hit:11904_conv:23809,utterance,speaker,i aint no snitch? Its not my life why be a loser and ruin theirs,angry
hit:11904_conv:23809,utterance,listener,snitch? is that actually still a thing?,questioning
hit:11904_conv:23809,utterance,speaker,no i just dont see why anyone would tattle like a child on someone when it doesnt affect you,neutral
hit:6145_conv:12290,situation,none,watching my favorite band,impressed
hit:6145_conv:12290,utterance,speaker,i am alwys in awe watching my favorite band play,impressed
hit:6145_conv:12290,utterance,listener,What band is it,questioning
hit:6145_conv:12290,utterance,speaker,the band prolyphia,nostalgic
hit:6145_conv:12290,utterance,listener,Thats a cool name,acknowledging
hit:4094_conv:8188,situation,none,My son stayed over my friends out. She said he was so well behaved. I was surprised because I spoiled him terribly.,impressed
hit:4094_conv:8188,utterance,speaker,MY son stayed over a friends house las week,trusting
hit:4094_conv:8188,utterance,listener,How did it go? Was it his first sleep over?,questioning
hit:4094_conv:8188,utterance,speaker,IT was. He was well behaved. I was surprised because he is only 3 and I spoiled him. oops,impressed
hit:4094_conv:8188,utterance,listener,That's impressive for a 3 year old!  I didn't have my first sleepover til I was 6.,impressed
hit:4094_conv:8188,utterance,speaker,She is my best friend and she has all boys,jealous
hit:11417_conv:22834,situation,none,I was thoroughly inspired by Tony Bennet's performance in concert in April. He is 92!,impressed
hit:11417_conv:22834,utterance,speaker,I saw Tony Bennett in concert in April!,joyful
hit:11417_conv:22834,utterance,listener,Did you have a good time?,questioning
hit:11417_conv:22834,utterance,speaker,Yes! It was an amazing performance! He is already 92 years old!,impressed
hit:11417_conv:22834,utterance,listener,That's amazing for someone that age. And his voice was still good?,impressed
hit:4708_conv:9416,situation,none,I was surprised at the quality of music at my county fair last night,impressed
hit:4708_conv:9416,utterance,speaker,I went to my county fair last night and listened to some music.,joyful
hit:4708_conv:9416,utterance,listener,I haven't been to a fair in so long.,excited
hit:4708_conv:9416,utterance,speaker,"I've missed the last couple of years, but the music was surprisingly good this time.",impressed
hit:4708_conv:9416,utterance,listener,That's cool. Did you meet some cool people.,acknowledging
hit:9612_conv:19225,situation,none,I came home from grocery shopping to find that my husband had cleaned the entire house up and started dinner.  I was amazed.,impressed
hit:9612_conv:19225,utterance,speaker,I came home from grocery shopping to find that my husband had cleaned the entire house up and started dinner. I was amazed.,impressed
hit:9612_conv:19225,utterance,listener,Wow that must of been such a great surprise.,acknowledging
hit:9612_conv:19225,utterance,speaker,"It was. He's not a muti-tasker, which is fine, and I was surprised that he got it all done in the 1.5 hours I was gone.",impressed
hit:9612_conv:19225,utterance,listener,Dang he should clean my house too then while i am gone.,suggesting
hit:9095_conv:18191,situation,none,it was impressive seeing a guy eat a 3 lbs burger the other day,impressed
hit:9095_conv:18191,utterance,speaker,it was impressive seeing a guy eat a 3 lbs burger the other day,impressed
hit:9095_conv:18191,utterance,listener,Woah!  Bet he was digesting for days!,acknowledging
hit:9095_conv:18191,utterance,speaker,yea,nostalgic
hit:9095_conv:18191,utterance,listener,That is amazing.  He should be on one of those food shows to see how much he can eat.,impressed
hit:7034_conv:14068,situation,none,i moved my push ups to 1000 im astonished,impressed
hit:7034_conv:14068,utterance,speaker,"i love calisthenics , recently i moved up my push ups to a total of 1000 and astonished at what the body is capable",impressed
hit:7034_conv:14068,utterance,listener,"Wow, that is awesome! How long does that take?",questioning
hit:7034_conv:14068,utterance,speaker,"about 1 hour and a half , but i do other exercises like dips , pull ups , and curls with elastic bands",neutral
hit:7034_conv:14068,utterance,listener,That is really great! Your fitness and health are very important to take care of.,acknowledging
hit:1428_conv:2857,situation,none,I've been happy with the amount of work I've gotten done today.,impressed
hit:1428_conv:2857,utterance,speaker,I've gotten a good deal of work done today.,content
hit:1428_conv:2857,utterance,listener,That's awesome. You must feel really relieved.,acknowledging
hit:1428_conv:2857,utterance,speaker,I do feel a lot better when I work well.,confident
hit:1428_conv:2857,utterance,listener,Do you tend to have a lot of work?,questioning
hit:746_conv:1492,situation,none,I was very positively suprissed by the work done by a coworker.,impressed
hit:746_conv:1492,utterance,speaker,"Hi, yesterday, I was very positively suprissed by the work done by a coworker.",impressed
hit:746_conv:1492,utterance,listener,Thats good news! What did they do to surprise you?,questioning
hit:746_conv:1492,utterance,speaker,He is realised a full project on his own and have used all IT best pratices for this project in very short period of time. He is very skilled.,impressed
hit:746_conv:1492,utterance,listener,"Amazing, Im happy for you. :)",acknowledging
hit:11781_conv:23562,situation,none,"My mom has taken on my brother's two children in the interim while he deals with social services, for getting in trouble with the law. She's in her 60s, and she's handling a 2-year-old and 7-year-old, while working full time. I'm proud of her.",impressed
hit:11781_conv:23562,utterance,speaker,"My mom has taken on my brother's two children in the interim while he deals with social services, for getting in trouble with the law. She's in her 60s, and she's handling a 2-year-old and 7-year-old, while working full time. I'm proud of her.",impressed
hit:11781_conv:23562,utterance,listener,Your mom must be a strong woman.,acknowledging
hit:11781_conv:23562,utterance,speaker,"I love her. She has so much patience to deal with it all, and she does it all with kindness, and tries to be as loving as possible to the children. But I wish she were harder on my brother. Sometimes I feel like she enables him, by how much she helps him, and prevents reality from slapping my brother in the face. Either way, she's a great woman.",caring
hit:11781_conv:23562,utterance,listener,That sounds so troubling.  You should get on your brother's case.,acknowledging
hit:12267_conv:24534,situation,none,My husband started working out only 3 months ago and can already do 90 push ups in a row! Its crazy amazing!,impressed
hit:12267_conv:24534,utterance,speaker,My husband started working out only 3 months ago and can already do 90 push ups in a row! Its crazy amazing!,impressed
hit:12267_conv:24534,utterance,listener,Wow that is impressive. Do you work with him?,questioning
hit:12267_conv:24534,utterance,speaker,I do workout with him. I have a lot of muscle problems so I can only do 20 wall push ups but its a far cry from where I started.,proud
hit:12267_conv:24534,utterance,listener,That is still not bad!,acknowledging
hit:1983_conv:3967,situation,none,"I went to a circus recently and was thought it was going to be boring, but it was very fun!",impressed
hit:1983_conv:3967,utterance,speaker,"I went to a circus recently and was thought it was going to be boring, but it was very fun!",impressed
hit:1983_conv:3967,utterance,listener,"That sounds cool, what did the circus consist of? Did they have elephants?",questioning
hit:1983_conv:3967,utterance,speaker,No exotic animals were at the circus which I why I thought it would be boring. But there were a lot of acrobatics and terrifying stunts by people!,surprised
hit:1983_conv:3967,utterance,listener,Cool! I haven't been to a circus in years. I think I should go again soon.,acknowledging
hit:8197_conv:16394,situation,none,I can't believe how well my boyfriend did in cooking class. He was a lost soul before,impressed
hit:8197_conv:16394,utterance,speaker,My boyfriend and I did a cooking class for dater night.,confident
hit:8197_conv:16394,utterance,listener,what did you all make,questioning
hit:8197_conv:16394,utterance,speaker,We make chicken parmesan with home made pasta. He got the best student award!,proud
hit:8197_conv:16394,utterance,listener,that sounds tasty.,acknowledging
hit:8197_conv:16394,utterance,speaker,It was I told him he has to cook once a week now,ashamed
hit:8816_conv:17632,situation,none,I was at a skating park the other day. Some of the people were doing amazing tricks.,impressed
hit:8816_conv:17632,utterance,speaker,Hi I went to a skating park.,joyful
hit:8816_conv:17632,utterance,listener,Never heard of such a thing. Is it outdoors?,questioning
hit:8816_conv:17632,utterance,speaker,Yes but sometimes they are also indoors.,neutral
hit:8816_conv:17632,utterance,listener,"True, is it a fun place too go?",questioning
hit:8816_conv:17632,utterance,speaker,Yes there are some very talented people that skate there,impressed
hit:3081_conv:6162,situation,none,Just saw a squirrel jump from one neirbor's deck to the other. Pretty amazing.,impressed
hit:3081_conv:6162,utterance,speaker,Just saw a squirrel jump from one neirbor's deck to the other. Pretty amazing,impressed
hit:3081_conv:6162,utterance,listener,Those little guys are quite nimble!  Did is surprise you?,questioning
hit:3081_conv:6162,utterance,speaker,Oh yea. I saw it and was quite amazed. Didn't know they can jump that far.,impressed
hit:3081_conv:6162,utterance,listener,"Yeah, I guess they need to be agile to escape all the neighborhood cats!",suggesting
hit:2812_conv:5625,situation,none,A friend of mine wrote a book. I admire the dedication and knowledge she has to complete such a big project.,impressed
hit:2812_conv:5625,utterance,speaker,A friend just published her own book. I don't know how she does it!,impressed
hit:2812_conv:5625,utterance,listener,That's awesome! What is the name of the book?,questioning
hit:2812_conv:5625,utterance,speaker,"I honestly can't remember right now (don't tell her I said that), but I know she worked on it for a long time.",neutral
hit:2812_conv:5625,utterance,listener,That's great. I produce audio and I have an album coming out by the end of the summer! Tell her to keep it up!,acknowledging
hit:9024_conv:18049,situation,none,i was watching jeopardy with a friend the other day and the category was british literature. he crushed it.,impressed
hit:9024_conv:18049,utterance,speaker,"I was watching jeopardy with my friend the other day, and the cateogry was british literature.",impressed
hit:9024_conv:18049,utterance,listener,Did you know all the answers?  I wouldn't be too good at it.,questioning
hit:9024_conv:18049,utterance,speaker,"Lol I didn't know squat, but my buddy knew every freaking question!",jealous
hit:9024_conv:18049,utterance,listener,"Wow, impressive!  I'd have to get some category like Kids or Nutrition to know much of anything. ha ha",impressed
hit:8907_conv:17814,situation,none,I ate at my favorite restaurant earlier and everything was tasted better than ever!,impressed
hit:8907_conv:17814,utterance,speaker,I ate at my favorite restaurant earlier and everything was tasted better than ever!,impressed
hit:8907_conv:17814,utterance,listener,"Oh wow! That usually doesn't happy, usually that feeling fades with time.",acknowledging
hit:8907_conv:17814,utterance,speaker,indeed some places go down hill with time but things turned out even better today,neutral
hit:8907_conv:17814,utterance,listener,It sounds like you have a keep of a place to go!,acknowledging
hit:8661_conv:17322,situation,none,I saw a man drink an entire gallon of chocolate milk.  I was very inspired by the act.,impressed
hit:8661_conv:17322,utterance,speaker,I saw a man drink an entire gallon of chocolate milk.,impressed
hit:8661_conv:17322,utterance,listener,That man is a winner if he kept it all down!,impressed
hit:8661_conv:17322,utterance,speaker,He did! I was very inspired by the act!,impressed
hit:8661_conv:17322,utterance,listener,I am really amazed.  Was it you?,questioning
hit:8661_conv:17322,utterance,speaker,"No it was a friend of mine, I wish I could do that.",jealous
hit:11335_conv:22670,situation,none,my daughter made the volleyball team,impressed
hit:11335_conv:22670,utterance,speaker,my daughet made the volleyball team,proud
hit:11335_conv:22670,utterance,listener,That's great!  Congrats to her!  I bet she worked hard.,acknowledging
hit:11335_conv:22670,utterance,speaker,"yes, we both were on pin and needles",neutral
hit:11335_conv:22670,utterance,listener,I bet!  She's going to have so much fun,encouraging
hit:11335_conv:22670,utterance,speaker,i hope so. she really wanted this,encouraging
hit:8948_conv:17896,situation,none,i won a lottery,proud
hit:8948_conv:17896,utterance,speaker,"Let me tell you something, i never win anything but yesterday i won 75$ in a lotery! i know it's not much but i felt so lucky",joyful
hit:8948_conv:17896,utterance,listener,That's really awesome! I never win anything either...,acknowledging
hit:8948_conv:17896,utterance,speaker,that's why i was so surprised when i saw i won some money. i kept checking to see if it's really true,surprised
hit:8948_conv:17896,utterance,listener,Well congratulations! I hope you spend it on something good for yourself!,wishing
hit:2181_conv:4362,situation,none,"My neighbors got together to clean up our community, it was a great thing to see!",impressed
hit:2181_conv:4362,utterance,speaker,"My neighborhood put together a community wide cleanup day, it was great fun and such a sight to see!",impressed
hit:2181_conv:4362,utterance,listener,That is so beautiful! Are you going to do it every year now and make it tradition?,questioning
hit:2181_conv:4362,utterance,speaker,"I think so, it was such a great turnout, it'd be silly not to!",surprised
hit:2181_conv:4362,utterance,listener,Right! Thats what I am thinking too... so cool when communities come together like that.,acknowledging
hit:2775_conv:5550,situation,none,that i won a medal for the high jump,proud
hit:2775_conv:5550,utterance,speaker,I am so proud of myself for winning a medal at the track meet we had last year.,proud
hit:2775_conv:5550,utterance,listener,Congratulations. I never payed any sports.,wishing
hit:2775_conv:5550,utterance,speaker,I enjoyed them because I like competition.,impressed
hit:2775_conv:5550,utterance,listener,Did you win a lot?,questioning
hit:2868_conv:5737,situation,none,I was very happy when I saw my favorite band live last night. They were so good,impressed
hit:2868_conv:5737,utterance,speaker,I got to see my favorite band last night. They were good,impressed
hit:2868_conv:5737,utterance,listener,Oh that is pretty neat. Who is your favorite band anyway?,questioning
hit:2868_conv:5737,utterance,speaker,"Deftones, they have been around for awhile",surprised
hit:2868_conv:5737,utterance,listener,"Oh I like them too. I like that song I think it is called ""Change"". It is so good.",agreeing
hit:7101_conv:14202,situation,none,My friend had basically nothing in his life. Randomly he got a job and a girlfriend within like a week.,impressed
hit:7101_conv:14202,utterance,speaker,I was really proud of my friend recently.,impressed
hit:7101_conv:14202,utterance,listener,What did they do to make you proud?,questioning
hit:7101_conv:14202,utterance,speaker,He got a job and found a girlfriend so soon that I can't help but feel good for him.,proud
hit:7101_conv:14202,utterance,listener,That is good news. What kind of job?,questioning
hit:12329_conv:24659,situation,none,My mom forgave me for something horrible i did. I am so soprised of how amazing she is.,impressed
hit:12329_conv:24659,utterance,speaker,My mom is the best. my mom gave me the benefit of the doubt when i got a DUI.,grateful
hit:12329_conv:24659,utterance,listener,Were you actually under the influence?,questioning
hit:12329_conv:24659,utterance,speaker,"Yes, i thought she would disown me but she ended up supporting me.",neutral
hit:12329_conv:24659,utterance,listener,"Well that's great of her, we've all done stuff.",acknowledging
hit:7565_conv:15130,situation,none,I really enjoyed the concert last night.,impressed
hit:7565_conv:15130,utterance,speaker,I really enjoyed the concert last night.,impressed
hit:7565_conv:15130,utterance,listener,What was the concert?,questioning
hit:7565_conv:15130,utterance,speaker,It was Taylor Swift.,surprised
hit:7565_conv:15130,utterance,listener,I'm glad you enjoyed it.,sympathizing
hit:6199_conv:12398,situation,none,My friend's 8 year old kid cooks like a tiny Chef Ramsey.,impressed
hit:6199_conv:12398,utterance,speaker,My friend's 8 year old kid cooks like a tiny Chef Ramsey.,impressed
hit:6199_conv:12398,utterance,listener,"That is very nice to have around, what kind of food",acknowledging
hit:6199_conv:12398,utterance,speaker,She can cook all kinds. I had 3 servings of everything!,content
hit:6199_conv:12398,utterance,listener,I am very jealous,jealous
hit:7398_conv:14797,situation,none,I saw this little chihuahua tell off a parrot.,impressed
hit:7398_conv:14797,utterance,speaker,I saw this little chihuahua tell off a parrot.,impressed
hit:7398_conv:14797,utterance,listener,oh really how?,questioning
hit:7398_conv:14797,utterance,speaker,He was barking until the parrot shut up.,annoyed
hit:7398_conv:14797,utterance,listener,haha that is great,acknowledging
hit:9111_conv:18223,situation,none,My friend changed carerr in her 40s and turns to be the best decision of her life.,impressed
hit:9111_conv:18223,utterance,speaker,My friend changed carerr in her 40s and turns to be the best decision of her life,impressed
hit:9111_conv:18223,utterance,listener,"That's awesome, she sounds multi faceted.",acknowledging
hit:9111_conv:18223,utterance,speaker,Yea. She's definitely an inspiration. I'm glad to see her happy now.,agreeing
hit:9111_conv:18223,utterance,listener,"That's human, when you live for a while you don't have to get stuff right the first time.",neutral
hit:7869_conv:15739,situation,none,I was watching a NFL preseason game the other day. I was so impressed at the athleticism of the players. They must train hard.,impressed
hit:7869_conv:15739,utterance,speaker,I was watching a preseason football game the other night. I was impressed at how athletic the players are.,impressed
hit:7869_conv:15739,utterance,listener,"Oh wow, What team was you watching ?",questioning
hit:7869_conv:15739,utterance,speaker,It was the Tampa Bay Bucs. They must train real hard. I will have to watch the regular season now.,impressed
hit:7869_conv:15739,utterance,listener,Oh wow! Personally I am a fan of the Falcons.,surprised
hit:1617_conv:3234,situation,none,I had never eaten at an authentic Italian restaurant until today. It was awesome.,impressed
hit:1617_conv:3234,utterance,speaker,I had my first real Italian restaurant experience today.,impressed
hit:1617_conv:3234,utterance,listener,"That sounds like a lot of fun! I mean I haven't even really gone anywhere higher than Olive Garden myself, so I'm jealous. Did you go with anyone special?",questioning
hit:1617_conv:3234,utterance,speaker,I took my daughter. It was really good. Olive Garden is good but this place was great.,impressed
hit:1617_conv:3234,utterance,listener,"That's really sweet! I bet that was a nice scene. Was it a special occasion, or did you guys just want to enjoy yourselves just for the heck of it",acknowledging
hit:1617_conv:3234,utterance,speaker,Just doing something nice before school starts.,caring
hit:7596_conv:15193,situation,none,I was really glad to the work the mason did on my building,impressed
hit:7596_conv:15193,utterance,speaker,The mason did a great job,impressed
hit:7596_conv:15193,utterance,listener,What did he do?,questioning
hit:7596_conv:15193,utterance,speaker,He did erect the structure for my new building,neutral
hit:7596_conv:15193,utterance,listener,That sounds very interesting.,acknowledging
hit:7596_conv:15193,utterance,speaker,It's really interesting,acknowledging
hit:12188_conv:24377,situation,none,"My boyfriend came home with a brand new car for me, one that I really wanted. I was shocked and very happy.",surprised
hit:12188_conv:24377,utterance,speaker,"My boyfriend came home with a brand new car for me, one that I really wanted.",jealous
hit:12188_conv:24377,utterance,listener,Congrats! Did he choose wisely?,wishing
hit:12188_conv:24377,utterance,speaker,"Yes, I was shocked and happy at the same time!",surprised
hit:12188_conv:24377,utterance,listener,"Well, you did say it was one you really wanted. How nice of him to do that for you.",neutral
hit:3625_conv:7251,situation,none,My friend learned to speak another language (quite fluently) in 3 months. I don't think I could ever do that!,impressed
hit:3625_conv:7251,utterance,speaker,My friend learned to speak another language (quite fluently) in 3 months,impressed
hit:3625_conv:7251,utterance,listener,"That's honestly really amazing, most people take forever to learn even a tiny bit of a foreign language.",impressed
hit:3625_conv:7251,utterance,speaker,"I know! I doubt I could do that. I tried to before, but I quickly gave up. Maybe too quickly",agreeing
hit:3625_conv:7251,utterance,listener,"Some people just have amazing dedication, something I don't seem to have.",jealous
hit:6577_conv:13154,situation,none,"My sister got  a great job at Lockheed martin, very impressed",impressed
hit:6577_conv:13154,utterance,speaker,My sister now works at Lockheed Martin. I wish that was my job,jealous
hit:6577_conv:13154,utterance,listener,That's really impressive! What do you like about it?,questioning
hit:6577_conv:13154,utterance,speaker,They build airplanes and missiles i always wanted to work with fighter jets,jealous
hit:6577_conv:13154,utterance,listener,That does sound really exciting.,acknowledging
hit:4598_conv:9196,situation,none,I was very impressed with a speaker I heard at work last week. He really got to me,impressed
hit:4598_conv:9196,utterance,speaker,I was impressed with a speaker at work last week. He really got to me,impressed
hit:4598_conv:9196,utterance,listener,Oh so what did he speak about?,questioning
hit:4598_conv:9196,utterance,speaker,It was about saving money,sentimental
hit:4598_conv:9196,utterance,listener,That is a very important topic to know about. I always try to save money where I can.,agreeing
