Dialog_ID,Type,Actor,Text,Label
hit:4306_conv:8612,utterance,speaker,"I'm not familiar with skating myself, but he was skating on some kind of rap and doing all kinds of tricks.",impressed
hit:4306_conv:8612,utterance,listener,"Oh, now I understand.  He is skateboarding.",agreeing
hit:4157_conv:8315,situation,none,I recently was very shocked and happy to find my husband had cleaned the entire house while I was out with friends.,impressed
hit:4157_conv:8315,utterance,speaker,I recently was very shocked and happy to find my husband had cleaned the entire house,impressed
hit:4157_conv:8315,utterance,listener,That was sweet of him!  Were you shocked because that's something that never happens?,questioning
hit:4157_conv:8315,utterance,speaker,Yes! I was out with some friends and have never come home to a house being so clean after an outing with friends!,impressed
hit:4157_conv:8315,utterance,listener,I guess you need to go out more often so he can keep surprising you.,suggesting
hit:3298_conv:6596,situation,none,I watched a man eat an entire turkey the other day.  I was really inspired from seeing it.,impressed
hit:3298_conv:6596,utterance,speaker,I watched a man eat an entire turkey the other day.,impressed
hit:3298_conv:6596,utterance,listener,wow thats crazy.,acknowledging
hit:3298_conv:6596,utterance,speaker,I was really inspired from seeing it.,impressed
hit:3298_conv:6596,utterance,listener,i bet it was with something like that.,acknowledging
hit:1475_conv:2950,situation,none,My daughter has gone through elementary school with all As!,proud
hit:1475_conv:2950,utterance,speaker,Do you want to know something incredible? My daughter is!,proud
hit:1475_conv:2950,utterance,listener,thats so sweet i bet she is how old is she?,questioning
hit:1475_conv:2950,utterance,speaker,She's 10 and made it through first through fifth grade with all As on every one of her report cards!,impressed
hit:1475_conv:2950,utterance,listener,omg i cant wait to see what that feels like as a parent congrats!,acknowledging
hit:2675_conv:5350,situation,none,I visited a car assembly the new models are awesome!,impressed
hit:2675_conv:5350,utterance,speaker,The latest models of cars are sophisticated,impressed
hit:2675_conv:5350,utterance,listener,I agree. Do you have a new car?,questioning
hit:2675_conv:5350,utterance,speaker,"Not yet,though I'm a car enthusiasts",apprehensive
hit:2675_conv:5350,utterance,listener,Oh cool. I love visiting car shows myself.,acknowledging
hit:9617_conv:19235,situation,none,i was so very happy when my son came home from the navy i felt so happy i was so i can not use the word but it was the best,joyful
hit:9617_conv:19235,utterance,speaker,i dont no what to right,apprehensive
hit:9617_conv:19235,utterance,listener,"I guess neither do I, sorry to hear about your rabbit though.",sympathizing
hit:9617_conv:19235,utterance,speaker,at the time i was little and i cry for days but now i think about it it is funny will not do that again,sentimental
hit:9617_conv:19235,utterance,listener,"Yes its a good lesson for you, hopefully you dont repeat it!",encouraging
hit:9617_conv:19235,utterance,speaker,am grow now and no better lol,sad
hit:6122_conv:12244,situation,none,My brother got a new promotion at work. I was pretty surprised in a good way to see his paycheck,impressed
hit:6122_conv:12244,utterance,speaker,My brother got a promotion at work. I was surprised in a good way at his paycheck,impressed
hit:6122_conv:12244,utterance,listener,"That's great, good for him! It's always makes you feel good when your hard work is appreciated.",acknowledging
hit:6122_conv:12244,utterance,speaker,He did deserve it,impressed
hit:6122_conv:12244,utterance,listener,"Well, it's nice that you are happy for him as well. I'm sure he can find many uses for the extra money.",acknowledging
hit:5258_conv:10517,situation,none,I was in awe when my dad won his award!,impressed
hit:5258_conv:10517,utterance,speaker,I was in awe when my dad won his award,impressed
hit:5258_conv:10517,utterance,listener,Nice. What was the award for?,questioning
hit:5258_conv:10517,utterance,speaker,Best toes in the USA.,impressed
hit:5258_conv:10517,utterance,listener,Congratulation.,wishing
hit:383_conv:767,situation,none,I felt this way when I attended Disney World.,impressed
hit:383_conv:767,utterance,speaker,I can't wait for next february,anticipating
hit:383_conv:767,utterance,listener,What is happening in February?,questioning
hit:383_conv:767,utterance,speaker,I'm going to Disney World with my family for the first time!,excited
hit:383_conv:767,utterance,listener,Good for you.You are going to have the time of your life.,acknowledging
hit:383_conv:767,utterance,speaker,"I can't wait, everyone says it is the most magical place on Earth!",excited
hit:5437_conv:10874,situation,none,My friend learned how to fly a plane in his spare time. I wish I had that kind of dedication!,impressed
hit:5437_conv:10874,utterance,speaker,My friend learned how to fly a plane in his spare time!,impressed
hit:5437_conv:10874,utterance,listener,"Wow, that's a pretty cool hobby. Just a small plane?",acknowledging
hit:5437_conv:10874,utterance,speaker,"Yup. He said he might move up to bigger craft but he's not sure yet. Regardless, I wish I had the nerves to do that",confident
hit:5437_conv:10874,utterance,listener,Yeah I always thought it would be fun to learn to do that.,acknowledging
hit:6888_conv:13776,situation,none,My son hit a home run at little league tonight.,proud
hit:6888_conv:13776,utterance,speaker,My son hit a home run at little league tonight.,proud
hit:6888_conv:13776,utterance,listener,Wow!  Impressive!  He must be beaming and you must be so proud!,acknowledging
hit:6888_conv:13776,utterance,speaker,I was very proud of him.  It was his first one ever and he didn't even know it went over the fence until he had run all the bases.,proud
hit:6888_conv:13776,utterance,listener,I bet his face was priceless when he found out!  Those are the best times in life!  Take him out for vegan ice cream!,joyful
hit:9434_conv:18868,situation,none,I was very positively surprised by the work made by a co-worker.,impressed
hit:9434_conv:18868,utterance,speaker,I was very positively surprised by the work made by a co-worker.,impressed
hit:9434_conv:18868,utterance,listener,Really?  What did they do to impress you so much?,questioning
hit:9434_conv:18868,utterance,speaker,She created a software that use artificial intelligence. The software will help us detect fraud. It is great application.,proud
hit:9434_conv:18868,utterance,listener,Wow!  That sounds amazing and complicated!  Now I understand why you were positively surprised!,acknowledging
hit:5437_conv:10875,situation,none,"I seen a guy driving a motorcycle today riding only on his back wheel. He was going pretty fast too, it was amazing.",impressed
hit:5437_conv:10875,utterance,speaker,I seen this guy driving his motorcycle only on his back wheel today. It was crazy,surprised
hit:5437_conv:10875,utterance,listener,"Haha, I've seen plenty do wheelies. I've seen a few crash too, sadly",neutral
hit:5437_conv:10875,utterance,speaker,"Oh no, yeah he seemed like he had it under control. It was pretty cool.",acknowledging
hit:5437_conv:10875,utterance,listener,"That takes a lot of nerve, so kudos to that guy. I'd never do that because I'd probably die lol",neutral
hit:1411_conv:2823,situation,none,I am impressed by the owner of goats of anarchy. She goes on no matter what.,impressed
hit:1411_conv:2823,utterance,speaker,I love the goats of Anarchy owner. She gave up a lucrative career on wallstreet to save goats and now other animals that would otherwise be pts or used for meat. She dedicates everything to help them.,caring
hit:1411_conv:2823,utterance,listener,That is so generous. Sounds like she has found her calling in life.,grateful
hit:1411_conv:2823,utterance,speaker,She has! She does have hard days when some don't make it. I understand that but she is a saint. if we all helped a cause like this- whether animals or people- much less suffering would happen.,caring
hit:1411_conv:2823,utterance,listener,I hope she is getting the donations she needs to keep doing this.,hopeful
hit:1411_conv:2823,utterance,speaker,She does sometimes. She dedicates her life too it. She definitely should get a show to continue to help animals who need a lot of medical care,impressed
hit:7640_conv:15281,situation,none,Lately I saw a really beautiful piece of art and I loved it.,impressed
hit:7640_conv:15281,utterance,speaker,lately I saw a really beautiful piece of art and I loved it.,impressed
hit:7640_conv:15281,utterance,listener,"Oh, what was it?",questioning
hit:7640_conv:15281,utterance,speaker,It was an art based on the game Zelda!,nostalgic
hit:7640_conv:15281,utterance,listener,That is my favorite video game!,joyful
hit:10430_conv:20860,situation,none,I came back home and noticed my younger bro kept everywhere clean,impressed
hit:10430_conv:20860,utterance,speaker,"I came back home and noticed my younger brother kept everywhere clean, It pleased me",impressed
hit:10430_conv:20860,utterance,listener,That's a pleasant surprise! Is this out of the ordinary?,questioning
hit:10430_conv:20860,utterance,speaker,Oh yeah.  Because he hardly sweep,agreeing
hit:10430_conv:20860,utterance,listener,Let's hope he keeps it up!,encouraging
hit:3960_conv:7921,situation,none,I heard a speaker on tv tonight that was really impressive. It made me want to save money,impressed
hit:3960_conv:7921,utterance,speaker,I heard a person tv tonight that was impressive. He made me want to save money,impressed
hit:3960_conv:7921,utterance,listener,It wasn't Dave Ramsey was it?,questioning
hit:3960_conv:7921,utterance,speaker,"Ha, it absolutely was",agreeing
hit:3960_conv:7921,utterance,listener,Ha I took a shot in the dark. I have heard him recommended a lot for people who want to learn how to pay down debt and save money.,apprehensive
hit:3895_conv:7790,situation,none,I went to a tiny little restaurant in my neighborhood today. I was amazed at how good it was.,impressed
hit:3895_conv:7790,utterance,speaker,I tried a new restaurant in my neighborhood today,impressed
hit:3895_conv:7790,utterance,listener,How'd it go?,questioning
hit:3895_conv:7790,utterance,speaker,IT was amazing. I couldn't believe such a small place was so good.,impressed
hit:3895_conv:7790,utterance,listener,Sounds like a great place! What did you get?,questioning
hit:3895_conv:7790,utterance,speaker,"Just a salad, but I tried my boufriends pasta and it was great",neutral
hit:1468_conv:2936,situation,none,when my family bought me a car,grateful
hit:1468_conv:2936,utterance,speaker,I cant not believe my family did what they did for me !,grateful
hit:1468_conv:2936,utterance,listener,Do you mind talking about it specifically?,questioning
hit:1468_conv:2936,utterance,speaker,"Of course, they bought a car for me... still in shock",surprised
hit:1468_conv:2936,utterance,listener,haha well that's a pleasant surprise...what kind of car,acknowledging
hit:3517_conv:7035,situation,none,"I was proud of my friend when he was the high school valedictorian, he did a great job!",impressed
hit:3517_conv:7035,utterance,speaker,"I have heard that, diapers and formula are expensive for no reason",apprehensive
hit:3517_conv:7035,utterance,listener,They sure are! I try to breastfeed but usually can't do that for more than 6 months so I'm hoping I can keep my milk supply up longer. It really does cost a fortune.  I also use reusable diapers at home.,hopeful
hit:3517_conv:7035,utterance,speaker,"I was proud of my friend when he was the high school valedictorian, he did a great job",impressed
hit:3517_conv:7035,utterance,listener,"That is so cool!  Also, its great how proud you were of him.  When did that happen?",acknowledging
hit:3517_conv:7035,utterance,speaker,"That would save you a lot of money, I know formula specifically is very very pricey. I did not know reusable diapers existed!",agreeing
hit:1137_conv:2274,situation,none,Lakers getting Lebron was impressive,impressed
hit:1137_conv:2274,utterance,speaker,Lakers getting Lebron was impressive,impressed
hit:1137_conv:2274,utterance,listener,I saw that.  It was pretty crazy!,acknowledging
hit:1137_conv:2274,utterance,speaker,yea,nostalgic
hit:1137_conv:2274,utterance,listener,What are your thoughts on that?,questioning
hit:1667_conv:3335,situation,none,I am really impressed that I am still able to teach my dog things at his age,impressed
hit:1667_conv:3335,utterance,speaker,I am really impressed that I am still able to teach my dog things at his age,impressed
hit:1667_conv:3335,utterance,listener,How old is he?,questioning
hit:1667_conv:3335,utterance,speaker,He is 14!,surprised
hit:1667_conv:3335,utterance,listener,"Wow, you can teach an old dog new tricks.",impressed
hit:10000_conv:20001,situation,none,I really like the new paint job on my house.,impressed
hit:10000_conv:20001,utterance,speaker,I really like the new paint job on my house.,impressed
hit:10000_conv:20001,utterance,listener,That's nice. What color did you paint it?,questioning
hit:10000_conv:20001,utterance,speaker,I went with blue and yellow.,faithful
hit:10000_conv:20001,utterance,listener,Those are swell colors! I am sure they will bring any guests much joy and merriment.,joyful
hit:11654_conv:23309,situation,none,My friend managed to do a cartwheel in front of me. I didn't think he could do it anymore.,impressed
hit:11654_conv:23309,utterance,speaker,My friend managed to do a cartwheel in front of me. I didn't think he could do it anymore.,impressed
hit:11654_conv:23309,utterance,listener,haha that's pretty cool. Is he a gymnasist?,acknowledging
hit:11654_conv:23309,utterance,speaker,"Nope, he just swore he would be able to. I can't accomplish that!",angry
hit:11654_conv:23309,utterance,listener,Me neither! That is pretty cool. I fun party trick haha,acknowledging
hit:1514_conv:3028,situation,none,I recently visited a new restaurant in town. I didn't have high expections but it was great!,impressed
hit:1514_conv:3028,utterance,speaker,I didn't have high expectations for this new restaurant in town but my friend and I had dinner there last week and it was better than I thought it would be!,impressed
hit:1514_conv:3028,utterance,listener,"That's always a positive in my book, what kind of food was it?  What were your reservations about the restaurant before going?",questioning
hit:1514_conv:3028,utterance,speaker,"It was seafood and no, they weren't. Usually the restaurants in that particular building don't last long  at all.",surprised
hit:1514_conv:3028,utterance,listener,Is it in a bad part of town or is the building just bad luck or run down?,questioning
hit:4301_conv:8603,situation,none,It's really amazing the amount of great doctors that write books. I had a lot of research to do and I love that there is so much information readily available.,impressed
hit:4301_conv:8603,utterance,speaker,It's really amazing the amount of great doctors that write books.,impressed
hit:4301_conv:8603,utterance,listener,"Oh really, I was unaware of that.",neutral
hit:4301_conv:8603,utterance,speaker,I had a lot of research to do and I love that there is so much information readily available.,impressed
hit:4301_conv:8603,utterance,listener,That is quite interesting.,acknowledging
hit:1422_conv:2844,situation,none,I was really impressed when my boss won an award for his leadership.,impressed
hit:1422_conv:2844,utterance,speaker,I was really impressed when my boss won an award for his leadership,impressed
hit:1422_conv:2844,utterance,listener,"Cool. Did he thank the ""little people""?",questioning
hit:1422_conv:2844,utterance,speaker,Yes he certainly did.,agreeing
hit:1422_conv:2844,utterance,listener,That's good. Sometimes bosses think they do it all by themselves.,impressed
hit:5477_conv:10955,situation,none,My daughter is 6 years old and learning to use a sewing machine,proud
hit:5477_conv:10955,utterance,speaker,"My daughter is 6 and learning how to use a sewing machine, very cool!",impressed
hit:5477_conv:10955,utterance,listener,"it is indeed, learning things at young age is a boon. you got an exceptional daughter",agreeing
hit:5477_conv:10955,utterance,speaker,"Thank you, I'm pretty lucky to be her mom",grateful
hit:5477_conv:10955,utterance,listener,haha!! you are i guess!!,acknowledging
hit:7883_conv:15767,situation,none,I've been pleased with how well things have been going lately.,impressed
hit:7883_conv:15767,utterance,speaker,I've been happy with the way things have been going lately.,content
hit:7883_conv:15767,utterance,listener,That's Awesome. Did you change anything lately?,questioning
hit:7883_conv:15767,utterance,speaker,I've just been trying harder with life in general.,hopeful
hit:7883_conv:15767,utterance,listener,Oh that is awesome. What motivates you?,questioning
hit:11007_conv:22015,situation,none,My daughter won an award at her school for best artist. I was so happy for her.,proud
hit:11007_conv:22015,utterance,speaker,My daughter won an award at her school for best artist. I was so happy for her.,proud
hit:11007_conv:22015,utterance,listener,Sounds amazing! What kind of art does she want to produce?,questioning
hit:11007_conv:22015,utterance,speaker,She likes to work in oils but lately she's been doing sculture too.,neutral
hit:11007_conv:22015,utterance,listener,Wow. Sculpture. Very impressed.,impressed
hit:11007_conv:22015,utterance,speaker,"She's in grade 12, not sure if she'll persue it in university.",apprehensive
hit:10561_conv:21122,situation,none,"My wife amazes me more and more everyday. She's worked so hard for years to get to where she is today, and has become very successful in her line of work.",impressed
hit:10561_conv:21122,utterance,speaker,I just got married to a wonderful woman. She's been working so hard to get to where she is nowadays. She's become a very successful clinical psychologist.,proud
hit:10561_conv:21122,utterance,listener,"Wow, you are a lucky man! Good to have a psychologist in the family too.",acknowledging
hit:10561_conv:21122,utterance,speaker,"Yeah but it would be a tad unethical to get service from her, but I assure you she's a good one.",neutral
hit:10561_conv:21122,utterance,listener,I wish you both all the best and hope that you have a wonderful life together!,wishing
hit:10561_conv:21122,utterance,speaker,Thank you so much that is so kind of you to say.,sympathizing
hit:6278_conv:12556,situation,none,I have recently started watching professional handball. I can't believe how good some of the players are. They must have been training a long time.,impressed
hit:6278_conv:12556,utterance,speaker,I started watching professional handball recently. It is such a great sport. I can't believe how good some of the player are.,impressed
hit:6278_conv:12556,utterance,listener,my dad used to play hand ball.it was very fun and interesting watching them play when i was a kid,nostalgic
hit:6278_conv:12556,utterance,speaker,"Cool, I am surprised it is not more popular. It is really exciting to watch.",acknowledging
hit:6278_conv:12556,utterance,listener,yeah.it needs more exposure,agreeing
hit:1098_conv:2197,situation,none,It was impressive that Lebron left the cavs a second time,impressed
hit:1098_conv:2197,utterance,speaker,It was impressive that Lebron left the cavs a second time,impressed
hit:1098_conv:2197,utterance,listener,"Yes, I was happy he left.",joyful
hit:1098_conv:2197,utterance,speaker,i hope he can bring down the warriors in the next year or two,encouraging
hit:1098_conv:2197,utterance,listener,I don't think he will.,apprehensive
hit:1679_conv:3359,situation,none,I watched my friend do a really cool backflip!,impressed
hit:1679_conv:3359,utterance,speaker,I was so happy to watch my friend do a backflip,impressed
hit:1679_conv:3359,utterance,listener,I've always been too scared to do a backflip. I always worry I'm going to break my neck or something. Did it take him a long time to get it right?And did he get hurt?,apprehensive
hit:1679_conv:3359,utterance,speaker,I think he just took gymnastics classes. He luckily did not get hurt!,grateful
hit:1679_conv:3359,utterance,listener,"Oh, that makes sense. And I'm glad to hear that. I always worry about that sort of thing. You ever think about trying to do it netx?",acknowledging
hit:2464_conv:4929,situation,none,I went to STOMP in New York.The way they use normal things to make music is fascinating.,impressed
hit:2464_conv:4929,utterance,speaker,"When I was in New York, I got to see STOMP. It was an amazing show.",impressed
hit:2464_conv:4929,utterance,listener,Wow. I had that DVD.,nostalgic
hit:2464_conv:4929,utterance,speaker,I used to watch it in music class a lot. I am fascinated by the way they make music with everyday items.,impressed
hit:2464_conv:4929,utterance,listener,I know. I wonder if they still do that show,nostalgic
hit:2464_conv:4929,utterance,speaker,"This was just a few years ago, so hopefully.",consoling
hit:8074_conv:16148,situation,none,I saw some person eat like 30 hamburgers in Mcdonalds,impressed
hit:8074_conv:16148,utterance,speaker,I saw some person eat like 30 hamburgers in Mcdonalds,impressed
hit:8074_conv:16148,utterance,listener,How long did it take them?,questioning
hit:8074_conv:16148,utterance,speaker,"I think he was making a Youtube video so he was eating very fast, so like 10 minutes",neutral
hit:8074_conv:16148,utterance,listener,He must of been sick after.,acknowledging
hit:10692_conv:21384,situation,none,I thought it was so cool that my friend did a backflip.,impressed
hit:10692_conv:21384,utterance,speaker,I thought it was so cool that my friend did a backflip.,impressed
hit:10692_conv:21384,utterance,listener,Wow! that is really cool. Did he land the back flip?,questioning
hit:10692_conv:21384,utterance,speaker,He did! I didn't know he could do that.,impressed
hit:10692_conv:21384,utterance,listener,What prompted his back flip?,questioning
hit:9910_conv:19820,situation,none,"The new girl at work has very little experience, so I was very shocked at her well done performance.",impressed
hit:9910_conv:19820,utterance,speaker,The new girl at work is doing really well considering she has not experience. I'm shocked!,impressed
hit:9910_conv:19820,utterance,listener,That is good to hear. She should be a big help a lot quicker than normal then.,acknowledging
hit:9910_conv:19820,utterance,speaker,I agree! Everyone including me were quite shocked byt it.,agreeing
hit:9910_conv:19820,utterance,listener,"That should bode well for her and her future there though, so it was a good surprise!",hopeful
hit:9910_conv:19820,utterance,speaker,Yes it was. We all didnt think she woudl do well so fast. Took us by suprise.,surprised
hit:3727_conv:7455,situation,none,My wife bench pressed a hundred fifty pounds at the gym.,impressed
hit:3727_conv:7455,utterance,speaker,"I thought I could lift, but my wife upstaged me by benching 150 lbs at the gym the other day. I can only lift 130 lbs.",impressed
hit:3727_conv:7455,utterance,listener,Did you feel very emasculated by this?,questioning
hit:3727_conv:7455,utterance,speaker,"No, it actually turned me on. I didn't know she was that strong.",surprised
hit:3727_conv:7455,utterance,listener,"Yeah, I can see that viewpoint as well. She may end up carrying you to bed next time!",agreeing
hit:9620_conv:19241,situation,none,proud of my wife,proud
hit:9620_conv:19241,utterance,speaker,Today my wife worked super hard for our future and made an amazing progress,proud
hit:9620_conv:19241,utterance,listener,that is wonderful it is good to hear you guys are doing good progress,acknowledging
hit:9620_conv:19241,utterance,speaker,"thank you, in a few months everything will work out perfectly",consoling
hit:9620_conv:19241,utterance,listener,that is good hard work and determination will always pay off,neutral
hit:1342_conv:2684,situation,none,"I had a leak in my roof, that was causing major damage.  No matter what I did to the roof (including replacing), the leak continued.  Another person came out to look, and said it was because nobody checked the chimney.  He put a gutter around the stone chimney and I have had no leaks since!",impressed
hit:1342_conv:2684,utterance,speaker,"After a full year of trying to get a leak fixed, I got help from a neighbor's roofer, who ""knew a guy.""  He said the guy didn't work on roofs, so I was confused!",apprehensive
hit:1342_conv:2684,utterance,listener,That makes no sense.,annoyed
hit:1342_conv:2684,utterance,speaker,"Exactly!  The roofer told me that since I replaced my roof and the leak was still there, the problem had to be my fireplace chimney.  He said stone chimneys often develop leaks.  As it turns out, this chimney guy fabricates a type of gutter for chimneys to keep the water from running down the rock.  For $300 he made and installed the ""gutter"" on site, and I have had NO leaks!",impressed
hit:1342_conv:2684,utterance,listener,That seems like a good price.,acknowledging
hit:5015_conv:10030,situation,none,A friend of mine got a new high paying job.  I didn't think he could do it but he somehow pulled it off,impressed
hit:5015_conv:10030,utterance,speaker,A friend of mine got a new high paying job,jealous
hit:5015_conv:10030,utterance,listener,"That's good on his part, how do you feel about it?",questioning
hit:5015_conv:10030,utterance,speaker,"I thought it was amazing he got it, seemed like a tough job to land",impressed
hit:5015_conv:10030,utterance,listener,"That's awesome, and I agree, the job market is tough now a days.  High paying or not.",agreeing
hit:2359_conv:4719,situation,none,I was really proud of my friend for doing a backflip,impressed
hit:2359_conv:4719,utterance,speaker,I was really proud of my friend for doing a backflip,impressed
hit:2359_conv:4719,utterance,listener,Backflips are scary. Neck injury is serious.,terrified
