Dialog_ID,Type,Actor,Text,Label
hit:6507_conv:13015,utterance,speaker,You should look at it - such an amazing city,impressed
hit:6507_conv:13015,utterance,listener,I just Googled it. It does seem beautiful online. Maybe that could be next year's trip!,suggesting
hit:6507_conv:13015,utterance,speaker,You should. I've been a few times and it's very impressive.,impressed
hit:4027_conv:8055,situation,none,i was impressed when a friend of mine got a job 2 days after telling me he wanted to quit,impressed
hit:4027_conv:8055,utterance,speaker,i was impressed when a friend of mine got a job 2 days after telling me he wanted to quit,impressed
hit:4027_conv:8055,utterance,listener,That is impressive. He must have been prepared well for the switch.,impressed
hit:4027_conv:8055,utterance,speaker,yea i dont know about that but he usually gets what he wants,neutral
hit:4027_conv:8055,utterance,listener,Good for him. It takes me forever to find a job.,acknowledging
hit:2310_conv:4620,situation,none,I'm proud of myself for sticking to my work goals this summer.,proud
hit:2310_conv:4620,utterance,speaker,I've been working hard to meet my work goals this summer.,prepared
hit:2310_conv:4620,utterance,listener,What are your goals?,questioning
hit:2310_conv:4620,utterance,speaker,It was to earn a certain amount of money.,apprehensive
hit:2310_conv:4620,utterance,listener,Ah I see. It's always nice to have a goal to work towards.,acknowledging
hit:7166_conv:14333,situation,none,I was amazed at how beautiful San Sebastian was the first time I went.,impressed
hit:7166_conv:14333,utterance,speaker,When I went on holiday to San Sebastian I was amazed at how beautful it was,impressed
hit:7166_conv:14333,utterance,listener,That sounds so amazing!,acknowledging
hit:7166_conv:14333,utterance,speaker,It was - it's a spectacular city,impressed
hit:7166_conv:14333,utterance,listener,I am so happy for you!,joyful
hit:7166_conv:14333,utterance,speaker,Thanks,acknowledging
hit:5189_conv:10379,situation,none,"My friend didn't like the price of wedding cakes, so she just made her own.",impressed
hit:5189_conv:10379,utterance,speaker,"My friend didn't like the price of wedding cakes, so she just made her own",impressed
hit:5189_conv:10379,utterance,listener,That's pretty awesome! I feel my skin jump a bit when I see how much people spend on one day,acknowledging
hit:5189_conv:10379,utterance,speaker,"Yea, really, She was getting quotes of $200+. We don't care about fancy cakes and just want her to be happy.",disappointed
hit:5189_conv:10379,utterance,listener,I feel the same! No use spending that on something that will be eaten either,agreeing
hit:9014_conv:18029,situation,none,It was really cool to see those circus performers do those tricks. I was so amazed at their talent.,impressed
hit:9014_conv:18029,utterance,speaker,"I recently went to the circus, and I was so amazed at how the performers do their tricks!",impressed
hit:9014_conv:18029,utterance,listener,They are really impressive.  What circus was it?,questioning
hit:9014_conv:18029,utterance,speaker,It was one of those touring circuses with limited animals. It was more about the talented acrobats and magic tricks.,impressed
hit:9014_conv:18029,utterance,listener,Have you ever gotten to go to a Cirque du Soliel?  If you like acrobats you would love that!,jealous
hit:6012_conv:12025,situation,none,I went to a piano recital the other day and watched all the younger kids play.  Then a young man started playing and he played the most complicated piece I've ever heard!  Its amazing the talent some people have and amazing how people can write that kind of music too!,impressed
hit:6012_conv:12025,utterance,speaker,I went to a piano recital the other day and watched all the younger kids play. Then a young man started playing and he played the most complicated piece I've ever heard! Its amazing the talent some people have and amazing how people can write that kind of music too!,impressed
hit:6012_conv:12025,utterance,listener,Wow thats awesome.  I tried learning the piano once.  I wasnt good.  So i can really appreciate good talent.  Im always impressed,impressed
hit:6012_conv:12025,utterance,speaker,I took piano for 7 years and was pretty good but never really wanted to use it for anything so it kind of wasn't worth it.  I think this guy is trying to get into an orchestra.  It is inspiring!,impressed
hit:6012_conv:12025,utterance,listener,Yea he must be really good then.  7 years is a long time.  I bet you can impress people with your skills,encouraging
hit:5428_conv:10856,situation,none,"When I first found out ""Fight Club"" was originally a short story I was surprised at how intricate and creative of a plot the directors were able to weave out into a movie.",impressed
hit:5428_conv:10856,utterance,speaker,"I was surprised at how creative and fleshed out the ""Fight Club"" characters were on screen...especially after finding out the script was originally a vague short story.",impressed
hit:5428_conv:10856,utterance,listener,"Oh man, Fight Club is a great movie! I just recently saw it myself and was really surprised too.",impressed
hit:5428_conv:10856,utterance,speaker,Nice yeah I love how at the beginning there are foreshadowing images of Tyler flashing in and out of frame...pretty unique style of filming,acknowledging
hit:5428_conv:10856,utterance,listener,"I agree, that movie is definitely ahead of it's time!",agreeing
hit:2381_conv:4763,situation,none,I was so pleased with the delivery service I recently received.,impressed
hit:2381_conv:4763,utterance,speaker,I was so pleased with the service I received from the delivery company when I bought my new stove!,impressed
hit:2381_conv:4763,utterance,listener,"Well that's good, are you enjoying the new stove?",questioning
hit:2381_conv:4763,utterance,speaker,"I am! The delivery guys were nice enough to connect the cord, plug it in and even set the clock!",grateful
hit:2381_conv:4763,utterance,listener,Wow how kind.,acknowledging
hit:5903_conv:11806,situation,none,My dentist did an awesome job on my teeth!,impressed
hit:5903_conv:11806,utterance,speaker,"My dentist did an awesome job on my teeth, I love them!",impressed
hit:5903_conv:11806,utterance,listener,You must be very proud of your new set of teeth,impressed
hit:5903_conv:11806,utterance,speaker,"I really am, I had bad teeth my entire life because of genetic reasons.",ashamed
hit:5903_conv:11806,utterance,listener,Congrats you can smile freely now :),wishing
hit:6914_conv:13828,situation,none,I watch a lot of infomercials and I got the steak knives. They are even better than expected. They can cut through anything!,impressed
hit:6914_conv:13828,utterance,speaker,I watch a lot of infomercials because I'm always up late at night. I ordered the steak kneves and they are awesome. They can cut through anything!,impressed
hit:6914_conv:13828,utterance,listener,What have you used them on so far?,questioning
hit:6914_conv:13828,utterance,speaker,Well I used them to cut some potatoes and they slice through them like butter!,annoyed
hit:6914_conv:13828,utterance,listener,They sound like good knives,acknowledging
hit:5853_conv:11707,situation,none,My package got lost in the mail but the company was quick to replace it,impressed
hit:5853_conv:11707,utterance,speaker,My package got lost in the mail but the company was quick to replace it,impressed
hit:5853_conv:11707,utterance,listener,I hate when that happens but that is good they were quick to replace it.,neutral
hit:5853_conv:11707,utterance,speaker,Yes the company had good customer service at least,neutral
hit:5853_conv:11707,utterance,listener,Hopefully it wasn't something time important,consoling
hit:8467_conv:16935,situation,none,My brother taught me a lesson on beer. It was pretty cool,impressed
hit:8467_conv:16935,utterance,speaker,My brother taught me some things about beer last week. It was pretty cool,impressed
hit:8467_conv:16935,utterance,listener,what did you learn,questioning
hit:8467_conv:16935,utterance,speaker,About different styles of beer and beer glasses,apprehensive
hit:8467_conv:16935,utterance,listener,ah thats cool,acknowledging
hit:2948_conv:5897,situation,none,I am very pleased with the work Trump has done.,impressed
hit:2948_conv:5897,utterance,speaker,I am very pleased with the work Trump has done.,impressed
hit:2948_conv:5897,utterance,listener,"Yeah, I really liked those hunting trophies he got. We should be allowed to kill any animals we see!",impressed
hit:2948_conv:5897,utterance,speaker,I was talking about him as president.,nostalgic
hit:2948_conv:5897,utterance,listener,Oh I was thinking of his son. I don't know much about the Donald besides the Twitter stuff.,sentimental
hit:1778_conv:3557,situation,none,I was recently impressed with someone's bravery. They met up with a stranger online and hit it off really wel.,impressed
hit:1778_conv:3557,utterance,speaker,On a similar theme. I have a friend who got on really well on an blind date,impressed
hit:1778_conv:3557,utterance,listener,That is great news.  He must be lucky.,acknowledging
hit:1778_conv:3557,utterance,speaker,Yeah - I'd be too scared to meet a stranger from online.,agreeing
hit:1778_conv:3557,utterance,listener,It seems like everything worked out for him.,content
hit:3367_conv:6734,situation,none,My daughter has been working hard on training her new puppy to get it ready to show. She has taught her many tricks.,impressed
hit:3367_conv:6734,utterance,speaker,My daughter has been working hard on training her new puppy to get it ready to show. She has taught her many tricks,impressed
hit:3367_conv:6734,utterance,listener,Has she taught him to sit?,questioning
hit:3367_conv:6734,utterance,speaker,That and so much more. She is a natural with dogs and her work ethic is amazing.,impressed
hit:3367_conv:6734,utterance,listener,"wow she must be a really good dog owner, is this her first?",questioning
hit:8143_conv:16286,situation,none,Today when my daughter behaved being out of the house.,impressed
hit:8143_conv:16286,utterance,speaker,My 2 year old was such a good girl today out and I am very proud of her!,proud
hit:8143_conv:16286,utterance,listener,I bet you are a happy parent then,encouraging
hit:8143_conv:16286,utterance,speaker,Yes I am because I was dreading even going out with her as she usually gets fussy real quick.,apprehensive
hit:8143_conv:16286,utterance,listener,I guess thats all kids though,neutral
hit:9324_conv:18648,situation,none,My friend used to be such a nobody. But then he got quite a good job as well as a girlfriend and that really surprised me.,impressed
hit:9324_conv:18648,utterance,speaker,My friend used to be such a nobody until he got a job and a girlfriend out of nowhere.,surprised
hit:9324_conv:18648,utterance,listener,Life can have some sudden turns. But these are very little chances to count on and hope for,trusting
hit:9324_conv:18648,utterance,speaker,"I feel you. It just really came out of the blue, honestly.",agreeing
hit:9324_conv:18648,utterance,listener,Good for him. But do not count on such things happening in life. They are very rare unless you put hard work to get them,neutral
hit:8970_conv:17940,situation,none,"I'm pretty amazed at how far I've come in life.  I was such a bum now I'm a real man, living on my own self-employed with my own car paying my own bills",impressed
hit:8970_conv:17940,utterance,speaker,"Looking back at my older self I've come a long way.  It's pretty amazing really, I was such a bum now I'm a real man, living on my own self-employed with my own car paying my own bills. Like waking up from a nightmare haha",surprised
hit:8970_conv:17940,utterance,listener,Sometimes it can be difficult to get your footing when starting out. It sounds like you enjoy your life now and have something to be proud of.,acknowledging
hit:8970_conv:17940,utterance,speaker,Yes a lot more than back then for sure.  Still striving for better every day though,neutral
hit:8970_conv:17940,utterance,listener,"That is all that people can expect of you, that you try to be the best you possible, each and every day.",faithful
hit:10016_conv:20032,situation,none,I really like the new Nike shoes.,impressed
hit:10016_conv:20032,utterance,speaker,I really like the new Nike shoes.,impressed
hit:10016_conv:20032,utterance,listener,Nikes are usually pretty cool. What do you like about the new ones?,questioning
hit:10016_conv:20032,utterance,speaker,I really like the new comfort fit soles.,impressed
hit:10016_conv:20032,utterance,listener,Did you buy some yet?,questioning
hit:3903_conv:7807,situation,none,I went thrift shopping for the first time today. I can't believe what good deals I found,impressed
hit:3903_conv:7807,utterance,speaker,I went thrift shopping for the first time today,nostalgic
hit:3903_conv:7807,utterance,listener,That's good. I always find interesting things whenever I go.,acknowledging
hit:3903_conv:7807,utterance,speaker,I found some really cool thing. I think I am going to go again next weekend,excited
hit:3903_conv:7807,utterance,listener,You should! Alot of the profits from thrift stores go to good causes too!,agreeing
hit:3903_conv:7807,utterance,speaker,I know. Its a win win,agreeing
hit:1093_conv:2187,situation,none,I liked the way Lebron was snatched up by the Lakers,impressed
hit:1093_conv:2187,utterance,speaker,I liked the way Lebron was snatched up by the Lakers,impressed
hit:1093_conv:2187,utterance,listener,Will be a game changer.,anticipating
hit:1093_conv:2187,utterance,speaker,I hope so.  I hope they can crush the warriors,hopeful
hit:1093_conv:2187,utterance,listener,Did the Warriors get a replacement?,questioning
hit:5137_conv:10274,situation,none,I am fascinated by how in depth Roblox is.,impressed
hit:5137_conv:10274,utterance,speaker,My daughter has been playing Roblox and I am fascinated by how detailed the game is!,impressed
hit:5137_conv:10274,utterance,listener,What kind of game is that,questioning
hit:5137_conv:10274,utterance,speaker,It's an online computer game.,neutral
hit:5137_conv:10274,utterance,listener,It sounds cool,acknowledging
hit:6896_conv:13793,situation,none,Nephew starts football this year,proud
hit:6896_conv:13793,utterance,speaker,My nephew starts the 10th grade this year,sentimental
hit:6896_conv:13793,utterance,listener,10th grade was a good year.  I met my favorite girlfriend that year.  Is he excited?,joyful
hit:6896_conv:13793,utterance,speaker,Yeah.   He's playing football too.  Little boy is growing up :),proud
hit:6896_conv:13793,utterance,listener,thats so cool.  what position is he playing?,questioning
hit:6896_conv:13793,utterance,speaker,Not sure yet.  School just started back 2 days ago.  I'm sure they'll pick something good for him!,confident
hit:2301_conv:4602,situation,none,I thought it was really cool when my friend offered to buy me a car if he won the lottery,impressed
hit:2301_conv:4602,utterance,speaker,I thought it was really cool when my friend offered to buy me a car if he won the lottery,impressed
hit:2301_conv:4602,utterance,listener,"That would be nice, but it's highly unlikely.",acknowledging
hit:2301_conv:4602,utterance,speaker,I know. The though was cool though.,agreeing
hit:2301_conv:4602,utterance,listener,It sure was.,neutral
hit:7657_conv:15314,situation,none,I was really happy to my son's result,impressed
hit:7657_conv:15314,utterance,speaker,He had good grades,proud
hit:7657_conv:15314,utterance,listener,"Nice, who did may I ask?",questioning
hit:7657_conv:15314,utterance,speaker,My son,proud
hit:7657_conv:15314,utterance,listener,"I see, you must me so proud of him.",impressed
hit:7657_conv:15314,utterance,speaker,Yes I am. Thank you,agreeing
hit:2782_conv:5564,situation,none,Im glad i'll be able to leave from work on time today,grateful
hit:2782_conv:5564,utterance,speaker,Im glad i'll be able to leave from work on time today,grateful
hit:2782_conv:5564,utterance,listener,"thats great, are you usually not able to?",questioning
hit:2782_conv:5564,utterance,speaker,work just starts to stack towards the end of the day,angry
hit:2782_conv:5564,utterance,listener,i understand how that goes,agreeing
hit:4163_conv:8327,situation,none,When my daughter told me she peed on the floor.,proud
hit:4163_conv:8327,utterance,speaker,"So some parents might react differently but im quite proud of my daughter, she peed on the floor and came to show me what she did. Its the thought that counts.",proud
hit:4163_conv:8327,utterance,listener,"That would make me mad, do you have carpet or hardwood?",questioning
hit:4163_conv:8327,utterance,speaker,"Its carpet, it didnt bother me because shes in potty training stage and I am just glad she came to show me she did it so she realized it was wrong! ( lol )",neutral
hit:4163_conv:8327,utterance,listener,"Oh, well that is a good start then!",acknowledging
hit:6061_conv:12122,situation,none,I was in a work meeting the other day and one of my coworkers was was able to recite from memory a whole lot of legal policy and verbiage. I was floored by how much he had retained from studying!,impressed
hit:6061_conv:12122,utterance,speaker,I was in a work meeting the other day and one of my coworkers was was able to recite from memory a whole lot of legal policy and verbiage. I was floored by how much he had retained from studying!,impressed
hit:6061_conv:12122,utterance,listener,Oh wow yeah that is quite impressive! He should become a lawyer if he isn't one already!,acknowledging
hit:6061_conv:12122,utterance,speaker,I was thinking that he must have some kind of photographic memory!  I could never have remembered all that stuff!,surprised
hit:6061_conv:12122,utterance,listener,"Yeah, I have heard some people have that! Sometimes after just reading a bunch of information just once can remember every single word!",agreeing
hit:2526_conv:5052,situation,none,The dallas cowboys won a bunch of games last year.,impressed
hit:2526_conv:5052,utterance,speaker,The Dallas Cowboys won a bunch of games last year!,surprised
hit:2526_conv:5052,utterance,listener,That's cool. I don't watch too much. Are you a fan?,questioning
hit:2526_conv:5052,utterance,speaker,"I am a fan, I try to watch as much as I can.",jealous
hit:2526_conv:5052,utterance,listener,Are the cowboys your favorite team? I prefer watching college.,questioning
hit:2111_conv:4223,situation,none,The quality of television the make these days compared to when I was growing up is very good,impressed
hit:2111_conv:4223,utterance,speaker,The quality of television the make these days compared to when I was growing up is very good,impressed
hit:2111_conv:4223,utterance,listener,I think there are a lot more choices now than there was years ago,nostalgic
hit:2111_conv:4223,utterance,speaker,yes now you have LED and OLED,agreeing
hit:2111_conv:4223,utterance,listener,I still remember the old tube tvs,nostalgic
hit:4085_conv:8170,situation,none,I watched my gym coach bench press a ton of weight.,impressed
hit:4085_conv:8170,utterance,speaker,My power lifting coach bench pressed 650 pounds for 3 reps. I couldn't believe my eyes!,impressed
hit:4085_conv:8170,utterance,listener,Wow! He houldl do competitions. I have only seen that on TV,impressed
hit:4085_conv:8170,utterance,speaker,"He does actually, he goes to power lifting meets pretty regularly and breaks records! He's amazing.",impressed
hit:4085_conv:8170,utterance,listener,Must have been pretty cool to watch. How much do you bench press?,acknowledging
hit:2494_conv:4989,situation,none,Some random guy at the gas station asked me if I wanted to see a ninja flip so I thought it can't hurt to see what he was talking about for a few seconds. He did the most insane flip I have ever seen in my life!,impressed
hit:2494_conv:4989,utterance,speaker,Some random guy at the gas station asked me if I wanted to see a ninja flip so I thought it can't hurt to see what he was talking about for a few seconds. He did the most insane flip I have ever seen in my life!,impressed
hit:2494_conv:4989,utterance,listener,That is very random but very cool,acknowledging
hit:2494_conv:4989,utterance,speaker,Yeah I know. It takes a lot to impress me so I was pretty moved haha,agreeing
hit:2494_conv:4989,utterance,listener,I bet it was fun to see that,acknowledging
hit:12280_conv:24560,situation,none,My friends 3 year old is able to ride a skateboard with ease!  I was amazed at his skill!,impressed
hit:12280_conv:24560,utterance,speaker,My friends 3 year old is able to ride a skateboard with ease! I was amazed at his skill!,impressed
hit:12280_conv:24560,utterance,listener,"Nice, it's like little kids can learn anything!",acknowledging
hit:12280_conv:24560,utterance,speaker,"Yeah, I just couldn't get over how well he was able to balance!",impressed
hit:12280_conv:24560,utterance,listener,"That's awesome, hope he goes far",encouraging
hit:3548_conv:7097,situation,none,I watched the UFC fights last night.  I didn't think it would happen but Dillishaw knocked out Corey again.,impressed
hit:3548_conv:7097,utterance,speaker,Did you watch the UFC fights last night,surprised
hit:3548_conv:7097,utterance,listener,Yes I love combat sports.,agreeing
hit:3548_conv:7097,utterance,speaker,I didn't think it would happen but to see Dillishaw get another knockout in first round was a surprise,surprised
hit:3548_conv:7097,utterance,listener,"Dillishaw is a warrior,  Do you think very highly of connor?",questioning
hit:5152_conv:10305,situation,none,it was impressive when lebron signed with the lakers,impressed
hit:5152_conv:10305,utterance,speaker,it was impressive when lebron signed with the lakers,impressed
hit:5152_conv:10305,utterance,listener,Why were you impressed,impressed
hit:5152_conv:10305,utterance,speaker,cause he had the stones to leave the cavs again.. which was the right move,neutral
hit:5152_conv:10305,utterance,listener,I am not sure it was,neutral
hit:5161_conv:10322,situation,none,"My friend doesn't know how to swim, and she just went in the pool with her life jacket with no care in the world.",impressed
hit:5161_conv:10322,utterance,speaker,"My friend doesn't know how to swim, and she just went in the pool with her life jacket with no care in the world.",impressed
hit:5161_conv:10322,utterance,listener,"That is amazing,  Is there a certain reason she cant swim,  she just never learned?",questioning
hit:5161_conv:10322,utterance,speaker,"Yea, she just never learned and wants to hang out with us when he go to the pool or beach.",neutral
hit:5161_conv:10322,utterance,listener,was her life jacket fancy?,questioning
hit:9968_conv:19936,situation,none,I was watching professional bowling the other day. I was amazed at how good the players are. They make getting strikes look so easy!,impressed
hit:9968_conv:19936,utterance,speaker,I was recently watching professional bowling and I was struck by how good the players are. They make getting strikes look so easy!,impressed
hit:9968_conv:19936,utterance,listener,"I know! Then you get to the bowling alley, try to do what they do, end up getting 3 gutter balls in a row, and fall flat on your butt to boot!",agreeing
hit:9968_conv:19936,utterance,speaker,"Sounds like me on a good day, lol. I guess I will never reach that level of play.",jealous
hit:9968_conv:19936,utterance,listener,"Me and you both, friend. We can always try and have a blast though! I'm sure if we keep at it we'll get a turkey in a century or two.",confident
hit:4203_conv:8407,situation,none,My sister graduated with an MBA,impressed
hit:4203_conv:8407,utterance,speaker,My sister graduated with an MBA.,impressed
hit:4203_conv:8407,utterance,listener,"that is awesome, what is she doing now?",questioning
hit:4203_conv:8407,utterance,speaker,Working at a company.,confident
hit:4203_conv:8407,utterance,listener,"well, good for her, that is an accomplishment for sure!",acknowledging
hit:3360_conv:6721,situation,none,I once saw a buddy of mine jump his bike over a car,impressed
hit:3360_conv:6721,utterance,speaker,Once a buddy of mine jumped his bike over a moving car,impressed
hit:3360_conv:6721,utterance,listener,Really? That is a crazy thing to do,surprised
hit:3360_conv:6721,utterance,speaker,I know he is the bravest person I know,trusting
hit:3360_conv:6721,utterance,listener,Did anything happen to him?,questioning
hit:1272_conv:2545,situation,none,"I was in awe of the driving ability of my old aunt, she's old but she still has it!",impressed
hit:1272_conv:2545,utterance,speaker,"I was in awe at the driving ability of my aunt, she's old but she still has it!",impressed
hit:1272_conv:2545,utterance,listener,Right on! That's cool to hear. Everyone likes to rag on older people driving. Glad to hear she's the exception. What kind of car does she drive?,acknowledging
hit:1272_conv:2545,utterance,speaker,Thank you! She drives an old cadillac and she drives it like a Ferrari. It's pretty grand watching her drive sometimes!,impressed
hit:1272_conv:2545,utterance,listener,"Haha... That sounds awesome. Wish I could carpool with her. I hate driving, but it sounds like she loves it.",acknowledging
hit:2018_conv:4036,situation,none,"I was kayaking with friends over the 4th of July holiday. The river was very fast due to recent rains. My friend managed to make it through the rapids very smoothly without any trouble at all, to a degree which was very surprising.",impressed
hit:2018_conv:4036,utterance,speaker,"Hi there. Did you do anything fun for the 4th of July? I went kayaking and hit some pretty heavy rapids. I had trouble with them, but the friend I was with did not.",questioning
hit:2018_conv:4036,utterance,listener,That's awesome.  Do you go kayaking often?,questioning
hit:2018_conv:4036,utterance,speaker,As often as I can. I don't get to enough. It's hard to get away from work.,disappointed
hit:2018_conv:4036,utterance,listener,Do you own your own kayak or do you rent?,questioning
