Dialog_ID,Type,Actor,Text,Label
hit:4160_conv:8320,utterance,listener,I am sure it was super stressful but I am so happy for you now and yes pop the bubbly!,joyful
hit:11170_conv:22340,situation,none,Everyone in my family was always very happy during Christmas. t makes me happy to think of it.,joyful
hit:11170_conv:22340,utterance,speaker,My family always loved Christmastime. Thinking about christmas makes me happy.,joyful
hit:11170_conv:22340,utterance,listener,What is your favorite Christmas memory?,questioning
hit:11170_conv:22340,utterance,speaker,Decorating the Christmas tree with my parents and the Christmas feast my mother used to cook. It was such a wonderful time.,nostalgic
hit:11170_conv:22340,utterance,listener,That sounds like a pleasant time.,acknowledging
hit:3149_conv:6299,situation,none,I am happy to snuggle in my boyfriends arms and watch tv all day tomorrow,joyful
hit:3149_conv:6299,utterance,speaker,I am happy to snuggle in my boyfriends arms and watch tv all day tomorrow,joyful
hit:3149_conv:6299,utterance,listener,"That sounds like a jolly good time, ole chap. What shows/movies are you planning on watching?",questioning
hit:3149_conv:6299,utterance,speaker,We will probably binge watch the office,content
hit:3149_conv:6299,utterance,listener,Nice. The Office is one of my favorite shows. I do enjoy Steve Carrell's character.,impressed
hit:4073_conv:8146,situation,none,I get so happy when I get to visit my family over the holidays. It is my favorite time of year!,joyful
hit:4073_conv:8146,utterance,speaker,My favorite time of year is the holidays. I get to see my family that I miss so much during the year.,joyful
hit:4073_conv:8146,utterance,listener,Holidays are a great time for family. I love that too.,joyful
hit:4073_conv:8146,utterance,speaker,Yeah I really enjoy spending time with them and talking about our different lives.,agreeing
hit:4073_conv:8146,utterance,listener,Do you get to gether for all holidays?,questioning
hit:205_conv:411,situation,none,When I was gifted my laptop for christmas,joyful
hit:205_conv:411,utterance,speaker,"This past chrstmas, I was gifted my HP laptop, and I have been consistently using it ever since! It really was a great gift.",joyful
hit:205_conv:411,utterance,listener,That's such a nice gift! What are your main uses of it?,questioning
hit:205_conv:411,utterance,speaker,"Mainly Youtube, I do some freelance work on it occasionally, and Reddit. Lots of Reddit.",annoyed
hit:205_conv:411,utterance,listener,I've heard great things about Reddit but have never actually signed up myself!,apprehensive
hit:6469_conv:12938,situation,none,I had a great family holiday at disneyworld when I was twelve,joyful
hit:6469_conv:12938,utterance,speaker,When I was 12 we went to DisneyWorld,nostalgic
hit:6469_conv:12938,utterance,listener,A true American right of passage. How does the memory make you feel?,sentimental
hit:6469_conv:12938,utterance,speaker,It was amazing. Syuch a joyful experience. I'm not from America - I'm in the UK. So it was like anotehr world.,joyful
hit:6469_conv:12938,utterance,listener,Cheers from across the pond! It truly is a magical place.,joyful
hit:10483_conv:20966,situation,none,My husband brought a puppy home this weekend and I was so excited. The first time my son saw him I actually cried because it was so cute and I was so happy. I've been in such a great mood ever since.,joyful
hit:10483_conv:20966,utterance,speaker,I had the best weekend! My husband brought a puppy home and seeing him with our son for the first time was so cute!,joyful
hit:10483_conv:20966,utterance,listener,That sounds adorable! What type of puppy is it?,questioning
hit:10483_conv:20966,utterance,speaker,He is an 8 week old Cane Corso. My son has had such a great time learning how to play with him and teach him things.,proud
hit:10483_conv:20966,utterance,listener,That sounds like a great time. I'm sure it's going to be cool to see the puppy grow up along with your son and how their relationship builds.,acknowledging
hit:202_conv:404,situation,none,My grandmother is getting out of the hospital,joyful
hit:202_conv:404,utterance,speaker,I am so happy. My grandmother is getting out of the hospital.,joyful
hit:202_conv:404,utterance,listener,That's awesome. Is she better?,questioning
hit:202_conv:404,utterance,speaker,"Yes, she is. She having issues with her heart. She needed a chirurgical operation.",agreeing
hit:202_conv:404,utterance,listener,That's scary! How old is she?,questioning
hit:404_conv:809,situation,none,I am so happy.,joyful
hit:404_conv:809,utterance,speaker,I am very happy lately.,joyful
hit:404_conv:809,utterance,listener,What are you feeling happy about?,questioning
hit:404_conv:809,utterance,speaker,I get to see my kids next weekend.,joyful
hit:404_conv:809,utterance,listener,That's great. I'm sure you will enjoy being with them,acknowledging
hit:4538_conv:9077,situation,none,I was happy to get invited on a trip for next week,excited
hit:4538_conv:9077,utterance,speaker,I was happy to get invited on a trip for next week,excited
hit:4538_conv:9077,utterance,listener,Oh that's awesome!  Where you going?,questioning
hit:4538_conv:9077,utterance,speaker,south padre island in texas,sad
hit:4538_conv:9077,utterance,listener,Cool!  I've never been there.  Are you excited to go?,questioning
hit:1365_conv:2731,situation,none,Reading to my neice,joyful
hit:1365_conv:2731,utterance,speaker,"Speaking of family, I love reading to my little neice.",caring
hit:1365_conv:2731,utterance,listener,"That must be fun, it is so cute watching kids try to read books for some reason",acknowledging
hit:1365_conv:2731,utterance,speaker,Yeah - I think it's because you know that they will learn to do it within a couple of years but whilst they are learning they are trying to discover it for themselves.,neutral
hit:1365_conv:2731,utterance,listener,"Yeah, kids are just so adorable, watching them learn in front of your eyes is an awesome privelege",acknowledging
hit:5831_conv:11662,situation,none,I am so happy that I get to see Foreigner in concert next month.,excited
hit:5831_conv:11662,utterance,speaker,I am so happy that I get to see Foreigner in concert next month.,excited
hit:5831_conv:11662,utterance,listener,That's good. It means you will be on vacation and having fun,joyful
hit:5831_conv:11662,utterance,speaker,"No, just going to see them after work one night.",suggesting
hit:5831_conv:11662,utterance,listener,oh ok. it's good to catch up on old times with foreign friends,acknowledging
hit:1226_conv:2452,situation,none,I got a promotion at work that was completely unexpected. It was actually a very nice day!,joyful
hit:1226_conv:2452,utterance,speaker,I got a promotion at work which was unexpected!,surprised
hit:1226_conv:2452,utterance,listener,Well congratulations! What will you be doing at your new billet?,wishing
hit:1226_conv:2452,utterance,speaker,"I will be managing a small team of software developers. It makes me a little nervous, but I think I can do it",confident
hit:1226_conv:2452,utterance,listener,"You managed to get a promotion, so you're obviously talented. I'm sure you will do just fine and earn many more promotions.",confident
hit:3074_conv:6148,situation,none,This new Korean barbeque place just opened up. Will be nice not to have to drive more than 30 minutes to one anymore.,joyful
hit:3074_conv:6148,utterance,speaker,This new Korean barbeque place just opened up. Will be nice not to have to drive more than 30 minutes to one anymore.,joyful
hit:3074_conv:6148,utterance,listener,I love Korean barbeque.,proud
hit:3074_conv:6148,utterance,speaker,It's some great stuff! That's why I used to travel for it lol.,acknowledging
hit:3074_conv:6148,utterance,listener,Is it open 24 hours a day?,questioning
hit:11528_conv:23056,situation,none,I finally have enough money to quit my bad job. It has made me miserable for years.,joyful
hit:11528_conv:23056,utterance,speaker,I finally have enough money to quit my bad job. It has made me miserable for years.,joyful
hit:11528_conv:23056,utterance,listener,I'm sorry you had to go through all that stress. But yay for you being able to leave that situation!,sympathizing
hit:11528_conv:23056,utterance,speaker,I know. I cannot tell you how happy I am. Things are a little hard in my life so this will relieve some of that stress.,joyful
hit:11528_conv:23056,utterance,listener,That's great to hear. It sounds like it's a well needed change. Things will look up from here!,acknowledging
hit:918_conv:1837,situation,none,I got really happy when my dad surprised me with my first car. I cannot remember feeling so joyful,joyful
hit:918_conv:1837,utterance,speaker,I got really joyful when my dad got me my first vehicle. It was just a happy feeling,excited
hit:918_conv:1837,utterance,listener,"Yeah. I know that feeling., although I had to buy my own.",agreeing
hit:918_conv:1837,utterance,speaker,Its a good feeling to get a vehicle whenever,excited
hit:918_conv:1837,utterance,listener,I know. What kind of car was it,agreeing
hit:6481_conv:12963,situation,none,i am happy that its almost the weekend!,joyful
hit:6481_conv:12963,utterance,speaker,im happy that its almost the weekend!,joyful
hit:6481_conv:12963,utterance,listener,Me too. What are your plans?,questioning
hit:6481_conv:12963,utterance,speaker,to go clubbin,hopeful
hit:6481_conv:12963,utterance,listener,Cool. I might do that too,acknowledging
hit:8088_conv:16177,situation,none,A few weeks ago I went to a baseball game. My team was doing pretty badly but in the end they managed to pull it together and win the game. I was so ectastic!,joyful
hit:8088_conv:16177,utterance,speaker,I went to a baseball game with my favorite team a few weeks ago. They had been doing pretty badly in the first half. Somehow they managed to pull it together and win in the end! That made me very happy!,joyful
hit:8088_conv:16177,utterance,listener,"That's awesome! Sometimes pulling through a tough battle is more satisfying than just winning outright! Shows perseverance and a ""never give up"" attitude.",acknowledging
hit:8088_conv:16177,utterance,speaker,Yeah it was much more exciting than if it was easy. I'm sure the other team felt excitment in the opposite way too.,neutral
hit:8088_conv:16177,utterance,listener,Oh yeah. Makes for a great game when it's close!,acknowledging
hit:5644_conv:11289,situation,none,I am happy about an upcoming meeting between some of my old friends this weekend.,joyful
hit:5644_conv:11289,utterance,speaker,I'm feeling very happy at the moment.,joyful
hit:5644_conv:11289,utterance,listener,That's good to hear. What's going on?,questioning
hit:5644_conv:11289,utterance,speaker,I have a meeting this weekend with some old friends that I haven't seen in a long time.,nostalgic
hit:5644_conv:11289,utterance,listener,"It's good to reunite with them again, hu?",questioning
hit:6844_conv:13688,situation,none,When my job got me a present.,joyful
hit:6844_conv:13688,utterance,speaker,My job got me the best present the other day when they celebrated my birthday.,grateful
hit:6844_conv:13688,utterance,listener,Nice!,acknowledging
hit:6844_conv:13688,utterance,speaker,"It was a flat image of Darth Vader, where he was drawn with lights that change color.",terrified
hit:6844_conv:13688,utterance,listener,That is so cool and thoughtful!,acknowledging
hit:6844_conv:13688,utterance,speaker,"I know, I really enjoyed it!",agreeing
hit:5698_conv:11397,situation,none,"On christmas morning last year, i got everything i wanted.",joyful
hit:5698_conv:11397,utterance,speaker,A women to take care of myself!,confident
hit:5698_conv:11397,utterance,listener,What?,questioning
hit:5698_conv:11397,utterance,speaker,My girlfriend is what I got for christmas!,joyful
hit:5698_conv:11397,utterance,listener,Well thats cute,acknowledging
hit:5698_conv:11397,utterance,speaker,5,apprehensive
hit:1672_conv:3345,situation,none,I was ecstatic when my kids came home yesterday.,excited
hit:1672_conv:3345,utterance,speaker,I was ecstatic when my kids came home yesterday,joyful
hit:1672_conv:3345,utterance,listener,Where did they come from?,questioning
hit:1672_conv:3345,utterance,speaker,They were on vacation with their father,trusting
hit:1672_conv:3345,utterance,listener,Where did they go?,questioning
hit:11206_conv:22412,situation,none,I went to visit my dad who I haven't seen in years this spring. We had a really great time catching up.,joyful
hit:11206_conv:22412,utterance,speaker,This spring I got to go visit with my dad who I haven't seen in ten years!,joyful
hit:11206_conv:22412,utterance,listener,That sounds great! Did you have a good visit? I hope it wasn't awkward.,encouraging
hit:11206_conv:22412,utterance,speaker,We went camping and fishing and we really had a great time catching up. We didn't miss a beat.,content
hit:11206_conv:22412,utterance,listener,Very cool. My own father passed away a few years ago. I miss doing things with him.,sentimental
hit:11206_conv:22412,utterance,speaker,"Aww, I'm so sorry to hear that.",sympathizing
hit:11206_conv:22412,utterance,listener,Thanks. I just wish we had taken more time to spend together in his final years.,wishing
hit:1212_conv:2425,situation,none,"I just rescued a dog that was abused, overbred and starved. She is only a puppy. I am so happy that she is no longer suffering.",joyful
hit:1212_conv:2425,utterance,speaker,I just rescued a dog this week and she was so abused. Just a baby.,caring
hit:1212_conv:2425,utterance,listener,Awwwww that's so sad to here. Where did you rescue her from?,questioning
hit:1212_conv:2425,utterance,speaker,She was running around the neighborhood and my neighbor was going to kick her so I had to take her,caring
hit:1212_conv:2425,utterance,listener,I would have done the same thing! Who does that guy think he is? I would've tried kicking him back.,angry
hit:1212_conv:2425,utterance,speaker,I hear you! He doesn't mess with me though. She is so pretty was starved and overbred. I am so happy she is no longer being abused.,grateful
hit:2144_conv:4289,situation,none,I'm pretty happy that my daughters have a day off from school today.,joyful
hit:2144_conv:4289,utterance,speaker,"Well, my daughters have a day off from school due to our state elections.",joyful
hit:2144_conv:4289,utterance,listener,I wish I got that many days off.  The good old days of childhood.,nostalgic
hit:2144_conv:4289,utterance,speaker,"Yeah, it's nice for them. I like it when they're home.",acknowledging
hit:2144_conv:4289,utterance,listener,"Wait until summer comes, you'll be ready for them to go back to school after a month.",prepared
hit:68_conv:136,situation,none,I turn 29 today! It is a great day since its my birthday,joyful
hit:68_conv:136,utterance,speaker,Today is my birthday! I think tonight we are all going out.,joyful
hit:68_conv:136,utterance,listener,Awesome! Happy Birthday to you! Where are you going?,wishing
hit:68_conv:136,utterance,speaker,I think to a amusment park but im not sure!,apprehensive
hit:68_conv:136,utterance,listener,That seriously sounds like the best birthday ever... i hope you guys have an awesome time.,encouraging
hit:68_conv:136,utterance,speaker,Thank you! I hope you have a good dau.,encouraging
hit:7582_conv:15165,situation,none,i am happy about next week,excited
hit:7582_conv:15165,utterance,speaker,i am happy about next week,excited
hit:7582_conv:15165,utterance,listener,what is happening next week?,questioning
hit:7582_conv:15165,utterance,speaker,the kids return to school,nostalgic
hit:7582_conv:15165,utterance,listener,So you can get some peace and quiet?,questioning
hit:2500_conv:5001,situation,none,Listening to feel good music makes me feel so good. I don't about you but music can really cure a lot of negative emotions,joyful
hit:2500_conv:5001,utterance,speaker,Listening to feel good music makes me feel so good. I don't about you but music can really cure a lot of negative emotions,joyful
hit:2500_conv:5001,utterance,listener,"yes, who do you like?",questioning
hit:2500_conv:5001,utterance,speaker,A lot of EDM. Music hippies listen to haha,nostalgic
hit:2500_conv:5001,utterance,listener,thats cool,acknowledging
hit:9734_conv:19469,situation,none,"I was at the store the other day and some old man offered to pay for my drink! He said he didn't want anything in return, he was feeling generous!",grateful
hit:9734_conv:19469,utterance,speaker,"I was at the store the other day and some old man offered to pay for my drink! He said he didn't want anything in return, he was feeling generous!",grateful
hit:9734_conv:19469,utterance,listener,Wow. I wish something like that would happen to me. That is so cool.,acknowledging
hit:9734_conv:19469,utterance,speaker,It was! I just wish I could do something to repay him. I hope I see him again.,grateful
hit:9734_conv:19469,utterance,listener,Maybe you can pay it forward next time you see someone buying a drink.,suggesting
hit:5697_conv:11395,situation,none,"On christmas morning last year, i got everything i wanted.",joyful
hit:5697_conv:11395,utterance,speaker,"On christmas morning last year, I got everything I wanted!",joyful
hit:5697_conv:11395,utterance,listener,Really?,questioning
hit:5697_conv:11395,utterance,speaker,"Yes, i got all of the flat screen tvs.",neutral
hit:5697_conv:11395,utterance,listener,All of them?,questioning
hit:6671_conv:13342,situation,none,Things have been going well for me lately.,joyful
hit:6671_conv:13342,utterance,speaker,I've been happy with the way things have been going in my life lately.,content
hit:6671_conv:13342,utterance,listener,"That's awesome, glad to hear, what are you most happy with?",questioning
hit:6671_conv:13342,utterance,speaker,My family life is what I'm always the most happy with.,content
hit:6671_conv:13342,utterance,listener,A solid and happy family life is the key to a happy life!,faithful
hit:5170_conv:10340,situation,none,Had dinner with my family not too long ago. It's nice seeing everyone together again.,joyful
hit:5170_conv:10340,utterance,speaker,Had dinner with my family not too long ago. It's nice seeing everyone together again.,joyful
hit:5170_conv:10340,utterance,listener,I bet that was nice,acknowledging
hit:5170_conv:10340,utterance,speaker,It really was. I hope we can make time to have more dinners together.,nostalgic
hit:5170_conv:10340,utterance,listener,I am sure you will,confident
hit:6668_conv:13336,situation,none,I went to a vacation and was able to ride in the water with the dolphins.,joyful
hit:6668_conv:13336,utterance,speaker,Have you ever swam with the dolphins?,questioning
hit:6668_conv:13336,utterance,listener,"No, but we are going on a cruise to Cozumel next Spring Break and I think that would be so much fun. Have you ever been?",questioning
hit:6668_conv:13336,utterance,speaker,"Yes, I went on a vacation and then I was able to swim with them!",excited
hit:6668_conv:13336,utterance,listener,That sounds amazing! I bet it was so much fun!,acknowledging
hit:4040_conv:8081,situation,none,I received my first check from my first job yesterday. I am happy. I am finally financially independent.,joyful
hit:4040_conv:8081,utterance,speaker,I received my first check from my first job yesterday. I am happy. I am finally financially independent.,joyful
hit:4040_conv:8081,utterance,listener,That's great! I know that is an amazing feeling to have.,agreeing
hit:4040_conv:8081,utterance,speaker,"Yes, I am planning to save money to buy a car.",confident
hit:4040_conv:8081,utterance,listener,That's wonderful. A car is one of the most useful purchases one can make I think.,acknowledging
hit:5207_conv:10415,situation,none,"My best friend will come visit me on Friday, so I am feeling pretty good.",joyful
hit:5207_conv:10415,utterance,speaker,My best friend is coming to visit me this Friday.,excited
hit:5207_conv:10415,utterance,listener,oh thats nice. do you all have plans?,questioning
hit:5207_conv:10415,utterance,speaker,"Yes, we are going to grab dinner and then some drinks while catching up.",content
hit:5207_conv:10415,utterance,listener,that sounds great.,acknowledging
hit:2979_conv:5958,situation,none,I was pretty happy to find out I was having a girl,joyful
hit:2979_conv:5958,utterance,speaker,I was pretty happy to find out I was having a girl,joyful
hit:2979_conv:5958,utterance,listener,Oh cool!  How pregnant are you?,questioning
hit:2979_conv:5958,utterance,speaker,I had her 7 months ago,joyful
hit:2979_conv:5958,utterance,listener,Ohhhh so you already had her!  Congratulations!,wishing
hit:10207_conv:20415,situation,none,The day I got married was the second best day of my life! It was beautiful!,joyful
hit:10207_conv:20415,utterance,speaker,I just celebrated my 2 year anniversary! I've been reminiscing about my wedding a lot lately lol.,nostalgic
hit:10207_conv:20415,utterance,listener,"Nice, too bad I wasn't invited!",acknowledging
hit:10207_conv:20415,utterance,speaker,Sorry! We eloped anyway so it wasn't that exciting lol!,sympathizing
hit:10207_conv:20415,utterance,listener,Sounds fun! Keep fighting the good fight lol,acknowledging
hit:9938_conv:19877,situation,none,"I'm really happy in life right now. I have my cat, books and can eat all the good foods.",joyful
hit:9938_conv:19877,utterance,speaker,"I'm really happy in life right now. I have my cat, books and can eat all the good foods",joyful
hit:9938_conv:19877,utterance,listener,"That's great! I also have a cat, she's so precious",acknowledging
hit:9938_conv:19877,utterance,speaker,How long have you had her?,questioning
hit:9938_conv:19877,utterance,listener,"A couple years, she's a persian mix",surprised
hit:8669_conv:17338,situation,none,I was just able to pay off my parents house!,joyful
hit:8669_conv:17338,utterance,speaker,I was just able to pay off my parents house!,joyful
hit:8669_conv:17338,utterance,listener,Holy cow that's amazing!  That's awesome of you!!,acknowledging
hit:8669_conv:17338,utterance,speaker,They paid for my college all the way through and I always wanted to do something to pay them back.,grateful
hit:8669_conv:17338,utterance,listener,That's the coolest thing I've heard all day,acknowledging
hit:1245_conv:2491,situation,none,I am excited to be starting law school soon.  I will be attending Syracuse University in the Spring.,joyful
hit:1245_conv:2491,utterance,speaker,I will be getting into some major debt myself soon with law school.,anticipating
hit:1245_conv:2491,utterance,listener,Law school Wow,apprehensive
hit:1245_conv:2491,utterance,speaker,"Though the tuition is enormous, I am excited about the challenge that lies ahead.",hopeful
hit:1245_conv:2491,utterance,listener,I hope you do well,encouraging
hit:1878_conv:3757,situation,none,I got a call informing me I was selected for a job offer,excited
hit:1878_conv:3757,utterance,speaker,I was so full with joy,joyful
hit:1878_conv:3757,utterance,listener,Why is that?,questioning
hit:1878_conv:3757,utterance,speaker,Getting a good after some time of searching and interviewing around,confident
hit:1878_conv:3757,utterance,listener,"Wow, congrats, I know that is not a fun process at all, so great job!",acknowledging
hit:1878_conv:3757,utterance,speaker,Thanks,acknowledging
hit:3254_conv:6508,situation,none,I won a year of unlimited pizza. I'm so psyched.,joyful
hit:3254_conv:6508,utterance,speaker,I won a year of unlimited pizza. I'm so psyched.,joyful
hit:3254_conv:6508,utterance,listener,that is awesome!,acknowledging
hit:3254_conv:6508,utterance,speaker,"Yea, it is. If I'm ever tired of cooking, I can always get pizza.",suggesting
hit:3254_conv:6508,utterance,listener,It will save you a lot of money too,acknowledging
hit:4139_conv:8278,situation,none,The abused dog I took in is finally RUNNING and playing. I didn't think she had it in her. It is so nice to see!,joyful
hit:4139_conv:8278,utterance,speaker,The abused dog I took in is finally RUNNING and playing.,joyful
hit:4139_conv:8278,utterance,listener,"Wow, that's great! You did a great thing by taking in a scared animal!",acknowledging
hit:4139_conv:8278,utterance,speaker,I try! I am just glad she is calm and nice! thank god! I didn't think she had it in her to play or even run. It is so nice to see!,grateful
hit:4139_conv:8278,utterance,listener,It's bringing a smile to my face just thinking about it!,joyful
hit:4139_conv:8278,utterance,speaker,:))),wishing
hit:5427_conv:10854,situation,none,I recently went on vacation to Florida and it was so relaxing.,content
hit:5427_conv:10854,utterance,speaker,I went on vacation to Florida and had a great time. I just felt really happy and relaxed the entire time.,content
hit:5427_conv:10854,utterance,listener,I'm glad you had a nice trip. Was it your first.,sympathizing
hit:5427_conv:10854,utterance,speaker,"It was, actually! I'm from Louisiana and was so surprised at the difference in humidity! The heat is more bearable in Florida.",surprised
hit:5427_conv:10854,utterance,listener,I would have thought it would be the other way around.,surprised
hit:2777_conv:5554,situation,none,I care a lot about all the little birds in my neighborhood. I am a sensitive soul and I just want to help every critter I see.,caring
hit:2777_conv:5554,utterance,speaker,"I think a lot about all the little birds in my neighborhood, I always try to make sure I feed them and any critter that comes along.",caring
hit:2777_conv:5554,utterance,listener,i love all the cardinals in the woods behind my house,caring
hit:2777_conv:5554,utterance,speaker,Aren't they the prettiest? I am an HSP and I just can't stand to see anything so innocent suffer.,disgusted
hit:2777_conv:5554,utterance,listener,i dont want them to suffer either,agreeing
hit:8782_conv:17564,situation,none,My previous landlord waited until the very last minute to do so but they returned my security deposit. I can now use it to put down on a new place for my wife and I!,joyful
