Dialog_ID,Type,Actor,Text,Label
hit:6137_conv:12274,situation,none,I was pretty happy this morning. A friend made me a nice breakfast,joyful
hit:6137_conv:12274,utterance,speaker,I was happy this morning. A friend made me a nice breakfast,grateful
hit:6137_conv:12274,utterance,listener,That must have been nice.  What did they make you?,questioning
hit:6137_conv:12274,utterance,speaker,A omelet and bacon,content
hit:6137_conv:12274,utterance,listener,Very nice.  Did you enjoy it?,questioning
hit:4405_conv:8810,situation,none,"I suffered from such terrible acne when I was younger that thankfully, I rarely ever have when I started college.",grateful
hit:4405_conv:8810,utterance,speaker,"I suffered from such terrible acne when I was younger that thankfully, I rarely ever have when I started college.",grateful
hit:4405_conv:8810,utterance,listener,"That's really bad, but really good that your faced didn't turn out scarred for life.",neutral
hit:4405_conv:8810,utterance,speaker,"Well, I have some scars but at least I don't have acne anymore.",neutral
hit:4405_conv:8810,utterance,listener,True. It is quite terrible to have acne. Mine is so bad that I can't even see.,agreeing
hit:5446_conv:10892,situation,none,I found out my sister is pregnant today! She's been trying for years.,joyful
hit:5446_conv:10892,utterance,speaker,I found out my sister is pregnant today! She's been trying for years,joyful
hit:5446_conv:10892,utterance,listener,Oh that's cool.  Glad it worked out for her,acknowledging
hit:5446_conv:10892,utterance,speaker,"Yeah, I think its great.",acknowledging
hit:5446_conv:10892,utterance,listener,Boy or girl?,questioning
hit:8963_conv:17927,situation,none,I was at the store and I dropped my wallet without knowing. Luckily some nice man gave it to me later in the trip! I was so surprised!,grateful
hit:8963_conv:17927,utterance,speaker,I was at the store and I dropped my wallet without knowing. Luckily some nice man gave it to me later in the trip! I was so surprised!,grateful
hit:8963_conv:17927,utterance,listener,"Wow, thats really lucky of you.  Its good to find nice people out there",acknowledging
hit:8963_conv:17927,utterance,speaker,It is! That has never happened to me before!,surprised
hit:8963_conv:17927,utterance,listener,Good thing you found that guy and not someone else,neutral
hit:968_conv:1936,situation,none,I won the lottery last week. I was so happy.,excited
hit:968_conv:1936,utterance,speaker,"I won the lottery last week, I was so happy.",joyful
hit:968_conv:1936,utterance,listener,Happiness comes and goes. it could change at any time.,content
hit:968_conv:1936,utterance,speaker,That is true but hopefully the money last a long time.,encouraging
hit:968_conv:1936,utterance,listener,"As long as you take care of it, and use it the right way it will last you forever.",neutral
hit:5979_conv:11959,situation,none,"My son was hit by a car while driving and half of the car was crushed, but he was virtually unscathed!  I'm so happy!",joyful
hit:5979_conv:11959,utterance,speaker,"My son was hit by a car while driving and half of the car was crushed, but he was virtually unscathed! I'm so happy!",joyful
hit:5979_conv:11959,utterance,listener,"Oh that's really lucky!  What happened, did someone run a light or something?",questioning
hit:5979_conv:11959,utterance,speaker,They were texting while riving around a curvy road.  I can't believe people don't think they will cause harm while texting and driving.  Yes!  I don't care about the car. I'm just so thankful he's safe!,trusting
hit:5979_conv:11959,utterance,listener,"That stinks, but I'm glad he's ok!  That must be the scariest thing!",acknowledging
hit:3352_conv:6705,situation,none,I found my grandfather's old watch that I thought was lost. I was so happy to find it as he gave it to me as a kid,joyful
hit:3352_conv:6705,utterance,speaker,I found my grandfather's old watch that I thought was lost,sentimental
hit:3352_conv:6705,utterance,listener,You must have been overjoyed. I know what he meant to you.,acknowledging
hit:3352_conv:6705,utterance,speaker,"Yea, I was given it as a kid so I was happy to find it after all these years!",surprised
hit:3352_conv:6705,utterance,listener,Be sure and put it in a safe place.,trusting
hit:2227_conv:4455,situation,none,I was really excited when Friday came,joyful
hit:2227_conv:4455,utterance,speaker,I was really excited when Friday came,joyful
hit:2227_conv:4455,utterance,listener,What's going on on Friday?,questioning
hit:2227_conv:4455,utterance,speaker,I was headed to vacation at the end of the workday,joyful
hit:2227_conv:4455,utterance,listener,Oh awesome! I love taking vacations. Where are you going?,questioning
hit:5988_conv:11977,situation,none,Being a child was the best. I just remember laughing and running on summer days with my friends,joyful
hit:5988_conv:11977,utterance,speaker,Being a child was the best.,neutral
hit:5988_conv:11977,utterance,listener,Why do you think that is?,questioning
hit:5988_conv:11977,utterance,speaker,I just remember laughing and running on summer days with my friends,joyful
hit:5988_conv:11977,utterance,listener,"Yes, do you ever remember playing in the ocean?",questioning
hit:11613_conv:23226,situation,none,I finally graduated after 4 years of traning!,proud
hit:11613_conv:23226,utterance,speaker,I was able to graduate today after 4 years of school!,proud
hit:11613_conv:23226,utterance,listener,That is great! Congrats!,acknowledging
hit:11613_conv:23226,utterance,speaker,Thank you. There were a lot of moments i felt like giving up but i perservered!,neutral
hit:11613_conv:23226,utterance,listener,I bet you are so happy you stuck with it.. definitely something to be proud of.,agreeing
hit:11613_conv:23226,utterance,speaker,Thanks! It is a great feeling!,acknowledging
hit:6138_conv:12276,situation,none,"When the Eagles finally won the superbowl, I was so so happy, I cried even",joyful
hit:6138_conv:12276,utterance,speaker,"When the Eagles finally won the superbowl, I was so so happy, I cried even",joyful
hit:6138_conv:12276,utterance,listener,Oh lord! I am glad you have something that is a healthy hobby,grateful
hit:6138_conv:12276,utterance,speaker,"Me too, it is a big part of my time, watching games and tape",agreeing
hit:6138_conv:12276,utterance,listener,That's cool! It's always good to have a hobby,acknowledging
hit:4891_conv:9783,situation,none,Recently hired a second person to work with me and I am optimistic they will help as sell more cars,hopeful
hit:4891_conv:9783,utterance,speaker,Recently hired a second person to work with me and I am optimistic they will help as sell more cars,hopeful
hit:4891_conv:9783,utterance,listener,That's good news.  Did they have a good track record for sales in past jobs?,questioning
hit:4891_conv:9783,utterance,speaker,"They do, plus we simply dont have enough people, so its a good fill in.",neutral
hit:4891_conv:9783,utterance,listener,Hope it all works out for you.  Selling cars can also be a stresfull job.,encouraging
hit:4132_conv:8264,situation,none,i was happy when my wife brought home our new tortoise,joyful
hit:4132_conv:8264,utterance,speaker,i was happy when my wife brought home our new tortoise,joyful
hit:4132_conv:8264,utterance,listener,Did she surprise you with it?,questioning
hit:4132_conv:8264,utterance,speaker,yea it was something i always wanted,neutral
hit:4132_conv:8264,utterance,listener,That's so sweet!,acknowledging
hit:7832_conv:15665,situation,none,Today is going to be awesome!  We are going to the lake to see all of our family!,joyful
hit:7832_conv:15665,utterance,speaker,Today is going to be awesome! We are going to the lake to see all of our family!,joyful
hit:7832_conv:15665,utterance,listener,"That sounds like a lot of fun, will you be cooking stuff too?",questioning
hit:7832_conv:15665,utterance,speaker,"Yep, we will be grilling hot dogs and hamburgers, and jet-skiing!",excited
hit:7832_conv:15665,utterance,listener,"Sounds like a wonderful day-long event, hope you enjoy it!",encouraging
hit:4513_conv:9026,situation,none,Going to disney world in december!,excited
hit:4513_conv:9026,utterance,speaker,Going to disney world in december,excited
hit:4513_conv:9026,utterance,listener,Oh that's exciting! Have you gone before?,questioning
hit:4513_conv:9026,utterance,speaker,Only a few times when younger! It's nice to go when older!,acknowledging
hit:4513_conv:9026,utterance,listener,"That's true, the experience is different when you're older.",agreeing
hit:2709_conv:5419,situation,none,I was happy when i woke up and it was friday!,joyful
hit:2709_conv:5419,utterance,speaker,I was happy when i woke up and it was friday!,joyful
hit:2709_conv:5419,utterance,listener,what are you looking forward to?,questioning
hit:2709_conv:5419,utterance,speaker,being at home without having to do anything!,content
hit:2709_conv:5419,utterance,listener,"That's a great feeling, I agree! I rarely get a day where I just stay home",agreeing
hit:5228_conv:10457,situation,none,Going to get some pizza after work. I love pizza.,joyful
hit:5228_conv:10457,utterance,speaker,Going to get some pizza after work. I love pizza.,joyful
hit:5228_conv:10457,utterance,listener,"I'm eating some pepperoni pizza as I'm typing this.. washing it down with some beer, my kind of Tuesday night",content
hit:5228_conv:10457,utterance,speaker,hahaha sounds nice. I'll be that in a couple minutes.,acknowledging
hit:5228_conv:10457,utterance,listener,What are your default pizzas.  Mine are Little C's or Dominoes,questioning
hit:3263_conv:6527,situation,none,I am excited for summer to be over soon,joyful
hit:3263_conv:6527,utterance,speaker,I am excited for summer to be over soon,joyful
hit:3263_conv:6527,utterance,listener,Oh that's rare. How come?,questioning
hit:3263_conv:6527,utterance,speaker,I can't wait for football season,anticipating
hit:3263_conv:6527,utterance,listener,Oh now I see lol. Who's your favorite team?,questioning
hit:5710_conv:11421,situation,none,My dogs love to lay on me!,joyful
hit:5710_conv:11421,utterance,speaker,My dogs love to lay on me!,joyful
hit:5710_conv:11421,utterance,listener,I feel as if dogs think humans are the most comfortable bed!,annoyed
hit:5710_conv:11421,utterance,speaker,I love when my dogs cuddle with me!,joyful
hit:5710_conv:11421,utterance,listener,Yes! cuddling is I feel an instinctual joy!,agreeing
hit:5660_conv:11321,situation,none,when you go to a restaurant and they did not mess up your order,impressed
hit:5660_conv:11321,utterance,speaker,"every time i go to any fast food joint like mcdonalds they always get something wrong , but that one time they get everything right im actually happy .... and they want to get increased in pay lol",jealous
hit:5660_conv:11321,utterance,listener,That's why they are being replaced by machines lol,neutral
hit:5660_conv:11321,utterance,speaker,"i saw an episode of lockdown once where people would go through the drive threw to order there food, they did not know it but a call center in prison was taking there orders lol",neutral
hit:5660_conv:11321,utterance,listener,I thought I had seen every episode of lock down. I haven't seen that lol,surprised
hit:1787_conv:3575,situation,none,I won a lottery,excited
hit:1787_conv:3575,utterance,speaker,"Waited as the numbers spinned,and finally the call, that was mine!",anticipating
hit:1787_conv:3575,utterance,listener,What game were you playing?,questioning
hit:1787_conv:3575,utterance,speaker,Lotto,jealous
hit:1787_conv:3575,utterance,listener,"Wow, I am so happy for you!",acknowledging
hit:1134_conv:2269,situation,none,I recently got promoted at my job. It was something I had been trying to obtain for a long time.,joyful
hit:1134_conv:2269,utterance,speaker,I recently got promoted at my job. It was something I had been trying to obtain for a long time.,joyful
hit:1134_conv:2269,utterance,listener,"wow congrats, how long have you worked there?",questioning
hit:1134_conv:2269,utterance,speaker,6 years! I definitely feel I deserved it!,agreeing
hit:1134_conv:2269,utterance,listener,thats cool,acknowledging
hit:7095_conv:14191,situation,none,I jumped for joy when my baby was born.,joyful
hit:7095_conv:14191,utterance,speaker,I jumped for joy when my baby was born.,joyful
hit:7095_conv:14191,utterance,listener,wow that must have been a huge moment for you,acknowledging
hit:7095_conv:14191,utterance,speaker,"Yes, it is my first child.",excited
hit:7095_conv:14191,utterance,listener,well good for you,acknowledging
hit:3856_conv:7712,situation,none,"I told my mom that I didin't want to be in compsci anymore, because I was really miserable. She said that I should do what makes me happy.",joyful
hit:3856_conv:7712,utterance,speaker,"I told my mom that I didin't want to be in compsci anymore, because I was really miserable. She said that I should do what makes me happy.",joyful
hit:3856_conv:7712,utterance,listener,That's good advice.  If you're not happy doing something you should spend time thinking about what you'd really like to be doing.,suggesting
hit:3856_conv:7712,utterance,speaker,"Thanks. My mom is usually very strict, and I thought she would be really upset.",acknowledging
hit:3856_conv:7712,utterance,listener,Even if she's strict she's probably doing because she wants what's best for you.  And she'll probably support you no matter what you decide.,agreeing
hit:12068_conv:24136,situation,none,I met a lady a few weeks ago and we've been texting almost every day since. We're going out next week and I feel really good about it.,joyful
hit:12068_conv:24136,utterance,speaker,"So, I met someone new a few weeks ago and we've been texting almost every day.",trusting
hit:12068_conv:24136,utterance,listener,"awesome, whens' the first date?",questioning
hit:12068_conv:24136,utterance,speaker,Next week. I feel really good about it!,confident
hit:12068_conv:24136,utterance,listener,"Aweomse, always great to see people forming new relationships.",acknowledging
hit:483_conv:967,situation,none,I have been working so hard and my vacation will start tomorrow.,joyful
hit:483_conv:967,utterance,speaker,Do you know the feeling of having a vacation after long working months,joyful
hit:483_conv:967,utterance,listener,Yes! Theres nothing like the relief that comes with not having any assignments or projects due,excited
hit:483_conv:967,utterance,speaker,I will be going on a cruise for the vacation,excited
hit:483_conv:967,utterance,listener,"I've never been on a cruise before, I'm too afraid of the open ocean. Where are you going to go cruising?",questioning
hit:12092_conv:24184,situation,none,"I am happy with my life right now, everything is going well",content
hit:12092_conv:24184,utterance,speaker,"I am happy with my life right now, everything is going well",content
hit:12092_conv:24184,utterance,listener,That is awesome! What all do you have going on?,questioning
hit:12092_conv:24184,utterance,speaker,"I have a good job, good girlfriend and good friends!",content
hit:12092_conv:24184,utterance,listener,"That is great, you are very lucky and blessed!",acknowledging
hit:1872_conv:3745,situation,none,"I am happy to have my girlfriend of almost 3 years, she is amazing!",joyful
hit:1872_conv:3745,utterance,speaker,"I am happy to have my girlfriend of almost 3 years, she is amazing!",joyful
hit:1872_conv:3745,utterance,listener,"Good for you, healthy relationships are the best part about life!",acknowledging
hit:1872_conv:3745,utterance,speaker,"That is for sure, it feels great to have someone on your side all the time",agreeing
hit:1872_conv:3745,utterance,listener,"I agree, going through life alone would be boring!",agreeing
hit:170_conv:341,situation,none,We moved to a new house last year and love it - and have spend much less working on projects and more time with the kids.,joyful
hit:170_conv:341,utterance,speaker,We moved to a new house last year and love it - and have spend much less working on projects and more time with the kids.,joyful
hit:170_conv:341,utterance,listener,"That's great! That time with the kids will really be worth it, ultimately.",acknowledging
hit:170_conv:341,utterance,speaker,"Absolutely, and the time taken to becmoe experts on home repair is rather large.",agreeing
hit:170_conv:341,utterance,listener,"Yeah, it's a good thing that you have a lot of time for other more important things now.",acknowledging
hit:1063_conv:2127,situation,none,"I felt so much wonder and awe when I went to the beach. I was surrounded by such profound beauty, and I spent my entire day swimming, sunbathing, and laughing with my partner. It made me so happy.",joyful
hit:1063_conv:2127,utterance,speaker,"I went to the beach a few weeks ago, and it was great. The beach is so beautiful and serene",joyful
hit:1063_conv:2127,utterance,listener,"I live near the beach, too! It really is great. Although I've been out of town for a while, so I haven't been to it yet this summer. I'm glad you got to go there.",joyful
hit:1063_conv:2127,utterance,speaker,"Lucky you to be so close! Yeah, I had so much fun, especially since I could spend a lot of time with my partner and a lot of time swimming!",joyful
hit:1063_conv:2127,utterance,listener,Only thing I'm not wild about is dealing with cleaning up afterwards.,annoyed
hit:4513_conv:9027,situation,none,I really wanted to go on this trip to Texas and I didn't think I'd get to. Then a spot got unfilled and I got to go on it!,joyful
hit:4513_conv:9027,utterance,speaker,I didn't think I'd get to go on this trip to Texas with my friends but I did end up getting to!,surprised
hit:4513_conv:9027,utterance,listener,Trips are very expensive to go on.,neutral
hit:4513_conv:9027,utterance,speaker,"Yeah they are, but this one was paid for except for the food costs.",neutral
hit:4513_conv:9027,utterance,listener,Food is so expensive these days.,sad
hit:1406_conv:2813,situation,none,that i am going to be selling my house!!!,joyful
hit:1406_conv:2813,utterance,speaker,I am feeling in such a good mood this week. Finally!,joyful
hit:1406_conv:2813,utterance,listener,That's nice to hear! What's going on?,questioning
hit:1406_conv:2813,utterance,speaker,"My house is going to possibly get signed tonight around 7pm, and I found a better job. :D",hopeful
hit:1406_conv:2813,utterance,listener,Wow. Those are 2 fantastic news!,acknowledging
hit:5666_conv:11333,situation,none,every time i get payed,joyful
hit:5666_conv:11333,utterance,speaker,"Every payday im so happy, then i pay all my bills and left with but a few bucks , and i think .... welcome to the real world",sad
hit:5666_conv:11333,utterance,listener,"That's how it works, for most of us lol",agreeing
hit:5666_conv:11333,utterance,speaker,ah lifes beautiful that way lol,acknowledging
hit:5666_conv:11333,utterance,listener,If only they had told us sooner.,neutral
hit:6770_conv:13541,situation,none,I stopped by the gas station today to fill up the car.  I bought a scratcher too and won $2500!,joyful
hit:6770_conv:13541,utterance,speaker,I had to make a pit stop at the gas station this afternoon to get gas.  I bought a scratch off lottery ticket too.,hopeful
hit:6770_conv:13541,utterance,listener,Pit stops can be fun.  How did you do on the scratch off?,questioning
hit:6770_conv:13541,utterance,speaker,I won $2500!,joyful
hit:6770_conv:13541,utterance,listener,No way! Congrats!!! I've never come close to that much on a scratch off.  I bet your heart was racing.,wishing
hit:5594_conv:11188,situation,none,"I won free grocery! I kinda of wish I would have bought more now, haha.",joyful
hit:5594_conv:11188,utterance,speaker,"I won free grocery! I kinda of wish I would have bought more now, haha.",joyful
hit:5594_conv:11188,utterance,listener,I didn't know such a thing existed! What store?,surprised
hit:5594_conv:11188,utterance,speaker,Mina's market. It's local.,surprised
hit:5594_conv:11188,utterance,listener,"Oh! That's a nice program. Well getting any amount of groceries for free is nice, but yes too bad it wasn't a supermarket sweep",acknowledging
hit:7423_conv:14847,situation,none,I'm so happy about going camping next weekend!,joyful
hit:7423_conv:14847,utterance,speaker,I'm feeling very happy about being able to go camping next weekend!,joyful
hit:7423_conv:14847,utterance,listener,that's awesome. i really want to go camping but we haven't been able to yet,acknowledging
hit:7423_conv:14847,utterance,speaker,Yeah it's so fun but so hard to find time for. It's been a long time since I have done it.,neutral
hit:7423_conv:14847,utterance,listener,are you going somewhere local or going out of town ?,questioning
hit:7423_conv:14847,utterance,speaker,"It's going to be a local campground type of place, but I have never been to it before.",apprehensive
hit:7423_conv:14847,utterance,listener,that is always fun. enjoy your time.,acknowledging
hit:14_conv:29,situation,none,I was so happy when I moved in to my new home. My girlfriend and I have been saving for awhile and we finally got the keys last month. Now we can finally move on with our life plans.,joyful
hit:14_conv:29,utterance,speaker,Planning out my new home has turned out to be a blast!,joyful
hit:14_conv:29,utterance,listener,What kind of house are you building?,questioning
hit:14_conv:29,utterance,speaker,I just moved in so it is already built. Just working on planning out decorating and appliances and such.,prepared
hit:14_conv:29,utterance,listener,That sounds great. What are you most excited for?,questioning
hit:14_conv:29,utterance,speaker,I think I am most excited for all the space I have. I can have friends over and not feel cramped.,content
hit:11890_conv:23781,situation,none,my wife makes me happy,joyful
hit:11890_conv:23781,utterance,speaker,"i am over the moon, do you know how it feels like to have someone that always supports you",grateful
hit:11890_conv:23781,utterance,listener,That's amazing! I do not (so far) but i hope to some day.,encouraging
hit:11890_conv:23781,utterance,speaker,"i hope so, stay strong man! it's going to be okay",consoling
hit:11890_conv:23781,utterance,listener,Thanks! I appreciate it. I am really happy for you though! That's one of the best things to feel in life I am sure.,acknowledging
hit:12380_conv:24760,situation,none,My favorite time of year is the holidays. I love getting together with my family and talking about our lives. It is such a merry time.,joyful
hit:12380_conv:24760,utterance,speaker,My favorite time of the year is during the holidays. My family gets together and talks about our lives. It is such a merry time.,joyful
hit:12380_conv:24760,utterance,listener,That's wonderful. I also love the holidays. It's the perfect time for families.,joyful
hit:12380_conv:24760,utterance,speaker,Yeah it is so peaceful drinking egg nogg and watching logs burn in the fire. I can't wait for the holidays.,content
hit:12380_conv:24760,utterance,listener,Sounds like heaven! I am also looking forward to them too.,acknowledging
hit:5914_conv:11829,situation,none,The start of school is soon!,joyful
hit:5914_conv:11829,utterance,speaker,"The start of school is soon, I'm ready to get back to work!",prepared
hit:5914_conv:11829,utterance,listener,I feel you! Summer is great and all but I miss my classmates and the work I'm studying.,sentimental
hit:5914_conv:11829,utterance,speaker,"Yeah, I love the feeling of keeping busy during the school year.",acknowledging
hit:5914_conv:11829,utterance,listener,I hope you have a successful semester!,encouraging
hit:7908_conv:15817,situation,none,I'm really enjoying a peaceful Sunday afternoon.,joyful
hit:7908_conv:15817,utterance,speaker,I'm just enjoying a peaceful Sunday.,content
hit:7908_conv:15817,utterance,listener,That sounds so relaxing!,acknowledging
hit:7908_conv:15817,utterance,speaker,It is very nice. I don't get enough of them.,acknowledging
hit:7908_conv:15817,utterance,listener,I hope you enjoy it!,encouraging
hit:3351_conv:6703,situation,none,I was adopted and searched for my real family my whole life. I finally found them and we are about to meet for the first time.,joyful
hit:3351_conv:6703,utterance,speaker,I was adopted and spent the last several years searching for my biological family.,devastated
hit:3351_conv:6703,utterance,listener,"Oh, that sounds rough. Were you successful?",questioning
hit:3351_conv:6703,utterance,speaker,Yes! I finally found my biological mom and a sister. We are about to meet for the first time and I am so excited!,excited
hit:3351_conv:6703,utterance,listener,That's great! I'm happy for you. I hope you get along real well,encouraging
hit:6644_conv:13288,situation,none,I'm glad the weekend is finally here.,joyful
hit:6644_conv:13288,utterance,speaker,I'm glad the weekend is here.,grateful
hit:6644_conv:13288,utterance,listener,So am I! Do you have plans?,questioning
hit:6644_conv:13288,utterance,speaker,"Going swimming Sunday, probably relaxing on Saturday.",content
hit:6644_conv:13288,utterance,listener,That sounds good. I hope you get re-energized.,encouraging
hit:246_conv:492,situation,none,When the Washington Capitals won the Stanley Cup i was in such great spirits. I ran into the streets of DC celebrating. I couldn't believe this was happening.,joyful
hit:246_conv:492,utterance,speaker,So lately my most fun experience I've had was when the Capitals won the Stanley cup finally.,joyful
hit:246_conv:492,utterance,listener,"That is exciting when your team wins, have you always been a hockey fan?",questioning
hit:246_conv:492,utterance,speaker,Yep since i was 3! Was a nice time the streets of DC flooded with people celebrating a championship finally for the team.,joyful
hit:246_conv:492,utterance,listener,"That is awesome! I am from Chicago, so when the cubs won the world series I felt the same way.",acknowledging
hit:11980_conv:23960,situation,none,I was very happy when I found that I am getting a bonus from my employer.,joyful
