Dialog_ID,Type,Actor,Text,Label
hit:5260_conv:10520,utterance,listener,That sounds like a fun weekend! Did you go swimming?,questioning
hit:5260_conv:10520,utterance,speaker,A couple of them did!  The older people went fishing!,jealous
hit:5260_conv:10520,utterance,listener,That sound fun! I love to eat fresh fish!,acknowledging
hit:5260_conv:10520,utterance,speaker,Yeah!  I caught a very large catfish!  The kids loved it!,joyful
hit:3215_conv:6430,situation,none,I watched my daughter be born this morning.  It was one of the best days of my life!,joyful
hit:3215_conv:6430,utterance,speaker,I watched my daughter be born this morning. It was one of the best days of my life!,joyful
hit:3215_conv:6430,utterance,listener,"That's amazing, first child?",questioning
hit:3215_conv:6430,utterance,speaker,It was.  I didn't realize I would love a kid so much!,caring
hit:3215_conv:6430,utterance,listener,"Cherish every moment, they grow up SO fast!",grateful
hit:1995_conv:3990,situation,none,"Once, I won $2500 at the casino.",joyful
hit:1995_conv:3990,utterance,speaker,"Last weekend, I won $2500 playing roulette at the casino!",joyful
hit:1995_conv:3990,utterance,listener,Wow that is a lot of money! Congrats!,acknowledging
hit:1995_conv:3990,utterance,speaker,Thanks! I still don't know what to spend the money on.,sympathizing
hit:1995_conv:3990,utterance,listener,"If all else fails, save it!",consoling
hit:8898_conv:17797,situation,none,I'm so glad that summer is almost over.,joyful
hit:8898_conv:17797,utterance,speaker,I'm very happy that summer is almost over and fall is around the corner.,joyful
hit:8898_conv:17797,utterance,listener,"I used to be that way, because I love holidays and the mood it puts everyone in. But I'm starting to hate how short the fall and winter days are, and how quickly it gets dark. Now that I've been exercising outside more lately, I hate losing that time in the sun",sad
hit:8898_conv:17797,utterance,speaker,"I like the summer some, but really love the fall and winter.",sentimental
hit:8898_conv:17797,utterance,listener,"I can understand that. And I live in the south, so it doesn't get that cold, so I can't really complain. I visited my girlfriend who lives in the midwest last winter, and it got under 0 at times. I could not live like that long term.",jealous
hit:5958_conv:11916,situation,none,I'm living life to the fullest right now.  I live in the present and I'm loving it,joyful
hit:5958_conv:11916,utterance,speaker,My life is not where I want it to be yet...but I know I'm on the right path because I've got full autonomy of time and I'm living it to the fullest so I know I'm on the right track,content
hit:5958_conv:11916,utterance,listener,That's great! How can you tell you are on the right path?,questioning
hit:5958_conv:11916,utterance,speaker,"Because I just paid rent, took care of bills, tire rotation, and still have time to hit the gym 6 days a week and feel like Bruce Wayne",proud
hit:5958_conv:11916,utterance,listener,Congrats! That's awesome,acknowledging
hit:8548_conv:17096,situation,none,I love to have ice creams. I eat 2 cups of ice cream today. I much happy about it.,joyful
hit:8548_conv:17096,utterance,speaker,I had 2 cups of ice cream today.,content
hit:8548_conv:17096,utterance,listener,Is that good or bad?,questioning
hit:8548_conv:17096,utterance,speaker,Good to have occasionally. I love to have it.,grateful
hit:8548_conv:17096,utterance,listener,"Good, enjoy it when you get it, that is what I say",encouraging
hit:11806_conv:23612,situation,none,My best friend is coming to visit me tomorrow.  I am so happy to see her.,joyful
hit:11806_conv:23612,utterance,speaker,My best friend is coming to visit me tomorrow.,excited
hit:11806_conv:23612,utterance,listener,Cool!  What are you all gonna do?,questioning
hit:11806_conv:23612,utterance,speaker,We are going to go clubbing! I am so happy to see her!,joyful
hit:11806_conv:23612,utterance,listener,That's awesome!!  I hope you have fun and be safe!,encouraging
hit:12317_conv:24634,situation,none,"I was so happy for my brother, he won a karate tournemant.",proud
hit:12317_conv:24634,utterance,speaker,My brother won a championship in karate. I am so happy for him!,proud
hit:12317_conv:24634,utterance,listener,What kind of belt does he have?,questioning
hit:12317_conv:24634,utterance,speaker,he is already black.,neutral
hit:12317_conv:24634,utterance,listener,Heh. Thats really cool. I need to take self defense classes.,acknowledging
hit:3361_conv:6723,situation,none,I was so happy to see my nephew born recently. He was so tiny!,joyful
hit:3361_conv:6723,utterance,speaker,I am so happy about my little nephew! He was born last month and is so precious!,joyful
hit:3361_conv:6723,utterance,listener,"Aw, that's adorable! I bet he's the cutest thing",acknowledging
hit:3361_conv:6723,utterance,speaker,"Yes, it's amazing how tiny and fragile little babies are! He is growing so fast!",surprised
hit:3361_conv:6723,utterance,listener,That's awesome. I want a baby nephew :(,acknowledging
hit:3361_conv:6723,utterance,speaker,Hopefully you'll be able to experience the happiness of a little nephew or niece!,encouraging
hit:1119_conv:2238,situation,none,I just had my fourth child five months ago. It was a great day!,joyful
hit:1119_conv:2238,utterance,speaker,"It's hard giving birth, any way you do it, but I was still so happy when my kids were born",joyful
hit:1119_conv:2238,utterance,listener,I am glad they are healthy,grateful
hit:1119_conv:2238,utterance,speaker,"Yes, they are all healthy.  I've been really lucky.  Do you have kids?",questioning
hit:1119_conv:2238,utterance,listener,I do not just a cat,caring
hit:1119_conv:2238,utterance,speaker,My daughter loves cats!  She's allergic...but it doesn't stop her from trying to adopt strays everytime one finds us,caring
hit:3160_conv:6321,situation,none,I was very happy to have the whole family at my house for Easter,joyful
hit:3160_conv:6321,utterance,speaker,I was very happy to have the whole family at my house for Easter,joyful
hit:3160_conv:6321,utterance,listener,That's really neat. Did you guys have an easter egg hunt?,questioning
hit:3160_conv:6321,utterance,speaker,"yes, we did.",neutral
hit:3160_conv:6321,utterance,listener,That's cool. Who collected the most eggs?,acknowledging
hit:3160_conv:6321,utterance,speaker,We had them all collect the same amount so it was fair for the littler ones,grateful
hit:2089_conv:4179,situation,none,I am so happy with my life.,joyful
hit:2089_conv:4179,utterance,speaker,I am so happy with my life right now.,joyful
hit:2089_conv:4179,utterance,listener,That must be a great feeling!  Good for you!  You should be proud that things are going well and not take it for granted.,acknowledging
hit:2089_conv:4179,utterance,speaker,"Nice advice , thanks.I will make sure I follow the advice.",acknowledging
hit:2089_conv:4179,utterance,listener,Good deal!  I am happy to help!,joyful
hit:10683_conv:21367,situation,none,"My son recently got married, and I gained a new daughter in law. The wedding was beautiful, everyone had a great time !",joyful
hit:10683_conv:21367,utterance,speaker,"My son recently got married, and I gained a new daughter in law. The wedding was beautiful, everyone had a great time !",joyful
hit:10683_conv:21367,utterance,listener,Oh that's awesome. Do you like her?,questioning
hit:10683_conv:21367,utterance,speaker,She's quite the gal. Treats my son with the utmost respect.,caring
hit:10683_conv:21367,utterance,listener,"That's great, nothing better :)",acknowledging
hit:1863_conv:3727,situation,none,I remember when my first child was born.  I was overcome with pride and happiness!,joyful
hit:1863_conv:3727,utterance,speaker,I remember when my first child was born. I was overcome with pride and happiness!,joyful
hit:1863_conv:3727,utterance,listener,"I would imagine, that is a huge event! My favorite game was Zelda by the way",surprised
hit:1863_conv:3727,utterance,speaker,Now that my kids are older I should get the Nintendo Switch and teach them to play.  They would love that.,hopeful
hit:1863_conv:3727,utterance,listener,"You should, there are tons of age appropriate games like Mario Kart and Splatoon!",agreeing
hit:5444_conv:10889,situation,none,I am at my most zen when I'm alone.  I'm not a loner but I feel that having peace of mind all to myself is a gift that most people take for granted.,joyful
hit:5444_conv:10889,utterance,speaker,I'm no loner and I love hanging out with my friends.  But for me true Nirvana is when I've got my own space...because I feel that having peace of mind is a gift that most people take for granted.,content
hit:5444_conv:10889,utterance,listener,Sounce like you're a bit of an introvert.,embarrassed
hit:5444_conv:10889,utterance,speaker,Not exactly.  Had 2 girls over yesterday and it was pretty fun lol...all while ppl were messaging me on facebook,agreeing
hit:5444_conv:10889,utterance,listener,"Yeah, That gets old after a whle for me.",acknowledging
hit:5956_conv:11913,situation,none,i am so happy after giving birth successfully. i feel so blessed,joyful
hit:5956_conv:11913,utterance,speaker,i gave birth to a beautiful princess,joyful
hit:5956_conv:11913,utterance,listener,That makes you a queen.,neutral
hit:5956_conv:11913,utterance,speaker,"yes i am a Queen, am so excited, my husband both a special gift for me after my delivery",surprised
hit:5956_conv:11913,utterance,listener,What's that ?,questioning
hit:5956_conv:11913,utterance,speaker,Limo,apprehensive
hit:5714_conv:11429,situation,none,i just went on a vacation and i was very happy i needed it,joyful
hit:5714_conv:11429,utterance,speaker,so friend i just went on a vacation and i was very happy i needed it,grateful
hit:5714_conv:11429,utterance,listener,Yes! where did you go? do you feel relaxed?,questioning
hit:5714_conv:11429,utterance,speaker,i went to santa fe! I felt very relaxed and happy you know? It was chill,content
hit:5714_conv:11429,utterance,listener,"Yes! I bet it was great, probably really nice weather.",acknowledging
hit:2009_conv:4018,situation,none,"There are a lot of things to be depressed about in this world.  But if there's one thing that warms my heart it's seeing all my bills paid, debt nonexistent, income far greater than expenses and a nice fat check from tax returns at the end of the year.",joyful
hit:2009_conv:4018,utterance,speaker,"I feel like if there's one thing equal to if not greater than sex it's seeing all my bills paid, debt nonexistent, income far greater than expenses and a nice fat check from tax returns at the end of the year.",joyful
hit:2009_conv:4018,utterance,listener,"I agree, man. Almost nothing feels as good as financial security.",agreeing
hit:2009_conv:4018,utterance,speaker,Exactly.  Good lovin don't pay the bills,agreeing
hit:2009_conv:4018,utterance,listener,But good lovin' can be a bill.. if you know what I mean.,neutral
hit:5362_conv:10724,situation,none,I just got a raise that'll kick in in February.,joyful
hit:5362_conv:10724,utterance,speaker,I've gotten a raise that'll start in February.,joyful
hit:5362_conv:10724,utterance,listener,Congratulations!  Are you going to celebrate?,wishing
hit:5362_conv:10724,utterance,speaker,"I just did, by telling you...lol. No, I'll be too broke till then.",neutral
hit:5362_conv:10724,utterance,listener,Why does it take so long to kick in?,questioning
hit:1087_conv:2174,situation,none,I was happy when I went on vacation from work,joyful
hit:1087_conv:2174,utterance,speaker,I was happy when I went on vacation from work,joyful
hit:1087_conv:2174,utterance,listener,That is such a great feeling did you have a great time?,questioning
hit:1087_conv:2174,utterance,speaker,Well it was 111 degrees on my first day camping with the family but it got cooler after that initial day,neutral
hit:1087_conv:2174,utterance,listener,This heat is very dangerous hope yall was very hydrated with water to stay cool.,prepared
hit:7475_conv:14951,situation,none,I won the table-tennis competition that was held in our college among students. I was given an iPad as a prize,joyful
hit:7475_conv:14951,utterance,speaker,Guess what. I won the table-tennis competition that was held in college among all students. I received an iPad as a prize,joyful
hit:7475_conv:14951,utterance,listener,That's cool. Was it the newest one?,questioning
hit:7475_conv:14951,utterance,speaker,"It was the latest edition of iPad family. I am so happy to have it. As I already have one, i was thinking of selling it on Craigslists to get a cash",joyful
hit:7475_conv:14951,utterance,listener,Good idea,acknowledging
hit:2534_conv:5069,situation,none,I just got a new promotion. This makes me so happy when I think about it.,joyful
hit:2534_conv:5069,utterance,speaker,I am so happy I just got a new promotion!,grateful
hit:2534_conv:5069,utterance,listener,That's great! Congrats!,acknowledging
hit:2534_conv:5069,utterance,speaker,Thank you! I have been waiting for  this for awhile.,joyful
hit:2534_conv:5069,utterance,listener,I am sure it was well-deserved.,neutral
hit:3250_conv:6501,situation,none,ended up getting a pizza from Costco. I'm so hungry.,joyful
hit:3250_conv:6501,utterance,speaker,ended up getting a pizza from Costco. I'm so hungry,joyful
hit:3250_conv:6501,utterance,listener,"Oh man, Costco pizza is great, and so cheap, too. It may not be the best, but for the price and quantity, you can't really beat it. Do you like shopping at Costco often?",impressed
hit:3250_conv:6501,utterance,speaker,"Not really. I kinda feel like I don't get much, but their food court stuff is great value for the money.",content
hit:3250_conv:6501,utterance,listener,"Yeah, I guess it depends on your household. I just tag along with my parents from time to time to get certain things in bulk. But I think you need to have a certain amount of people in your family for it to be worth the membership. Still, I really appreciate the business and the owner as a whole.",neutral
hit:3043_conv:6086,situation,none,I was pretty excited to have a night out with the girls,joyful
hit:3043_conv:6086,utterance,speaker,I was pretty excited to have a night out with the girls,joyful
hit:3043_conv:6086,utterance,listener,How long has it been?,questioning
hit:3043_conv:6086,utterance,speaker,It has probably been about 8 months are so,anticipating
hit:3043_conv:6086,utterance,listener,Whoa! SO needed! What did you guys do?,questioning
hit:11085_conv:22170,situation,none,I got a promotion at my new job.,proud
hit:11085_conv:22170,utterance,speaker,I got a promotion at my new job,proud
hit:11085_conv:22170,utterance,listener,Congratulations! Is this your first ever promotion?,wishing
hit:11085_conv:22170,utterance,speaker,Yes I am so happy.,joyful
hit:11085_conv:22170,utterance,listener,Cool! What industry do you work in?,questioning
hit:824_conv:1648,situation,none,I took my girlfriend to my school dance the other night. It was truly a magical experience.,joyful
hit:824_conv:1648,utterance,speaker,I took my girlfriend to my school dance the other night. It was truly a magical experience!,joyful
hit:824_conv:1648,utterance,listener,That is great. Some of the best romantic experiences are at school dances.,acknowledging
hit:824_conv:1648,utterance,speaker,"Oh, you're telling me. When the first slow dance came on, I thought my heart was going to burst.",surprised
hit:824_conv:1648,utterance,listener,Sounds like you had a wonderful night. I am sure she felt the same way.,acknowledging
hit:1983_conv:3966,situation,none,"Recently I bought a keyboard that I was looking forward to buying for a long time. My old one kept double-tapping on certain letters. I was so happy when it arrived, I took it out of the box and I have had so much fun using it since then.",joyful
hit:1983_conv:3966,utterance,speaker,"Recently I bought a keyboard that I was looking forward to buying for a long time. My old one kept double-tapping on certain letters. I was so happy when it arrived, I took it out of the box and I have had so much fun using it since then.",joyful
hit:1983_conv:3966,utterance,listener,That is great. Did you buy anything else?,questioning
hit:1983_conv:3966,utterance,speaker,"No, I only bought the keyboard. A few months before that though, I bought a nice mouse.",neutral
hit:1983_conv:3966,utterance,listener,So you have relatively new computer essentials. Sounds like you are set for the next while.,acknowledging
hit:1983_conv:3966,utterance,speaker,"Yup, I won't need anything else related to computers for a while",anticipating
hit:1223_conv:2447,situation,none,I got a shotgun for Christmas last year. I was so happy to use it to hunt small critters!,joyful
hit:1223_conv:2447,utterance,speaker,"So, last year my parents got me a shotgun for Christmas. I was so stoked!",excited
hit:1223_conv:2447,utterance,listener,"Wow, that's interesting. What do you do with it?",questioning
hit:1223_conv:2447,utterance,speaker,I take it up to my cabin in Michigan and hunt a bunch of small woodland critters! I like to think of myself as the hunter from Bambi.,confident
hit:1223_conv:2447,utterance,listener,Oh no- Well I am the opposite. I rescue bambi and small critters :),caring
hit:9306_conv:18612,situation,none,I got a raise today at work. I was not expecting it!,joyful
hit:9306_conv:18612,utterance,speaker,I got a huge raise at work today!,joyful
hit:9306_conv:18612,utterance,listener,That's amazing! You must be so happy,acknowledging
hit:9306_conv:18612,utterance,speaker,I am! I wasn't expecting it at all!,surprised
hit:9306_conv:18612,utterance,listener,Hard work pays off,grateful
hit:3004_conv:6009,situation,none,I feel like blowing a trumpet I am so happy.  I got my medical marijuana card today.,joyful
hit:3004_conv:6009,utterance,speaker,I feel like blowing a trumpet I am so happy!,joyful
hit:3004_conv:6009,utterance,listener,Yay! What made you very happy?,questioning
hit:3004_conv:6009,utterance,speaker,LOLOL.  I got my medical marijuana card in the mail today!,joyful
hit:3004_conv:6009,utterance,listener,Oh yeah!!! I need to get my ass to a legal state to get my card too!,agreeing
hit:1739_conv:3478,situation,none,When i graduated high school.,proud
hit:1739_conv:3478,utterance,speaker,Gradating high school was the best day of my life.,proud
hit:1739_conv:3478,utterance,listener,Did you party after?,questioning
hit:1739_conv:3478,utterance,speaker,"Of course not, i went straight to sleep!",neutral
hit:1739_conv:3478,utterance,listener,I partied like crazy after graduation.,ashamed
hit:9070_conv:18141,situation,none,i was happy to get approved for the weekend off,joyful
hit:9070_conv:18141,utterance,speaker,i was happy to get approved for the weekend off,joyful
hit:9070_conv:18141,utterance,listener,That's nice! How are you gonna spend your weekend?,questioning
hit:9070_conv:18141,utterance,speaker,going to vegas!,excited
hit:9070_conv:18141,utterance,listener,"Oh man, good luck! Hope you roll high.",wishing
hit:3927_conv:7854,situation,none,I've been with my wife for 13 years.,content
hit:3927_conv:7854,utterance,speaker,I've been with my wife for 13 years.,content
hit:3927_conv:7854,utterance,listener,That is very sweet,questioning
hit:3927_conv:7854,utterance,speaker,Thank you. She's the love of my life.,grateful
hit:3927_conv:7854,utterance,listener,I hope to have that one day,encouraging
hit:8948_conv:17897,situation,none,I just got a raise at work. I'm so happy!,joyful
hit:8948_conv:17897,utterance,speaker,I work in finance and just got a raise and new office.,joyful
hit:8948_conv:17897,utterance,listener,that's great! congrats! I'm glad to hear that. you deserved it,acknowledging
hit:8948_conv:17897,utterance,speaker,Yeah I'm so happy!,joyful
hit:8948_conv:17897,utterance,listener,you should go celebrate with your other half and your friends!,suggesting
hit:6389_conv:12779,situation,none,I was so happy when I found out my wife was pregnant.,joyful
hit:6389_conv:12779,utterance,speaker,"I was so happy when I found out my wife was pregnant,",joyful
hit:6389_conv:12779,utterance,listener,Oh congrats! When is the due date?,questioning
hit:6389_conv:12779,utterance,speaker,The baby is due in January.,anticipating
hit:6389_conv:12779,utterance,listener,That is coming up soon!,excited
hit:9274_conv:18548,situation,none,"I really enjoyed my time in Tokyo, it was a great experience",joyful
hit:9274_conv:18548,utterance,speaker,"I really enjoyed my time in Tokyo, it was a great experience",joyful
hit:9274_conv:18548,utterance,listener,Oh I bet! Did you just go on vacation?,questioning
hit:9274_conv:18548,utterance,speaker,Yes! The food was great and the culture is so interesting,impressed
hit:9274_conv:18548,utterance,listener,Wow so happy for you. I have always wanted to go myself.,proud
hit:4654_conv:9308,situation,none,I received a promotion.,joyful
hit:4654_conv:9308,utterance,speaker,"I received a promotion and while I didn't expect it, it is much needed and appreciated!",grateful
hit:4654_conv:9308,utterance,listener,unexpected is even better than expected! congrats!,neutral
hit:4654_conv:9308,utterance,speaker,"Yes, I'm so very happy for it!",joyful
hit:4654_conv:9308,utterance,listener,my god i would be too pop the bubbly!,acknowledging
hit:11747_conv:23494,situation,none,I am going to my favorite restaurant tomorrow i am so excited.,joyful
hit:11747_conv:23494,utterance,speaker,I am going to my favorite restaurant tomorrow i cant wait,excited
hit:11747_conv:23494,utterance,listener,That's cool. What are you gonna eat there?,questioning
hit:11747_conv:23494,utterance,speaker,Shrimp and fried rice. It is a Japanese place,content
hit:11747_conv:23494,utterance,listener,Oh sweet is it one of those where they cook it in front of you?,questioning
hit:4561_conv:9122,situation,none,I am overcome by joy when I'm with my son's,joyful
hit:4561_conv:9122,utterance,speaker,I am overcome by joy when I'm with my son's,joyful
hit:4561_conv:9122,utterance,listener,That's precious. How old are they?,questioning
hit:4561_conv:9122,utterance,speaker,"They are 8, 10, 12. They are the whole meaning of my existence.",sentimental
hit:4561_conv:9122,utterance,listener,"They are really starting to grow up, you better cherish them while you can.",sentimental
hit:4024_conv:8048,situation,none,i was happy when i saw lebron james go to the lakers,joyful
hit:4024_conv:8048,utterance,speaker,i was happy when i saw lebron james go to the lakers,joyful
hit:4024_conv:8048,utterance,listener,That is awesome!  He is such an amazing athlete!  Any team that has him is lucky!,acknowledging
hit:4024_conv:8048,utterance,speaker,yea i hope they can do some damage,consoling
hit:4024_conv:8048,utterance,listener,I guarantee they will!  That's raw talent right there!,confident
hit:7059_conv:14118,situation,none,"It's finally the weekend, woohooo!",excited
hit:7059_conv:14118,utterance,speaker,"It's finally the weekend, woohooo!",excited
hit:7059_conv:14118,utterance,listener,That is definitely something to celebrate!,agreeing
hit:7059_conv:14118,utterance,speaker,Yes so many things to  do,agreeing
hit:7059_conv:14118,utterance,listener,Do you have big plans?,questioning
hit:7209_conv:14418,situation,none,I proposed to my girlfriend and she said yes.  I am so happy she did.,joyful
hit:7209_conv:14418,utterance,speaker,I proposed to my girlfriend and she said yes!,joyful
hit:7209_conv:14418,utterance,listener,"Congratulations, thats great news. How did you propose?",wishing
hit:7209_conv:14418,utterance,speaker,I put the ring in a casserole.  I'm so happy she said yes!,joyful
hit:7209_conv:14418,utterance,listener,"Yeah man, it would have sucked if she said no.",acknowledging
hit:3010_conv:6020,situation,none,I am so excited to go to the park with the kids today,joyful
hit:3010_conv:6020,utterance,speaker,I am so excited to go to the park with the kids today,joyful
hit:3010_conv:6020,utterance,listener,That sounds like fun! What kind of park is it?,acknowledging
hit:3010_conv:6020,utterance,speaker,We are going to a really big park that is the kids favorite and we will have a picnic,excited
hit:3010_conv:6020,utterance,listener,Great! Make sure to pack sunscreen. Hot here where I am,prepared
hit:9798_conv:19596,situation,none,The day I got accepted to my dream school. I worked so hard to get there.,joyful
hit:9798_conv:19596,utterance,speaker,Just got accepted to Yale!,excited
hit:9798_conv:19596,utterance,listener,That's awesome! What are you going to study?,questioning
hit:9798_conv:19596,utterance,speaker,I'm going to study some business administration.,hopeful
hit:9798_conv:19596,utterance,listener,That's really cool! Good luck!,wishing
hit:2067_conv:4134,situation,none,I am so happy these days.,joyful
hit:2067_conv:4134,utterance,speaker,I am so happy these days.,joyful
hit:2067_conv:4134,utterance,listener,I am so glad to hear that. What is the secret?,questioning
hit:2067_conv:4134,utterance,speaker,I just met the most wonderful woman. We went out and clicked for the first time.,caring
hit:2067_conv:4134,utterance,listener,How did you meet her? Was it through an online dating service?,questioning
hit:3216_conv:6433,situation,none,I got an extra 2 days paid time off from work.,joyful
hit:3216_conv:6433,utterance,speaker,I got an extra 2 days paid time off from work.,joyful
hit:3216_conv:6433,utterance,listener,Oh I bet you enjoyed that,acknowledging
hit:3216_conv:6433,utterance,speaker,Yep. I'll enjoy it greatly!,anticipating
hit:3216_conv:6433,utterance,listener,I bet you will,encouraging
hit:7846_conv:15692,situation,none,I just found out I am pregnant after years of trying! I've had so many disappointments but it's finally happened!,joyful
hit:7846_conv:15692,utterance,speaker,"""I just found out I am pregnant after years of trying!",joyful
hit:7846_conv:15692,utterance,listener,That's really great! I'm so happy for you!,acknowledging
