Dialog_ID,Type,Actor,Text,Label
hit:7566_conv:15133,utterance,listener,Oh yeah that is a really nice one!,acknowledging
hit:1260_conv:2521,situation,none,My little sister is getting married!  I am so happy for her and can't wait for the wedding!,joyful
hit:1260_conv:2521,utterance,speaker,My little sister is getting married!  I am so happy for her and can't wait for the wedding!,joyful
hit:1260_conv:2521,utterance,listener,How exciting!  When is the wedding?,questioning
hit:1260_conv:2521,utterance,speaker,August 11!  I t will be such a happy event.  The wedding is in New Orleans!,joyful
hit:1260_conv:2521,utterance,listener,"Wow that's right around the corner!  New Orleans is the PERFECT place for a celebration, too!",agreeing
hit:1805_conv:3611,situation,none,"I watched a film recently at the theater and it was really good, so that made me feel happy.",joyful
hit:1805_conv:3611,utterance,speaker,I felt really good tonight after I got back from the cinema.,content
hit:1805_conv:3611,utterance,listener,Oh that sounds like fun! What kind of film did you see?,questioning
hit:1805_conv:3611,utterance,speaker,"It was an action film, and it was surprisingly one of the best I've seen recently.",impressed
hit:1805_conv:3611,utterance,listener,Action films on the big screen are very exciting with the loud sounds and visual effects!!,acknowledging
hit:8288_conv:16577,situation,none,So happy I got my momma dog a new bed today. I had to go to a few different stores. They normally have a ton at the stores I go too but somehow when I need one they are out!,joyful
hit:8288_conv:16577,utterance,speaker,So happy I got my momma dog a new bed today.,joyful
hit:8288_conv:16577,utterance,listener,Oh that's great! I got my cat a new bed and she won't touch it,acknowledging
hit:8288_conv:16577,utterance,speaker,Lol- cats are picky- Here I have a bunch of animals so someone will always like it. She won't leave her cage though and stays curled around her puppy all day and the blankets I have weren't cutting it so she seems more comfortable now- She is in a cage because she feels safer- she was trying to bite other animals.,content
hit:8288_conv:16577,utterance,listener,That's so nice of you to do that for her. I have two dogs and they're picky too.,acknowledging
hit:8288_conv:16577,utterance,speaker,My dogs are just not picky. And they never leave you alone lol! I do have one dog that chews any dog bed or blanket though :( Sigh- Lab mix! He is a handful and a half.,annoyed
hit:2051_conv:4102,situation,none,I got a raise yesterday! It made me so happy and that my hard work was noticed.,joyful
hit:2051_conv:4102,utterance,speaker,Yesterday I got a raise! I'm glad my work was noticed,grateful
hit:2051_conv:4102,utterance,listener,Congrats.I bet you worked hard for tha raised.,acknowledging
hit:2051_conv:4102,utterance,speaker,I did! I feel extra motivated too which is probably good for them too lol.,acknowledging
hit:2051_conv:4102,utterance,listener,You deserve this raise and many more in the future.,proud
hit:1019_conv:2038,situation,none,I have plans to go meet my best friend who I haven't seen in 10 years.,joyful
hit:1019_conv:2038,utterance,speaker,I'm planning a trip next month and I am super excited.,anticipating
hit:1019_conv:2038,utterance,listener,Where are you headed to?,questioning
hit:1019_conv:2038,utterance,speaker,"I'm going home to California, I plan on meeting with my best friend.",hopeful
hit:1019_conv:2038,utterance,listener,"Oh, well that sounds like it will be a ton of fun, I hope all goes well!",acknowledging
hit:5256_conv:10513,situation,none,My brother just told me his wife is pregnant.  I could not be happier for him.,joyful
hit:5256_conv:10513,utterance,speaker,My brother just told me his wife is pregnant. I could not be happier for him.,joyful
hit:5256_conv:10513,utterance,listener,Is it your baby.,questioning
hit:5256_conv:10513,utterance,speaker,"No, it is my brothers baby.",afraid
hit:5256_conv:10513,utterance,listener,We will see once the baby comes out and is tested!,anxious
hit:11330_conv:22660,situation,none,My kid starts preschool in a week.,joyful
hit:11330_conv:22660,utterance,speaker,So my kid starts preschool in a week.,joyful
hit:11330_conv:22660,utterance,listener,"That is really exciting, I bet it will be hard to let them go.",encouraging
hit:11330_conv:22660,utterance,speaker,I will probably cry then celebrate. I'm excited but a little sad at once.,joyful
hit:11330_conv:22660,utterance,listener,"It is so exciting to watch them grow up, I am sure it will be an emotional moment. But it will be a good one.",sentimental
hit:6356_conv:12713,situation,none,I finally got the car of my dreams today. A brand new mustang!,excited
hit:6356_conv:12713,utterance,speaker,Today I finally got my dream car!,excited
hit:6356_conv:12713,utterance,listener,awesome! what kind?,questioning
hit:6356_conv:12713,utterance,speaker,It's a 2019 Bullit edition mustang!,excited
hit:6356_conv:12713,utterance,listener,whoa that is an awesome ride! what color?,questioning
hit:3909_conv:7818,situation,none,"My Grandma, whom I absolutely love and is the best Grandma, is moving back to my city to live here! I never thought she would but I can't wait!",joyful
hit:3909_conv:7818,utterance,speaker,"My Grandma, whom I absolutely love and is the best Grandma, is moving back to my city to live here! I never thought she would but I can't wait!",joyful
hit:3909_conv:7818,utterance,listener,"That's great, what will you do when you first see her?",questioning
hit:3909_conv:7818,utterance,speaker,"Give her the biggest hug and help her settle in.  She's going to a wonderful retirement place that is so nice, I wouldn't mind living there right now!",caring
hit:3909_conv:7818,utterance,listener,It's nice you have such a good relationship with her!,acknowledging
hit:6317_conv:12634,situation,none,I won a dollar playing the lottery yesterday. It was very nice.,joyful
hit:6317_conv:12634,utterance,speaker,I won a whole dollar playing the lottery yesterday!,joyful
hit:6317_conv:12634,utterance,listener,Oh wow! Congratulations! How much did you pay for the ticket?,wishing
hit:6317_conv:12634,utterance,speaker,Thanks! I was so happy! I paid a hundred bucks for the ticket. Just 99 more and I'll be able to buy another!,joyful
hit:6317_conv:12634,utterance,listener,Oh wow! I bet you'll have that $99 in no time so you can buy another! Good job!,encouraging
hit:12143_conv:24287,situation,none,My daughter received several awards at the school awards ceremony. I was proud of her hard work to earn them.,proud
hit:12143_conv:24287,utterance,speaker,I went to my daughter's awards ceremony at school recently.,proud
hit:12143_conv:24287,utterance,listener,How was that experience for you,questioning
hit:12143_conv:24287,utterance,speaker,It was really wonderful seeing her go up for so many awards.,impressed
hit:12143_conv:24287,utterance,listener,You must have been proud.  But she wouldn't be there if you didn't persistently push her to do her best,neutral
hit:11803_conv:23606,situation,none,My mother got me a new puppy. A small blue eyed husky.,excited
hit:11803_conv:23606,utterance,speaker,Wow what an absolutely amazing day!,impressed
hit:11803_conv:23606,utterance,listener,Why is it a great day?,questioning
hit:11803_conv:23606,utterance,speaker,"My mother got me a new puppy, his names Jim.",excited
hit:11803_conv:23606,utterance,listener,What type of dog is it?,questioning
hit:11803_conv:23606,utterance,speaker,"A blue eyed husky, he's so jumpy and active.",anxious
hit:11803_conv:23606,utterance,listener,"Wow, that is so cute, I hope he gets trained quickly!",encouraging
hit:4116_conv:8232,situation,none,"My friends invited me to go to the movies with them after work. I haven't been in many years, so it will be fun to see how it's changed and to catch up with them",joyful
hit:4116_conv:8232,utterance,speaker,My friends invited me to go to the movies with them after work!,joyful
hit:4116_conv:8232,utterance,listener,That sounds really fun. Are you going to go?,questioning
hit:4116_conv:8232,utterance,speaker,"I am! I haven't been in many years, so it will be fun to see how it's changed and to catch up with them",anticipating
hit:4116_conv:8232,utterance,listener,Have fun!,encouraging
hit:1351_conv:2702,situation,none,I fixed my plant hanger today with a new hook screw that had been stripped and broken for a couple weeks.,joyful
hit:1351_conv:2702,utterance,speaker,"I was so excited and happy after my wood glue and toothpick trick worked, and it held the screw!",joyful
hit:1351_conv:2702,utterance,listener,That sounds awesome!,acknowledging
hit:1351_conv:2702,utterance,speaker,"Yes it was, and so far the screw is holding up. :-)",neutral
hit:1351_conv:2702,utterance,listener,"I'm glad that worked out for you, it could have gone in a completely different way.",neutral
hit:1351_conv:2702,utterance,speaker,"Absolutely, my first two attempts did not work so well so this was a super pleasant surprise!",surprised
hit:1351_conv:2702,utterance,listener,Yay you! I hope your next project turns out just as good.,encouraging
hit:10006_conv:20013,situation,none,Last week when my first daughter was born after a complicated pregnancy and almost having her being born in the car,joyful
hit:10006_conv:20013,utterance,speaker,Last week my daughter was born,joyful
hit:10006_conv:20013,utterance,listener,"wow, you must have been out of this world",acknowledging
hit:10006_conv:20013,utterance,speaker,"I was, I still feel happy, specially because of the hardships of the pregnancy",grateful
hit:10006_conv:20013,utterance,listener,Only woman knows the hardship and endurance of pregnancy. I am happy for you,proud
hit:10006_conv:20013,utterance,speaker,Thanks,acknowledging
hit:993_conv:1986,situation,none,"I had a baby last month, so happy.",joyful
hit:993_conv:1986,utterance,speaker,"I had a baby last month, so happy.",joyful
hit:993_conv:1986,utterance,listener,I know you are over the moon. What did you have?,questioning
hit:993_conv:1986,utterance,speaker,"It was a boy, I named him after me.",joyful
hit:993_conv:1986,utterance,listener,Enjoy every minute with him. Time goes fast when they are little.,caring
hit:5536_conv:11072,situation,none,"I am so happy that the preseason for football starts tomorrow, the Eagles play tomorrow, that is awesome",excited
hit:5536_conv:11072,utterance,speaker,"I am so happy that the preseason for football starts tomorrow, the Eagles play tomorrow, that is awesome",excited
hit:5536_conv:11072,utterance,listener,"I enjoy football, but I mainly enjoy that when football happens, fall comes.",joyful
hit:5536_conv:11072,utterance,speaker,"That is true, the only down side is my job gets busier",agreeing
hit:5536_conv:11072,utterance,listener,What do you do for work?,questioning
hit:6372_conv:12744,situation,none,It's finally Friday and I'm just so happy about that fact.,joyful
hit:6372_conv:12744,utterance,speaker,"It might sound simple, but I am just happy that it is finally Friday.",joyful
hit:6372_conv:12744,utterance,listener,i know right,agreeing
hit:6372_conv:12744,utterance,speaker,Yup. It's been a long week. Felt like it would never get here.,anticipating
hit:6372_conv:12744,utterance,listener,"now that summer break is over, every week will be like that for me",anticipating
hit:6854_conv:13709,situation,none,I collect antiques and I found a really old coin. It was a great deal to so I'm so excited!,joyful
hit:6854_conv:13709,utterance,speaker,I was in an antique store and found a really old coin for cheap. It was real and its very valuable. I'm so happy!,joyful
hit:6854_conv:13709,utterance,listener,thats awesome!,acknowledging
hit:6854_conv:13709,utterance,speaker,Yeah I don't think I will sell it though. It's got a good backstory.,apprehensive
hit:6854_conv:13709,utterance,listener,yea that sounds like a plan,acknowledging
hit:6619_conv:13239,situation,none,It is about to be the weekend. I am so excited to be off from work for two whole days,joyful
hit:6619_conv:13239,utterance,speaker,It is about to be the weekend.,joyful
hit:6619_conv:13239,utterance,listener,I know! I am excited about it. Are you?,agreeing
hit:6619_conv:13239,utterance,speaker,"Me too, I cant wait to just relax all weekend.",agreeing
hit:6619_conv:13239,utterance,listener,Same. Ive worked hard this week and now I am ready to just relax,content
hit:2973_conv:5946,situation,none,My company will give us a bonus because the quarter was good. I am happy.,joyful
hit:2973_conv:5946,utterance,speaker,My company will give us a bonus because the quarter was good. I am happy.,joyful
hit:2973_conv:5946,utterance,listener,That's great. I've never gotten a bonuse at work.,surprised
hit:2973_conv:5946,utterance,speaker,I am planning to use it for a trip with my family. That will be great.,joyful
hit:2973_conv:5946,utterance,listener,I just went on a vaction with my kids. Its was so relaxing. Have fun,content
hit:7366_conv:14732,situation,none,Tomorrow should be fun. We are going hiking and kayaking,joyful
hit:7366_conv:14732,utterance,speaker,Tomorrow is going to be fun. We are going hiking and kayaking,joyful
hit:7366_conv:14732,utterance,listener,That sounds pretty amazing. Is the place you go to nearby?,questioning
hit:7366_conv:14732,utterance,speaker,"Its 30 minutes away, but its so nice",acknowledging
hit:7366_conv:14732,utterance,listener,Oh that's actually not that bad. How long are you guys going for?,questioning
hit:10680_conv:21360,situation,none,My aunt that I had not seen in 10 years came to visit me last weekend from Spain.,joyful
hit:10680_conv:21360,utterance,speaker,My aunt that I had not seen in 10 years came to visit me last weekend,joyful
hit:10680_conv:21360,utterance,listener,Wow. What for? Had you recently talked to her?,questioning
hit:10680_conv:21360,utterance,speaker,Yes. I hadn't seen her in so long because she lived in Cuba for all those years. She recently moved to Spain and wanted to visit my family and I.,surprised
hit:10680_conv:21360,utterance,listener,I bet you guys had a lot of catching up to do!,acknowledging
hit:10680_conv:21360,utterance,speaker,Definitely! It was beautiful moment when our family finally reunited!,agreeing
hit:11378_conv:22757,situation,none,I just bought a new puppy and super stoked about it!,excited
hit:11378_conv:22757,utterance,speaker,I just got a new dog!,excited
hit:11378_conv:22757,utterance,listener,"hey, that sounds wonderful. a puppy?",questioning
hit:11378_conv:22757,utterance,speaker,YES! he is adorable.,agreeing
hit:11378_conv:22757,utterance,listener,"i imagine, all puppies are adorable and lovable",acknowledging
hit:11378_conv:22757,utterance,speaker,He is such a ladies man...haha,acknowledging
hit:1550_conv:3100,situation,none,I'm going on vacation tomorrow,joyful
hit:1550_conv:3100,utterance,speaker,Guess what I get to do tomorrow!!!,excited
hit:1550_conv:3100,utterance,listener,"Whatever it is, you seem excited. What is it?",questioning
hit:1550_conv:3100,utterance,speaker,I'm going on vacation! I haven't been on one in years!,excited
hit:1550_conv:3100,utterance,listener,Vacations are sooooo nice!!!  I hope you have an amazing one@!,encouraging
hit:5412_conv:10825,situation,none,I remember the time me and my partner had our first child. I remember them handing the baby to me. Instantly I knew that this was what life was about.,joyful
hit:5412_conv:10825,utterance,speaker,I remember when my first child was born. The nurses handed her to me and I remember feeling happier than I ever have been.,joyful
hit:5412_conv:10825,utterance,listener,thats awesome i cant wait to have kids!,acknowledging
hit:5412_conv:10825,utterance,speaker,There's nothing like it. It's exhausting but in the back of your mind you know there's nothing better.,neutral
hit:5412_conv:10825,utterance,listener,i bet!,encouraging
hit:7721_conv:15442,situation,none,"I have been jobless for 14 months. Last week, I finally got a job. I am so happy.",grateful
hit:7721_conv:15442,utterance,speaker,"I have been jobless for 14 months. Last week, I finally got a job. I am so happy.",grateful
hit:7721_conv:15442,utterance,listener,"I'm very happy for you, thank God you could get a job, that's good!",proud
hit:7721_conv:15442,utterance,speaker,I can now pay my bills. It is a relief.,content
hit:7721_conv:15442,utterance,listener,"I imagine it was very complicated for you when you did not have a job, that happened to me once and I felt very distressed.",neutral
hit:4978_conv:9957,situation,none,I'm joyful that I have a wonderful and supporting family.  Who knows where I would be without them.,grateful
hit:4978_conv:9957,utterance,speaker,"I'm very joyful for my wonderful and supporting family, they have helped me through a lot",grateful
hit:4978_conv:9957,utterance,listener,"a great family makes all the difference, and can get you through anything",grateful
hit:4978_conv:9957,utterance,speaker,"I agree, who knows where I would of ended up without their love and support.",agreeing
hit:4978_conv:9957,utterance,listener,i am also grateful to have a caring family that means the world to me,grateful
hit:11581_conv:23163,situation,none,My sister just gave birth to a healthy beautiful baby girl. I was so happy to meet my niece!,joyful
hit:11581_conv:23163,utterance,speaker,My sister gave birth to a beautiful healthy baby girl last week! I was so happy to meet my niece.,joyful
hit:11581_conv:23163,utterance,listener,What is your nieces name?,questioning
hit:11581_conv:23163,utterance,speaker,"Amelia, she makes my heart so happy!",joyful
hit:11581_conv:23163,utterance,listener,"That's amazing, was it your sisters first baby?",questioning
hit:6018_conv:12037,situation,none,"I'm so happy, My jalapeno plants are producing so many peppers.",joyful
hit:6018_conv:12037,utterance,speaker,"I'm so happy, My jalapeno plants are producing so many peppers.",joyful
hit:6018_conv:12037,utterance,listener,That's great news! Congrats! My garden is not doing great this year. Do you grow anything else?,wishing
hit:6018_conv:12037,utterance,speaker,"I grow a few other things. Green beans, tomatoes, cucumber, melons, and a few other things",caring
hit:6018_conv:12037,utterance,listener,Yum. I wish I had a green thumb.,jealous
hit:2632_conv:5265,situation,none,once upen a day my friend is meet to the road very happy and enjoy.,joyful
hit:2632_conv:5265,utterance,speaker,hi,wishing
hit:2632_conv:5265,utterance,listener,What have your experiences been like?,questioning
hit:2632_conv:5265,utterance,speaker,so nice my experience.,acknowledging
hit:2632_conv:5265,utterance,listener,That's good to hear! Hope that it continues that way.,encouraging
hit:2632_conv:5265,utterance,speaker,yes,agreeing
hit:11340_conv:22681,situation,none,I am the happiest in my life when I am at the ocean. There is just something so special about nature at the ocean for me.,joyful
hit:11340_conv:22681,utterance,speaker,I am the happiest in my life when I am at the ocean. There is just something so special about nature at the ocean for me.,joyful
hit:11340_conv:22681,utterance,listener,That sounds amazing. What's your favorite beach to go to?,questioning
hit:11340_conv:22681,utterance,speaker,I don't really have a favorite. They are all my favorite! But I prefer the beaches that have perfect soft sand with no rocks or anything. Like a huge swimming pool!,excited
hit:11340_conv:22681,utterance,listener,Those are the best. Especially the white sand crystal clear water beaches.,impressed
hit:4059_conv:8119,situation,none,I used to take cold showers in the morning it made me feel good.,joyful
hit:4059_conv:8119,utterance,speaker,I used to enjoy cold showers in the morining.,nostalgic
hit:4059_conv:8119,utterance,listener,I have never tried a cold shower? What is it like?,questioning
hit:4059_conv:8119,utterance,speaker,"It's very cold and refreshing, wakes you up instantly.",acknowledging
hit:4059_conv:8119,utterance,listener,I bet it does wake you up right away. I guess I should try that sometime if I oversleep. lol !,encouraging
hit:1431_conv:2862,situation,none,"We just finished a camping trip, and spent some great quality time together.  We did some fishing, played board games, and had campfires almost every night.",joyful
hit:1431_conv:2862,utterance,speaker,"We love going on our annual family camping trip, and just got back from it!",joyful
hit:1431_conv:2862,utterance,listener,Oh nice! How long did you guys stay?,questioning
hit:1431_conv:2862,utterance,speaker,"We went for a week, but did have to come back to town once.",neutral
hit:1431_conv:2862,utterance,listener,"Oh no, What happened?",questioning
hit:1431_conv:2862,utterance,speaker,"Nothing bad.  We actually purchased a house to pick up and move, and they drove it down the road the week that we were on vacation.",furious
hit:8894_conv:17789,situation,none,I got a call from a friend that I haven't heard from in years. I was so happy to hear from her!,joyful
hit:8894_conv:17789,utterance,speaker,I got a phone call from a friend that I haven't heard from in a really long time.,nostalgic
hit:8894_conv:17789,utterance,listener,That's great! You must have been so surprised and pleased to hear from them.,acknowledging
hit:8894_conv:17789,utterance,speaker,I was! It was so great hearing from her again.,joyful
hit:8894_conv:17789,utterance,listener,I bet you had tons of catching up to do!,acknowledging
hit:2199_conv:4399,situation,none,My friend from out of town came to visit me.,joyful
hit:2199_conv:4399,utterance,speaker,"Last week, my childhood friend came to visit from out of town. I couldn't stop smiling when we hung out.",joyful
hit:2199_conv:4399,utterance,listener,Oh awesome! How are they doing?,questioning
hit:2199_conv:4399,utterance,speaker,Great. We were just cracking jokes the whole time. It was good to see him.,acknowledging
hit:2199_conv:4399,utterance,listener,Awesome! It's nice to see people who knew you so long ago. No friendships like those!,acknowledging
hit:10735_conv:21471,situation,none,One time my mom bought an ice cream from Mcdonalds!,joyful
hit:10735_conv:21471,utterance,speaker,One time my mom bought an ice cream from Mcdonalds!,joyful
hit:10735_conv:21471,utterance,listener,Really? what kind of icecream?,questioning
hit:10735_conv:21471,utterance,speaker,A plain vanilla one. It is rare since their machine is always broken!,surprised
hit:10735_conv:21471,utterance,listener,That is a good one! it is not always broken though. Sometimes they are out of ice cream mix because the workers eat it all,neutral
hit:2007_conv:4015,situation,none,I feel so fortunate to just know that there are like minded people around me.,grateful
hit:2007_conv:4015,utterance,speaker,I recently discovered that there are plenty of like minded people around where I live.,grateful
hit:2007_conv:4015,utterance,listener,That's always a good thing. It means you should get on great with your neighbors.,hopeful
hit:2007_conv:4015,utterance,speaker,"Yes, Just knowing that I'm not alone is such a great feeling.",lonely
hit:2007_conv:4015,utterance,listener,"Most of my neighbors are good, kind people too, so I know just what you mean.",agreeing
hit:10948_conv:21897,situation,none,"I went fishing with my son a month ago, and didn't know how he'd do.  He caught 4 fish and was really excited!",joyful
hit:10948_conv:21897,utterance,speaker,I went fishing with my 4 year-old about a month ago.,terrified
hit:10948_conv:21897,utterance,listener,"That sounds great, I can remeber going fishing with my dad at that age. Did your 4 year-old have a good time?",nostalgic
hit:10948_conv:21897,utterance,speaker,He did!  He caught 4 fish all by himself.,impressed
hit:10948_conv:21897,utterance,listener,"Wow, that's impressive! I'm glad he had a good time.",acknowledging
hit:455_conv:910,situation,none,I was joyful when my grandparents shared the gospel with me.,joyful
hit:455_conv:910,utterance,speaker,I was joyful because my grandad shared the gospel with me when I was 11.,joyful
hit:455_conv:910,utterance,listener,You mean nostalgic?,questioning
hit:455_conv:910,utterance,speaker,I guess I am nostalgic now.,sentimental
hit:455_conv:910,utterance,listener,What your grand father did to you was very special.,sentimental
hit:455_conv:910,utterance,speaker,He read a tract to me. He explained God's love for me with pictures in a way I could understand.,proud
hit:613_conv:1227,situation,none,The thought of having a third child in our family is overwhelming.,joyful
hit:613_conv:1227,utterance,speaker,The thought of having a third child in our family is overwhelming,joyful
hit:613_conv:1227,utterance,listener,"Wow, but to have children in the house is good",neutral
hit:613_conv:1227,utterance,speaker,Every time we add another child it feels great.,joyful
hit:613_conv:1227,utterance,listener,"Oh yes...children are blessings, I love them being around me",grateful
hit:2284_conv:4569,situation,none,i got a letter from my grandmother in the mail today,joyful
hit:2284_conv:4569,utterance,speaker,i got a letter from my grandmother in the mail today,joyful
hit:2284_conv:4569,utterance,listener,That's nice. I always like getting letters.,acknowledging
hit:2284_conv:4569,utterance,speaker,did you ever have a pen pal when you were a child?,questioning
hit:2284_conv:4569,utterance,listener,"no, I never did. It might have been nice.",acknowledging
hit:3949_conv:7899,situation,none,getting a new job after being unemployed for a long while,grateful
hit:3949_conv:7899,utterance,speaker,"After four long, broke months of looking, I finally got offered a job today!",excited
hit:3949_conv:7899,utterance,listener,That's great. Are you excited?,questioning
hit:3949_conv:7899,utterance,speaker,"Yes, and incredibly happy. I was getting really worried about the bills.",excited
hit:3949_conv:7899,utterance,listener,Is it your dream job? Then you should really be happy.,hopeful
