Dialog_ID,Type,Actor,Text
hit:9171_conv:18343,utterance,listener,Yup.  But here's a link https://www.facebook.com/doggocom/photos/pcb.511713622609187/511711852609364/?type=3&theater
hit:6350_conv:12700,situation,none,Someone threw away my lunch at work.  I am so mad that it happened.
hit:6350_conv:12700,utterance,speaker,Someone threw away my lunch at work.
hit:6350_conv:12700,utterance,listener,I hate when that happens! What did you do?
hit:6350_conv:12700,utterance,speaker,"Nothing, I am so mad that it happened."
hit:6350_conv:12700,utterance,listener,"Well, I hope it doesn't happen again. And I hope you find out who did it and give them an earful!"
hit:1304_conv:2608,situation,none,My pizza didn't arrive on time last night - it was an hour late!
hit:1304_conv:2608,utterance,speaker,"So, last night I was enjoying myself watching a movie. I ordered pizza and it didn't come on time. It was an hour late!"
hit:1304_conv:2608,utterance,listener,I bet you were starving! Did they say why they were so late?
hit:1304_conv:2608,utterance,speaker,"Oh, they said they were over-saturated with orders, but come on! An hour is way too long."
hit:1304_conv:2608,utterance,listener,Did you get it free? I would be so annoyed!
hit:3135_conv:6270,situation,none,I can't believe my daughter left the freezer open.  The popsicles melted.
hit:3135_conv:6270,utterance,speaker,my daughter left our freezer open for hours today.
hit:3135_conv:6270,utterance,listener,Uh oh! Was everything ruined?
hit:3135_conv:6270,utterance,speaker,We only had popsicles in there. But I wanted those popsicles lol
hit:3135_conv:6270,utterance,listener,Oh how disappointing.
hit:3135_conv:6270,utterance,speaker,I know
hit:778_conv:1556,situation,none,I and my friend got into fist fight while playing football
hit:778_conv:1556,utterance,speaker,"Last week, me and my friend got into fist fight"
hit:778_conv:1556,utterance,listener,"Oh no, why were you fighting?"
hit:778_conv:1556,utterance,speaker,"we were just arguing, whether its a goal or not while playing soccer. We laughed it off with beer at the end though"
hit:778_conv:1556,utterance,listener,I'm glad you guys could just shrug it off. But I imagine you guys were pretty mad during to break out into a fist fight.
hit:8521_conv:17042,situation,none,i was mad when i saw my gate open
hit:8521_conv:17042,utterance,speaker,i was mad when i saw my gate open
hit:8521_conv:17042,utterance,listener,What happened?
hit:8521_conv:17042,utterance,speaker,my dogs got out and they are still missing
hit:8521_conv:17042,utterance,listener,"That sucks, did you find them?"
hit:11745_conv:23490,situation,none,Our home was broken into right after we moved in and I felt this way.
hit:11745_conv:23490,utterance,speaker,Our home was broken into right after we moved in. I was so mad!
hit:11745_conv:23490,utterance,listener,That sounds like a nightmare! Hopefully no one was hurt.
hit:11745_conv:23490,utterance,speaker,It was. I am so thankful we were not home.
hit:11745_conv:23490,utterance,listener,Did they take a lot of things?
hit:12229_conv:24458,situation,none,It really bothers me when people stand close to me in line
hit:12229_conv:24458,utterance,speaker,It really bothers me when people stand right on top of me in line
hit:12229_conv:24458,utterance,listener,Me too. It is a huge pet peeve of mine.
hit:12229_conv:24458,utterance,speaker,Its not like they can go anywhere so back on up!
hit:12229_conv:24458,utterance,listener,Right? Get out of the way!
hit:9167_conv:18335,situation,none,Someone took my car stereo from my truck.  I am furious about it.
hit:9167_conv:18335,utterance,speaker,Someone took my car stereo from my truck.
hit:9167_conv:18335,utterance,listener,On no! Did you report it?
hit:9167_conv:18335,utterance,speaker,"Yes, I am so furious about it!"
hit:9167_conv:18335,utterance,listener,Was it a really expensive one?
hit:848_conv:1697,situation,none,Somebody stole my mail
hit:848_conv:1697,utterance,speaker,It was my birthday and my friends sent me birthday cards in the mail. I received all of them but not the one who contained a gift card. i'm so angry about it
hit:848_conv:1697,utterance,listener,"Ugh, oh no.... is there someway you can have the person who sent it call the gift card to see what can be done?"
hit:848_conv:1697,utterance,speaker,I don't want to bother her about it. but i did call usps and they will investigate it
hit:848_conv:1697,utterance,listener,"True true, well im glad they are looking into it for you. I hope they find it!"
hit:9650_conv:19301,situation,none,My car just got stolen last night! I'm so furious!
hit:9650_conv:19301,utterance,speaker,My car was stolen last night!
hit:9650_conv:19301,utterance,listener,Oh no! That is horrible! Did you get it back?
hit:9650_conv:19301,utterance,speaker,No and the police have no leads. They are worthless
hit:9650_conv:19301,utterance,listener,That must be so stressful. I am sorry.
hit:1125_conv:2250,situation,none,"I recently got in trouble at work for not making my schedule, but it is their fault because they gave me one they knew I couldn't work."
hit:1125_conv:2250,utterance,speaker,"I recently got in trouble at work for not making my schedule, but it is their fault because they gave me one they knew I couldn't work"
hit:1125_conv:2250,utterance,listener,That sounds shady.  Did it ever get worked out?
hit:1125_conv:2250,utterance,speaker,No it didn't. I am actually on a final warning right now. It's discouraging for sure.
hit:1125_conv:2250,utterance,listener,That is very discouraging.   I am sorry you have to deal with that stress.
hit:7826_conv:15653,situation,none,I stubbed my toe on the side of my bed this morning. It's still hurting.
hit:7826_conv:15653,utterance,speaker,"I stubbed my toe on the side of my bed this morning, it's still hurting!"
hit:7826_conv:15653,utterance,listener,i hate when that happens! I stub my toes all the time i'm surprised i didn't break none of them yet
hit:7826_conv:15653,utterance,speaker,"I think this one might be broken, I'm so annoyed."
hit:7826_conv:15653,utterance,listener,good thing is they heal pretty fast and you don't need a cast or anything like that
hit:3771_conv:7543,situation,none,"I'm so mad, I was supposed to go out with some friends tonight. But suddenly everyone is busy now, so im just home alone"
hit:3771_conv:7543,utterance,speaker,"I wish that when people say they are going to do something or make a promise, that they would stick to it."
hit:3771_conv:7543,utterance,listener,"I know exactly what you mean. I have been let down many times, and it's never a good feeling."
hit:3771_conv:7543,utterance,speaker,"I  had plans to go out with my friends tonight, but suddenly everyone is busy now. and Im stuck home alone"
hit:3771_conv:7543,utterance,listener,You can and should make the best of it. You should have a blast and binge watch some TV show!
hit:10960_conv:21921,situation,none,A car nearly hit me yesterday just because they wanted to change lanes while turning
hit:10960_conv:21921,utterance,speaker,A car nearly hit me yesterday just because they wanted to change lanes while turning
hit:10960_conv:21921,utterance,listener,"Oh man, that is terrifying. I'm glad you didn't get hit. What kind of crazy person tries to turn and change lanes at the same time?"
hit:10960_conv:21921,utterance,speaker,I don't know. People drive horribly where I live. It's like a zoo every time I need to drive anywhere.
hit:10960_conv:21921,utterance,listener,"I know that feeling, I see that kind of stuff all the time where I live too. I hope you stay safe."
hit:1827_conv:3654,situation,none,My boss fired me for no reason
hit:1827_conv:3654,utterance,speaker,"Hi, my boss my fired me for no reason"
hit:1827_conv:3654,utterance,listener,"I'm sorry, I think it's an opportunity to start a new job better"
hit:1827_conv:3654,utterance,speaker,"I agree, but it was unfair since I had the highest return in my department"
hit:1827_conv:3654,utterance,listener,that's right ... but you have to keep going ... I know that you will do well
hit:3325_conv:6650,situation,none,I lost my wallet at work today.  I am so upset I did that.
hit:3325_conv:6650,utterance,speaker,I lost my wallet at work today.
hit:3325_conv:6650,utterance,listener,oh no! did you block your cards?
hit:3325_conv:6650,utterance,speaker,"Yes, I am so upset I lost it."
hit:3325_conv:6650,utterance,listener,what are you going to do about it?
hit:1998_conv:3996,situation,none,I just witnessed someone steal from an old woman walking across the street. Boils my blood!
hit:1998_conv:3996,utterance,speaker,I witnessed a man rob an old woman walking across the street. Boils my friggin' blood!
hit:1998_conv:3996,utterance,listener,Oh my God that's terrible!  So sad.  I'd be mad too.  What did you do?
hit:1998_conv:3996,utterance,speaker,"I would have chased that punk down if I was close enough, but I saw it from a distance."
hit:1998_conv:3996,utterance,listener,Did the police come? I hope she got her stuff back
hit:1998_conv:3996,utterance,speaker,"They did, and I explained in as much detail as I could remember what he looked like. Hopefully they catch him."
hit:1998_conv:3996,utterance,listener,No kidding.  I would hate for that to happen to anyone else.
hit:1998_conv:3996,utterance,speaker,I felt so bad for her. She seemed really shook up.
hit:1998_conv:3996,utterance,listener,I bet.  The world can be so scary!  I'm glad she was okay
hit:6746_conv:13493,situation,none,"The other day while driving. someone cut me off, when I honked they flicked me off."
hit:6746_conv:13493,utterance,speaker,"Soo the other day I was driving, got cut off, and when I honked at the other driver to let him know he almost hit my car, he flicked me off. I'm still bitter about it."
hit:6746_conv:13493,utterance,listener,"Oh that sucks, I would honk harder at him"
hit:6746_conv:13493,utterance,speaker,Lol I should've done that. Anything to show my extreme displeasure. I live in a big city so bad drivers are everywhere.
hit:6746_conv:13493,utterance,listener,"Yeah, some cities have a lot of people and some really bad drivers. They're rude and disrepectful to all other people even pedestrians."
hit:5686_conv:11373,situation,none,My sister slapped me. I was annoyed with her.
hit:5686_conv:11373,utterance,speaker,I annoyed with my sister.
hit:5686_conv:11373,utterance,listener,Oh really? And why is that?
hit:5686_conv:11373,utterance,speaker,She slapped me.
hit:5686_conv:11373,utterance,listener,"Wow, any reason for that?"
hit:4323_conv:8647,situation,none,Today i waited for the cable company to show up at my house for 5 hours... No one ever came
hit:4323_conv:8647,utterance,speaker,"Today i waited for the cable company to show up at my house for 5 hours... No one ever came"""
hit:4323_conv:8647,utterance,listener,wow thats a huge pain
hit:4323_conv:8647,utterance,speaker,"yeah, horrible waste of time... could've been doing something more productive"
hit:4323_conv:8647,utterance,listener,i know what you mean
hit:5216_conv:10432,situation,none,i was upset when i saw someone left my gate open and our dog ran away
hit:5216_conv:10432,utterance,speaker,i was upset when i saw someone left my gate open and our dog ran away
hit:5216_conv:10432,utterance,listener,That's terrible. Did you find your dog?
hit:5216_conv:10432,utterance,speaker,no he is still missing
hit:5216_conv:10432,utterance,listener,I'm sorry to hear that. I hope you find him soon.
hit:3140_conv:6281,situation,none,I lost another wallet today. I just can't keep up with those things
hit:3140_conv:6281,utterance,speaker,I lost another wallet today
hit:3140_conv:6281,utterance,listener,Oh darn that is stressful I bet.
hit:3140_conv:6281,utterance,speaker,I have lost every single one I have ever had.
hit:3140_conv:6281,utterance,listener,That's no good. How does that happen?
hit:3140_conv:6281,utterance,speaker,I have no earthly idea.
hit:6335_conv:12670,situation,none,My parrot pooped on my arm last night. I was so mad!
hit:6335_conv:12670,utterance,speaker,My parrot pooped on my arm last night. I was so mad!
hit:6335_conv:12670,utterance,listener,Oh no! I'm sure it didn't do it on purpose
hit:6335_conv:12670,utterance,speaker,"I am sure it didn't, but it didn't make me any less angry. I let him loose into the wild because I was so peeved!"
hit:6335_conv:12670,utterance,listener,Poor parrot
hit:10992_conv:21984,situation,none,My dishwasher leaked and we had to have our whole kitchen and living redone due to the damages.
hit:10992_conv:21984,utterance,speaker,My dishwasher leaked and it damaged the floors and kitchen cupboards.
hit:10992_conv:21984,utterance,listener,"Man, that really stinks.  Did insurance pay to repair your floor and cupboards?"
hit:10992_conv:21984,utterance,speaker,"Thankfully it was covered by insurance, but it still got me upset to have to get our whole kitchen and living room redone."
hit:10992_conv:21984,utterance,listener,When will your house be put back together?
hit:4354_conv:8708,situation,none,I lost my credit card and someone charged 500 dollars on it.  I am so upset it happened.
hit:4354_conv:8708,utterance,speaker,I lost my credit card and someone charged 500 dollars on it.
hit:4354_conv:8708,utterance,listener,Oh boy.  That's no good.  Did the credit card company alert you or did they miss it too?
hit:4354_conv:8708,utterance,speaker,They missed it.  I am so upset that it happened.
hit:4354_conv:8708,utterance,listener,I bet.  I can't believe they didn't alert you.  Were they able to take care of it for you and suspend the charges and the account?
hit:2253_conv:4507,situation,none,I wsa really upse when I found out my co-worker was fired
hit:2253_conv:4507,utterance,speaker,I was really upse when I found out my co-worker was fired
hit:2253_conv:4507,utterance,listener,Was it their fault?
hit:2253_conv:4507,utterance,speaker,Kind of.  They maxxed out on the amount of points they had from lates and absences
hit:2253_conv:4507,utterance,listener,"Been there, done that lol."
hit:2692_conv:5385,situation,none,My workers did not perform the task to satisfactory standard.
hit:2692_conv:5385,utterance,speaker,"Hi, the workers at my firm have not been performing their tasks to the required standard."
hit:2692_conv:5385,utterance,listener,That sounds horrible. Are you trying to motivate them?
hit:2692_conv:5385,utterance,speaker,Yes but it is making me livid that they are not listening to my instructions!
hit:2692_conv:5385,utterance,listener,I can understand the feeling. I always feel ignored.
hit:4494_conv:8988,situation,none,I got a parking ticket for no reason!. I was livid with the city.
hit:4494_conv:8988,utterance,speaker,I was so mad at the city when I got a parking ticket for no reason!
hit:4494_conv:8988,utterance,listener,Why did you get a ticket then if it was for no reason?
hit:4494_conv:8988,utterance,speaker,I have no idea. The sign said no parking over an hour and I was only there for 10 minutes.
hit:4494_conv:8988,utterance,listener,That's absurd!  Too bad there arent any cameras around to prove your innocence!
hit:2719_conv:5439,situation,none,My kids don't like to listen and it drives me crazy.
hit:2719_conv:5439,utterance,speaker,My kids are always not listening it drives me so crazy
hit:2719_conv:5439,utterance,listener,time to lay the smack down
hit:2719_conv:5439,utterance,speaker,Would you believe that doesn't work they still don't listen
hit:2719_conv:5439,utterance,listener,yea i can believe it.. but it makes you feel better!
hit:1480_conv:2961,situation,none,My manager keep lying about a promotion that he promised.
hit:1480_conv:2961,utterance,speaker,My manager keep lying about a promotion that he promised.
hit:1480_conv:2961,utterance,listener,I am sorry to hear that.  How long has he been promising you the promotion?
hit:1480_conv:2961,utterance,speaker,About six month now. It is making me angry.
hit:1480_conv:2961,utterance,listener,I can imaging.  He sounds pretty spineless and shady.
hit:6289_conv:12579,situation,none,My dog pooped on the rug. I was so mad!
hit:6289_conv:12579,utterance,speaker,My dog pooped on the rug.
hit:6289_conv:12579,utterance,listener,oopsie!
hit:6289_conv:12579,utterance,speaker,I know! I was so mad! She usually doesn't do that!
hit:6289_conv:12579,utterance,listener,MAybe she is sick
hit:5555_conv:11111,situation,none,I bought a used car for my son recently. I found out the odometer had been rolled back.
hit:5555_conv:11111,utterance,speaker,I'm so mad. I bought a used car for my son and found out later the odometer had been rolled back.
hit:5555_conv:11111,utterance,listener,"Wow, that is sleazy, what did you do?"
hit:5555_conv:11111,utterance,speaker,"Well, I've contacted the police, the DMV and their bond company but I'm not getting anywhere. I don't know how people like that can sleep at night."
hit:5555_conv:11111,utterance,listener,"I do not know, how did you discover that was the case?"
hit:6965_conv:13930,situation,none,I spilled soda on my laptop.
hit:6965_conv:13930,utterance,speaker,I spilled soda on my laptop.
hit:6965_conv:13930,utterance,listener,oh no!!! Did you put it in rice?
hit:6965_conv:13930,utterance,speaker,Oh I can put a whole laptop in rice?
hit:6965_conv:13930,utterance,listener,Sure!  Then cook the rice later!
hit:3988_conv:7977,situation,none,"Somehow a LEGO got stuck under my front-door to my house, and now it helped to crack the frame of the door, and it needs to be replaced. What's worse is I had just gotten done telling my child that they need to make sure they're more responsible with their toys, and to put them in their appropriate places. I'm trying to be patient and not overreact in the situation, but it's hard."
hit:3988_conv:7977,utterance,speaker,"Somehow a LEGO got stuck under my front-door to my house, and now it helped to crack the frame of the door, and it needs to be replaced. What's worse is I had just gotten done telling my child that they need to make sure they're more responsible with their toys, and to put them in their appropriate places. I'm trying to be patient and not overreact in the situation, but it's hard."
hit:3988_conv:7977,utterance,listener,Just try and teach them to be more careful with them
hit:3988_conv:7977,utterance,speaker,"Yeah, it's hard, since I feel like what I'm trying to communicate to them isn't getting through. They repeat the same thing a dozen times,and then maybe they start making some progress. It's hard for me to see them run into the same wall over and over, so to speak. But you're right."
hit:3988_conv:7977,utterance,listener,I am sure it will get beter
hit:5687_conv:11375,situation,none,My roommate ate all of my food today. I didn't have any lunch.
hit:5687_conv:11375,utterance,speaker,My roommates took my food I had labeled with my name in the fridge today.
hit:5687_conv:11375,utterance,listener,That was a crappy thing to do. Better get a handle on it now or it could become a big problem.
hit:5687_conv:11375,utterance,speaker,"I know, I think I'm gonna steak their food to let them see how it feels."
hit:5687_conv:11375,utterance,listener,They probably deserve it but you know the old saying two wrongs don't make a right.
hit:4301_conv:8602,situation,none,Someone threw a bunch of trash in my yard.  That makes me so mad!
hit:4301_conv:8602,utterance,speaker,Someone threw a bunch of trash in my yard.
hit:4301_conv:8602,utterance,listener,Ugh! They do that here too! Are you in a bad city too?
hit:4301_conv:8602,utterance,speaker,"Yes, it makes me so mad!"
hit:4301_conv:8602,utterance,listener,Did you find out who did it?
hit:2070_conv:4140,situation,none,I lost the spelling bee when I was in second grade. I was so peeved.
hit:2070_conv:4140,utterance,speaker,"Way back in my elementary school days, I lost the spelling when I was only in the second grade."
hit:2070_conv:4140,utterance,listener,Oh well it's still fun that you got to participate in that.
hit:2070_conv:4140,utterance,speaker,"Yeah, I do recall that it was a swell time. I was pretty peeved that I lost though. I studied so hard."
hit:2070_conv:4140,utterance,listener,Haha that's really a cute story though.
hit:2294_conv:4588,situation,none,I can't believe I lost another bet to my sister. I think she cheats.
hit:2294_conv:4588,utterance,speaker,I just lost another bet to my sister.
hit:2294_conv:4588,utterance,listener,Oh yea? What was the bet?
hit:2294_conv:4588,utterance,speaker,That my mom never worked at McDonalds when she was younger.
hit:2294_conv:4588,utterance,listener,Everyone's got that low minimum wage job at one point in their life sometimes.
hit:2294_conv:4588,utterance,speaker,She told me she had never worked in a restaurant when I wa little. I think they duped me.
hit:9691_conv:19383,situation,none,I asked my friend to water my plants while I was on vacation but she didn't and they died. I was so mad
hit:9691_conv:19383,utterance,speaker,I asked my friend to water my plants while I was on vacation but she didn't and they died. I was so mad
hit:9691_conv:19383,utterance,listener,Oh no ! Did she offer to replace the cost of the plants at least ?
hit:9691_conv:19383,utterance,speaker,"No, but we have always been good friends. The plants were not that expensive, I really wasn't that mad. She had a minor fender bender and forgot about it"
hit:9691_conv:19383,utterance,listener,Oh thats quite understandable then ! I try to never let small things overcome a good relationship with friends =)
hit:4544_conv:9088,situation,none,I'm very angry about my boss attitude to work
hit:4544_conv:9088,utterance,speaker,I'm very angry about my boss attitude to work
hit:4544_conv:9088,utterance,listener,Sounds like trouble. What did he do?
hit:4544_conv:9088,utterance,speaker,yes
hit:4544_conv:9088,utterance,listener,Thanks that was very helpful.
hit:8713_conv:17427,situation,none,When I got through shopping there was a scrape on my car door where someone had banged their door into it. They didn't leave a note and I was enraged.
hit:8713_conv:17427,utterance,speaker,When I got through shopping there was a scrape on my car door where someone had banged their door into it. They didn't leave a note and I was enraged.
hit:8713_conv:17427,utterance,listener,"I would be pretty furious as well, those can be expensive to get removed!"
hit:8713_conv:17427,utterance,speaker,People just don't seem to have any respect for other peoples property anymore.
hit:8713_conv:17427,utterance,listener,"I agree, some people just don't care about anyone but themselves. It's sad."
hit:3410_conv:6820,situation,none,I was so mad when my mom wanted to divorce my dad. I thought she was crazy
hit:3410_conv:6820,utterance,speaker,I was pretty angry when my mom wanted to divorce my dad. I thought she was crazy
hit:3410_conv:6820,utterance,listener,ooooh thats so bad what happened
hit:3410_conv:6820,utterance,speaker,"They stayed together, but it wasnt the same"
hit:3410_conv:6820,utterance,listener,sorry now how is the situation
hit:9927_conv:19854,situation,none,I am so mad at what Andrew Cuomo said.
hit:9927_conv:19854,utterance,speaker,I am so mad at what Andrew Cuomo said.
hit:9927_conv:19854,utterance,listener,These people are becoming so pathetic and out of touch with reality that logic and reasoning are becoming an aliens to them
hit:9927_conv:19854,utterance,speaker,Who are these people you refer to?
hit:9927_conv:19854,utterance,listener,People at CNN and the whole liberal media who ignore the reality of the people's lives and try to project their own moral wonderland onto them
hit:5378_conv:10757,situation,none,my neighbor keeps being really loud late at night
hit:5378_conv:10757,utterance,speaker,"My neighbor is so loud at night. Everynight after 11pm shes out in the parking lot, in and out of her vehicle making noise."
hit:5378_conv:10757,utterance,listener,that must be pretty frustrating
hit:5378_conv:10757,utterance,speaker,It is honestly especially when you have to work in the morning
hit:5378_conv:10757,utterance,listener,maybe you should have a talk with her
hit:1194_conv:2388,situation,none,My sister had my laundry for two days and is sending it back dirty.
hit:1194_conv:2388,utterance,speaker,My sister really gets on my nerves. She was supposed to do me a favor
hit:1194_conv:2388,utterance,listener,because of my illness i got some frustration too
hit:1194_conv:2388,utterance,speaker,Well she took a load of laundry and is returning it after two days unwahed
hit:1194_conv:2388,utterance,listener,family is much needed thing during these time. take care of your health
hit:10949_conv:21898,situation,none,today my boss made me angry by giving me too much work to possibly do
hit:10949_conv:21898,utterance,speaker,She acted as though I am a magician and can do 12 things at once
hit:10949_conv:21898,utterance,listener,Who are we talking about? I'm sorry you're upset. Maybe you could talk to her and let her know you need help.
hit:10949_conv:21898,utterance,speaker,My boss sorry im venting
hit:10949_conv:21898,utterance,listener,It's okay. We all need to vent sometimes. Bosses are the worst people to deal with sometimes.
hit:8171_conv:16343,situation,none,I was driving to work today. I was very late and then a slow driver got in front of me. They made me even more late!
hit:8171_conv:16343,utterance,speaker,I was so late for work and trying to drive fast to get there.
hit:8171_conv:16343,utterance,listener,Why were you late
hit:8171_conv:16343,utterance,speaker,My alarm clock didn't wake me..
hit:8171_conv:16343,utterance,listener,"That happened to me too, I hate it"
hit:367_conv:734,situation,none,My oldest daughter had a hard time in school.  She struggled with friends that were not true friends.
hit:367_conv:734,utterance,speaker,My oldest daughter had a hard time with other kids in school.
hit:367_conv:734,utterance,listener,"I am sorry, kids can be mean"
