Dialog_ID,Type,Actor,Text
hit:3634_conv:7268,utterance,listener,"Oh wow, what a bummer! Not that it makes it any better, but at least you're not alone. Maybe you'll get a refund?"
hit:3634_conv:7268,utterance,speaker,Yes I did get the refund.
hit:3293_conv:6587,situation,none,I ordered pizza today and they forgot to put pepperoni on it.  I am so disappointed about it.
hit:3293_conv:6587,utterance,speaker,I ordered a pizza today and they forgot to put pepperoni on it.
hit:3293_conv:6587,utterance,listener,Did you call the manager and complain?
hit:3293_conv:6587,utterance,speaker,"No, I am just so disappointed about it."
hit:3293_conv:6587,utterance,listener,You should of called and told them.
hit:6283_conv:12566,situation,none,I just got cable installed and I can never find anything good on television. What a waste
hit:6283_conv:12566,utterance,speaker,I just ordered cable a couple weeks ago and got it installed
hit:6283_conv:12566,utterance,listener,wow that's great!
hit:6283_conv:12566,utterance,speaker,it's not. I still can't find anything on tv
hit:6283_conv:12566,utterance,listener,"I hate when that happens... so many channels, nothing to watch"
hit:6283_conv:12566,utterance,speaker,Exactly. A waste of my hard earned cash
hit:7382_conv:14765,situation,none,My neighbor is out again having a party...I find it strange because he yelled at me on a night before- but he has decided when HE isn't working- it's fine to be loud later at night
hit:7382_conv:14765,utterance,speaker,My neighbor is out again having a party...I find it strange because he yelled at me on a night before when he was working...but it's okay when he wants too?
hit:7382_conv:14765,utterance,listener,"No, not if he is being loud and rude, that is never okay"
hit:7382_conv:14765,utterance,speaker,They are very strange. I don't understand that selfishness. People work all different days and hours. Of course he doesn't have the nerve to go yell at the people who set off fireworks all night after 10.
hit:7382_conv:14765,utterance,listener,I guess he has no care for anyone but himself
hit:4237_conv:8475,situation,none,My manager keep lying to me. He is trying to advantage of me.
hit:4237_conv:8475,utterance,speaker,My manager keep lying to me. He is trying to advantage of me.
hit:4237_conv:8475,utterance,listener,Do you want to yell at him and call him a liar?
hit:4237_conv:8475,utterance,speaker,I want to do both but I can't if I want to keep my job.
hit:4237_conv:8475,utterance,listener,One time i secretly called my boss's wife and outted him for an affair he was having with one of my coworkers.. lol he never knew..
hit:1676_conv:3352,situation,none,"I just stubbed my toe a few minutes ago. Why does that have to even be a thing? Something so small on your body can cause you such great pain, and all you can do is just hop around like a moron."
hit:1676_conv:3352,utterance,speaker,"I just stubbed my toe a few minutes ago. Why does that have to even be a thing? Something so small on your body can cause you such great pain, and all you can do is just hop around like a moron."
hit:1676_conv:3352,utterance,listener,It is these delicate balance of our natural body that makes us to be diligent for survival
hit:1676_conv:3352,utterance,speaker,"That's actually a really interesting way to frame it. We try hard to survive because we know how fragile we are as a species. If we weren't so fragile, we'd take it for granted. Interesting perspective!"
hit:1676_conv:3352,utterance,listener,Indeed. Nature is very interesting and complex to interpret. Survival is the only mechanism that drive us to have certain physical features
hit:12192_conv:24385,situation,none,A few weeks ago my 3 year old broke my favorite eyeshadows.
hit:12192_conv:24385,utterance,speaker,Ugh so a few weeks ago my 3 year old broke my favorite eyeshadows.
hit:12192_conv:24385,utterance,listener,No way!! Are you ok?
hit:12192_conv:24385,utterance,speaker,"Yeah, I should have probably put it in a safer spot. Oh well."
hit:12192_conv:24385,utterance,listener,Did they take anything valuable?
hit:929_conv:1859,situation,none,My nephew told me once of something really stupid that he would do if the situation arose.
hit:929_conv:1859,utterance,speaker,My nephew told me once of something really stupid that he would do if the situation arose
hit:929_conv:1859,utterance,listener,What situation?
hit:929_conv:1859,utterance,speaker,He would drink bleach. That really made my blood boil.
hit:929_conv:1859,utterance,listener,Oh wow. Kid is crazy!
hit:7543_conv:15086,situation,none,People around my workplace are always leaving litter all around the office and it really makes me mad.
hit:7543_conv:15086,utterance,speaker,People around my workplace are always leaving litter all around the office and it really makes me mad.
hit:7543_conv:15086,utterance,listener,That sounds so frustrating! I can't stand messy people.
hit:7543_conv:15086,utterance,speaker,Same here. It's like they don't care about anyone else but themselves.
hit:7543_conv:15086,utterance,listener,Sounds like it! Are you in a management position or something where you can say something to them?
hit:7543_conv:15086,utterance,speaker,"Unfortunately not, but I plan to pass my concerns up the chain if it keeps up (which it probably will)."
hit:5736_conv:11473,situation,none,Someone cut me off in traffic today
hit:5736_conv:11473,utterance,speaker,Someone cut me off in traffic today
hit:5736_conv:11473,utterance,listener,Oh I hate it when that happens!
hit:5736_conv:11473,utterance,speaker,yea i was quite annoyed
hit:5736_conv:11473,utterance,listener,I tend to get road rage and lay on my horn at times like those.
hit:1200_conv:2401,situation,none,I was upset when my dog ricky went missing
hit:1200_conv:2401,utterance,speaker,I was upset when my dog ricky went missing
hit:1200_conv:2401,utterance,listener,Well that sounds really sad. How long was he missing for?
hit:1200_conv:2401,utterance,speaker,about two years
hit:1200_conv:2401,utterance,listener,Did you ever find him?
hit:7223_conv:14446,situation,none,My brother was in a drunken mood.
hit:7223_conv:14446,utterance,speaker,My brother was in a drunken mood last night. He said nasty things and broke my furniture
hit:7223_conv:14446,utterance,listener,That's not acceptable even if he is drunk.
hit:7223_conv:14446,utterance,speaker,"I agree, I am so angry with him. He has been doing for years now."
hit:7223_conv:14446,utterance,listener,I hope you get to set him straight somehow.
hit:4973_conv:9946,situation,none,i let someone out in front of me today and they didnt wave or anything
hit:4973_conv:9946,utterance,speaker,"someone was waiting to pull out in traffic, i let them out and didnt even get acknowledged"
hit:4973_conv:9946,utterance,listener,"that is rude of them, they should at least wave a thank you or something"
hit:4973_conv:9946,utterance,speaker,thats what im saying! common courtesy
hit:4973_conv:9946,utterance,listener,Yeah i always to make sure to thank the people that do ncie things for me
hit:2301_conv:4603,situation,none,I'm upset about a project my daughter is working on.
hit:2301_conv:4603,utterance,speaker,My daughter is working on a school project without having all the information on it.
hit:2301_conv:4603,utterance,listener,That sounds familiar.  Is there someone she can get it from?
hit:2301_conv:4603,utterance,speaker,She's working on that now.
hit:2301_conv:4603,utterance,listener,Thats a relief.
hit:3293_conv:6586,situation,none,I am so mad I have to work on Sunday.
hit:3293_conv:6586,utterance,speaker,I am so mad I have to work Sunday.
hit:3293_conv:6586,utterance,listener,"That's a shame, you shouldn't have to do that."
hit:3293_conv:6586,utterance,speaker,"Yes, but the boss is not nice."
hit:3293_conv:6586,utterance,listener,Things will get better soon.
hit:7239_conv:14479,situation,none,Someone stole my ketchup at work.  I was so livid about it.
hit:7239_conv:14479,utterance,speaker,Someone stole my ketchup at work.
hit:7239_conv:14479,utterance,listener,OH NO! I would have been runnning up and down the halls yelling.
hit:7239_conv:14479,utterance,speaker,"Yes, I was so livid about it."
hit:7239_conv:14479,utterance,listener,Did you find out who did it and publicly spray ketchup all over them.
hit:7160_conv:14320,situation,none,A guy cut me off in traffic today
hit:7160_conv:14320,utterance,speaker,A guy cut me off in traffic today
hit:7160_conv:14320,utterance,listener,Arrgg - so annoying.
hit:7160_conv:14320,utterance,speaker,"I know, i was so annoyed"
hit:7160_conv:14320,utterance,listener,Did you shout at him?
hit:9460_conv:18921,situation,none,It pisses me off when someone interrupts me in the middle of a sentence.  Throws off my whole train of thought
hit:9460_conv:18921,utterance,speaker,Pisses me off when someone interrupts me in the middle of a sentence. Throws off my whole train of thought then I forget what I was gonna say
hit:9460_conv:18921,utterance,listener,Did this happen recently?
hit:9460_conv:18921,utterance,speaker,Yes but I told them to let me finish and they did haha
hit:9460_conv:18921,utterance,listener,That is good that the person was courteous. That may not happen everytime
hit:3016_conv:6033,situation,none,I lost my car keys at a bar last night.
hit:3016_conv:6033,utterance,speaker,I lost my keys at a bar last night.
hit:3016_conv:6033,utterance,listener,Oh man! Are they car keys as well?
hit:3016_conv:6033,utterance,speaker,"Yep.  and it gets worse.   Apparently sometimes people will steal keys,  then come back and steal your car after you leave, according to the bar tenders.  So I got my truck towed home.  And... no house keys.."
hit:3016_conv:6033,utterance,listener,Oh my god! Well please get ALL your locks changed. The car will be more difficult however hopefully they have no idea where you live so you should be ok.
hit:3016_conv:6033,utterance,speaker,"Yeah, it was super exciting.... and I wasn't calling my mom (she has an extra key) to come unlock my house at 3am either. so I 'slept' on back porch."
hit:3016_conv:6033,utterance,listener,"Oh god! How did you get in finally, did you contact your mom?"
hit:3016_conv:6033,utterance,speaker,"Well, we're talking here now."
hit:1167_conv:2335,situation,none,I got really mad when I failed a final in college. I just did not try hard enough
hit:1167_conv:2335,utterance,speaker,I got really mad when I failed a finals test. I knew I could do better
hit:1167_conv:2335,utterance,listener,I bet that wasn't a great feeling.
hit:1167_conv:2335,utterance,speaker,It sucked to be honest
hit:1167_conv:2335,utterance,listener,I am assuming you did study hard for it right?
hit:8595_conv:17190,situation,none,my new neighnors keep leaving trash on the stairs. it is so annoying
hit:8595_conv:17190,utterance,speaker,my new neighbors are the worst ones yet
hit:8595_conv:17190,utterance,listener,"Did you get a chance to talk to them yet, and introduce yourself?"
hit:8595_conv:17190,utterance,speaker,Its been a week and every day I am picking up their trash of the stairs
hit:8595_conv:17190,utterance,listener,Have you considered getting back at them by pranking them?
hit:8595_conv:17190,utterance,speaker,lol. how?
hit:5177_conv:10354,situation,none,My coworkers are not good at their jobs.  Because of them I had to stay late and do their work before i could go home
hit:5177_conv:10354,utterance,speaker,I wish people would be more responsible and would take more pride in their work
hit:5177_conv:10354,utterance,listener,I agree. I put a lot of effort into my work and I hate when things are half done.
hit:5177_conv:10354,utterance,speaker,I had to stay late at work today because my coworkers didnt finish what they were supposed to and I had to do their work for them
hit:5177_conv:10354,utterance,listener,I am sorry! I have been there before and it is no fun!
hit:5427_conv:10855,situation,none,I was upset at my daughter for sleeping too late.
hit:5427_conv:10855,utterance,speaker,My daughter slept in too late this morning.
hit:5427_conv:10855,utterance,listener,Oh no! Did she miss school?
hit:5427_conv:10855,utterance,speaker,"No, but we had to rush more than normal."
hit:5427_conv:10855,utterance,listener,Well good thing she got there! Kids always tend to want to go to bed at the last minute and end up not sleeping enough or sleeping past their alarms!
hit:7279_conv:14559,situation,none,i was pissed when i saw someone put a dent in my door
hit:7279_conv:14559,utterance,speaker,i was pissed when i saw someone put a dent in my door
hit:7279_conv:14559,utterance,listener,ooooh I would be too!  I had someone dent my car too last week.  I feel your pain!
hit:7279_conv:14559,utterance,speaker,yea .. people dont care about other people's property anymore
hit:7279_conv:14559,utterance,listener,Nope!  Try paintless dent repair. Its not too pricey and quick fix.
hit:2979_conv:5959,situation,none,I am so mad.  My husband won't stop playing his video game.  It has been days.
hit:2979_conv:5959,utterance,speaker,I am so mad.. My husband wont stop playing his video game.
hit:2979_conv:5959,utterance,listener,That would be annoying.  How about meeting up with a friend or something?
hit:2979_conv:5959,utterance,speaker,I am so mad.. my husband wont stop playing his video game
hit:2979_conv:5959,utterance,listener,Im sorry. What are you going to do?
hit:2979_conv:5959,utterance,speaker,That is a great idea... after all its been like a week of non stop gaming!
hit:2503_conv:5007,situation,none,"I used to be afraid of the dark but now I am not so much, I had a nightlight for a long time"
hit:2503_conv:5007,utterance,speaker,I got angry at my brother one time when he ruined a football game score that I had recorded
hit:2503_conv:5007,utterance,listener,why did he do that
hit:2503_conv:5007,utterance,speaker,Because he was sad at the result I suppose
hit:2503_conv:5007,utterance,listener,that sucks
hit:9531_conv:19063,situation,none,I just got a new car last week. Today at work someone hit my car when I was at lunch.
hit:9531_conv:19063,utterance,speaker,I just got a new car last week and now it's damaged.
hit:9531_conv:19063,utterance,listener,"Oh no, what happened?"
hit:9531_conv:19063,utterance,speaker,When I was at lunch someone hit it
hit:9531_conv:19063,utterance,listener,Did you find out who?
hit:8524_conv:17048,situation,none,i am pissed that someone put a dent in my door
hit:8524_conv:17048,utterance,speaker,i am pissed that someone put a dent in my door
hit:8524_conv:17048,utterance,listener,They didn't leave a note!?!?!?!?  That is the worst.  That is the kind of thing that makes you want to bring out forensics to take a paint sample and hunt the people down to bring them to justice.
hit:8524_conv:17048,utterance,speaker,no they didnt leave anything except for the dent :(
hit:8524_conv:17048,utterance,listener,"Ugh, that should be illegal...wait a minute...I think it is illegal.  So frustrating."
hit:3937_conv:7875,situation,none,I was so mad when I forgot to pay my credit card. I felt dumb
hit:3937_conv:7875,utterance,speaker,I was mad when I missed my credit card bill. I felt dumb
hit:3937_conv:7875,utterance,listener,Oh no! I've done that before.  Did you call them and ask for a grace period so you didn't build fines?  We all make mistakes like that so don't beat yourself up.
hit:3937_conv:7875,utterance,speaker,"I did, I still felt bad though"
hit:3937_conv:7875,utterance,listener,Those kinds of things are part of life and its better for our minds if we let them go and move on or see the humor in it.  I hope it didn't hurt your standing with the company.  You just reminded me to pay my internet bill! thanks!
hit:3007_conv:6015,situation,none,I am soooo mad.  I came home and someone burnt a pizza in my oven and left it there.
hit:3007_conv:6015,utterance,speaker,I am sooo mad.  I came home and someone burnt a pizza in my oven and left it there.
hit:3007_conv:6015,utterance,listener,OH. That's terrible.
hit:3007_conv:6015,utterance,speaker,I know and it was one of those expensive frozen pizzas too... Made my blood boil.
hit:3007_conv:6015,utterance,listener,What is DiGiorno?
hit:6184_conv:12368,situation,none,I was mad last week when my car would not start. Its always giving me problems
hit:6184_conv:12368,utterance,speaker,I was mad last week when my car would not start. Its always giving me problems
hit:6184_conv:12368,utterance,listener,Did you have to fix it?
hit:6184_conv:12368,utterance,speaker,I am going to have to this weekend
hit:6184_conv:12368,utterance,listener,"Oh, sorry to hear that!"
hit:3161_conv:6323,situation,none,I was waiting in a long line to take the bus. Two young women cut the line and go directly in front everybody.
hit:3161_conv:6323,utterance,speaker,I was waiting in a long line to take the bus. Two young women cut the line and go directly in front everybody.
hit:3161_conv:6323,utterance,listener,You need to speak up next time
hit:3161_conv:6323,utterance,speaker,I spoke up and was very angry.
hit:3161_conv:6323,utterance,listener,"Good, thats what needed to happen"
hit:9142_conv:18284,situation,none,I am kind of mad about tomorrow. My team meeting has been pushed up on short notice
hit:9142_conv:18284,utterance,speaker,I am mad about tomorrow. My team meeting has been pushed up on short notice
hit:9142_conv:18284,utterance,listener,"Oh no, I hate when that happens"
hit:9142_conv:18284,utterance,speaker,"Yeah, I guess I will have to prepare even more tonight"
hit:9142_conv:18284,utterance,listener,"Good luck, lots of coffee!"
hit:1073_conv:2147,situation,none,when i moved into my new apartment
hit:1073_conv:2147,utterance,speaker,I had such a bad experience moving into this apartment months ago...
hit:1073_conv:2147,utterance,listener,Why? What happened?
hit:1073_conv:2147,utterance,speaker,cockroaches everywhere... gross
hit:1073_conv:2147,utterance,listener,ok no. I can't even.
hit:5760_conv:11520,situation,none,I felt angry in the supermarket this week. The staff were ignoring the self serve checkouts.
hit:5760_conv:11520,utterance,speaker,I got angry in the supermarket yesterday
hit:5760_conv:11520,utterance,listener,Why did you get angry?
hit:5760_conv:11520,utterance,speaker,The self serve checkout stopped working but the staff were ignoring it.
hit:5760_conv:11520,utterance,listener,That isn't good. Did you speak to a manager?
hit:5760_conv:11520,utterance,speaker,"No - I am British, so I just waited and tried to attract their attention in a really passive way."
hit:9081_conv:18162,situation,none,i was pissed when i saw someone had dented my car door
hit:9081_conv:18162,utterance,speaker,i was pissed when i saw someone had dented my car door
hit:9081_conv:18162,utterance,listener,"That's not good. Guess they didn't leave their information, hu?"
hit:9081_conv:18162,utterance,speaker,nope no info left
hit:9081_conv:18162,utterance,listener,"Well, that's classy."
hit:2180_conv:4360,situation,none,My neighbors cat keeps pissing in my grill
hit:2180_conv:4360,utterance,speaker,my neighbor has an ugly cat that keeps pissing in my bbq grill
hit:2180_conv:4360,utterance,listener,Aw poor kitty! Well that is their fault for sure. Have you spoke to them about it? Also you can get these spray things that keep cast out of your yard- They spray them with water when they cross a barrier-
hit:2180_conv:4360,utterance,speaker,its a big old cat its not a kitty. I kept telling the owners but they dont care
hit:2180_conv:4360,utterance,listener,Oh man! Well some owners suck! I would definitely look in to the water sprayers. Is the cat fixed?
hit:9455_conv:18910,situation,none,My internet company tried to deny having someone come out to fix my internet. It hasnt been working for 3 months.
hit:9455_conv:18910,utterance,speaker,My internet company tried to not send someone out to fix my internet. It hasnt worked for 3 months
hit:9455_conv:18910,utterance,listener,Ah thats so bad. why not raise a complaint
hit:9455_conv:18910,utterance,speaker,"Well I had to talk to a supervisor. It was clearly an issue on their end, and they could see it."
hit:9455_conv:18910,utterance,listener,Hope it get resolved soon
hit:475_conv:950,situation,none,I was really upset when I found out that the Dallas Cowboys were going to let go of Dez Bryant. I think he's a really good wide receiver if only he wouldn't run his mouth.
hit:475_conv:950,utterance,speaker,So about 2 or 3 months ago I found out the Dallas Cowboys were letting Dez Bryant go and he's a free agent.  It's disappointing to me because I'm a Cowboys fan and I like him as part of the team.  Have you heard of Dez Bryant
hit:475_conv:950,utterance,listener,"Sure, my dad is a Cowboys fan. He misses the days of Troy Aikman and Emmett Smith!"
hit:475_conv:950,utterance,speaker,I agree Emmett Smith is an awesome runningback.  Dez Bryant just ran his mouth too much and was too emotional.  It's a shame and he's still unemployed.  How upsetting.  Troy Aikman was a great quarterback and a great commentator.
hit:475_conv:950,utterance,listener,"Yeah, I remember as a boy watching those guys. They creamed Buffalo in the Super Bowl!"
hit:475_conv:950,utterance,speaker,I agree they were some good games between the fills and cowboys.
hit:2260_conv:4521,situation,none,I was overcharged at the grocery store but did not realize it until I got home.
hit:2260_conv:4521,utterance,speaker,I was overcharged at the grocery store but did not realize it until I got home.
hit:2260_conv:4521,utterance,listener,"That suck's, have you tried calling the bank to let them know about the mistake?"
hit:2260_conv:4521,utterance,speaker,The bank can't help. I had to go back to the store. It's such a hassle but I want my money.
hit:2260_conv:4521,utterance,listener,Did you get your money back?
hit:2897_conv:5794,situation,none,"My dog threw up all over my $10,000 tuxedo. I was quite irate."
hit:2897_conv:5794,utterance,speaker,"My dog threw up on my $10,000 tuxedo that I purchased with my lottery winnings."
hit:2897_conv:5794,utterance,listener,That's awful!
hit:2897_conv:5794,utterance,speaker,"It is! I spent all my winnings on it after pouring $500,000 down the shame. I was so angry."
hit:2897_conv:5794,utterance,listener,"I would have been angry too, is it cleanable?"
hit:8819_conv:17638,situation,none,I'm so mad at my neighbor. He blasts his tv outside his patio all night. It's making me crazy.
hit:8819_conv:17638,utterance,speaker,I'm so mad at my neighbor! He blasts his tv outside on his patio all night long.
hit:8819_conv:17638,utterance,listener,call the po-po.
hit:8819_conv:17638,utterance,speaker,"I've reported him to the association because it's against our rules, but he doesn't care. I don't know how people can be so selfish."
hit:8819_conv:17638,utterance,listener,spray the hose in that direction to get the tv wet.
hit:1621_conv:3242,situation,none,My ex is such a jerk. He posted my phone number on facebook.
hit:1621_conv:3242,utterance,speaker,My ex is the worst.
hit:1621_conv:3242,utterance,listener,Why?
hit:1621_conv:3242,utterance,speaker,He posted my number on facebook.
hit:1621_conv:3242,utterance,listener,Why would he do that??
hit:1621_conv:3242,utterance,speaker,He is immature and upset because I'm done.
hit:277_conv:555,situation,none,I broke my phone
hit:277_conv:555,utterance,speaker,I broke my phone
hit:277_conv:555,utterance,listener,OH I am sorry to hear that. How?
hit:277_conv:555,utterance,speaker,I dropped it lol
hit:277_conv:555,utterance,listener,Oh no! I hope you can fix it!
hit:6655_conv:13310,situation,none,Someone cut me off in traffic this morning. I was so mad!
hit:6655_conv:13310,utterance,speaker,Someone cut me off in traffic this morning.
hit:6655_conv:13310,utterance,listener,I hate other drivers.  It seems like they are getting worse every day.  Did you honk at them or anything?
hit:6655_conv:13310,utterance,speaker,I did because they almost swerved into me and killed me! I was so mad!
hit:6655_conv:13310,utterance,listener,"I would be too.  I'm happy you didnt get into an accident or even worse, killed!"
hit:8389_conv:16778,situation,none,Someone backed into my car in the parking lot! They didn't even leave a note!
hit:8389_conv:16778,utterance,speaker,I just noticed someone backed into my car in my parking lot!
hit:8389_conv:16778,utterance,listener,"WHAT, did you catch them?"
hit:8389_conv:16778,utterance,speaker,No! They didn't even leave a note saying they were sorry!
hit:8389_conv:16778,utterance,listener,damn you should have hunted them down
hit:8389_conv:16778,utterance,speaker,"I should have, I'd have stomped them a new one!"
hit:8128_conv:16256,situation,none,My daughter made us late on the first day of school.. I hate being late
hit:8128_conv:16256,utterance,speaker,My daughter made us late on the first day of school
hit:8128_conv:16256,utterance,listener,what did she do? woke up late?
hit:8128_conv:16256,utterance,speaker,she went back to sleep when she was supposed to be getting ready
hit:8128_conv:16256,utterance,listener,ah yea mine does that.. i have a spray bottle for days like that :)
hit:8128_conv:16256,utterance,speaker,I am going to get one because I really dont like being late lol
hit:3838_conv:7677,situation,none,Today I was driving home and someone almost hit me.  I was really mad because I just got a new car
hit:3838_conv:7677,utterance,speaker,Today was one of those days where I almost lost it on someone.
hit:3838_conv:7677,utterance,listener,Im glad you didn't.  Do you have these days often?
hit:3838_conv:7677,utterance,speaker,I got a new car just a couple of weeks ago and today I was sitting at a red light and some guy came really close to hitting me.  Like he stopped only a few inches away.
hit:3838_conv:7677,utterance,listener,Honestly I would have freaked out.  I cant stand bad drivers!!
hit:11485_conv:22970,situation,none,fell on my keys
hit:11485_conv:22970,utterance,speaker,im so mad i fell
