Dialog_ID,Type,Actor,Text
hit:6909_conv:13818,utterance,speaker,"Oh my goodness!!  My sister in law refuses to take the boys to the doctor, even when they run a high fever like 104.  My mother in law steps in all the time."
hit:6909_conv:13818,utterance,listener,"its horrible to hear , but i agree with you 100 percent some people should not have kids at all"
hit:7822_conv:15645,situation,none,Someone cut me off in traffic the other day.
hit:7822_conv:15645,utterance,speaker,Someone cut me off in traffic the other day.
hit:7822_conv:15645,utterance,listener,DId you get out and kick them?
hit:7822_conv:15645,utterance,speaker,"No that doesn't seem like a good idea, what if they had a gun or something?"
hit:7822_conv:15645,utterance,listener,I have bad road rage.
hit:6882_conv:13764,situation,none,I wasn't happy today when someone ran in to the back of my moms car.
hit:6882_conv:13764,utterance,speaker,I wasn't happy today when someone ran in to the back of my moms car.
hit:6882_conv:13764,utterance,listener,That makes a lot of sense. I wouldn't be happy either! I hope that they have good insurance
hit:6882_conv:13764,utterance,speaker,Nope! They ran into her then drove off- an old guy!
hit:6882_conv:13764,utterance,listener,Wow! That's aweful. Is your mom ok?
hit:6882_conv:13764,utterance,speaker,"Yes, they put a huge crushed in dent in the back corner. They didn't get his plates on the camera :( And it's like $500 to pay the deductible to get it fixed..Seriously- insurance companies suck!"
hit:6882_conv:13764,utterance,listener,Man that really does stink! Hopefully the police will find some way to catch the guy!
hit:11472_conv:22945,situation,none,I was super annoyed when a scammer called me on the phone today. He wouldn't listen to my pleads to stop calling me.
hit:11472_conv:22945,utterance,speaker,"A scammer called me on the phone today, he tried to get me to sign up for a service."
hit:11472_conv:22945,utterance,listener,"oh no, were you polite to him? It can be pretty frustrating."
hit:11472_conv:22945,utterance,speaker,"Well this isn't the first time he's called. I was irritated, he won't leave me alone!"
hit:11472_conv:22945,utterance,listener,"oh no, is there any way you can file a complaint against him? And it's the same guy?! So weird!!!"
hit:8541_conv:17083,situation,none,"My boyfriend farted in bed the other day, it was so bad I had to leave"
hit:8541_conv:17083,utterance,speaker,"My boyfriend farted in bed the other day, it was so bad I had to leave"
hit:8541_conv:17083,utterance,listener,Lol I know you was bad he may need to watch what he eats or at least warn you next time.
hit:8541_conv:17083,utterance,speaker,"Haha yeah, it's definitely something he ate. It's usually not that bad"
hit:8541_conv:17083,utterance,listener,If y'all ate something green like vegetables that could be the reason keep the spray close next time.
hit:9243_conv:18486,situation,none,My dog pooped on the rug yesterday. I was so mad!
hit:9243_conv:18486,utterance,speaker,My dog pooped on the rug yesterday. I was so mad!
hit:9243_conv:18486,utterance,listener,What did you do?
hit:9243_conv:18486,utterance,speaker,"Well, I didn't do anything. I was pretty mad at first, but realized it was my fault that I didn't train her right. I put her outside for a bit and called it a day."
hit:9243_conv:18486,utterance,listener,It's good that you went easy on her.
hit:8884_conv:17769,situation,none,I didn't like when I found out my mom threw away my old Nintendo.
hit:8884_conv:17769,utterance,speaker,"My mom threw away my Nintendo, I was pissed."
hit:8884_conv:17769,utterance,listener,Did you dig it out of the trash?
hit:8884_conv:17769,utterance,speaker,"No, I was away and found out when I got back."
hit:8884_conv:17769,utterance,listener,Did you cry yourself to sleep that night?
hit:11289_conv:22579,situation,none,I think someone stole my headphones recently.
hit:11289_conv:22579,utterance,speaker,I think someone stole my headphones recently.
hit:11289_conv:22579,utterance,listener,Oh no! Do you have a suspect?
hit:11289_conv:22579,utterance,speaker,"Not exactly, I have many friends and acquaintances in my dorm on the regular, so I'm not sure who it could be."
hit:11289_conv:22579,utterance,listener,"I hope it turns up, or is returned to you soon."
hit:6537_conv:13075,situation,none,My friend has promised me that he would drive me to the airport for my flight. He never showed up and I missed my flight.
hit:6537_conv:13075,utterance,speaker,My friend promised to drive me to the airprot. He never showed up and I ended up missing my flight!
hit:6537_conv:13075,utterance,listener,That is terrible. Did you tried calling him?
hit:6537_conv:13075,utterance,speaker,I did try calling him. He kept telling me that he was on the way. I think he was still at home the whole time thogh.
hit:6537_conv:13075,utterance,listener,That is very bad person. You should forget about him.
hit:4025_conv:8051,situation,none,A part for my computer that I've been putting off buying went up 10% right before I finally ordered it.
hit:4025_conv:8051,utterance,speaker,I've been putting off buying a computer part that I needed and just noticed it went up 10%! I'm pretty mad at myself.
hit:4025_conv:8051,utterance,listener,Oh no! I hate when that happens... hopefully your computers holds on a little longer for it to go back down
hit:4025_conv:8051,utterance,speaker,I hope so too! I might have to just end up buying it. My hard drive is getting pretty old and running slow.
hit:4025_conv:8051,utterance,listener,Well good luck! I know how frustrating that can be
hit:2177_conv:4354,situation,none,My car broke down
hit:2177_conv:4354,utterance,speaker,My car broke down
hit:2177_conv:4354,utterance,listener,What happened to it
hit:2177_conv:4354,utterance,speaker,"I'm not sure, It wouldn't start the morning.   Its not the batttery or starter."
hit:2177_conv:4354,utterance,listener,That doesnt sound so hard to fix
hit:2177_conv:4354,utterance,speaker,"Well I don't know what's broken, so that's a bit of a problem"
hit:5169_conv:10339,situation,none,i was furious yesterday when i saw my dog had gotten out of the gate
hit:5169_conv:10339,utterance,speaker,i was furious yesterday when i saw my dog had gotten out of the gate
hit:5169_conv:10339,utterance,listener,"Oh no, were you able to track it down?"
hit:5169_conv:10339,utterance,speaker,no still looking
hit:5169_conv:10339,utterance,listener,"Aw sorry to hear that, hope he/she is fine and you'll able to find it."
hit:4014_conv:8029,situation,none,i was mad when i returned to my car and noticed someone put a dent in my door
hit:4014_conv:8029,utterance,speaker,i was mad when i returned to my car and noticed someone put a dent in my car
hit:4014_conv:8029,utterance,listener,That would really anger me as well.  What did you do?  Did you find the person who did it?
hit:4014_conv:8029,utterance,speaker,no i didnt find them.. sucks that people dont care about other peoples property
hit:4014_conv:8029,utterance,listener,"Yeah, it blows my mind that people think they can damage other peoples belonging and just go about their day."
hit:192_conv:385,situation,none,I was angry when my brother ruined the result of a football game. I recorded it to watch later
hit:192_conv:385,utterance,speaker,I was angry when my brother ruined the result of a football game. I recorded it to watch later
hit:192_conv:385,utterance,listener,sibling fights worth living for.. I wish  i had one.
hit:192_conv:385,utterance,speaker,"I am glad I do, I just wish they could shutup sometimes haha"
hit:192_conv:385,utterance,listener,you would know better hehe!!
hit:9994_conv:19989,situation,none,I was having a great day until someone rear ended my bumper on the way home
hit:9994_conv:19989,utterance,speaker,I was having a great day.  That was until some jerk rear ended me on the way home.
hit:9994_conv:19989,utterance,listener,omg. Driving skills are going down nowadays. You must very angry about it
hit:9994_conv:19989,utterance,speaker,I was not thrilled.  The guy was on his phone at the time.
hit:9994_conv:19989,utterance,listener,You should have chased him and must give your piece of mind
hit:1179_conv:2359,situation,none,Once my brother stole a pizza i made from me. He says he didn't each it even though i found him with a paper plate with fresh pizza sauce on it.
hit:1179_conv:2359,utterance,speaker,I made a pizza the other day. Let it cool off but when i came back it was gone.
hit:1179_conv:2359,utterance,listener,what happened to it?
hit:1179_conv:2359,utterance,speaker,Ends up my brother stole it. Was so mad he did that. i even would of shared it.
hit:1179_conv:2359,utterance,listener,that stinks
hit:1179_conv:2359,utterance,speaker,You ever have that happen to you?
hit:3226_conv:6453,situation,none,I am angry that the person I live with still doesn't like paying bills. You have to pay bills to have things. That is how life works.
hit:3226_conv:6453,utterance,speaker,I am very upset and a bit disgusted by that the person I live with still doesn't like paying bills. You have to pay bills to have things
hit:3226_conv:6453,utterance,listener,"I am sorry, roommates can be annoying sometimes"
hit:3226_conv:6453,utterance,speaker,"Not a roomate lol-but yes. That's how life works though. If you want things and luxuries, they cost money. I'll never understand entitled people."
hit:3226_conv:6453,utterance,listener,I will not either
hit:124_conv:248,situation,none,Lies
hit:124_conv:248,utterance,speaker,"Hi, how are you?"
hit:124_conv:248,utterance,listener,"I'm doing pretty alright, what about you?"
hit:124_conv:248,utterance,speaker,"I have been better, I just am kind of annoyed with lying.  Does lying annoy you also/"
hit:124_conv:248,utterance,listener,"Absolutely, it is one of my biggest pet peeves, especially when people accuse me of lying too."
hit:124_conv:248,utterance,speaker,"Yea, its the worst.  Especially when someone lies to you and you forgive them, but that little bit of anxiety is always in you thinking ""what if they are lying now again?""."
hit:1030_conv:2061,situation,none,I got mad when I lost my dog
hit:1030_conv:2061,utterance,speaker,I got mad when I lost my dog
hit:1030_conv:2061,utterance,listener,Oh no! I would have too. Did you find him?
hit:1030_conv:2061,utterance,speaker,"no, he dug a hole and ran away."
hit:1030_conv:2061,utterance,listener,Oh... Interesting. A hole under the fence? I'm sorry to hear that.
hit:8797_conv:17594,situation,none,My neighbors had a fight the other night. They were slammming and breaking things. It was 2am and I had to work at 7.
hit:8797_conv:17594,utterance,speaker,My neighbors had a really loud fight the other night at 2am.
hit:8797_conv:17594,utterance,listener,"Have they gotten in fights like that before, and did the police get called?"
hit:8797_conv:17594,utterance,speaker,"Not quite as loud, but they have before. They break up about once a month. I think the police did come."
hit:8797_conv:17594,utterance,listener,"Yuck, I used to live in a rough area and that kind of thing would happen. It gets really old fast."
hit:3409_conv:6819,situation,none,My cousin lost my cell phone.
hit:3409_conv:6819,utterance,speaker,I let my cousin borrow my phone to play games and he lost it!
hit:3409_conv:6819,utterance,listener,That is not good
hit:3409_conv:6819,utterance,speaker,"I agree, I am so livid right now. It was an expensive phone!"
hit:3409_conv:6819,utterance,listener,"I am sorry, you will get another one"
hit:2757_conv:5515,situation,none,Someone cut me off in traffic the other day.
hit:2757_conv:5515,utterance,speaker,"Someone cut me off in traffic the other day, and they were going pretty fast too."
hit:2757_conv:5515,utterance,listener,"oh no, were you hurt?"
hit:2757_conv:5515,utterance,speaker,"No fortunately I just had to slam on the breaks, very annoying though."
hit:2757_conv:5515,utterance,listener,"true that, stay safe!"
hit:9554_conv:19109,situation,none,My boss called me a liar in front of the whole office last week.
hit:9554_conv:19109,utterance,speaker,My boss called me a liar in front of the whole office last week.
hit:9554_conv:19109,utterance,listener,That was rude of them. Why?
hit:9554_conv:19109,utterance,speaker,"He thought I took money from the petty cash drawer, but they found out who really did it yesterday, and still no apology."
hit:9554_conv:19109,utterance,listener,"Wow, I would go over and talk to that boss and demand an apology"
hit:6315_conv:12630,situation,none,My dog pooped on the rug yesterday. I was so mad!
hit:6315_conv:12630,utterance,speaker,My dog pooped on the rug yesterday. I was so mad!
hit:6315_conv:12630,utterance,listener,Is your dog still a puppy?
hit:6315_conv:12630,utterance,speaker,"She is, but I still had to clean it up. It was so gross!"
hit:6315_conv:12630,utterance,listener,I'm sure she will grow out of it.
hit:6315_conv:12630,utterance,speaker,I am hoping.
hit:4072_conv:8145,situation,none,"A colleague at my job took credit for months of my work and claimed I was of no help to them. It all worked out as it should have in the end, but that's never an easy situation."
hit:4072_conv:8145,utterance,speaker,"I recently was in a situation at work where I had a colleague take credit for months of my work, and go out of their way to tell my boss and others in a committee that I actually held the team back."
hit:4072_conv:8145,utterance,listener,Ugh I hate crap like that.  Why can't credit be shared?  Does it always have to be so cutthroat?
hit:4072_conv:8145,utterance,speaker,"Honestly, I'm indifferent as to how it's shared. Later, my boss actually sat me down and told me they knew my colleague was out of line. Ironically, their contract with our company was up two weeks later and they weren't renewed."
hit:4072_conv:8145,utterance,listener,Well All's well that ends well.  I'm sure glad they were able to see through such a cheap ploy.
hit:4072_conv:8145,utterance,speaker,"It is what it is. I would never wish for anyone to lose their job, but I am thankful that in the end I was able to stay in the good graces of senior leadership."
hit:4072_conv:8145,utterance,listener,Hey people get what the deserve in this world sometimes.  Just be glad justice is served.
hit:4072_conv:8145,utterance,speaker,For sure! I appreciate the support. Professionalism is tantamount.
hit:1643_conv:3286,situation,none,I hate it when I get ignored. It makes me feel less human and I get very mad!
hit:1643_conv:3286,utterance,speaker,I hate it when I get ignored. It makes me feel less human and I get very mad!
hit:1643_conv:3286,utterance,listener,"Yeah, that bothers me to.  Don't sweat it too much though.  Just consider it their loss and move on."
hit:1643_conv:3286,utterance,speaker,I try to tell myself there are other people out there that care about what I have to say
hit:1643_conv:3286,utterance,listener,There are.  The people who ignore you are not worth your time or effort.
hit:5463_conv:10926,situation,none,I went to a job meeting and everybody was late
hit:5463_conv:10926,utterance,speaker,i went to a job meeting and a couple of people were late so we had to sit and wait for them! i was so mad
hit:5463_conv:10926,utterance,listener,That must have been really annoying. Sucks to be a person who's on time dealing with people who don't care about being on time themselves.
hit:5463_conv:10926,utterance,speaker,"i know! Like, can you be professional and show up on time?"
hit:5463_conv:10926,utterance,listener,Did you say anything after they arrived?
hit:1148_conv:2297,situation,none,I worked so hard on a project to find out that they had 2 teams working on the same thing.
hit:1148_conv:2297,utterance,speaker,I worked so hard on a project to find out that they had 2 teams working on the same thing.
hit:1148_conv:2297,utterance,listener,"Wow, I hate when people feel like it's okay to waste other peoples time."
hit:1148_conv:2297,utterance,speaker,Yea. I'm going to look for a new job.
hit:1148_conv:2297,utterance,listener,I'm glad you are. You deserve to work for a company that values you and your time.
hit:1466_conv:2932,situation,none,I was at the dentist's office today and had to wait 45 minutes past my appointment time to be seen.
hit:1466_conv:2932,utterance,speaker,I had a dentist appointment today and they made me wait over 45 minutes
hit:1466_conv:2932,utterance,listener,"I hate when that happens, and they tell you to come early too."
hit:1466_conv:2932,utterance,speaker,"I don't think I will be going back, going to find another dentist."
hit:1466_conv:2932,utterance,listener,"Seems fair, they don't value your time it seems like."
hit:2265_conv:4530,situation,none,I hate it when I see people get bullied. It makes me so furious!
hit:2265_conv:4530,utterance,speaker,I hate it when I see people get bullied. It makes me so furious!
hit:2265_conv:4530,utterance,listener,"Yes, I do not like that either."
hit:2265_conv:4530,utterance,speaker,Are you a bully!
hit:2265_conv:4530,utterance,listener,"Never, I am a nice guy."
hit:4620_conv:9241,situation,none,I applied to get a new passport. They have lost my paperwork.
hit:4620_conv:9241,utterance,speaker,I applied to get a new passport. They came back to me after two month to tell that they have lost my paperwork.
hit:4620_conv:9241,utterance,listener,So you have to do the whole process with the passport over again??
hit:4620_conv:9241,utterance,speaker,"Yes, I have to start over. They made me angry."
hit:4620_conv:9241,utterance,listener,I would ask the people in charge who lost my paperwork? And tell them to go find the paperwork!
hit:12_conv:25,situation,none,"I spent all weekend working on my truck to fix a miss in the engine. Despite spending over $200 in parts, it didn't do a thing to fix the miss."
hit:12_conv:25,utterance,speaker,I worked on my truck all weekend. Spent $215 on parts and a special tool. Still did not fix the miss in the engine.
hit:12_conv:25,utterance,listener,What is the problem with the engine?
hit:12_conv:25,utterance,speaker,It has a miss. Sometimes when you are driving it sputters and jerks and barely has any power. Other times it drives just fine. I have replaced so many things on it and nothing makes a difference for very long.
hit:12_conv:25,utterance,listener,Sorry to hear that. I hope you find what is the problem with the engine.
hit:2711_conv:5423,situation,none,I lost my job yesterday
hit:2711_conv:5423,utterance,speaker,I lost my job yesterday.
hit:2711_conv:5423,utterance,listener,"Sorry about that.I know how it feels,especially with the family concerns"
hit:2711_conv:5423,utterance,speaker,"yes, i just want to be able to feed my kids."
hit:2711_conv:5423,utterance,listener,"Please never stay idle ,fix yourself anywhere, I mean somewhere"
hit:8817_conv:17635,situation,none,i was pissed when i saw someone had put a dent in my door
hit:8817_conv:17635,utterance,speaker,i was pissed when i saw someone had put a dent in my door
hit:8817_conv:17635,utterance,listener,That sucks. Are there any cameras in the parking lot?
hit:8817_conv:17635,utterance,speaker,no cameras
hit:8817_conv:17635,utterance,listener,Some people have no integrity....
hit:5643_conv:11286,situation,none,i was upset when i saw someone had put a dent in my door
hit:5643_conv:11286,utterance,speaker,i was upset when i saw someone had put a dent in my door
hit:5643_conv:11286,utterance,listener,Your car door?
hit:5643_conv:11286,utterance,speaker,yep
hit:5643_conv:11286,utterance,listener,Was it parked at home? That sucks
hit:6330_conv:12661,situation,none,MY son is refusing to go to sleep. I had a long day and am really tired
hit:6330_conv:12661,utterance,speaker,I had a rough day today and now my son refuses to go to bed
hit:6330_conv:12661,utterance,listener,That really sucks. Maybe you should force feed him some melatonin?
hit:6330_conv:12661,utterance,speaker,That has never worked with him. I bought a huge bottle of the gummies
hit:6330_conv:12661,utterance,listener,"Oh, well hopefully that works. Wouldn't want you up all night!"
hit:6330_conv:12661,utterance,speaker,I really dont want that
hit:2816_conv:5633,situation,none,I put my yogurt in the fridge at work and someone else ate it. I was not happy about that.
hit:2816_conv:5633,utterance,speaker,I brought my lunch to work the other day and put it in the fridge like I always do. Guess what one of my dumb coworkers did.
hit:2816_conv:5633,utterance,listener,Probably ate it or threw it away!
hit:2816_conv:5633,utterance,speaker,Someone ate part of my lunch. Can you believe that? It made me so mad!
hit:2816_conv:5633,utterance,listener,Yeah I can!! You ought to put some laxatives in it for next time and see how much they like it then!
hit:7800_conv:15600,situation,none,Ate at a fancy place the other night with the wife and the food was just terrible it cost that much.
hit:7800_conv:15600,utterance,speaker,I ate at a fancy restaurant the other night and the quality of the food was awful. So mad I paid that much for it.
hit:7800_conv:15600,utterance,listener,That happens more often that you might think. Just because it's expensive doesn't mean it's any good.
hit:7800_conv:15600,utterance,speaker,"That's very true. I hate being disappointed like that, but that's the gamble I guess."
hit:7800_conv:15600,utterance,listener,"Yep, probably would have been happier at some hometown diner."
hit:5685_conv:11371,situation,none,These kids keep riding their bikes through my lawn! They've killed every one of my flowers!
hit:5685_conv:11371,utterance,speaker,The kids next door keep riding my bikes through my yard. I asked them to stop but they just laughed at me.
hit:5685_conv:11371,utterance,listener,Where are their parents?
hit:5685_conv:11371,utterance,speaker,"Who knows, they're never watching them. I tried to be nice but they're killing all my flowers,"
hit:5685_conv:11371,utterance,listener,Call the police. I would.
hit:4529_conv:9059,situation,none,I got into a big argument with my mom. She said that we really needed to get a job but we were already looking for jobs.
hit:4529_conv:9059,utterance,speaker,I got into an argument with my mom since we really need money and she wants me to get a job.
hit:4529_conv:9059,utterance,listener,Aww.  How do you feel about that?
hit:4529_conv:9059,utterance,speaker,I was already looking for jobs at the time so the argument really annoyed me.
hit:4529_conv:9059,utterance,listener,Yeah I bet.  Hey at least you're out there trying.  That's all you can really do.
hit:9863_conv:19727,situation,none,My father promised to buy me a car when I graduate from university. He never did.
hit:9863_conv:19727,utterance,speaker,My father promised to buy me a car when I graduate from university. He never did.
hit:9863_conv:19727,utterance,listener,Are you disappointed with it?
hit:9863_conv:19727,utterance,speaker,I was very angry and disappointed. I was dream to have a care.
hit:9863_conv:19727,utterance,listener,I feel like you should take it up with him.
hit:4050_conv:8100,situation,none,I was fired from one of my jobs because of something a coworker did and I was blamed for.
hit:4050_conv:8100,utterance,speaker,The situation was very unfair and I was treated as if I didn't matter after working there for over 5 years
hit:4050_conv:8100,utterance,listener,Wow im sorry to hear that. It sucks when something goes wrong at a job you've been there long
hit:4050_conv:8100,utterance,speaker,I know.  I worked my tail off for that company.  After I was fired they called me a week later to tell me they realized it wasn't my fault but I had already found a new job and told them to take a hike.
hit:4050_conv:8100,utterance,listener,I'm glad you found a job quick! That must have felt a little good to tell them at least
hit:1911_conv:3822,situation,none,My supervisor belittled me in front of all of my coworkers in a meeting.
hit:1911_conv:3822,utterance,speaker,My supervisor belittled me in front of all of my coworkers in a meeting.
hit:1911_conv:3822,utterance,listener,That is absolutely horrible! Was this recent?
hit:1911_conv:3822,utterance,speaker,Yes it was. I was furious and hurt. Leaders should not do that to their employees.
hit:1911_conv:3822,utterance,listener,I agree. You should bring that up to HR.
hit:9947_conv:19894,situation,none,My girlfriend didn't want to go to dinner with me and with another guy instead. I was so mad!
hit:9947_conv:19894,utterance,speaker,My girlfriend didn't want to go to dinner with me. She went with another guy instead.
hit:9947_conv:19894,utterance,listener,"That's awful, I'm sorry. Does she want to be with the other guy instead of you?"
hit:9947_conv:19894,utterance,speaker,I'm not sure. I was so angry though. I really hope she explains it to me once she gets home.
hit:9947_conv:19894,utterance,listener,I hope it all works out with you and your girlfriend.
hit:1759_conv:3519,situation,none,My sister always borrows money and never pays it back on time.
hit:1759_conv:3519,utterance,speaker,My sister always owes  me money
hit:1759_conv:3519,utterance,listener,Does she? Do you want me to break her kneecaps for you?
hit:1759_conv:3519,utterance,speaker,Please do. She never pays me back on time. I hate that.
hit:1759_conv:3519,utterance,listener,Me too. It's not fair. Just message me her address and $1000 and I'll do it :-)
hit:1759_conv:3519,utterance,speaker,Delete these messages lol
hit:7847_conv:15695,situation,none,Every time I clean up my kids room they mess it up again within a day. I don't know why they won't just keep their room clean. I get so upset when they don't listen to me!
hit:7847_conv:15695,utterance,speaker,Every time I clean my kids room they go in and mess it up again. I am so ticked off at them.
hit:7847_conv:15695,utterance,listener,That is why you never have kids.
hit:7847_conv:15695,utterance,speaker,Well I don't understand why they can't keep their room clean. I tell them so many times!
