Dialog_ID,Type,Actor,Text
hit:6298_conv:12597,utterance,speaker,I took a medical test today.
hit:6298_conv:12597,utterance,listener,How do you think you did on it?
hit:6298_conv:12597,utterance,speaker,I'm not sure.  I am so nervous to find out the results.
hit:6298_conv:12597,utterance,listener,"I am sure you did fine on it. And besides, if you did poorly, there is always the good ole local McDonalds."
hit:2649_conv:5298,situation,none,I have an exam tomorrow.
hit:2649_conv:5298,utterance,speaker,"Hi, I have a very important exam tomorrow."
hit:2649_conv:5298,utterance,listener,"Oh wow, what subject is it on?"
hit:2649_conv:5298,utterance,speaker,For math. I cant help but feel something bad is going to happen
hit:2649_conv:5298,utterance,listener,Well I hope you do good either way.
hit:2853_conv:5707,situation,none,I was nervous when I had to go to jury duty. I just did not want to go
hit:2853_conv:5707,utterance,speaker,I was nervous when I had to go to jury duty. I just did not want to go
hit:2853_conv:5707,utterance,listener,I can understand your apprehension. Have you ever served on jury duty before?
hit:2853_conv:5707,utterance,speaker,"No, I had no idea what to expect"
hit:2853_conv:5707,utterance,listener,I have never served on jury duty either. The closest thing that I have experienced was serving as a guard during a military court martial.
hit:4945_conv:9890,situation,none,"I have a doctors appointment next week. I might have some bad news, so I don't feel very good about it."
hit:4945_conv:9890,utterance,speaker,I have an appointment next for the doctor and I might get some bad news. I am not sleeping well just thinking about it.
hit:4945_conv:9890,utterance,listener,I hate to hear that! I hope everything goes well and you get better news than you are expecting.
hit:4945_conv:9890,utterance,speaker,Yes me too. I'm not feeling for well about it for now. I guess I just have to hope for the best.
hit:4945_conv:9890,utterance,listener,"I always try to do things to avoid thinking about things like that, maybe you could do the same!"
hit:4767_conv:9534,situation,none,I have a big interview scheduled for Friday. I am scared that I will not do well.
hit:4767_conv:9534,utterance,speaker,I have a job interview scheduled for Friday. I really want the job. It is making me so nervous.
hit:4767_conv:9534,utterance,listener,"Been there myself, the anticipation can really get to you.  What kind of job is it?"
hit:4767_conv:9534,utterance,speaker,Its for a financial analyst position. Ive been pacing around like crazy.
hit:4767_conv:9534,utterance,listener,"Finacial analyst, sounds impressive.  Good luck, I hope you do well and get it."
hit:8322_conv:16644,situation,none,I'm always nervous about public speaking
hit:8322_conv:16644,utterance,speaker,I'm always nervous about public speaking
hit:8322_conv:16644,utterance,listener,What do you have to speak on?
hit:8322_conv:16644,utterance,speaker,"I have a presentation for a client, I've been preparing vigorously"
hit:8322_conv:16644,utterance,listener,"My knees get weak when I try to publicly speak, it's bad."
hit:5565_conv:11130,situation,none,Ive been waiting for months for Madden to come out. Finally this friday i will be able to get it.
hit:5565_conv:11130,utterance,speaker,The new madden finally comes out friday!
hit:5565_conv:11130,utterance,listener,"Hey, I'm looking forward to it too! Can't wait to crush my co-workers."
hit:5565_conv:11130,utterance,speaker,"word, what system do you play on?"
hit:5565_conv:11130,utterance,listener,I play on the PS4. It's the only way to play Madden.
hit:5565_conv:11130,utterance,speaker,i agree! slimreaper22292 add me
hit:10490_conv:20981,situation,none,My son's pediatrician advised me to have early intervention out because he's delayed in talking.  The appointment is set for next week and I don't really know to expect.
hit:10490_conv:20981,utterance,speaker,My son's pediatrician told me to call Early Intervention because he's delayed in talking.
hit:10490_conv:20981,utterance,listener,"Oh no, I'm sorry to hear that. Do they have any idea what the cause may be yet?"
hit:10490_conv:20981,utterance,speaker,Not at all.  I'm hoping he'll catch up soon.  The appointment is set for next week and I'm pretty nervous.
hit:10490_conv:20981,utterance,listener,"I hope it's nothing too serious. My younger brother had the same problem early on, but he turned out to just be a slow developer."
hit:2104_conv:4209,situation,none,"When I was younger, I had social anxiety. Speeches would give me terrible anxiety."
hit:2104_conv:4209,utterance,speaker,"When I was younger, I had social anxiety. Speeches would give me terrible anxiety"
hit:2104_conv:4209,utterance,listener,Have you been able to get over your fear?
hit:2104_conv:4209,utterance,speaker,Slowly. Therapy and medication have helped a lot.
hit:2104_conv:4209,utterance,listener,That is good to hear. You might consider joining some groups. Toastmasters might be a good one to look into.
hit:8117_conv:16234,situation,none,"I woke up to the sound of my phone ringing. I hate the sound of my phone going off, it stresses me out. It was bill collectors too, although for the wrong person."
hit:8117_conv:16234,utterance,speaker,"I got woken up today by the sound of my phone going off. I haaate the sound of phones, they really stress me out for some reason."
hit:8117_conv:16234,utterance,listener,did you mute it
hit:8117_conv:16234,utterance,speaker,I answered the phone and it was just a bill collector for someone who isn't even me. I tried to go back to bed but I was already annoyed.
hit:8117_conv:16234,utterance,listener,i hate when that happens
hit:4643_conv:9287,situation,none,I was nervous when it storm last weekend. It rained hard
hit:4643_conv:9287,utterance,speaker,I was nervous when it stormed over the weekend. It was raining hard
hit:4643_conv:9287,utterance,listener,I would have been too we get them bad here. Are you in the south?
hit:4643_conv:9287,utterance,speaker,I am in the southeast
hit:4643_conv:9287,utterance,listener,"Same here, prepping for hurricane season. Stay safe!"
hit:12267_conv:24535,situation,none,I am expecting a very big settlement. I can not wait
hit:12267_conv:24535,utterance,speaker,I am expecting a settlement i cant wait
hit:12267_conv:24535,utterance,listener,Nice!  Hope something horrible didn't happen to you just to get it.  You getting a lot?
hit:12267_conv:24535,utterance,speaker,"it is supposed to be half a million, a sewage pipe busted over me while i was in a store"
hit:12267_conv:24535,utterance,listener,Wow!  That seems worth it!!!!  Wish it had happened to me! ha ha.  Hope you're healthy still and congratulations!
hit:11626_conv:23252,situation,none,My college entrance exam is tomorrow.
hit:11626_conv:23252,utterance,speaker,My college entrance exam is tomorrow and I can't stop thinking I will fail.
hit:11626_conv:23252,utterance,listener,"I can understand the anxiety, I'm sure you'll do fine though!"
hit:11626_conv:23252,utterance,speaker,Thanks. I hope I can at least get some sleep so that I cam fresh in the morning.
hit:11626_conv:23252,utterance,listener,"Sleep is so important before an exam, that's where all your facts and memories get better organized"
hit:12271_conv:24543,situation,none,I got a big exam coming up in my chemistry class. I am worried I will fail it. I just can't get my mind around the material.
hit:12271_conv:24543,utterance,speaker,I got a big chemistry exam coming up. I am so worried I will bomb it.
hit:12271_conv:24543,utterance,listener,"I hated chemistry in school, i hope you do well"
hit:12271_conv:24543,utterance,speaker,Yeah I just need to study more. Hopefully I can wrap my mind around the material.
hit:12271_conv:24543,utterance,listener,It is a difficult subject no doubt
hit:11769_conv:23539,situation,none,Just before driving for the first time. I wasn't sure how to streer the car.
hit:11769_conv:23539,utterance,speaker,"Driving is such a scary thing for me, it was my first time."
hit:11769_conv:23539,utterance,listener,"It definitely can be, just learn to drive defensively!"
hit:11769_conv:23539,utterance,speaker,I just don't quite know how to steer the car.
hit:11769_conv:23539,utterance,listener,You will learn with experience and I'm sure you will be a great driver!
hit:3694_conv:7388,situation,none,"At my day job, we recently had a departmental meeting where we were discussing who our new department head should be.  I'm really uncomfortable with one person we're considering, so I felt anxious during and after this meeting."
hit:3694_conv:7388,utterance,speaker,We had a departmental meeting at work recently that made me feel really anxious.  We're trying to figure out who our new department head should be.
hit:3694_conv:7388,utterance,listener,I think you will be fine. Don't feel too anxious worrying won't do anything
hit:3694_conv:7388,utterance,speaker,"One of the candidates is someone who makes a bunch of us miserable, so we're worried they will get the job."
hit:3694_conv:7388,utterance,listener,prayer works for me. I hope it does for you too so that person you just talked about won't get the job
hit:4686_conv:9373,situation,none,I cant wait for my daughters birthday in her new house.
hit:4686_conv:9373,utterance,speaker,I cant wait to throw my daughter a party this year for her birthday in our new home!
hit:4686_conv:9373,utterance,listener,That sounds exciting! What sort of plans do you have for it?
hit:4686_conv:9373,utterance,speaker,"I want to decorate the entire house in a winter wonderland theme since shes a winter baby, and then take her to the beach for a day or two. We live in the south."
hit:4686_conv:9373,utterance,listener,That sounds really exciting and like it will be a hit!
hit:1164_conv:2329,situation,none,I was worried when my dad was in the hospital. It just made me nervous
hit:1164_conv:2329,utterance,speaker,I was scared when my dad was in the hospital. It just made me worry
hit:1164_conv:2329,utterance,listener,What happened?
hit:1164_conv:2329,utterance,speaker,He got a stomach rash that got worse
hit:1164_conv:2329,utterance,listener,Is he okay now?
hit:9024_conv:18048,situation,none,Tomorrow I have to give a presentation at work and I just found out that the Vice President of the company is going to be there.
hit:9024_conv:18048,utterance,speaker,Tomorrow I have to give a presentation at work and I just found out that the Vice President of the company is going to be there.
hit:9024_conv:18048,utterance,listener,Oh boy I hope you get some sleep tonight!
hit:9024_conv:18048,utterance,speaker,"It'll be hard now that I know that, but I'm going to try.  At least it'll push me to do my most impressive work.  I hope.  Its intimidating so I'm trying not to think ab out it too much."
hit:9024_conv:18048,utterance,listener,you got it bro!
hit:2531_conv:5063,situation,none,"Driving gets me so nervous sometimes. At any moment, I know I can be involved in a deadly crash..."
hit:2531_conv:5063,utterance,speaker,"Driving gets me so nervous sometimes. At any moment, I know I can be involved in a deadly crash..."
hit:2531_conv:5063,utterance,listener,"Yes, but do you drive safe?"
hit:2531_conv:5063,utterance,speaker,Yes but sometimes you can't do anything about a drunk driver smashing right into you
hit:2531_conv:5063,utterance,listener,True but the odd's are slim.
hit:3189_conv:6378,situation,none,I am worried about not being ready for the party on Friday
hit:3189_conv:6378,utterance,speaker,I am worried about not being ready for the party on Friday
hit:3189_conv:6378,utterance,listener,"You're hosting a party? or attending one? Either way, social gatherings can always be a lot of pressure, so that's why I usually avoid them, unfortunately. What are some of your worries, if you don't mind me asking?"
hit:3189_conv:6378,utterance,speaker,I don't know if I have enough energy to get the house deep cleaned and prepare all the food
hit:3189_conv:6378,utterance,listener,"Oh, so you're hosting. Man, that's definitely hard. I really do feel for you, as I wouldn't have the courage to do that. Well, since you're worried about it, at least it shows you care. And you still have plenty of time to prepare! Do you have anyone that can help?"
hit:8906_conv:17813,situation,none,I went to the store and had to buy presents for my family. I really didn't know what to buy.
hit:8906_conv:17813,utterance,speaker,I hate having to buy presents for other people.
hit:8906_conv:17813,utterance,listener,Oh. Do you have to buy a lot of presents or do you just not know what to buy?
hit:8906_conv:17813,utterance,speaker,I just don't know what I should buy. It makes me nervous.
hit:8906_conv:17813,utterance,listener,I understand. You know there are websites were you can answer a few questions about the person you are buy a gift for and then it makes gift recommendations for that person.
hit:8906_conv:17813,utterance,speaker,Cool I didn't know that!
hit:8906_conv:17813,utterance,listener,"Yeah, I have tried it a few times. It suggests some pretty cool things too."
hit:1232_conv:2465,situation,none,I cant wait for school to start. I am so excited
hit:1232_conv:2465,utterance,speaker,School is about to start. I can't wait
hit:1232_conv:2465,utterance,listener,Are you attending post secondary?
hit:1232_conv:2465,utterance,speaker,Im in college. My kids are goin back too
hit:1232_conv:2465,utterance,listener,That's awesome! What are you and your kids taking?
hit:1232_conv:2465,utterance,speaker,Im studying criinal justice. They are just in elementary
hit:5108_conv:10217,situation,none,i cant wait to see if i got a raise on my next paycheck
hit:5108_conv:10217,utterance,speaker,i cant wait to see if i got a raise on my next paycheck
hit:5108_conv:10217,utterance,listener,"That would be great.  They don't tell you in advance, you just have to find out when you get the check?"
hit:5108_conv:10217,utterance,speaker,no they make it a suprise!
hit:5108_conv:10217,utterance,listener,That's good and bad I guess.  It would probably be nice to be able to plan on it.
hit:72_conv:145,situation,none,in a hurry to go on vacation!
hit:72_conv:145,utterance,speaker,I am so impatient right now... waiting for the clock to hit 5 so I can go on vacation!
hit:72_conv:145,utterance,listener,How many hours do you have left?
hit:72_conv:145,utterance,speaker,4 hours to go! ahhh
hit:72_conv:145,utterance,listener,haha not bad! where are you going on vacation?
hit:4363_conv:8726,situation,none,The next day was Christmas and I couldn't wait to open my presents. I couldn't sleep at all that night.
hit:4363_conv:8726,utterance,speaker,One night I couldn't sleep at all.
hit:4363_conv:8726,utterance,listener,Oh no! I hope you didn't have to go anywhere the next day? Did you try anything to help?
hit:4363_conv:8726,utterance,speaker,"Well, I definitely didn't have to go anywhere because the next day was Christmas!"
hit:4363_conv:8726,utterance,listener,"Oh, well that's a bonus! No one needs sleep on christmas lol"
hit:527_conv:1055,situation,none,I'm awaiting eagerly to meet my friend. She is coming to my home to meet after 5 years later.
hit:527_conv:1055,utterance,speaker,I'm awaiting eagerly to meet my friend. She is coming to my home.
hit:527_conv:1055,utterance,listener,"Thats awesome, i recently reconnected with my friend, its really awesome when it happens"
hit:527_conv:1055,utterance,speaker,yeah! We're best friends in our college. We're meeting now after 4 years.
hit:527_conv:1055,utterance,listener,Yea it is one of the best feelings
hit:527_conv:1055,utterance,speaker,Thank you! have a nice day
hit:2452_conv:4905,situation,none,Public speaking makes me so nervous! I get very sweaty and start to shake uncontrollably...
hit:2452_conv:4905,utterance,speaker,Public speaking makes me so nervous! I get very sweaty and start to shake uncontrollably...
hit:2452_conv:4905,utterance,listener,I hear ya.. practice makes perfect tho!
hit:2452_conv:4905,utterance,speaker,I'm trying to improve with self help books and online courses
hit:2452_conv:4905,utterance,listener,"good luck with that, i hope it works out!"
hit:9479_conv:18958,situation,none,"I'm going on a work trip this weekend, but I hate flying. I'm really nervous about the flight."
hit:9479_conv:18958,utterance,speaker,"My work is sending me on a business trip, but I'm really nervous about getting on the plane."
hit:9479_conv:18958,utterance,listener,A little anxious?  Have you ever flown on a plane before?
hit:9479_conv:18958,utterance,speaker,"I have. I fly a lot, actually. I just really really hate it. I get so worried and afraid. Hopefully the time will pass quickly."
hit:9479_conv:18958,utterance,listener,I'm sure you'll be fine. Statistically its safer than driving.
hit:11748_conv:23496,situation,none,"I remember when I was in 8th grade, I had to sing the national anthem at my middle school graduation in front of hundreds of students and parents"
hit:11748_conv:23496,utterance,speaker,"I remember when I was in 8th grade, I had to sing the national anthem at my middle school graduation in front of hundreds of students and parents"
hit:11748_conv:23496,utterance,listener,It must have been nerve wracking! Did you do well?
hit:11748_conv:23496,utterance,speaker,I was so nervous that I actually started choking up! Good thing people thought it was the microphone malfunctioning!
hit:11748_conv:23496,utterance,listener,"Ha! When in doubt, just blame it on the microphone!"
hit:11748_conv:23496,utterance,speaker,I was so relieved when my friends and parents complained about the microphone. That means nobody knew it was me!!
hit:6478_conv:12957,situation,none,I have an interview tomorrow.
hit:6478_conv:12957,utterance,speaker,I have an interview tomorrow and I just keep thinking I will perform badly in it.
hit:6478_conv:12957,utterance,listener,I'm sure you'll be fine. Sell yourself.
hit:6478_conv:12957,utterance,speaker,Thanks. Ill try my best. Maybe I will do some yoga do help relieve this anxiety!
hit:6478_conv:12957,utterance,listener,I'm sure that will help. I have confidence in you.
hit:11887_conv:23774,situation,none,finding out if baby is boy or girl
hit:11887_conv:23774,utterance,speaker,tomorrow we find out if we are having a baby boy or girl
hit:11887_conv:23774,utterance,listener,Oh wow!  Congrats!!  What are you hoping for?
hit:11887_conv:23774,utterance,speaker,i dont care either way.. i already have a boy and girl
hit:11887_conv:23774,utterance,listener,That is so awesome!  How old are they?
hit:9196_conv:18393,situation,none,waiting for my new car to be delivered
hit:9196_conv:18393,utterance,speaker,i cant wait for my new car to be delivered to me tomorrow!
hit:9196_conv:18393,utterance,listener,That's exciting! What car did you get?
hit:9196_conv:18393,utterance,speaker,i got a 2018 subaru wrx
hit:9196_conv:18393,utterance,listener,"Great car! I love Subarus, my favorite is the impreza with turbo"
hit:4995_conv:9991,situation,none,when i don't know if i have a busy day coming up the next day the unknown drives me crazy
hit:4995_conv:9991,utterance,speaker,when i don't know if i have a busy day coming up the next day the unknown drives me crazy
hit:4995_conv:9991,utterance,listener,"I can relate to that, the late night anxiety of the unknown. Hate that."
hit:4995_conv:9991,utterance,speaker,it's like i'm going to lay down in bed and go to sleep. just kidding here's your stress all jumbled up in a mile ong list. lol
hit:4995_conv:9991,utterance,listener,"It always seems to wait til your head hits the pillow, then BAM!"
hit:4995_conv:9991,utterance,speaker,exactly. it's like the hamster is sleeping all day then it goes crazy at bed time.
hit:585_conv:1170,situation,none,"I am so stress. Tomorrow, I will have my final exams."
hit:585_conv:1170,utterance,speaker,"I am so stress. Tomorrow, I will have my final exams."
hit:585_conv:1170,utterance,listener,"Awww, you need to take a nap,  for you to focus and read"
hit:585_conv:1170,utterance,speaker,"Yes, I know. I need to relax but I can't. I am so afraid to fail even if I am well prepared."
hit:585_conv:1170,utterance,listener,Are you always scared of the exam hall?
hit:6803_conv:13606,situation,none,I hope my real estate lady comes by Monday. She said she's busy
hit:6803_conv:13606,utterance,speaker,I hope my real estate lady comes by Monday. She said she was busy and to call her Monday morning
hit:6803_conv:13606,utterance,listener,They are very busy but if she made an appointment with you then she should be there on Monday.
hit:6803_conv:13606,utterance,speaker,I hope so. I need to sell my house fast. I have super evil neighbors.
hit:6803_conv:13606,utterance,listener,"Oh no, you are leaving the neighbors to terrorize some unsuspecting people. That is funny."
hit:6803_conv:13606,utterance,speaker,actually the exact opposite. These people are trying to set me up  for revenge and one is a cop
hit:6803_conv:13606,utterance,listener,Omg..You should get out fast as you can then. Everyone can't be trusted.
hit:6803_conv:13606,utterance,speaker,"I read what you said wrong. Sorry, They would be afraid of a man, I'm a woman, single and a target"
hit:7917_conv:15834,situation,none,I am so worried about my math test coming up. I am afraid I will flunk it. I need to study more.
hit:7917_conv:15834,utterance,speaker,I got a big math test coming up. I am so worried I will flunk it.
hit:7917_conv:15834,utterance,listener,"Don't think that well! As long as you are prepared, you will do great!"
hit:7917_conv:15834,utterance,speaker,Yeah I think I need to study some more. I hate trigonometry so much.
hit:7917_conv:15834,utterance,listener,"Ah, yeah, I struggled with that too, but if you try hard enough you will get through it."
hit:8856_conv:17713,situation,none,I have to go into a new job today. My friend told me it wasn't any fun.
hit:8856_conv:17713,utterance,speaker,I am starting a scary type of new job today.
hit:8856_conv:17713,utterance,listener,"Exciting, is it hazardous scary or more excited scary?"
hit:8856_conv:17713,utterance,speaker,"Yes, it is hazardous because of chemicals. And also my friend told me that the people working there are not fun and also not very nice."
hit:8856_conv:17713,utterance,listener,"Well, go in with an open mind and maybe your experience will be different. And be sure you pay attention to the safety requirement!"
hit:8856_conv:17713,utterance,speaker,Thank you!
hit:8856_conv:17713,utterance,listener,"Chemicals mean serious business, but you landed the job. Good luck with doing well."
hit:7253_conv:14506,situation,none,Big croud of people I had to find my friend in.
hit:7253_conv:14506,utterance,speaker,I was looking at this huge croud knowing I was about to have to walk right into it.
hit:7253_conv:14506,utterance,listener,Were you nervous and what for?
hit:7253_conv:14506,utterance,speaker,"I had to find my lost buddy, and nervous is an understatement."
hit:7253_conv:14506,utterance,listener,"Oh no, how old was he?"
hit:6687_conv:13374,situation,none,I can't wait for school to start. Just a couple more days
hit:6687_conv:13374,utterance,speaker,Just a couple more days and they are outta here
hit:6687_conv:13374,utterance,listener,"You sound like me a few weeks ago with my relatives, since they have a bunch of kids under the age of 10. Sorry to hear you're going through the same stress."
hit:6687_conv:13374,utterance,speaker,I love them but my ears need a break lol
hit:6687_conv:13374,utterance,listener,"Yeah, even if they're not being annoying or bad... just so many people at once and all that activity.. too much. Love to see them come, and love it even more to watch them go."
hit:6687_conv:13374,utterance,speaker,I couldn't have said it better!
hit:665_conv:1331,situation,none,"I just watched the testimony of Peter Strzok before congress today. It was quite a show, to see his behaviors unraveling, almost as a sociopath or psychopath would do."
hit:665_conv:1331,utterance,speaker,I just watched the testimony before Congress today. It was quite a show.
hit:665_conv:1331,utterance,listener,"Cool, whose testimony?"
hit:665_conv:1331,utterance,speaker,Peter Strozy's. He was really acting like a sociopath or psychopath. There's even a new MEME in reference to Clockwork Orange just now about him being hashtagged in #StrzokworkOrange
hit:665_conv:1331,utterance,listener,Are they still going on about the election?
hit:665_conv:1331,utterance,speaker,"Yes, but the targeted interests were more into Weiner's pedophile laptop and his lies"
hit:11318_conv:22636,situation,none,I was waiting to see if I got a job I interviewed for. I was nervous because I didn'
hit:11318_conv:22636,utterance,speaker,I applied for a job once that I really wanted. I can remember nervously waiting for a call back.
hit:11318_conv:22636,utterance,listener,Did you end up getting that job?
hit:11318_conv:22636,utterance,speaker,"Yes, they called me back like a week later."
hit:11318_conv:22636,utterance,listener,Oh awesome. I would have been nervous to if it was something I really wanted. glad you got the job.
hit:6312_conv:12624,situation,none,I went back to college as an adult.  It was surreal seeing all the  young kids around me.
hit:6312_conv:12624,utterance,speaker,"After my kids were in school, I decided it was time to do something for me."
hit:6312_conv:12624,utterance,listener,What did you do for you?
hit:6312_conv:12624,utterance,speaker,"I went back to college!  It was quite a bit scary, being in class with kids that just graduated."
hit:6312_conv:12624,utterance,listener,That is such a bold move to make.  Congratulations!
hit:2726_conv:5452,situation,none,I am worried and concerned about the environment. There always seems to be bad news on TV.
hit:2726_conv:5452,utterance,speaker,There always seems to be bad news on TV these days.
hit:2726_conv:5452,utterance,listener,Who even watches TV this days?
