Dialog_ID,Type,Actor,Text
hit:8592_conv:17184,utterance,listener,oh.
hit:6546_conv:13093,situation,none,"I have a court case coming up against someone who committed fraud against me. Even though I'm sure I have enough evidence, I'm nervous that things won't go my way."
hit:6546_conv:13093,utterance,speaker,I've been feeling so nervous! I have a court case coming up against someone who committed fraud against me!
hit:6546_conv:13093,utterance,listener,Oh good luck! I hope you're able to win.
hit:6546_conv:13093,utterance,speaker,"Thank you! I'm sure I have enough evidence to prove my case, but it's still very nerve wracking!"
hit:6546_conv:13093,utterance,listener,I can imagine. Going through the process is very stressful. Do you have an attorney representing you at least?
hit:8290_conv:16581,situation,none,waiting for my new car to arrive
hit:8290_conv:16581,utterance,speaker,my new 2018 subaru WRX is going to be delivered today!! i CANT WAIT!!
hit:8290_conv:16581,utterance,listener,Woohoo! That sounds like it'll be a blast to drive!
hit:8290_conv:16581,utterance,speaker,it is so much fun!
hit:8290_conv:16581,utterance,listener,Just make sure you drive safely! :)
hit:2557_conv:5114,situation,none,"I had all my stuff moved from my old apartment to my new one, but the truck had a crash. I'm scared to find out if my furniture is ok"
hit:2557_conv:5114,utterance,speaker,"I had all my stuff moved from my old apartment to my new one, but the truck got into a wreck."
hit:2557_conv:5114,utterance,listener,"Holy heck are you okay? Was it like, a fender bender or a full on collision?"
hit:2557_conv:5114,utterance,speaker,Full on. The person in front decided that slamming on their breaks at 70 MPH was a good idea.
hit:2557_conv:5114,utterance,listener,Freaking idiots on the road. Is your insurance going to be able to cover the damage?
hit:400_conv:800,situation,none,We made the decision to homeschool our girls.  It's a tremendous responsibility and I still don't think I've got it all together.
hit:400_conv:800,utterance,speaker,We made the decision to homeschool our girls years ago.
hit:400_conv:800,utterance,listener,Why did you make that choice?
hit:400_conv:800,utterance,speaker,"One of them is in a ballet company and regular school hours were hard to do and if we allowed it for one, we needed to allow it for the other.  I've graduated one and the other is close behind, but I still feel nervous about all of it."
hit:400_conv:800,utterance,listener,Iv'e never heard of ballet school being so intensive. Is it something she's considering as a career?
hit:5426_conv:10852,situation,none,"i was in a competition,tomorrow is the elimination stage"
hit:5426_conv:10852,utterance,speaker,who would and would not be eliminated was the apprehension of the night
hit:5426_conv:10852,utterance,listener,What were they being eliminated from?
hit:5426_conv:10852,utterance,speaker,A singing competition
hit:5426_conv:10852,utterance,listener,Were the singers any good?
hit:12096_conv:24192,situation,none,I can't wait for this halloween. I have the cutest theme for my kids
hit:12096_conv:24192,utterance,speaker,I just love halloween. This is going to be the best one yet.
hit:12096_conv:24192,utterance,listener,You sound excited? do you do it up big?
hit:12096_conv:24192,utterance,speaker,I I do themes with me and my kids. We were all comic book villains last year
hit:12096_conv:24192,utterance,listener,What are you going to do this year?
hit:12096_conv:24192,utterance,speaker,"Im thinking fast food. Burgers, fries, milkshake lol"
hit:12096_conv:24192,utterance,listener,That's an interesting theme.  Are you going to make the costumes your self?
hit:12096_conv:24192,utterance,speaker,Some parts.
hit:12096_conv:24192,utterance,listener,That sounds like lots of fun!
hit:5294_conv:10589,situation,none,School starts tomorrow for my oldest. I really hope he does well and enjoys it.
hit:5294_conv:10589,utterance,speaker,School starts tomorrow for my oldest. I really hope he does well and enjoys it and that he doesn't get scared or miss me too bad or misbehave.
hit:5294_conv:10589,utterance,listener,Schools are fun. I wish i could turn time back and go back to those good old days
hit:5294_conv:10589,utterance,speaker,I remember thinking how bad I had it because I had to go to school every day. Now I wish that was the worst thing I had going on! Lol.
hit:5294_conv:10589,utterance,listener,"Becoming adult is much worse to happen. School concerns as it appears now after realizing, were much more hassle free"
hit:5985_conv:11971,situation,none,I am receiving my work evaluation tomorrow. I am very nervous waiting for the results.
hit:5985_conv:11971,utterance,speaker,Tomorrow I will find out how I have been doing at work. I am really nervous.
hit:5985_conv:11971,utterance,listener,Just show them what you have accomplished this past year
hit:5985_conv:11971,utterance,speaker,I have been receiving good feedback. I still get nervous though.
hit:5985_conv:11971,utterance,listener,Just be confident in your ability!
hit:1642_conv:3284,situation,none,I have a math test tomorrow. My stomach won't stop churning.
hit:1642_conv:3284,utterance,speaker,I have a math test tomorrow and it is the biggest one of the semester.
hit:1642_conv:3284,utterance,listener,wow. I hope you have studied hard so you will do well.
hit:1642_conv:3284,utterance,speaker,I've been studying all night. It's going to be a real doozy. I am quite nervous!
hit:1642_conv:3284,utterance,listener,Well as long as you have studied hard you should do well. Just relax knowing you have prepared yourself.
hit:5611_conv:11223,situation,none,Applied to another unit and got it.
hit:5611_conv:11223,utterance,speaker,Applied to another unit and got it.
hit:5611_conv:11223,utterance,listener,"Oh wow, that's great.  What unit are you in now and what made you want to change?"
hit:5611_conv:11223,utterance,speaker,I'm in med/surg now. I'm changing for the higher pay.
hit:5611_conv:11223,utterance,listener,That's awesome.  Are you a nurse?  I used to work in the NICU.  It was a wonderful job.  Good luck with your new position.
hit:873_conv:1747,situation,none,I can't wait for school to start back. A litlle quieter in the house.
hit:873_conv:1747,utterance,speaker,It's almost time for school again. I am so excited.
hit:873_conv:1747,utterance,listener,Awesome. Are you going to s chool or your children?
hit:873_conv:1747,utterance,speaker,Both. I take classes online so I need them out of the house again lol
hit:873_conv:1747,utterance,listener,Right i work from home so i feel you
hit:873_conv:1747,utterance,speaker,They love school too so it works for all of us.
hit:6901_conv:13802,situation,none,I have to go to the dentist next week and im so nervous. I hate going to the dentist
hit:6901_conv:13802,utterance,speaker,Im so worried about next week
hit:6901_conv:13802,utterance,listener,That sucks. What's going on next week?
hit:6901_conv:13802,utterance,speaker,I have to go to the dentist on wednesday.  I hate going to the denstist.  Im always worried that im going to get poked or hurt
hit:6901_conv:13802,utterance,listener,I don't think anyone enjoys going to the dentist.
hit:8424_conv:16848,situation,none,I am already nervous about tomorrow. It might rain hard
hit:8424_conv:16848,utterance,speaker,I am already nervous about tomorrow. It might rain hard
hit:8424_conv:16848,utterance,listener,If you have to leave just be very careful on the road.
hit:8424_conv:16848,utterance,speaker,I am going to try
hit:8424_conv:16848,utterance,listener,Leave early and drive slower than normal. Just watch out for other drivers.
hit:5035_conv:10070,situation,none,"I get anxious whenever I'm waiting in line for a flight, and it's less than 30 minutes from take off."
hit:5035_conv:10070,utterance,speaker,I get anxious whenever I'm at the airport and I'm waiting in the security line and the plane is about to board.
hit:5035_conv:10070,utterance,listener,"i do too, flying is kinda nervewracking"
hit:5035_conv:10070,utterance,speaker,"I agree, seems like you have to plan to be there hours before it takes off."
hit:5035_conv:10070,utterance,listener,oh yes definitely
hit:11294_conv:22588,situation,none,when i was waiting on my baby to be born
hit:11294_conv:22588,utterance,speaker,i was on pins in needles waiting for the arrival of my first born
hit:11294_conv:22588,utterance,listener,but i bet you feel all better now right?
hit:11294_conv:22588,utterance,speaker,"yes, extremely better"
hit:11294_conv:22588,utterance,listener,that's really good. Everything went okay?
hit:11294_conv:22588,utterance,speaker,"thanks, yes everything went well and all of us are doing ok"
hit:10934_conv:21868,situation,none,My aunt was rushed to the hospital a few days ago. They are currently monitoring her condition.
hit:10934_conv:21868,utterance,speaker,My aunt was rushed to the hospital a few days ago. They are currently monitoring her condition.
hit:10934_conv:21868,utterance,listener,"i am sorry to hear that, i know she will be better"
hit:10934_conv:21868,utterance,speaker,"Thanks for that, it's important to keep the faith I think. Medicine and our technology today is also advanced so I am hopeful."
hit:10934_conv:21868,utterance,listener,"before you know it , she will be out and about"
hit:11342_conv:22685,situation,none,I was driving on the road one day and I saw a man hit a dog.
hit:11342_conv:22685,utterance,speaker,I was driving and I saw a man hitting a dog. It got me so mad.
hit:11342_conv:22685,utterance,listener,Oh no! That is horrible! Did you do anything?
hit:11342_conv:22685,utterance,speaker,"I stopped, got out of my car and told him to stop. I then called the police."
hit:11342_conv:22685,utterance,listener,Good for you! Animals need people like you! Very heroic!
hit:11342_conv:22685,utterance,speaker,We as people need to protect animals. They are innocent.
hit:3178_conv:6356,situation,none,I am feeling uneasy about going to court
hit:3178_conv:6356,utterance,speaker,I am feeling uneasy about going to court
hit:3178_conv:6356,utterance,listener,Why are you going to the court?
hit:3178_conv:6356,utterance,speaker,I am getting a divorce finally
hit:3178_conv:6356,utterance,listener,I understand. I hope things will go smoothly.
hit:8938_conv:17876,situation,none,Recently I had a shift at work cancelled. A lot of times that means more were going to be cancelled. I was very nervous that the whole weeks pay would be lost.
hit:8938_conv:17876,utterance,speaker,Recently I had a shift at work cancelled. Often that can mean that the rest of the week gets cancelled.
hit:8938_conv:17876,utterance,listener,Is that a bad thing?
hit:8938_conv:17876,utterance,speaker,Sometimes it is nice but loss of pay for 20+ hours definitely made me a little nervous. Thankfully only the one was cancelled.
hit:8938_conv:17876,utterance,listener,That's good
hit:9039_conv:18079,situation,none,my husband and i are trying to have a baby
hit:9039_conv:18079,utterance,speaker,my husband and i are trying to have a baby
hit:9039_conv:18079,utterance,listener,Aww! I bet that is so exciting! Do you want a girl or boy?
hit:9039_conv:18079,utterance,speaker,i would be fine either way as long we have a healthy baby that's all that matters to me.
hit:9039_conv:18079,utterance,listener,I hope it goes well. Children are great.
hit:9039_conv:18079,utterance,speaker,i hope so too. we have been trying for 6 years
hit:2663_conv:5326,situation,none,I can't wait to know if my wife is going to have a boy or a girl child
hit:2663_conv:5326,utterance,speaker,i  can't wait to know if my wife is going to have a boy or a girl child
hit:2663_conv:5326,utterance,listener,That's a very exciting time in life. Do you have any preference for gender?
hit:2663_conv:5326,utterance,speaker,"I want a girl, girls are closer to fathers than sons ..hahaha"
hit:2663_conv:5326,utterance,listener,I've heard that as well. I'm male I know I was much closer to my mom.
hit:5690_conv:11380,situation,none,I'm meeting a new guy for dinner tonight. I hope everything goes well.
hit:5690_conv:11380,utterance,speaker,"I have a date with a new guy tonight, he's taking me out to dinner"
hit:5690_conv:11380,utterance,listener,Who chose the place?
hit:5690_conv:11380,utterance,speaker,"I let him pick, he's taking me to a nice Italian place."
hit:5690_conv:11380,utterance,listener,Cool. I love italian. Real italian.
hit:12131_conv:24262,situation,none,I am learning how to wake-board this weekend!  I am really nervous though!
hit:12131_conv:24262,utterance,speaker,I am learning how to wake-board this weekend! I am really nervous though!
hit:12131_conv:24262,utterance,listener,What is wake-board. That sounds a bit scary.
hit:12131_conv:24262,utterance,speaker,"It is like water skiing but on a board!  It is fun, but a little nerve racking!"
hit:12131_conv:24262,utterance,listener,"I bet it is, i am afraid of water, I cannot swim so i know for a fact I would not be trying that. I hope you have fun."
hit:36_conv:72,situation,none,I heard a car outside that sounded like it wrecked yesterday. It sounded  awful.
hit:36_conv:72,utterance,speaker,Did you go outside and see if anyone was hurt?
hit:36_conv:72,utterance,listener,What do you mean? I don't know what you are talking about.
hit:36_conv:72,utterance,speaker,I heard a noise outside that sounded like a car had wrecked yesterday.
hit:36_conv:72,utterance,listener,Well then I guess you should have went and checked to see if anyone was hurt. I hope you called a ambulance.
hit:10545_conv:21091,situation,none,My husband just had a job interview. We are waiting to hear back from the company.
hit:10545_conv:21091,utterance,speaker,My husband had a job interview a few days ago...now we are waiting...
hit:10545_conv:21091,utterance,listener,Ahh that's so anxiety-making. I hope he gets the jon.
hit:10545_conv:21091,utterance,speaker,"Me, too! The anticipation is killing me!!!"
hit:10545_conv:21091,utterance,listener,Fingers crossed!
hit:5919_conv:11838,situation,none,When I was a little kid I participated in a spelling bee.  I was nervous at first but ended up taking first place.
hit:5919_conv:11838,utterance,speaker,I was nervous at first in the spelling bee...but ended up taking first place out of 100 plus kids
hit:5919_conv:11838,utterance,listener,WOW!  Congrats!  Was it hard contest?
hit:5919_conv:11838,utterance,speaker,Yes it was pretty hard actually
hit:5919_conv:11838,utterance,listener,You must be very smart!
hit:9912_conv:19824,situation,none,"The year was 2016, and I was severely worried that Hilary might win the presidency"
hit:9912_conv:19824,utterance,speaker,If things didn't go as planned we might not be able to make America great again
hit:9912_conv:19824,utterance,listener,What things are you wanting to go as planned?
hit:9912_conv:19824,utterance,speaker,"There was a lot of work to be done, and a lot of election machines to be hacked. Worst thing was, Vlad never sent the instructions on how to backdoor them so we were on our own"
hit:9912_conv:19824,utterance,listener,"Very true, I am sure those instructions are forth coming.  He wouldn't leave us hanging."
hit:4459_conv:8918,situation,none,I am waiting on some test results. I went to the doctor last week.
hit:4459_conv:8918,utterance,speaker,I've been a bit worried waiting for some test results from the doctor.
hit:4459_conv:8918,utterance,listener,what kind of results? are you okay?
hit:4459_conv:8918,utterance,speaker,"I got some blood work done, and they are testing my insulin levels."
hit:4459_conv:8918,utterance,listener,im sure youre in tip top shape.
hit:4459_conv:8918,utterance,speaker,"Hopefully everything turns out okay, thanks!"
hit:2453_conv:4907,situation,none,I can't wait to find a new show to bing on
hit:2453_conv:4907,utterance,speaker,I ove binge watching tv shows
hit:2453_conv:4907,utterance,listener,Me too. What kind of tv shows?
hit:2453_conv:4907,utterance,speaker,I love dramas. They leave you with a cliffhanger but you can watch the next show immediately lol
hit:2453_conv:4907,utterance,listener,"Yeah, seems like all tv shows are like that. My favorite is the Teletubbies."
hit:2453_conv:4907,utterance,speaker,Does that still come on?
hit:2267_conv:4534,situation,none,School starts in a few days. I am too excited.
hit:2267_conv:4534,utterance,speaker,School is about to start. Summer is over.
hit:2267_conv:4534,utterance,listener,Bummer. I enjoyed summer so much.
hit:2267_conv:4534,utterance,speaker,Happens every year.
hit:2267_conv:4534,utterance,listener,But at least Christmas is around the corner. I love Christmas just as much as the summer!
hit:2267_conv:4534,utterance,speaker,Halloween first though
hit:12044_conv:24088,situation,none,"I have to take my truck in to the mechanics next week. I'm not sure what the problem is, but it seems serious."
hit:12044_conv:24088,utterance,speaker,I've got to take my truck to a mechanic next week.
hit:12044_conv:24088,utterance,listener,Uh oh. Do you think it is something major?
hit:12044_conv:24088,utterance,speaker,"Yeah, it's an engine thing, so it may well be some really bad news."
hit:12044_conv:24088,utterance,listener,Well I hope it isnt too expensive. Maybe it will be a smaller issue.
hit:834_conv:1668,situation,none,"I had to go to the doctor recently for my foot, I was definitely scared of the possible outcome."
hit:834_conv:1668,utterance,speaker,"I got my foot looked at recently by a doctor, boy was I nervous going into it."
hit:834_conv:1668,utterance,listener,"Oh, that's annoying! I hate going to the doctor...freaks me out. I always feel like they're going to tell me I'll die in 5 weeks"
hit:834_conv:1668,utterance,speaker,"Yeah I feel the same way, then it ends up being nothing serious usually anyway."
hit:834_conv:1668,utterance,listener,"Similar to most things, yea. What was wrong with your foot?"
hit:5564_conv:11128,situation,none,I have my math test tomorrow and didn't study. I don't feel very good about it.
hit:5564_conv:11128,utterance,speaker,I have my final math test tomorrow.
hit:5564_conv:11128,utterance,listener,That is so nerve racking. I'm sure you will do great.
hit:5564_conv:11128,utterance,speaker,"I'm not too sure. Frankly, I am quite nervous about it since I haven't studied."
hit:5564_conv:11128,utterance,listener,Do you usually do good in math? It is my favorite subject and always came so easy for me.
hit:2713_conv:5426,situation,none,I have an important exam tomorrow.
hit:2713_conv:5426,utterance,speaker,"Hi, I have a really essential certificate exam tomorrow."
hit:2713_conv:5426,utterance,listener,Good luck! Have you studied for it? Do you feel prepared?
hit:2713_conv:5426,utterance,speaker,"Yes, I think so. but I just can't stop thinking that something bad will happen. I am worried!"
hit:2713_conv:5426,utterance,listener,Don't be paranoid. That just upsets you. Try to think positivley.
hit:3499_conv:6999,situation,none,"Whenever I go to family get together, I always feel extremely anxious and out of place"
hit:3499_conv:6999,utterance,speaker,"Anytime I have a family get together coming up, like during the holidays, I get super anxious and worry non-stop about it"
hit:3499_conv:6999,utterance,listener,Same here.  Is it because of needed prepartations or because of family drama?
hit:3499_conv:6999,utterance,speaker,"Yeah for the most part, I enjoy one side of my family, but other side, I could care less for.  Lots of drama and subtle remarks."
hit:3499_conv:6999,utterance,listener,Drama is never good.  I usually don't re-invite people who bring it with them.
hit:5755_conv:11510,situation,none,I can not wait for my best friend to visit from Germany.
hit:5755_conv:11510,utterance,speaker,I can not wait for my best friend to visit from Germany.
hit:5755_conv:11510,utterance,listener,Oh that's exciting! When are they coming?
hit:5755_conv:11510,utterance,speaker,He arrives this weekend. I have a fun planned weekend.
hit:5755_conv:11510,utterance,listener,That's excellent! I bet you two will have an amazing time!
hit:7153_conv:14306,situation,none,There was a wasp in my room when I woke up
hit:7153_conv:14306,utterance,speaker,When I woke up there was a wasp in my bedroom
hit:7153_conv:14306,utterance,listener,"Oh, that is awful, did it sting you?"
hit:7153_conv:14306,utterance,speaker,No. I ran away.
hit:7153_conv:14306,utterance,listener,"Oh, I'm glad, where was it?"
hit:7153_conv:14306,utterance,speaker,It's still in my room. I slammed the door shut and plan on hiding from it for as long as possible.
hit:3652_conv:7304,situation,none,I was raped. I have just gone for a test to know if I am pregnant or I caught a disease from the bad experience
hit:3652_conv:7304,utterance,speaker,I was raped. I have just gone for a test to know if I am pregnant or I caught a disease from the bad experience
hit:3652_conv:7304,utterance,listener,"Oh, I am so sorry this happened to you. What an animal! When will you know the results of your tests?"
hit:3652_conv:7304,utterance,speaker,"Its ok , I am so anxious about my status"
hit:3652_conv:7304,utterance,listener,"Hopefully the medical personnel will understand your predicament and your worry and will expedite the results. Until then, do you have someone you can confide in or just talk to?"
hit:11776_conv:23553,situation,none,I am worried about a flight coming up.
hit:11776_conv:23553,utterance,speaker,I have a flight coming up and i absolutely hate flying.
hit:11776_conv:23553,utterance,listener,"Yeah, flying is the worst."
hit:11776_conv:23553,utterance,speaker,I think im going to take some sleeping pills and attempt to sleep.
hit:11776_conv:23553,utterance,listener,You can also have some drinks too!
hit:6979_conv:13958,situation,none,when im stuck in high traffic my anxiety goes through the roof
hit:6979_conv:13958,utterance,speaker,"When ever i drive around 3 pm or 4 , or even at 7 am , my anxiety goes through the roof crazy traffic i honestly would not drive if i did not have too"
hit:6979_conv:13958,utterance,listener,Is it the traffic or driving that gives you anxiety?
hit:6979_conv:13958,utterance,speaker,"both , when im with my brother and hes typing on his phone and not looking at the road i start hyper ventilating"
hit:6979_conv:13958,utterance,listener,Oh gosh. That's not safe at all.
hit:2965_conv:5931,situation,none,I am so nervous.  I have a blind date tomorrow night.
hit:2965_conv:5931,utterance,speaker,I am so nervous.  I have a blind date coming up.
hit:2965_conv:5931,utterance,listener,Oh. That's kind of exciting though
hit:2965_conv:5931,utterance,speaker,Sorta.. Im just really nervous!
hit:2965_conv:5931,utterance,listener,"Well be yourself. If it doesnt work out, think of it as practice!"
hit:541_conv:1082,situation,none,"I once was in a car with my friend who was really high and I was pretty scared. I thought that he would drive really badly but he didn't, but it was still worrying."
hit:541_conv:1082,utterance,speaker,I was once a little scared that I was gonna die since I was in the passenger seat with someone who was very high driving the car. I didn't know a whole lot about drugs at the time.
hit:541_conv:1082,utterance,listener,I'm glad you made it out alive. I wonder what drugs they were on. Some drugs actually make you more careful.
hit:541_conv:1082,utterance,speaker,"He smoked some pot, so it really wasn't a big deal but I didn't know that at the time."
hit:541_conv:1082,utterance,listener,Good thing he wasn't drunk or he very well could have gotten in an accident. Alcohol really impairs motor skills.
hit:6609_conv:13218,situation,none,My lawn is getting overgrown and I don't know if I can afford a new mower. Mine is broken and hard to start. It's driving me crazy to have my lawn so high
hit:6609_conv:13218,utterance,speaker,My lawn is getting overgrown and I don't know if I can afford a new mower.
hit:6609_conv:13218,utterance,listener,Try your local pawn shop for a cheap one you don't want a messy looking yard.
hit:6609_conv:13218,utterance,speaker,The pawn shops here are OUTRAGEOUS..They cost just as much as a new one. I had one..that was stolen and my other one is VERY hard to start it's broken. Debating on getting a part or saving a little more for a new one
hit:6609_conv:13218,utterance,listener,That is crazy maybe you should check offer up and that is crazy I dislike when people steal what is yours especially something you really need.
hit:6609_conv:13218,utterance,speaker,YEP! So angry! I work hard for my stuff! Offerup and everything else here is expensive. I am in a poor county..so people charge ridiculous amounts for everything :/
hit:6283_conv:12567,situation,none,I go on vacation tomorrow.. I hope  I packed everything I need
hit:6283_conv:12567,utterance,speaker,I go on vacation tomorrow.. I hope I packed everything I need
hit:6283_conv:12567,utterance,listener,Where are you going
hit:6283_conv:12567,utterance,speaker,We're going to Disney World
hit:6283_conv:12567,utterance,listener,That sounds fun
hit:4669_conv:9338,situation,none,"I am scared about growing up, it is sort of unnerving"
hit:4669_conv:9338,utterance,speaker,"I am scared about growing up, it is sort of unnerving"
hit:4669_conv:9338,utterance,listener,That's true.. It is challenging. how old are you?
hit:4669_conv:9338,utterance,speaker,"I am 21, so sort of an adult, but not really"
hit:4669_conv:9338,utterance,listener,"It is natural to feel that way in early 20's, trust me. you will adapt with time though :)"
hit:6506_conv:13012,situation,none,There was a wasp in my room this morning
hit:6506_conv:13012,utterance,speaker,There was a wasp in my bedroom when I woke up this morning
hit:6506_conv:13012,utterance,listener,"Wow, did it scare you?!"
hit:6506_conv:13012,utterance,speaker,I'm terrified of them
hit:6506_conv:13012,utterance,listener,"So am I, I would have freaked out if I saw it my bedroom."
