Dialog_ID,Type,Actor,Text
hit:10364_conv:20728,utterance,listener,Why don't you think it will be a good fit? You might be underestimating yourself
hit:10364_conv:20728,utterance,speaker,"Well, it's a factory job and I'm afraid that the monotony will be too soul-crushing"
hit:10364_conv:20728,utterance,listener,You do have a good point. You really should do what will make you happy because life is just too short
hit:10326_conv:20653,situation,none,"Started a new job.  In an industry i have never worked in, with people from all over and a physically demanding job."
hit:10326_conv:20653,utterance,speaker,"Started a new job, it's so different from what I always have done."
hit:10326_conv:20653,utterance,listener,Do you at least enjoy the new job?
hit:10326_conv:20653,utterance,speaker,"I do, just hard work, used to sitting at a desk."
hit:10326_conv:20653,utterance,listener,"Hopefully the more you warm up to the new job, it will become easier."
hit:10326_conv:20653,utterance,speaker,"Hope so, my muscles are sore right now."
hit:10161_conv:20323,situation,none,All my friends signed up for horse back riding lessons but I had never been before.  I wasn't sure I wanted to go with them but they convinced me to sign up and go even though I was very scared!
hit:10161_conv:20323,utterance,speaker,All my friends signed up for horse back riding lessons but I'd never been before and was scared.  They convinced me to sign up and take them!
hit:10161_conv:20323,utterance,listener,"It does sound like fun, though. Did you have a good time?"
hit:10161_conv:20323,utterance,speaker,I wouldn't say it was a good time but I'm glad I tried it!
hit:10161_conv:20323,utterance,listener,Are you ever going to do it again or are you done? I went when I was a child.
hit:6242_conv:12484,situation,none,I am feeling quite a lot of trepidation about the weekend coming up. It might involve seeing someone I am kind of involved with and I am not ready to see them again.
hit:6242_conv:12484,utterance,speaker,I am feeling quite a lot of trepidation about the weekend coming up.
hit:6242_conv:12484,utterance,listener,why whats going on?
hit:6242_conv:12484,utterance,speaker,It might involve seeing someone I am kind of involved with and I am not ready to see them again.
hit:6242_conv:12484,utterance,listener,ahh thats not good! hopefully it works out for you
hit:1920_conv:3840,situation,none,"I went to Disney World in March.  I was in line for a roller coaster, and started feeling very nervous about it."
hit:1920_conv:3840,utterance,speaker,"Hi, at march break I went to Disney World with my family."
hit:1920_conv:3840,utterance,listener,sounds fun how long were you there
hit:1920_conv:3840,utterance,speaker,We were there for a week.  A lot of the roller coasters made me nervous though.
hit:1920_conv:3840,utterance,listener,aw what was your favorite things to do while there
hit:11017_conv:22035,situation,none,"I recently joined a new team of people at work (a new work group), and I was feeling unsure about the goals of the project we were working on or whether the project was even a good idea or not."
hit:11017_conv:22035,utterance,speaker,"I was recently added to a team of people to work on a new project at my job.  I'm not really sure the goal of the project is a good idea, so I've been reluctant to really jump into the project fully."
hit:11017_conv:22035,utterance,listener,Why do you feel that way?
hit:11017_conv:22035,utterance,speaker,"I'm very pragmatic, and like to focus on the specific outcomes and logistics.  Everyone else on this team has more of a big-picture view and is concerned with how this will make our organization look good at a national scale.  It's a difference of priorities, I suppose."
hit:11017_conv:22035,utterance,listener,You sound a bit like me. I get lost in the details of things myself sometimes. I'm sure after you weigh the pros and cons of the situation you'll come to the right conclusion for yourself.
hit:5809_conv:11618,situation,none,"Last month, I had to give a presentation at a big research convention. I was really nervous!"
hit:5809_conv:11618,utterance,speaker,I had to give a presentation at a big convention last month. I'm not used to presenting and I was really nervous!
hit:5809_conv:11618,utterance,listener,How did it go than?
hit:5809_conv:11618,utterance,speaker,It turned out all right. But my stomach was in knots the whole time.
hit:5809_conv:11618,utterance,listener,"Of course it was, but next time you'll handle it better."
hit:9054_conv:18108,situation,none,A bit worried about the future today. There is so much to get done before winter comes and I only have so many hours in the day
hit:9054_conv:18108,utterance,speaker,A bit worried about the future today.
hit:9054_conv:18108,utterance,listener,why what happened
hit:9054_conv:18108,utterance,speaker,I just have a lot to get done before winter comes and I only have so many hours in the day. It can be overwintering as I work 2 jobs and run a business on top of it.
hit:9054_conv:18108,utterance,listener,hopefully it works out for you
hit:338_conv:677,situation,none,"Buying my first home, and I'm worried about all the expenses that might happen besides the mortgage."
hit:338_conv:677,utterance,speaker,"so I'm buying my first home, and I'm worried about all the expenses that might happen besides the mortgage."
hit:338_conv:677,utterance,listener,"Oh, that is exciting. How big is your house?"
hit:338_conv:677,utterance,speaker,"It's a small 3 bedroom home, 1 level. It's just me and my elderly mom."
hit:338_conv:677,utterance,listener,"Oh, that sounds nice. What's your occupation?"
hit:12421_conv:24843,situation,none,I have an overseas trip coming up. I have never been and I am feeling a little scared right now about going.
hit:12421_conv:24843,utterance,speaker,I have an overseas trip coming up. I have never been and I am feeling a little scared right now about going.
hit:12421_conv:24843,utterance,listener,that is exciting@
hit:12421_conv:24843,utterance,speaker,Yea but I have never been in a foreign country before.
hit:12421_conv:24843,utterance,listener,yeah same but it can be fun
hit:11427_conv:22854,situation,none,My sister wants me to come out for drinks with her. I don't really drink nor do I like her friends. I don't think I want to go.
hit:11427_conv:22854,utterance,speaker,"My sister asked me to go out for drinks with her, but I don't drink"
hit:11427_conv:22854,utterance,listener,Did you go with her anyway?
hit:11427_conv:22854,utterance,speaker,I don't think I want to. It makes me feel weird.
hit:11427_conv:22854,utterance,listener,I understand that.
hit:11934_conv:23868,situation,none,Sometimes I'm afraid to ride the city bus because you never know what kind of drama will unfold.
hit:11934_conv:23868,utterance,speaker,Once I rode the city bus and a guy tried to get a free ride and an argument broke out between him and the driver.
hit:11934_conv:23868,utterance,listener,"Oh, it's crazy what some people will try. But, sometimes an argument can get very interesting to watch!"
hit:11934_conv:23868,utterance,speaker,"Yeah, it ended with the driver threatening to call the police because the guy was getting really loud about it. Held us up for about 10 minutes."
hit:11934_conv:23868,utterance,listener,"I don't really blame the driver. Plus, that's annoying delay in everybody's busy day."
hit:10464_conv:20928,situation,none,The building where I work is under construction and senior leadership was recently offering tours to staff members. I was a little nervous about having to walk through a live construction zone and thought I might trip on something.
hit:10464_conv:20928,utterance,speaker,I work in a building that has parts of it under construction and our senior staff is offering tours. I'm a little worried about tripping and falling on something if I take a tour through the live construction zone.
hit:10464_conv:20928,utterance,listener,"I can certainly relate to you, it could be a safety hazard."
hit:10464_conv:20928,utterance,speaker,"I agree! I think if I do it, i need to buy some closed-toe shoes and make sure I'm wearing the correct clothing."
hit:10464_conv:20928,utterance,listener,"That's a smart move, that would reduce the risk of injury."
hit:10305_conv:20610,situation,none,"About a year ago, my doctor asked me about an unusual mole on my shoulder.  She got out this special light and said she didn't like the look of it.  She sent me down to a dermatologist and I waited around for a couple hours.  He took a biopsy and I had to wait a week for the results.  It was a long wait."
hit:10305_conv:20610,utterance,speaker,I had a cancer scare last year.  My doctor found a strange mole. I had to wait a week for the biopsy to come back.  It was a long wait!
hit:10305_conv:20610,utterance,listener,I can't imagine what that must have felt like. What helped you get through it?
hit:10305_conv:20610,utterance,speaker,Xanax!  Just kidding.  I didn't have much help dealing with it because I didn't tell anyone.
hit:10305_conv:20610,utterance,listener,At least you kept your sense of humor!
hit:10305_conv:20610,utterance,speaker,"In retrospect!  I was pretty freaked out.  My family was mad at me for not telling them, but I didn't want them to worry."
hit:10269_conv:20538,situation,none,I've been anxious because I think my new landlords don't approve of dogs in the house I'm renting and I have a dog!
hit:10269_conv:20538,utterance,speaker,I've been anxious because I think my new landlords don't approve of dogs in the house I'm renting and I have a dog!
hit:10269_conv:20538,utterance,listener,Oh no that is awful! It is against the law where I live to ban animals from the house. So legally I am allowed to have a pet even if the contract says no pets allowed.
hit:10269_conv:20538,utterance,speaker,Really? I did not know such laws exist but it's awesome. Where do you live?
hit:10269_conv:20538,utterance,listener,Canada! You should check the laws in your area to see whether or not you are legally allowed to have a pet even if the land lords do not approve.
hit:3000_conv:6001,situation,none,I am reluctant to confront my my best friend's girlfriend. I think my best friend is cheating on her...
hit:3000_conv:6001,utterance,speaker,I am reluctant to confront my my best friend's girlfriend. I think my best friend is cheating on her...
hit:3000_conv:6001,utterance,listener,You should definitely first talk to your friend and clear out the concerns with him before talking to his partner
hit:3000_conv:6001,utterance,speaker,I don't know what to do but I'm apprehensive. Should I tell her?
hit:3000_conv:6001,utterance,listener,"As I said, first ask your friend why is he behaving in such an unacceptable way"
hit:6117_conv:12235,situation,none,I was nervous going on a first date last weekend. I thought about not going
hit:6117_conv:12235,utterance,speaker,I was nervous going on a first date last weekend. I thought about not going
hit:6117_conv:12235,utterance,listener,That is understandable.  Did you end up going?
hit:6117_conv:12235,utterance,speaker,"I did and it was fine, nothing to be nervous about"
hit:6117_conv:12235,utterance,listener,Are you going out again?
hit:10176_conv:20352,situation,none,"Working as a nurse, there are many times when I have been worried about my patients. Sometimes when a patient is just starting to get seriously ill, there are not any obvious signs, but my intuition is almost always correct."
hit:10176_conv:20352,utterance,speaker,Intuition can be a key tool to a seasoned nurse.
hit:10176_conv:20352,utterance,listener,"I suppose, but research and concrete knowledge is more beneficial as it is a very hands on and physical occupation, especially when the health of others are in their hands."
hit:10176_conv:20352,utterance,speaker,Those are very beneficial tools as well but sometimes experience plays a large part in patient outcomes.
hit:10176_conv:20352,utterance,listener,That is true. There are many situations where experience can strengthen your skills compared to just learning it from a book.
hit:10176_conv:20352,utterance,speaker,Skills can be difficult to learn from a book. Hands-on practice is what it takes to perfect those skills.
hit:11017_conv:22034,situation,none,"I got a call about a job offer back in late May this year. I wasn't sure if I wanted to try and interview for it it since seemed like just another in a long list of jobs I'd applied to. But in the end I decided that it was better than being unemployed, so I went for it. I won over the recruiter in the phone interview, and was hired the same day!"
hit:11017_conv:22034,utterance,speaker,"I had been unemployed for a long time until earlier this year. I originally wasn't sure if I was going to even interview for the position I did, but I'm glad I decided to. I got a call in late may from a merchandising company. I went back and forth in my mind after being rejected from many interviews over the past couple years. In the end I went for it, the interviewer liked what I had to say, and I was hired the same day! I've been working there ever since."
hit:11017_conv:22034,utterance,listener,"Congratulations!  That's awesome.  Sometimes it's scary to risk rejection, but it sounds like it totally paid off in this case."
hit:11017_conv:22034,utterance,speaker,Yeah I'm happy I kept at it :)
hit:11017_conv:22034,utterance,listener,"I'm about to switch careers, so I'll be doing the interviewing thing soon. It's scary."
hit:11017_conv:22034,utterance,speaker,Good luck!
hit:6245_conv:12490,situation,none,I'm going sky diving and kind of terrified.
hit:6245_conv:12490,utterance,speaker,I'm going sky diving and kind of terrified.
hit:6245_conv:12490,utterance,listener,I would be too
hit:6245_conv:12490,utterance,speaker,Are you also afraid of heights?
hit:6245_conv:12490,utterance,listener,yes. I cant even drive over a bridge
hit:10405_conv:20811,situation,none,I was worried about going out with a person I met at the grocery store.  It was my first date in a long time.
hit:10405_conv:20811,utterance,speaker,So I met a person at the grocery store and they asked me on a date!
hit:10405_conv:20811,utterance,listener,That's awesome! Are you going to go on the date with them?
hit:10405_conv:20811,utterance,speaker,I was worried about it but went to lunch with him.  It was awkward lol.
hit:10405_conv:20811,utterance,listener,"Oh, didn't work out, huh?"
hit:10405_conv:20811,utterance,speaker,"Well, we are going to do it again.  I'm less worried this time.  I suppose it was just awkward for me since he asked me to do it again."
hit:2304_conv:4608,situation,none,"I'm thinking about becoming a vegan, but I'm not so sure I can do it."
hit:2304_conv:4608,utterance,speaker,"I considered becoming a vegan, but I'm not so sure if it'll work out."
hit:2304_conv:4608,utterance,listener,I have never tried and never will lol
hit:2304_conv:4608,utterance,speaker,"I like the idea of it, for moral reasons, but I can't imagine I'd like any of the food."
hit:2304_conv:4608,utterance,listener,That's what I think. Plus I'd miss bacon too much.
hit:1637_conv:3274,situation,none,"I got a speeding ticket today on my way back from work. I did not believe it so I tried to argue with the cop, still got the the ticket."
hit:1637_conv:3274,utterance,speaker,"I got a speeding ticket today on my way back from work. I did not believe it so I tried to argue with the cop, still got the the ticket."
hit:1637_conv:3274,utterance,listener,That's too bad. Are you thinking about going to court for it?
hit:1637_conv:3274,utterance,speaker,"Yes, I will try to fight it in court. That was just wrong to ticket me for going 32 in a 30 plus I was going down a hill."
hit:1637_conv:3274,utterance,listener,"Yeah, that's a load of whack. I hope you win your case and show those pigs who's boss."
hit:1539_conv:3079,situation,none,I am nervous.  I have to go to court for the first time.
hit:1539_conv:3079,utterance,speaker,I am nervous.. I have to go to court for the first time.
hit:1539_conv:3079,utterance,listener,Oh no! I'm sorry to hear that. I have been to court before; it isn't as scary as it seems.
hit:1539_conv:3079,utterance,speaker,What if I say the wrong thing... Or trip and fall.
hit:1539_conv:3079,utterance,listener,"That won't happen. Even if it does, the judge may have a good laugh and cut you some slack."
hit:3281_conv:6562,situation,none,My husband wants us to move to another state for better job opportunity. I just do not know of it is worth starting over and having no family around.
hit:3281_conv:6562,utterance,speaker,My husband thinks we should move to another state for his job.
hit:3281_conv:6562,utterance,listener,What is the reason? Did he get a great job offer?
hit:3281_conv:6562,utterance,speaker,"He did get a great job offer, but I am just not sure it is worth uprooting our kids and starting all over."
hit:3281_conv:6562,utterance,listener,Families move all the time.The kids will be fine.
hit:7527_conv:15055,situation,none,Im not sire my boyfriend is right for me.
hit:7527_conv:15055,utterance,speaker,I want to break up with my boyfriend
hit:7527_conv:15055,utterance,listener,Sorry to hear that. Is there any specific reason for your decision?
hit:7527_conv:15055,utterance,speaker,I ust think that we are a good mix. He's a cool guy though
hit:7527_conv:15055,utterance,listener,"Does he treat differently now than it was before? If it is still the same, then why breaking his heart?"
hit:6615_conv:13231,situation,none,I'm a bit uneasy with my wife lately.
hit:6615_conv:13231,utterance,speaker,My wife has been extra cranky lately.
hit:6615_conv:13231,utterance,listener,Make her dinner one night to cheer her up
hit:6615_conv:13231,utterance,speaker,That might be good.
hit:6615_conv:13231,utterance,listener,She will enjoy that you are showing that you care.
hit:2929_conv:5858,situation,none,I am very reluctant to confront my boss on her behaviors recently. She is picking on all the male employees for no reason..
hit:2929_conv:5858,utterance,speaker,I am very reluctant to confront my boss on her behaviors recently. She is picking on all the male employees for no reason..
hit:2929_conv:5858,utterance,listener,That's no good.
hit:2929_conv:5858,utterance,speaker,"Yeah, she is acting discriminatory for no reason at all. It really sucks.."
hit:2929_conv:5858,utterance,listener,People aren't tolerating that type of behavior anymore. She had better watch it.
hit:9355_conv:18711,situation,none,I recently was worried about a job interview even though I think it went well. I hope I get it.
hit:9355_conv:18711,utterance,speaker,I recently was worried about a job interview even though I think it went well. I hope I get it.
hit:9355_conv:18711,utterance,listener,"Good for you. I had couple of interviews couple of years ago. Was very nervous, but thankfully they all went well. My advice, just try to hide your nervousness and show confidence"
hit:9355_conv:18711,utterance,speaker,"Thanks, I'll take all the advice I can get!"
hit:9355_conv:18711,utterance,listener,So when are you expected to hear back for final decision on your hire?
hit:3014_conv:6028,situation,none,Welp.. I am a little nervous about going back to school this year.  I am starting at a new school.  An alternative school.
hit:3014_conv:6028,utterance,speaker,Welp.. I am a little nervous about going back to school this year.
hit:3014_conv:6028,utterance,listener,What are you going to school for? Online or in person?
hit:3014_conv:6028,utterance,speaker,I am a teacher.. in person.. Starting at a new school.. an alternative school.
hit:3014_conv:6028,utterance,listener,"Oh that is tough! Oh man, especially at an alternative one. Make sure you do a lot of self care and don't take stuff too personally from kids :)"
hit:2594_conv:5188,situation,none,I'm starting a new job in September. It makes me a bit nervous and scared about how I will fit in
hit:2594_conv:5188,utterance,speaker,I'm starting a new job in September!
hit:2594_conv:5188,utterance,listener,That's awesome. What kind of job?
hit:2594_conv:5188,utterance,speaker,It's a plant manager job so I hope I get along with everyone. I'm somewhat scared that I wont
hit:2594_conv:5188,utterance,listener,You'll do great! That's right up your alley.
hit:11815_conv:23630,situation,none,I was starting a new job and could not sleep the night before. I was feeling extremely anxious about the decision to change jobs.
hit:11815_conv:23630,utterance,speaker,I was starting a new job and could not sleep the night before. I was feeling extremely anxious about the decision to change jobs.
hit:11815_conv:23630,utterance,listener,Did you ease your nerves?
hit:11815_conv:23630,utterance,speaker,"Not really, but after the first day it was a lot easier and I knew that I had made the right choice."
hit:11815_conv:23630,utterance,listener,I'm glad everything worked out for you!
hit:6693_conv:13386,situation,none,"When I first started working out, I was very nervous and apprehensive while lifting weights."
hit:6693_conv:13386,utterance,speaker,i was very nervous and apprehensive when I first started lifting weights again.
hit:6693_conv:13386,utterance,listener,"Good job, it's always good to hit the gym and to stay in shape.  I just started again as well."
hit:6693_conv:13386,utterance,speaker,Awesome! I got over my fear quickly too.
hit:6693_conv:13386,utterance,listener,Just keep at it and I'll do the same! We will be shredded in no time!
hit:6693_conv:13386,utterance,speaker,That's the goal! And losing about 40 lbs!
hit:7985_conv:15971,situation,none,"I have decided to move my son to a new daycare that is closer to home. I really hope I made the right choice, but I am not  sure."
hit:7985_conv:15971,utterance,speaker,I have decided to move my son to a new daycare that is closer to home.
hit:7985_conv:15971,utterance,listener,That sounds rather convenient. Are you giving up anything for that?
hit:7985_conv:15971,utterance,speaker,I am just really hoping that it's the right choice. He is leaving the only friends that he has known so far.
hit:7985_conv:15971,utterance,listener,"If it's too traumatic for him, you can always try to put him back."
hit:11713_conv:23427,situation,none,We're going to the amusement park and roller coaster riding tomorrow
hit:11713_conv:23427,utterance,speaker,I'm not sure if I want to go tomorrow
hit:11713_conv:23427,utterance,listener,Where?  Why are you feeling uncertain?
hit:11713_conv:23427,utterance,speaker,We're supposed to be roller coaster riding tomorrow :/
hit:11713_conv:23427,utterance,listener,"I can understand the nerves, but it will be fun!"
hit:11713_conv:23427,utterance,speaker,I hope so.  I've never ridden one before!
hit:7342_conv:14684,situation,none,My friend has been very distant lately.
hit:7342_conv:14684,utterance,speaker,My friend has been very distant lately.
hit:7342_conv:14684,utterance,listener,"I am sorry, any reason why?"
hit:7342_conv:14684,utterance,speaker,"She says everything is okay, but it's definitely not."
hit:7342_conv:14684,utterance,listener,I am sorry you are going through that
hit:11650_conv:23301,situation,none,I am very worried because I am waiting for a blood test results.
hit:11650_conv:23301,utterance,speaker,I am very worried because I am waiting for a blood test results.
hit:11650_conv:23301,utterance,listener,that is scary! what is the problem?
hit:11650_conv:23301,utterance,speaker,I have pain in multiple joints. I am worried that it could an immune system disease.
hit:11650_conv:23301,utterance,listener,oh im sorry to hear that! i hope it all works out for the best!
hit:12032_conv:24064,situation,none,A homeless person begged me for money the other day. I wasn't sure if I should give it to him because I didn't want him to spend it on drugs or something
hit:12032_conv:24064,utterance,speaker,A homeless person begged me for money the other day.
hit:12032_conv:24064,utterance,listener,I guess he really need it. Did you give him the money?
hit:12032_conv:24064,utterance,speaker,"I wasn't sure if I should give it to him because I didn't want him to spend it on drugs or something, but I did end up giving him 2 dollars."
hit:12032_conv:24064,utterance,listener,"Well, at least you gave him something. He could buy a burger at McDonald's"
hit:5635_conv:11270,situation,none,My kid has been staying late at school so much lately.
hit:5635_conv:11270,utterance,speaker,My kid has been staying late at school so much lately.
hit:5635_conv:11270,utterance,listener,That's kinda sad. Is he studying or something?
hit:5635_conv:11270,utterance,speaker,I think so. I hope she doesn't push herself too hard.
hit:5635_conv:11270,utterance,listener,"Yeah, pushing herself could end up to her having a horrible life."
hit:2373_conv:4746,situation,none,My boss wants to talk to me after lunch. I don't know what it could be about.
hit:2373_conv:4746,utterance,speaker,My boss wants to talk to me after lunch. I don't know what it could be about.
hit:2373_conv:4746,utterance,listener,It could be something good maybe.
hit:2373_conv:4746,utterance,speaker,"I'm hoping so, too. I wish they wouldn't do this."
hit:2373_conv:4746,utterance,listener,"I can only imagine how frustrating that is, that's why I work at home full time."
hit:8799_conv:17599,situation,none,I have to go to the Dentist tomorrow and I'm dreading it. Everything about the dentist's office gives me anxiety.
hit:8799_conv:17599,utterance,speaker,I have to go to the dentist's office tomorrow and I'm dreading it.
hit:8799_conv:17599,utterance,listener,"Oh no, do you have a anxiety pill you could take to calm you down?"
hit:8799_conv:17599,utterance,speaker,"No, I can't really take any medication right now. I wish I could though because everything about the dentist gives me anxiety."
hit:8799_conv:17599,utterance,listener,Bring someone with you that could be emotional support
