Dialog_ID,Type,Actor,Text
hit:4606_conv:9212,utterance,listener,Really?
hit:4606_conv:9212,utterance,speaker,Yeah its going to be fun
hit:4606_conv:9212,utterance,listener,Will you hang out with them?
hit:7917_conv:15835,situation,none,"I'm excited to try out my new 4-wheeler, haven't rode one in years!"
hit:7917_conv:15835,utterance,speaker,"I'm excited to try out my new 4-wheeler, haven't rode one in years!"
hit:7917_conv:15835,utterance,listener,That sounds like a lot of fun. Do you live in the country?
hit:7917_conv:15835,utterance,speaker,My friend has a bunch of acres in the country where we go and ride!
hit:7917_conv:15835,utterance,listener,"Awesome, you will have a blast. Make sure to stay safe."
hit:3641_conv:7283,situation,none,I can't wait for Halloween! I love everything about it like the candy and outfits!
hit:3641_conv:7283,utterance,speaker,I can't wait for Halloween! I love everything about it like the candy and outfits!
hit:3641_conv:7283,utterance,listener,"Do you do the whole nine yards, decorating your home, dressing up to scare the kids?"
hit:3641_conv:7283,utterance,speaker,Duh! I'm pretty old but the kid's expressions never get old! lol
hit:3641_conv:7283,utterance,listener,Do you live somewhere with lots of trick-or-treaters? It sounds like fun.
hit:4708_conv:9417,situation,none,Svhool is in two days. I have never been more happy
hit:4708_conv:9417,utterance,speaker,Two more days and the kids are the school systems problem again lol
hit:4708_conv:9417,utterance,listener,Mine started last week.
hit:4708_conv:9417,utterance,speaker,Im jealous lol
hit:4708_conv:9417,utterance,listener,"I kinda miss them, and our schedule gets a lot busier when schools in."
hit:4708_conv:9417,utterance,speaker,Well I want them to leave first. Then maybe I'll have a chance to miss them
hit:1685_conv:3371,situation,none,I am so hopeful for a bright future
hit:1685_conv:3371,utterance,speaker,I am so hopeful for a bright future
hit:1685_conv:3371,utterance,listener,What is the big end goal?
hit:1685_conv:3371,utterance,speaker,To be a happy and fulfilled person
hit:1685_conv:3371,utterance,listener,I think you can do it.
hit:11904_conv:23808,situation,none,next week !
hit:11904_conv:23808,utterance,speaker,I CAN'T WAIT! I CAN'T WAIT! next week i am finally going to take a holiday
hit:11904_conv:23808,utterance,listener,oh wow that sounds nice
hit:11904_conv:23808,utterance,speaker,thank you! i am so excited! are you going anywhere?
hit:11904_conv:23808,utterance,listener,i just did last week actually
hit:5516_conv:11032,situation,none,"I am super excited for the new super smash bros game, do you like the series?"
hit:5516_conv:11032,utterance,speaker,"I am super excited for the new super smash bros game, do you like the series?"
hit:5516_conv:11032,utterance,listener,"I do, I used to play growing up."
hit:5516_conv:11032,utterance,speaker,"It is worth a look for the new one, it looks awesome to me"
hit:5516_conv:11032,utterance,listener,I will have to try it out!
hit:9314_conv:18629,situation,none,i finally got to go on vacation
hit:9314_conv:18629,utterance,speaker,i finally got to go on vacation
hit:9314_conv:18629,utterance,listener,That's great! Wheer are you gonna go?
hit:9314_conv:18629,utterance,speaker,south padre island texas
hit:9314_conv:18629,utterance,listener,That's a fun place to go. You'll have to be sure to take lots of pics!
hit:398_conv:797,situation,none,"When I was accepted to college, I got to travel there and search for an apartment. My family and I took a plane there and I was ecstatic. I love riding in planes and going to see my college just made it more fun and interesting."
hit:398_conv:797,utterance,speaker,"When I got accepted to my university of choice, my family and I took a trip there. It was a fun experience"
hit:398_conv:797,utterance,listener,I bet that was really exciting!
hit:398_conv:797,utterance,speaker,Yes it was. I was ecstatic to go on a plane.
hit:398_conv:797,utterance,listener,Oh wow that does sound exciting! Are you still at this university?
hit:7429_conv:14859,situation,none,I am looking forward to tomorrow. I am going to church with a friend
hit:7429_conv:14859,utterance,speaker,I am looking forward to tomorrow. I am going to church with a friend
hit:7429_conv:14859,utterance,listener,Cool. I haven't ben to chrch in a while
hit:7429_conv:14859,utterance,speaker,"Its okay, it happens"
hit:7429_conv:14859,utterance,listener,I should make time to go though
hit:527_conv:1054,situation,none,Im really happy and ready for the start of my next year of uni.
hit:527_conv:1054,utterance,speaker,Im happy that the next year of uni is starting
hit:527_conv:1054,utterance,listener,Oh! It's excellence. Hope you enjoy your next year
hit:527_conv:1054,utterance,speaker,"Yea i cant wait, its nice being around a lot of people, my normal city is pretty boring"
hit:527_conv:1054,utterance,listener,"yeah! you're right. Once you've moved there, you started to love your city too!"
hit:6257_conv:12514,situation,none,i cant wait for the weekend!
hit:6257_conv:12514,utterance,speaker,i cant wait for the weekend!
hit:6257_conv:12514,utterance,listener,Oh I feel the exact opposite! lol. What are you looking forward too?
hit:6257_conv:12514,utterance,speaker,not having to wake up at 4am to go to work!
hit:6257_conv:12514,utterance,listener,OHH! That would be wonderful! Sleeping in is the best when you can do it!
hit:4297_conv:8594,situation,none,My friend sent me a package from Germany. i had no idea what was inside.
hit:4297_conv:8594,utterance,speaker,My friend sent me a package from Germany. i had no idea what was inside.
hit:4297_conv:8594,utterance,listener,Uh oh!!  I hope it wasn't a prank lol
hit:4297_conv:8594,utterance,speaker,No not at all. It was full of different food items. I was so anxious opening it though.
hit:4297_conv:8594,utterance,listener,I bet.  I would be too!  Was the food good??
hit:6452_conv:12904,situation,none,I am looking forward to the weekend. The new soccer season starts
hit:6452_conv:12904,utterance,speaker,I can't wait for the new soccer season to start
hit:6452_conv:12904,utterance,listener,Do you play?
hit:6452_conv:12904,utterance,speaker,No I just watch. I'm too old (and fat) to play now
hit:6452_conv:12904,utterance,listener,"If you have a favorite team, I hope they have a good season!"
hit:6452_conv:12904,utterance,speaker,Thanks. Me too
hit:8588_conv:17176,situation,none,I can't wait for Friday to get here!
hit:8588_conv:17176,utterance,speaker,I can't wait for Friday to get here!
hit:8588_conv:17176,utterance,listener,Me either! Do you have any plans?
hit:8588_conv:17176,utterance,speaker,"Yes, I'm going tubing down some rapids.  I love doing it every year and its supposed to me sunny and clear!"
hit:8588_conv:17176,utterance,listener,That's sounds like a blast! I've never been courageous enough to attempt that.
hit:12411_conv:24822,situation,none,I just bought my first house.  I get to move in next week.
hit:12411_conv:24822,utterance,speaker,I just bought my first house.  I get to move in next week.
hit:12411_conv:24822,utterance,listener,Oh wow that is so exciting! I'm sure you are excited to move in.
hit:12411_conv:24822,utterance,speaker,I really am.  My wife and I are going to go puppy shopping the day after we move in since we can finally have one!
hit:12411_conv:24822,utterance,listener,"Aww that's great! I have two dogs, they become part of the family! Enjoy your new house :)"
hit:438_conv:876,situation,none,am going to see my cousin this weekend its going to be fun
hit:438_conv:876,utterance,speaker,So I think we are all going to see the cousins new boat this weekend!
hit:438_conv:876,utterance,listener,Ah that sounds like a good time. Hope it doesn't rain for you guys.
hit:438_conv:876,utterance,speaker,We are supposed to get some showers in the morning but thats it
hit:438_conv:876,utterance,listener,Yea the radars are usually accurate. Cook good food for me.
hit:4610_conv:9221,situation,none,Day after tomorrow we planned to go a family trip. I'm anxious to go for it.
hit:4610_conv:9221,utterance,speaker,We planned a family trip day after tomorrow!
hit:4610_conv:9221,utterance,listener,Where are you going
hit:4610_conv:9221,utterance,speaker,It's nearby picnic area. I'm anxious to go for it.
hit:4610_conv:9221,utterance,listener,It will be fun
hit:8111_conv:16222,situation,none,I recently got accepted into a prestigious film school.
hit:8111_conv:16222,utterance,speaker,"I'm so stoked, I just got into the film school of my dreams."
hit:8111_conv:16222,utterance,listener,AMAZING! Congrats!
hit:8111_conv:16222,utterance,speaker,I know I am beyond thrilled. I've been wanting to go for years.
hit:8111_conv:16222,utterance,listener,How long does film school last?
hit:8111_conv:16222,utterance,speaker,It's a three year program.
hit:398_conv:796,situation,none,My husband and I had been wanting a camper for about 1 year. Last week we finally found the camper of our dreams and now have our first camping trip planned.
hit:398_conv:796,utterance,speaker,My husband and I finally found the camper of our dreams after about a year of wanting one and we finally have our first camping trip planned!
hit:398_conv:796,utterance,listener,Oh thats sounds fun! How much did it cost you?
hit:398_conv:796,utterance,speaker,Not near as much as we thought because we got an awesome deal!
hit:398_conv:796,utterance,listener,Thats great. Will you be camping in the mountains or a foresty place?
hit:3086_conv:6172,situation,none,Bumped into this girl I used to have a crush on in High School.
hit:3086_conv:6172,utterance,speaker,Bumped into this girl I used to have a crush on in High School.
hit:3086_conv:6172,utterance,listener,Thats exciting.  How did that go?
hit:3086_conv:6172,utterance,speaker,Pretty well. Turns out she's never dated since and has been busy with grad school.
hit:3086_conv:6172,utterance,listener,That's almost a little strange.  Do you still have any interest in her?
hit:753_conv:1506,situation,none,I'm going on vacation in 3 hours! Super stoked!
hit:753_conv:1506,utterance,speaker,I'm going on vacation in 3 hours! Super stoked!
hit:753_conv:1506,utterance,listener,Cool! Where are you going?
hit:753_conv:1506,utterance,speaker,Japan. My work is financing some of it.
hit:753_conv:1506,utterance,listener,Wow! Have you been there before? They have an amazing culture
hit:8071_conv:16143,situation,none,I am going on vacation next week.  I cant wait.  I really need time off from work
hit:8071_conv:16143,utterance,speaker,I cannot wait until next week.  I am going on vacation!
hit:8071_conv:16143,utterance,listener,How exciting! Where to?
hit:8071_conv:16143,utterance,speaker,Were going to Disney world.  I need to take time off of work.  I really need a break.  So excited!!!
hit:8071_conv:16143,utterance,listener,I am happy for you and hope you have a lot of fun!
hit:7465_conv:14931,situation,none,When my dad got me a new pair of skates. I feel so lucky.
hit:7465_conv:14931,utterance,speaker,I just got some new bauer skates.
hit:7465_conv:14931,utterance,listener,What kind of skates it that?
hit:7465_conv:14931,utterance,speaker,A hockey skate!
hit:7465_conv:14931,utterance,listener,"O, nice, do you play a lot?"
hit:7465_conv:14931,utterance,speaker,I do I'm going to tryout for the triple A team actually. My dad got me some skates.
hit:9165_conv:18330,situation,none,A new skating rink is being built. Should be done in time for Winter skating!
hit:9165_conv:18330,utterance,speaker,A new skating rink is being built. Should be done in time for Winter skating
hit:9165_conv:18330,utterance,listener,That's pretty nice! I haven't been skating in a coon's age. Is the rink nice?
hit:9165_conv:18330,utterance,speaker,"So far, it looks pretty nice!"
hit:9165_conv:18330,utterance,listener,That's great! I may look it up and go to their grand opening as well.
hit:7333_conv:14667,situation,none,I am looking forward to tomorrow. We are going kayaking
hit:7333_conv:14667,utterance,speaker,I am looking forward to tomorrow. We are going kayaking
hit:7333_conv:14667,utterance,listener,"That sounds like so much fun -- and like a break you're looking forward to, yes?"
hit:7333_conv:14667,utterance,speaker,"Yeah, it should be really fun"
hit:7333_conv:14667,utterance,listener,Have you been before? It seems like such a great way to both play and get a workout ;-)
hit:5659_conv:11318,situation,none,I'm taking my kids to Six Flags this weekend! It'll be a surprise for them!
hit:5659_conv:11318,utterance,speaker,This weekend I'm taking my kids to Six Flags
hit:5659_conv:11318,utterance,listener,That is nice. Do you take them frequently?
hit:5659_conv:11318,utterance,speaker,Not very often so they're gonna be really surprised.
hit:5659_conv:11318,utterance,listener,That is a good surprised.
hit:5929_conv:11858,situation,none,Going to some mma fights!
hit:5929_conv:11858,utterance,speaker,I can't wait for Saturday!
hit:5929_conv:11858,utterance,listener,What happens on Saturday?
hit:5929_conv:11858,utterance,speaker,I'm going to an MMA show in Louisville.  There's going to be a bunch of awesome fights!
hit:5929_conv:11858,utterance,listener,That sounds really cool. Have fun!
hit:5929_conv:11858,utterance,speaker,I'm sure I will.  I can't wait!
hit:737_conv:1474,situation,none,I was very happy  lastnight
hit:737_conv:1474,utterance,speaker,I was very happy because my result was out
hit:737_conv:1474,utterance,listener,"Must have been a good result.  Was it for a job, school, or for medical results?"
hit:737_conv:1474,utterance,speaker,Yes I made excellent result
hit:737_conv:1474,utterance,listener,"I am sure your family was proud of you, as well!"
hit:1996_conv:3993,situation,none,I just can't wait for this weekend.
hit:1996_conv:3993,utterance,speaker,I just can't wait for this weekend
hit:1996_conv:3993,utterance,listener,what about it?
hit:1996_conv:3993,utterance,speaker,My family and I are going camping in the mountains.
hit:1996_conv:3993,utterance,listener,really? that seems to be an amazing event
hit:7984_conv:15969,situation,none,I can't wait for kids to start school tomorrow. They have been driving me crazy all summer long!
hit:7984_conv:15969,utterance,speaker,I absolutely can't wait for my kids to go back to school tomorrow. They have been driving me crazy all summer!
hit:7984_conv:15969,utterance,listener,Bet you'll be glad to have some free time on your hands at last.
hit:7984_conv:15969,utterance,speaker,"Yes, I can finally catch up on Netflix and get the house clean. Can't wait!"
hit:7984_conv:15969,utterance,listener,lol - yeah I can relate. Kids can be a real handful when they don't have structure - as in during the summer months.
hit:3222_conv:6444,situation,none,I am going on a cruise next month with my friend. I have been saving up for this for so long. I have never been on a cruise before. I cannot wait!
hit:3222_conv:6444,utterance,speaker,"I have never been on a cruise before, but I am going on one next month with my best friend."
hit:3222_conv:6444,utterance,listener,That sounds amazing!   What do you have planned?
hit:3222_conv:6444,utterance,speaker,"We have so many activities planned; scuba diving, parasailing, and relaxing! I have been saving up for this for so long. I cannot wait!"
hit:3222_conv:6444,utterance,listener,That sounds great!
hit:131_conv:263,situation,none,I am ready for hockey season.
hit:131_conv:263,utterance,speaker,"I love hockey, are you ready for the season?"
hit:131_conv:263,utterance,listener,"I am, I like the Oilers, who's your favorite team?"
hit:131_conv:263,utterance,speaker,I love the Leafs.
hit:131_conv:263,utterance,listener,"Nice, I hope they do well this season."
hit:5707_conv:11414,situation,none,I am so happy for date night. We had to cancel the last few.
hit:5707_conv:11414,utterance,speaker,I am so ready for date night.
hit:5707_conv:11414,utterance,listener,Yes! that can be once of the best times of the week.
hit:5707_conv:11414,utterance,speaker,We had to cancel the last 3 so this is gonna be special
hit:5707_conv:11414,utterance,listener,yes! are you going to a fancy restaurant ??
hit:5707_conv:11414,utterance,speaker,Yep and then to an art show
hit:9875_conv:19750,situation,none,Waiting for my cake to done. Gonna be yum yum yum!
hit:9875_conv:19750,utterance,speaker,Waiting for my cake to done. Gonna be yum yum yum!
hit:9875_conv:19750,utterance,listener,what kind of cake cake cake?
hit:9875_conv:19750,utterance,speaker,pineapple turnover cake! Gonna pimp it up with cherries.
hit:9875_conv:19750,utterance,listener,oh you try baking it with the cherries on already ? its great
hit:825_conv:1651,situation,none,"Tomorow, I am starting a trip of six months to visit different country. I am so happy and I cannot sleep."
hit:825_conv:1651,utterance,speaker,"Tomorow, I am starting a trip of six months to visit different country. I am so happy and I cannot sleep."
hit:825_conv:1651,utterance,listener,I recently got back from a trip abroad as well! Traveling is a blast. Where are you going?
hit:825_conv:1651,utterance,speaker,"I am visiting France, Egypt, Thailand, India. I having saving money for this for the last four years"
hit:825_conv:1651,utterance,listener,"Dang, now that sounds like a swell adventure. Which one are you most excited to visit?"
hit:1462_conv:2925,situation,none,I had been planning a trip to Europe for months and finally got all my tickets and hostel reservations. It was such a rush to realize it was actually going to happen.
hit:1462_conv:2925,utterance,speaker,I had been planning a trip to Europe for months and finally got all my tickets and hostel reservations. It was such a rush to realize it was actually going to happen.
hit:1462_conv:2925,utterance,listener,Wow. That's exciting!
hit:1462_conv:2925,utterance,speaker,Now I feel bad bringing it up when you've had such annoying neighbors.
hit:1462_conv:2925,utterance,listener,Its not that bad. I'll get to Europe one day lol
hit:3671_conv:7343,situation,none,I'm looking forward to my cousin's future! She is almost done with med school and is getting married soon!
hit:3671_conv:7343,utterance,speaker,I'm looking forward to my cousin's future! She is almost done with med school and is getting married soon!
hit:3671_conv:7343,utterance,listener,What kind of doctor is she going to be?
hit:3671_conv:7343,utterance,speaker,She is currently studying neurology so I think that is something to do with the brain?
hit:3671_conv:7343,utterance,listener,"That is impressive, where is she having her wedding?!"
hit:3671_conv:7343,utterance,speaker,"She hasn't told me yet, but I am anticipating it to be in Hawaii or some other island!"
hit:3671_conv:7343,utterance,listener,I would suggest Fiji it's so nice there I went in august!
hit:9380_conv:18760,situation,none,I am so ready for my birthday party.
hit:9380_conv:18760,utterance,speaker,I am so ready for my birthday party.
hit:9380_conv:18760,utterance,listener,Happy Birthday to You!  I love birthdays so much.  Just recently celebrated by youngest daughter's 14th birthday on August 9th and my granddaughter's 4th birthday on August 10th.  When is/was your birthday?
hit:9380_conv:18760,utterance,speaker,Mine is July 1st. Did you have a party for them?
hit:9380_conv:18760,utterance,listener,My daughter just had a nice birthday dinner with family.  My granddaughter had a couple of parties. What kind of party do you plan on having?
hit:1957_conv:3914,situation,none,When I was eight my parents got me a dog for Christmas.
hit:1957_conv:3914,utterance,speaker,When I was eight my parents got me a dog for Christmas.
hit:1957_conv:3914,utterance,listener,A dog is an awesome gift for a little kid.  I bet you were super excited.
hit:1957_conv:3914,utterance,speaker,To this day I remember it as the best Christmas of my life.
hit:1957_conv:3914,utterance,listener,"I bet!  Maybe I should get my kids a dog for Christmas, I know it would be a great choice for them."
hit:8677_conv:17354,situation,none,My brownies are almost done!  They smell so gooood!!
hit:8677_conv:17354,utterance,speaker,Oh man it smells SOO good in here!!!
hit:8677_conv:17354,utterance,listener,Did you just clean your place?
hit:8677_conv:17354,utterance,speaker,No.  I've got brownies in the oven!!!
hit:8677_conv:17354,utterance,listener,"Mmmm, I love that brownie smell.  Also nothing better than fresh brownies."
hit:8677_conv:17354,utterance,speaker,That's right!  I can't wait until they're done!
hit:3221_conv:6443,situation,none,Im having movie night with my toddlers tomorrow. They like good movies.
hit:3221_conv:6443,utterance,speaker,Tomorrow is movie night!
hit:3221_conv:6443,utterance,listener,What movie is it
hit:3221_conv:6443,utterance,speaker,SING for the 100th time. My kids love that movie
hit:3221_conv:6443,utterance,listener,Well as long as they love it
hit:3221_conv:6443,utterance,speaker,Last day of summer vacation I can watch it once more
hit:8762_conv:17524,situation,none,I get to go to Greece in a few weeks! I've been wanting to go there forever
hit:8762_conv:17524,utterance,speaker,I get to go to Greece in a few weeks!
hit:8762_conv:17524,utterance,listener,"Wow, how did you afford that?"
hit:8762_conv:17524,utterance,speaker,I budgeted for a year to make sure I could afford it. Well worth it!
hit:8762_conv:17524,utterance,listener,"Awesome, I hope it is all worth it"
hit:1859_conv:3718,situation,none,I am excited for the new super smash bros game coming out for the switch soon
hit:1859_conv:3718,utterance,speaker,I am excited for the new super smash bros game coming out for the switch soon
hit:1859_conv:3718,utterance,listener,wow i am happy for you
hit:1859_conv:3718,utterance,speaker,"thank you, it is a few months away still"
hit:1859_conv:3718,utterance,listener,around christmas right
hit:4360_conv:8720,situation,none,I am really happy when I see the Mile 22 trailer.
hit:4360_conv:8720,utterance,speaker,I am really happy when I see the Mile 22 trailer.
hit:4360_conv:8720,utterance,listener,I'm not sure what that is. Tell me about it?
hit:4360_conv:8720,utterance,speaker,It is an action movie with Mark Wahlberg.
hit:4360_conv:8720,utterance,listener,"Oh, okay, I believe I know what you are talking about now. He is a good actor and usually his movies are great!"
hit:9981_conv:19962,situation,none,Beach vacation coming up!!
hit:9981_conv:19962,utterance,speaker,Man this weekend is gonna be AWESOME
hit:9981_conv:19962,utterance,listener,I feel ya! Do you have any big plans?
hit:9981_conv:19962,utterance,speaker,Oh heck yeah!!!  We're going to Florida to the beach!!
hit:9981_conv:19962,utterance,listener,"Nice! I've been in San Diego for the past two weeks hitting up the beach. I wish I could go with ya, since my vacation is coming to an end!"
hit:9981_conv:19962,utterance,speaker,Oh nooo!  I'm gonna be feeling those blues about a week from now.   Come on with us!
hit:5125_conv:10250,situation,none,I am pumped for this weekend.  I am going to the lake for a 3 day weekend.
hit:5125_conv:10250,utterance,speaker,I cannot wait for this weekend.  I am going to the lake for a 3 day weekend.
hit:5125_conv:10250,utterance,listener,That sounds fun! Do you have a boat or jet skis?
hit:5125_conv:10250,utterance,speaker,I have a jet ski.  It is a blast to ride on the lake with it.
hit:5125_conv:10250,utterance,listener,Oh for sure! I love riding jet skis!
hit:6142_conv:12285,situation,none,I am looking forward to the weekend. We are going to a baseball game
hit:6142_conv:12285,utterance,speaker,I am looking forward to this weekend. We are going to a baseball game
hit:6142_conv:12285,utterance,listener,Very nice. The weather should be perfect.
hit:6142_conv:12285,utterance,speaker,I hope it is
hit:6142_conv:12285,utterance,listener,Drink a few beers and have a hotdog for me. Should be fun.
hit:2443_conv:4886,situation,none,I am going to meet up with a special friend I haven't seen for  years
hit:2443_conv:4886,utterance,speaker,I am going to meet up with a special friend I haven't seen for years
hit:2443_conv:4886,utterance,listener,Well that's nice. What are you going to do?
hit:2443_conv:4886,utterance,speaker,We are meeting for breakfast on Saturday
hit:2443_conv:4886,utterance,listener,That's pretty cool. I don't see my friends much since I moved.
hit:10516_conv:21032,situation,none,My husband and I were engaged for a year and a half. The day of our wedding was quickly approaching. I was so ecstatic for the day to be here!
hit:10516_conv:21032,utterance,speaker,Nothing really quite compares to the feeling you get when something exciting is about to happen. I still remember how I felt the days leading up to my wedding.
hit:10516_conv:21032,utterance,listener,"Were you jittery at all? I know I was when I was getting ready for mine,"
hit:10516_conv:21032,utterance,speaker,I was definitely jittery but mostly excited. We'd been engaged for a year and a half and I was ready for the day!
hit:10516_conv:21032,utterance,listener,That's awesome. I hope it was an amazing ceremony. Weddings are always so much fun and romantic.
hit:3365_conv:6731,situation,none,My mother once suprised me with a vacation
hit:3365_conv:6731,utterance,speaker,once my mother woke me up and told me we were going to disney land
hit:3365_conv:6731,utterance,listener,Wow that sounds like a lot of fun!
hit:3365_conv:6731,utterance,speaker,"It was indeed,  I had never felt that happy before in my life"
hit:3365_conv:6731,utterance,listener,What was your favorite part of the trip?
hit:8488_conv:16976,situation,none,Going fishing this weekend!
hit:8488_conv:16976,utterance,speaker,Can't wait for this weekend
hit:8488_conv:16976,utterance,listener,What do you have planned?
hit:8488_conv:16976,utterance,speaker,Taking the kids to the lake and going fishing!
hit:8488_conv:16976,utterance,listener,"That's going to be fun, little catch and release?"
