Dialog_ID,Type,Actor,Text
hit:5336_conv:10673,utterance,speaker,"Its me and my fiances anniversary next month and keeps dropping hints about what hes getting me, and I have no idea what it is because I have not told him I wanted anything. Its puzzling but makes me eager to see."
hit:5336_conv:10673,utterance,listener,Anticipation sucks. The hints don't help you figure it out?
hit:5336_conv:10673,utterance,speaker,"No, they're more like, ""I know what I'm getting you"" and then when went over bills he was like Im going use money for your gift, non specific type of hints Lol"
hit:5336_conv:10673,utterance,listener,HAHA that's a shame. It's just like having to stare at Christmas gifts for a month but not being able to open them as a kid.
hit:8945_conv:17890,situation,none,I am going to go see a band I have wanted to see for a long time. I had tried in the past but it just hadn't worked out.
hit:8945_conv:17890,utterance,speaker,I am going to see a band that i have wanted to see for a long time.
hit:8945_conv:17890,utterance,listener,That's awesome. What band is it?
hit:8945_conv:17890,utterance,speaker,Postmodern Jukebox
hit:8945_conv:17890,utterance,listener,Never heard of it. I hope it was a good show!
hit:5047_conv:10094,situation,none,"I am ready for the weekend, I get to go see my favorite band."
hit:5047_conv:10094,utterance,speaker,"I am ready for the weekend, I get to go see my favorite band."
hit:5047_conv:10094,utterance,listener,"Well, that's fun! I bet you are really excited about it."
hit:5047_conv:10094,utterance,speaker,"Yes, I got front row tickets. It is going to be epic."
hit:5047_conv:10094,utterance,listener,"Oh, front row tickets make it even better! Have a great time."
hit:6532_conv:13064,situation,none,I'm planning on going to a party with my girlfriend after work. It's supposed to be a lot of fun! I can't wait to go!
hit:6532_conv:13064,utterance,speaker,I'm going to go to a party after work with my girlfriend. I think it'll be so much fun. I can't wait!
hit:6532_conv:13064,utterance,listener,sounds great
hit:6532_conv:13064,utterance,speaker,I think so. Just about 12 more hours till party time!
hit:6532_conv:13064,utterance,listener,have fun!
hit:3894_conv:7788,situation,none,I'm going to try out the new Japanese restaurant that just opened up next weekend.
hit:3894_conv:7788,utterance,speaker,I'm going to try out the new Japanese restaurant that just opened up next weekend.
hit:3894_conv:7788,utterance,listener,I bet that will be fun
hit:3894_conv:7788,utterance,speaker,My coworkers rave about the place. I'm psyched to go.
hit:3894_conv:7788,utterance,listener,I do like that food a lot
hit:8403_conv:16806,situation,none,I got pretty happy and joyful yesterday. We were going to see a movie I had wanted to see
hit:8403_conv:16806,utterance,speaker,I was pretty happy yesterday. I was going to see a movie I had wanted to see
hit:8403_conv:16806,utterance,listener,what did you see?
hit:8403_conv:16806,utterance,speaker,The new mission impossible
hit:8403_conv:16806,utterance,listener,i hear that movie is great
hit:8403_conv:16806,utterance,speaker,It was so good
hit:4442_conv:8885,situation,none,I am looking forward to my vacation.  I can't wait!
hit:4442_conv:8885,utterance,speaker,I am looking forward to my vacation.
hit:4442_conv:8885,utterance,listener,Thats a nice thing to be coming up. Are you planning to go somewhere?
hit:4442_conv:8885,utterance,speaker,I'm going to Hawaii.  I can't wait for it!
hit:4442_conv:8885,utterance,listener,"Oh sweet. hawaii is a tropical paradise, you are going to love it"
hit:2188_conv:4376,situation,none,I was super excited when I got my new phone! I saved up for a few weeks for it.
hit:2188_conv:4376,utterance,speaker,I just got a new phone. It was the one I wanted and for a great deal! I don't like spending money but I figured the better one would last longer.
hit:2188_conv:4376,utterance,listener,a good phone is something everyone must have
hit:2188_conv:4376,utterance,speaker,Well it's helpful in my rough neighborhood to have a good working phone and video. Also I use it for work. I love having an xperia again!
hit:2188_conv:4376,utterance,listener,you're the first person i know that has an xperia
hit:4049_conv:8098,situation,none,My boyfriend surprised me with flowers today.
hit:4049_conv:8098,utterance,speaker,My boyfriend surprised me with flowers today.
hit:4049_conv:8098,utterance,listener,That is so romantic. I also try to surprise my girlfriend occasionally with some little gifts
hit:4049_conv:8098,utterance,speaker,You should totally do it! You will earn a lot of brownie points.
hit:4049_conv:8098,utterance,listener,Such things even though may seem little have much positive impact on couple's relationship
hit:1752_conv:3505,situation,none,There is a concert coming to town and I can hardly wait to see it.
hit:1752_conv:3505,utterance,speaker,There is a concert coming to town and I can hardly wait to see it
hit:1752_conv:3505,utterance,listener,Whos playing?
hit:1752_conv:3505,utterance,speaker,Pink. She is such an amazing performer.
hit:1752_conv:3505,utterance,listener,Omg. I love her.
hit:5210_conv:10420,situation,none,I've got lasagna in the oven. I hope it turns our well!
hit:5210_conv:10420,utterance,speaker,I've got lasagna in the oven. I hope it turns our well!
hit:5210_conv:10420,utterance,listener,I am sure it will
hit:5210_conv:10420,utterance,speaker,Thanks. I can smell it now.
hit:5210_conv:10420,utterance,listener,I bet it smells nice
hit:9421_conv:18842,situation,none,I just purchased my first new car!
hit:9421_conv:18842,utterance,speaker,I just got my very first new car!
hit:9421_conv:18842,utterance,listener,"Wow, congratulations! Did you save up a long time for it? What kind of car is it?"
hit:9421_conv:18842,utterance,speaker,"I feel like I saved forever, it's a camary."
hit:9421_conv:18842,utterance,listener,"I love that model, man I'm jealous. I bet it was agonizing to have to save and resist the temptation, but wow it's so worth it now, huh?"
hit:9421_conv:18842,utterance,speaker,It's totally worth it. It's the first car I've had that wasn't used.
hit:9421_conv:18842,utterance,listener,"You are going to love that thing for a long time, seriously congratulations!"
hit:5931_conv:11863,situation,none,I am super excited to try a few new supplements I have learned about.
hit:5931_conv:11863,utterance,speaker,I am super intrigued to try a few new supplements I have learned about.
hit:5931_conv:11863,utterance,listener,That's cool.  What type of supplements
hit:5931_conv:11863,utterance,speaker,"Chlorella, Bitter Apricot and Wheatgrass. All should help me detox, get my gut in line and give me some much needed vitamins I can absorb."
hit:5931_conv:11863,utterance,listener,That sounds pretty healthy.  Have you always been this health conscious
hit:5931_conv:11863,utterance,speaker,I wasn't but I have been trying to stay on organic for years..when you get older and get health problems and doctors only want to ignore you or prescribe pills and make it worse- It's good to research and help yourself.
hit:9443_conv:18886,situation,none,I am finally going to be able to afford my new piercing soon. I have been wanting it for a while.
hit:9443_conv:18886,utterance,speaker,I am finally going to be able to afford to get my new piercing soon. I have been wanting it for soo long.
hit:9443_conv:18886,utterance,listener,"That sounds interesting, I would love to get a piercing. Where will you be getting the piercing?"
hit:9443_conv:18886,utterance,speaker,I am going to be doing a double nose piercing. So two in one nostril
hit:9443_conv:18886,utterance,listener,"Darn it! I have never seen that before, now I am would like to see what it looks like"
hit:1018_conv:2036,situation,none,Excited when the Lakers got Lebron.
hit:1018_conv:2036,utterance,speaker,Excited when the Lakers got Lebron.
hit:1018_conv:2036,utterance,listener,Oh no. Not another Lebron story.
hit:1018_conv:2036,utterance,speaker,"yes of course, all day!"
hit:1018_conv:2036,utterance,listener,I know. He is a great player though.
hit:11_conv:23,situation,none,"Last week, I was watching the world cup, and watched croatia win from russia"
hit:11_conv:23,utterance,speaker,"So last week we were watching the world cup, and lo and behold, Croatia beat the host country, Russia"
hit:11_conv:23,utterance,listener,I saw that game. They won on penalty kicks!
hit:11_conv:23,utterance,speaker,Yes! Both countries were not about to let each other win
hit:11_conv:23,utterance,listener,It was very tense. The other game with England and Sweden was not nearly as nerve-wracking.
hit:11_conv:23,utterance,speaker,"You're right. I prefer nerve-wrecking matches. When both teams are great, the tension really builds."
hit:8029_conv:16059,situation,none,I'm getting a new phone soon. I've wanted one for ages and I'm looking forward to it.
hit:8029_conv:16059,utterance,speaker,I'm getting a new phone soon and I'm really looking forward to it!
hit:8029_conv:16059,utterance,listener,Nice! Which one you getting?
hit:8029_conv:16059,utterance,speaker,Oneplus 6 hopefully!
hit:8029_conv:16059,utterance,listener,Dang! Now that is a savvy phone! I have 12 of them.
hit:7625_conv:15250,situation,none,I was happy to know my application for scholarship was considered for an award
hit:7625_conv:15250,utterance,speaker,I wanted money for college
hit:7625_conv:15250,utterance,listener,What did you do to get it?
hit:7625_conv:15250,utterance,speaker,Good grades and a convincing cover letter
hit:7625_conv:15250,utterance,listener,Well done then. When do you start?
hit:7625_conv:15250,utterance,speaker,Thank you. Fall 2019
hit:7625_conv:15250,utterance,listener,I hope it all goes well.
hit:977_conv:1954,situation,none,I love dogs and yesterday I got to watch a friend's puppy for a week while they were on vacation. He was adorable.
hit:977_conv:1954,utterance,speaker,My friend's went on vacation for a week and I got to watch their super adorable puppy for a week!
hit:977_conv:1954,utterance,listener,That's awesome! I love dog sitting no matter the occasion!
hit:977_conv:1954,utterance,speaker,"Yea, they're fun even when they're jerks lol. He's a little Jack Russell so he's got quite the energy"
hit:977_conv:1954,utterance,listener,That sounds like a good way to have fun and get some exercise!
hit:4450_conv:8901,situation,none,waiting to hear if i got a job or not.
hit:4450_conv:8901,utterance,speaker,i cant get any sleep. i want to know if i got the job or not.
hit:4450_conv:8901,utterance,listener,"hope you get the job , i would feel the exact same way"
hit:4450_conv:8901,utterance,speaker,i have a very good feeling about it!!
hit:4450_conv:8901,utterance,listener,i really hope you get it
hit:9724_conv:19448,situation,none,I have a really awesome beach trip coming up next week. I cant wait to take some time off of work.
hit:9724_conv:19448,utterance,speaker,I cant wait to take some time off of work. I have an awesome beach trip coming up next week.
hit:9724_conv:19448,utterance,listener,Thats awesome.  Make sure you wear sunscreen.  Dont want to get burned
hit:9724_conv:19448,utterance,speaker,That would be the worst. I cant wait to just lay around all day drinking cold beers on the beach.
hit:9724_conv:19448,utterance,listener,I need some time off of work too.  Maybe I should take a vacation!
hit:1929_conv:3858,situation,none,"I used to be overly enthusiastic if a girl gave me any kind of attention, which scared them away...it's funny how now that I'm a more apathetic person girls find me attractive. Human beings are weird"
hit:1929_conv:3858,utterance,speaker,I used to scare girls away by being overly enthusiastic. it's funny how now that I'm a more apathetic person girls find me attractive. Human beings are weird
hit:1929_conv:3858,utterance,listener,"Lol , I think my son has done that , he use to embrasse me when I would go to the store when he was little by crying a lot"
hit:1929_conv:3858,utterance,speaker,Interesting...so as a mother do you get embarrassed if your son is too clingy in public?
hit:1929_conv:3858,utterance,listener,"No any more he is a lot older and does pretty good on his own , but the thing is he is always close by if we in the store together .Yes I do believe that the human are weird"
hit:3184_conv:6369,situation,none,About to open a restaurant with my friend. I hope it goes well.
hit:3184_conv:6369,utterance,speaker,About to open a restaurant with my friend. I hope it goes well.
hit:3184_conv:6369,utterance,listener,Oh yeah? What is going to be your hallmark meal?
hit:3184_conv:6369,utterance,speaker,Probably the sushi and steak special.
hit:3184_conv:6369,utterance,listener,Can't go wrong the sushi and steak special. A classic in Alaska.
hit:7449_conv:14899,situation,none,When I won a hundred dollars on a scratch off ticket. I felt very lucky in that moment.
hit:7449_conv:14899,utterance,speaker,"Just got back from the store, ended up winning $100!"
hit:7449_conv:14899,utterance,listener,On a scratch ticket?
hit:7449_conv:14899,utterance,speaker,"Yep on a scratch ticket, got 3 apples!"
hit:7449_conv:14899,utterance,listener,I never win anything
hit:7449_conv:14899,utterance,speaker,I got so lucky in this moment.
hit:7449_conv:14899,utterance,listener,You sure did
hit:7449_conv:14899,utterance,speaker,What should I spend my winnings on?
hit:7449_conv:14899,utterance,listener,Beer and more tickets
hit:45_conv:90,situation,none,I was going to see the new Marvel movie. On the way I got really pumped up.
hit:45_conv:90,utterance,speaker,So I went to see the new Marvel movie with Thanos. It was so good and I am so pumped up now.
hit:45_conv:90,utterance,listener,What was it. I've been too busy to notice new movies out.
hit:45_conv:90,utterance,speaker,It was called Infinity War! You should find time to see it.
hit:45_conv:90,utterance,listener,They do put out good movies most of the time. I will try and check it out.
hit:45_conv:90,utterance,speaker,I think the new villain Thanos might be my favorite bad guy ever!
hit:8319_conv:16638,situation,none,The new wow expansion just launched.
hit:8319_conv:16638,utterance,speaker,The new wow expansion just launched.
hit:8319_conv:16638,utterance,listener,Are you excited about it?
hit:8319_conv:16638,utterance,speaker,Indeed I am.
hit:8319_conv:16638,utterance,listener,Whats new in the game?
hit:8319_conv:16638,utterance,speaker,"New races, new places to go. new story lines."
hit:1384_conv:2769,situation,none,I am very excited to play the new pokemon game coming out for the nintendo switch soon
hit:1384_conv:2769,utterance,speaker,I am very excited to play the new pokemon game coming out for the nintendo switch soon
hit:1384_conv:2769,utterance,listener,i am excited for you
hit:1384_conv:2769,utterance,speaker,"I am too, it is a really fun game, I cannot wait to see what else they do for it"
hit:1384_conv:2769,utterance,listener,will you be playing it a lot ?
hit:6270_conv:12540,situation,none,i cant wait for the weekend!
hit:6270_conv:12540,utterance,speaker,i cant wait for the weekend!
hit:6270_conv:12540,utterance,listener,big plans?
hit:6270_conv:12540,utterance,speaker,gonna go to the coast and chillax
hit:6270_conv:12540,utterance,listener,I wish I could go and chillax anywhere
hit:7524_conv:15048,situation,none,I can't wait to go on vacation this fall.
hit:7524_conv:15048,utterance,speaker,I can't wait to go on vacation this fall
hit:7524_conv:15048,utterance,listener,"where are you going , im excited for you"
hit:7524_conv:15048,utterance,speaker,"I'll be going to Nara, Japan this time."
hit:7524_conv:15048,utterance,listener,"wow my friend at work was born in japan , she married a u.s. solder then moved here"
hit:3841_conv:7682,situation,none,"I get to take a cruise in a few weeks. Finally, all my preparation has come to fruition"
hit:3841_conv:7682,utterance,speaker,I get to take a cruise in a few weeks!
hit:3841_conv:7682,utterance,listener,YAY! where are you going??
hit:3841_conv:7682,utterance,speaker,"I get to go to Italy, Croatia, and other places. It's going to be a blast!"
hit:3841_conv:7682,utterance,listener,I CANT BELIEVE THAT.  I need a vacation so badly.
hit:12296_conv:24592,situation,none,I'm really looking forward to starting my new semester next week. I'm really looking forward to it.
hit:12296_conv:24592,utterance,speaker,I'm really looking forward to starting my new semester next week.
hit:12296_conv:24592,utterance,listener,You want to start school back up?  What are you going for?
hit:12296_conv:24592,utterance,speaker,"I'm getting a masters in education. Yeah, I feel like summer break has been good but it's time to get back on it."
hit:12296_conv:24592,utterance,listener,I bet that is a lot of work!  Do you already teach?
hit:12296_conv:24592,utterance,speaker,"It is unfortunately! Yes, I am doing that full time in a high school now."
hit:9334_conv:18669,situation,none,"I was outside playing with my dogs earlier. Throwing the ball around, they got so playful and ran around as fast as they could!"
hit:9334_conv:18669,utterance,speaker,"I was outside playing with my dogs earlier. Throwing the ball around, they got so playful and ran around as fast as they could!"
hit:9334_conv:18669,utterance,listener,That's so cool! I really wish I had a dog!
hit:9334_conv:18669,utterance,speaker,They are the best! Cats are also great though
hit:9334_conv:18669,utterance,listener,I really like cats but I want a dog at some point.
hit:2984_conv:5969,situation,none,I can't wait for the movie Venom to come out! It's going to be awesome.
hit:2984_conv:5969,utterance,speaker,I can't wait for the movie Venom to come out! It's going to be awesome.
hit:2984_conv:5969,utterance,listener,When does it come out?
hit:2984_conv:5969,utterance,speaker,October 5
hit:2984_conv:5969,utterance,listener,What is it about?
hit:11218_conv:22437,situation,none,I'm going to a concert this weekend for one of my favorite bands.
hit:11218_conv:22437,utterance,speaker,"This weekend, I'm going to a concert for one of my favorite bands!"
hit:11218_conv:22437,utterance,listener,Neat! What typeof music is the concert for?
hit:11218_conv:22437,utterance,speaker,"Hard Rock. It's the band Breaking Benjamin, who I've liked since I was a kid, and have always wanted to see live."
hit:11218_conv:22437,utterance,listener,Interesting! I've never hear their music before!
hit:3795_conv:7591,situation,none,Only 3 more days until I go on vacation. I am so ready for the beach! I can't wait.
hit:3795_conv:7591,utterance,speaker,In three more days I finally get to go on vacation. I can't wait.
hit:3795_conv:7591,utterance,listener,"dude that is freakin awesome , im sure you earned it"
hit:3795_conv:7591,utterance,speaker,"Yeah, we are hitting the beach. I've been waiting so long."
hit:3795_conv:7591,utterance,listener,"i hope you have a lot of fun , i cant wait to go on my vacation as well"
hit:6794_conv:13589,situation,none,I'm excited for the plums on my plum tree to ripen
hit:6794_conv:13589,utterance,speaker,I'm excited for the plums on my plum tree to ripen
hit:6794_conv:13589,utterance,listener,I'm sure they'll be delicious.
hit:6794_conv:13589,utterance,speaker,"They are, they are usually very sweet"
hit:6794_conv:13589,utterance,listener,I'm glad they came in for you.
hit:2276_conv:4552,situation,none,I purchased a new truck today.
hit:2276_conv:4552,utterance,speaker,I purchased a new truck today.
hit:2276_conv:4552,utterance,listener,"Wow great,  are you happy with your purchase?"
hit:2276_conv:4552,utterance,speaker,Yes. its the first new vehicle i've ever purchased too.
hit:2276_conv:4552,utterance,listener,Congratulation! i hope you enjoy it.
hit:2276_conv:4552,utterance,speaker,I will thanks!
hit:2276_conv:4552,utterance,listener,Was it a good deal?
hit:2276_conv:4552,utterance,speaker,It was a fair price. and its 4 wheel drive.
hit:2276_conv:4552,utterance,listener,Excellent that it was a great value
hit:8254_conv:16509,situation,none,One more month and I get to go on a vacation to the beach!  Its been 5 years so I'm chomping at the bit!  Yay!
hit:8254_conv:16509,utterance,speaker,One more month and I get to go on a vacation to the beach! Its been 5 years so I'm chomping at the bit! Yay!
hit:8254_conv:16509,utterance,listener,Excellent! Which beach?
hit:8254_conv:16509,utterance,speaker,"Outer Banks, North Carolina.  I love that area!  We'll be in Corolla."
hit:8254_conv:16509,utterance,listener,I'm jealous.
hit:8254_conv:16509,utterance,speaker,"I know, for years I've been hearing my friends and family going without me and felt the same way.  I finally saved up enough money and got it when it was much cheaper."
hit:5128_conv:10257,situation,none,I was really excited to hear that my son was playing in a band!
hit:5128_conv:10257,utterance,speaker,I'm happy to hear that he found a great band.
hit:5128_conv:10257,utterance,listener,What kind of band
hit:5128_conv:10257,utterance,speaker,bluegrass
hit:5128_conv:10257,utterance,listener,I like that music
hit:5128_conv:10257,utterance,speaker,He loves it!
hit:3493_conv:6987,situation,none,I am in such a good mood.  I am going on vacation tomorrow!!!  Going to Hawaii.
hit:3493_conv:6987,utterance,speaker,I am in the best of moods... I am going on vacation tomorrow!
hit:3493_conv:6987,utterance,listener,I bet! Where are you going on vacation?
hit:3493_conv:6987,utterance,speaker,Hawaii!  I have been saving forever!
hit:3493_conv:6987,utterance,listener,"Wow! Hawaii sounds like a great place to vacay.  I have never been there, have you?"
hit:3493_conv:6987,utterance,speaker,"Nope.. thats why I am so excited.  With the volcano stuff and all it has been sorta grim, but I can still make the best of it."
hit:3493_conv:6987,utterance,listener,"Oh yeah, I didn't even think about that.  It was terrifying to watch on tv.  I hope you are staying somewhere safe."
hit:3493_conv:6987,utterance,speaker,I am it is a mission trip but I am taking part of it as a normal vaca too
hit:3493_conv:6987,utterance,listener,That's awesome.  Are you traveling with others?
hit:8097_conv:16195,situation,none,I can't wait for my new laptop to arrive.
hit:8097_conv:16195,utterance,speaker,I can't wait for my new laptop to arrive
hit:8097_conv:16195,utterance,listener,I bet your so excited! I just got one last month too and it makes my life so much easier!
hit:8097_conv:16195,utterance,speaker,I am! My old laptop is like AOL slow. Can barely get anything done!
hit:8097_conv:16195,utterance,listener,AOL slow Lol.. I certainly know how you feel! I would have expedited it to me!
hit:5726_conv:11453,situation,none,I found twenty dollars in my pants!
hit:5726_conv:11453,utterance,speaker,I found twenty dollars in my pants!@
hit:5726_conv:11453,utterance,listener,What did you do with the money?
hit:5726_conv:11453,utterance,speaker,I bought myself something nice!
hit:5726_conv:11453,utterance,listener,What was it? Was it clothing?
hit:1595_conv:3191,situation,none,I am very excited to try a new lip stick and I found it for a good price.
hit:1595_conv:3191,utterance,speaker,Well I find a new organic lip stick brand and found it for a good price and I am really happy to get it in the mail and try it!
hit:1595_conv:3191,utterance,listener,Oh nice. What color is it?
hit:1595_conv:3191,utterance,speaker,It  is a mauve. Lipstick queen! I can't always afford much so it's always nice when I can afford lipstick lol! especially a healthy kind.
hit:1595_conv:3191,utterance,listener,"Interesting to see how muave works. That's a shade of purple, isn't it?"
hit:11654_conv:23308,situation,none,I am going on vacation next week and can't wait!
hit:11654_conv:23308,utterance,speaker,I can't wait to go on vacation!
hit:11654_conv:23308,utterance,listener,I love vacation! Where are you going?
hit:11654_conv:23308,utterance,speaker,California to see all of my family!
hit:11654_conv:23308,utterance,listener,That sounds so lovely
hit:11654_conv:23308,utterance,speaker,I haven't seen them for years so it will be a lot of fun!
hit:1352_conv:2705,situation,none,I am excited to try a new diet.
hit:1352_conv:2705,utterance,speaker,I am trying out a new Fodmaps diet because of all my health issues and I am excited about it!
hit:1352_conv:2705,utterance,listener,That's great! I hope it goes well for you!
hit:1352_conv:2705,utterance,speaker,Me too! I have tried everything else.
hit:1352_conv:2705,utterance,listener,Good luck!
hit:243_conv:486,situation,none,I went to a new restaurant with friends I hadn't seen in a long time.
hit:243_conv:486,utterance,speaker,The other day I met up with some friends I hadn't seen in a while
hit:243_conv:486,utterance,listener,What did you and your friends do on that day?
hit:243_conv:486,utterance,speaker,We went to a new restaurant none of us had ever been to. It was fun!
hit:243_conv:486,utterance,listener,That does sound fun! Was the food good?
hit:9029_conv:18058,situation,none,My wife surprised me with football tickets. I cannot wait to go this season!
hit:9029_conv:18058,utterance,speaker,I was so happy when my wife surprised me with preseason football tickets.
hit:9029_conv:18058,utterance,listener,Now that's quite a gift! Are you going to take her to any games as a thank you?
hit:9029_conv:18058,utterance,speaker,"Oh yeah, I definitely want her to join me. We've gone to a lot of tailgate events, too. Going to be a great football season!"
hit:9029_conv:18058,utterance,listener,I've been looking forward to it starting too. Not a lot going on at the moment. But that's wonderful to hear!
hit:2163_conv:4326,situation,none,I am excited I get to go to the thrift store and get some nice clothes this weekend.
hit:2163_conv:4326,utterance,speaker,I get to go to the thrift store this weekend and I haven't been in a long time! It's one of my favorite places to shop
hit:2163_conv:4326,utterance,listener,I love going to the thrift stores as well! What did you by
