Dialog_ID,Type,Actor,Text
hit:6629_conv:13259,situation,none,"I'm happy that it is almost Fall, my favorite time of year."
hit:6629_conv:13259,utterance,speaker,I'm glad that Fall is almost here.
hit:6629_conv:13259,utterance,listener,"Okay, but I'm pretty sure we aren't done yet."
hit:6629_conv:13259,utterance,speaker,5
hit:5954_conv:11909,situation,none,I am going on a cruise next month with some friends. I cannot wait!
hit:5954_conv:11909,utterance,speaker,I am going on a cruise next month with some friends.
hit:5954_conv:11909,utterance,listener,That should be fun. Where does the cruise go to?
hit:5954_conv:11909,utterance,speaker,We are going to the Bahamas. I cannot wait! It is going to be so fun!
hit:5954_conv:11909,utterance,listener,The Bahamas is beautiful. I am sure you will love it.
hit:9598_conv:19196,situation,none,Im am starting my new job on Monday! I cant wait to get started.
hit:9598_conv:19196,utterance,speaker,I am starting my new job on Monday! I cant wait to get started. I will be working with two of my best friends.
hit:9598_conv:19196,utterance,listener,What kind of job is it?
hit:9598_conv:19196,utterance,speaker,I will be working at the zoo. Its going to be so much fun!
hit:9598_conv:19196,utterance,listener,Thats interesting!
hit:7891_conv:15782,situation,none,I'm taking a trip to New York for the first time! I am looking forward to it!
hit:7891_conv:15782,utterance,speaker,I'm taking a trip to New York for the first time!
hit:7891_conv:15782,utterance,listener,Awesome! Are you going alone?
hit:7891_conv:15782,utterance,speaker,"No, with my boyfriend! I am looking forward to it!"
hit:7891_conv:15782,utterance,listener,That's great! Is it for vacation?
hit:7388_conv:14776,situation,none,I'm getting married next weekend!
hit:7388_conv:14776,utterance,speaker,I'm getting married next weekend!
hit:7388_conv:14776,utterance,listener,Wow congratulations! Will it be a big ceremony?
hit:7388_conv:14776,utterance,speaker,"No, we are just going to go sign the papers lol. We're saving for a home."
hit:7388_conv:14776,utterance,listener,"That's smart, I think big weddings are a waste of money honestly."
hit:1504_conv:3009,situation,none,I got happy when I knew I was going to six flags. I could not wait
hit:1504_conv:3009,utterance,speaker,I got happy when I knew I was going to six flags. I could hardly wait
hit:1504_conv:3009,utterance,listener,Six Flags is such a fun park! Are you a fan of roller coasters?
hit:1504_conv:3009,utterance,speaker,I love riding those
hit:1504_conv:3009,utterance,listener,They are! Cedar Point has some gnarly roller coasters too.
hit:9059_conv:18118,situation,none,I am so ready to go to the Yankees game tomorrow.
hit:9059_conv:18118,utterance,speaker,I am so ready to go to the Yankees  game tomorrow.
hit:9059_conv:18118,utterance,listener,"Oh, who are they playing?"
hit:9059_conv:18118,utterance,speaker,They are playing Tampa Bay.
hit:9059_conv:18118,utterance,listener,That will be so fun!
hit:1185_conv:2371,situation,none,A new piece of workout equipment I ordered just came in. I'm really excited to try it out.
hit:1185_conv:2371,utterance,speaker,I just got a new piece of workout equipment in the mail. Can't wait to try it out.
hit:1185_conv:2371,utterance,listener,wow thats awesome
hit:1185_conv:2371,utterance,speaker,Yeah. It's a special type of bar that allows you to do different movements that you can't do with a regular barbell.
hit:1185_conv:2371,utterance,listener,sounds like you will be using that often
hit:1185_conv:2371,utterance,speaker,Oh I plan on it! It will boost my progress into overdrive!
hit:3756_conv:7513,situation,none,"My grand mum bought me a gold watch as a birthday gift,  that really made me happy"
hit:3756_conv:7513,utterance,speaker,I have really wished to have one ever since I lost the one my mum bought during my convocation
hit:3756_conv:7513,utterance,listener,What are you talking about?
hit:3756_conv:7513,utterance,speaker,I am talking about a gold watch my grandma bought for me
hit:3756_conv:7513,utterance,listener,Oh ok. That's awesome. It's nice to have something of value.
hit:495_conv:990,situation,none,Going to California for the first time.
hit:495_conv:990,utterance,speaker,I recently got to visit California for the first time. It's a pretty incredible place.
hit:495_conv:990,utterance,listener,I've always wanted to go there! What did you like most about it?
hit:495_conv:990,utterance,speaker,The weather. It's the same temperature and humidity everyday. Makes packing easy.
hit:495_conv:990,utterance,listener,"I bet! I'm guessing it must be good weather, then?"
hit:495_conv:990,utterance,speaker,Oh yea. Just above 70 with a light breeze.
hit:5132_conv:10265,situation,none,I won the opportunity to go up in a hot air balloon. Wonder who I should take with me.
hit:5132_conv:10265,utterance,speaker,I won the opportunity to go up in a hot air balloon. Wonder who I should take with me.
hit:5132_conv:10265,utterance,listener,Any gf or bf? That would be scary yet wonderful!
hit:5132_conv:10265,utterance,speaker,Nope. Living the single life. Might take family or a friend.
hit:5132_conv:10265,utterance,listener,I would take someone who would be thrilled about it :)
hit:9082_conv:18165,situation,none,"I'm pumped for my next leg day. Been eating really well lately and getting enough sleep, I'm gonna go all out"
hit:9082_conv:18165,utterance,speaker,"I'm stoked for leg day.  Been eating really well lately and getting enough sleep, I'm gonna go all out"
hit:9082_conv:18165,utterance,listener,Leg day? Never heard of that. Do explain.
hit:9082_conv:18165,utterance,speaker,The gym.
hit:9082_conv:18165,utterance,listener,Oh yeah now I get it. Hope you get a good workout in.
hit:8398_conv:16797,situation,none,The time my stepdad got me and my brother a dog. I wasn't expecting it.
hit:8398_conv:16797,utterance,speaker,My stepdad got me a dog!
hit:8398_conv:16797,utterance,listener,whats the dogs name ? what kind is it
hit:8398_conv:16797,utterance,speaker,It's a big husky we haven't named her yet but we like her.
hit:8398_conv:16797,utterance,listener,oh those are nice loyal dogs.
hit:8723_conv:17446,situation,none,"I bought a few $3 lottery tickets at the store just for fun one night knowing I probably would not win a thing. I won $50,000 to my surprise!"
hit:8723_conv:17446,utterance,speaker,"I never win anything but took a chance on buying a few lottery tickets the and I won $50,000!"
hit:8723_conv:17446,utterance,listener,"Wow, that must have made you feel so good about yourself."
hit:8723_conv:17446,utterance,speaker,"Considering I never win, it made it even more awesome, yes!"
hit:8723_conv:17446,utterance,listener,It's such a great joy to win something. I hope your luck continues.
hit:1063_conv:2126,situation,none,I get to visit my long distance girlfriend in less than a week!
hit:1063_conv:2126,utterance,speaker,I get to visit my long distance girlfriend in less than a week!
hit:1063_conv:2126,utterance,listener,I bet you are excited for that
hit:1063_conv:2126,utterance,speaker,"Yeah, no kidding. I love traveling, and obviously love seeing her. Gonna suck that it only lasts a couple weeks though."
hit:1063_conv:2126,utterance,listener,"Yeah, it's always hard to leave in those situations. Are you flying to see her?"
hit:5923_conv:11846,situation,none,I have been waiting for my union members points to come in the mail so I can get two free movie tickets. Ive been wanting to see the new Jurassic Park movie and can't wait!
hit:5923_conv:11846,utterance,speaker,I have been waiting for my union members points to come in the mail so I can get two free movie tickets. Ive been wanting to see the new Jurassic Park movie and can't wait!
hit:5923_conv:11846,utterance,listener,What are union memners points?
hit:5923_conv:11846,utterance,speaker,My Fiance is a part of a union for communications workers and they have rewards points you get to redeem for different things. The points and perks alone arent worth the union fees in my opinion but he wants to be a part of it so
hit:5923_conv:11846,utterance,listener,Oh. Maybe they should lower the fees or up the rewards
hit:6152_conv:12304,situation,none,"I am so pumped for the new Super Smash Bros game, it looks amazing"
hit:6152_conv:12304,utterance,speaker,"I am so pumped for the new Super Smash Bros game, it looks amazing"
hit:6152_conv:12304,utterance,listener,"I saw that, I can't wait to play!"
hit:6152_conv:12304,utterance,speaker,"Me neither, they are doing this game right for the fans, I am pumped"
hit:6152_conv:12304,utterance,listener,"Yes! I was astounded how good it looks, didn't expect it to be like that!"
hit:222_conv:444,situation,none,"I decided to I would buy a few lottery tickets. My luck is normally not all that great. I scratched the 3 lottery tickets I bought and won $50,000!"
hit:222_conv:444,utterance,speaker,"I won $50,000 on one of the 3 scratch off tickets I recently bought!"
hit:222_conv:444,utterance,listener,Holy smokes - thats unbelievable.  I gave up on playing those scratch off games
hit:222_conv:444,utterance,speaker,I know! I normally do not win so I could not believe it when I did!
hit:222_conv:444,utterance,listener,How often do you play?
hit:7129_conv:14258,situation,none,I went to the perk to meet with a friend I havent seen in a long time
hit:7129_conv:14258,utterance,speaker,Yesterday I went to the park to meet with a long time friend I haven't seen since we graduated in highschool
hit:7129_conv:14258,utterance,listener,Cool - how did it go?
hit:7129_conv:14258,utterance,speaker,"It was very good, we catch up with a lot of things"
hit:7129_conv:14258,utterance,listener,Good. Have you arranged to meet again?
hit:7129_conv:14258,utterance,speaker,"Yes, next week"
hit:7129_conv:14258,utterance,listener,Brilliant. It's like having a new friend.
hit:7129_conv:14258,utterance,speaker,"Yes, and there are so many things we could do, he is also new in the city"
hit:3550_conv:7101,situation,none,I am so elated. I am going on a vacation tomorrow.
hit:3550_conv:7101,utterance,speaker,I am so elated!  I am going on a vacation tomorrow!
hit:3550_conv:7101,utterance,listener,Where are you headed?
hit:3550_conv:7101,utterance,speaker,I am going to North Korea.. I can't wait!
hit:3550_conv:7101,utterance,listener,"Wow, that should be interesting, have fun!"
hit:7488_conv:14976,situation,none,im gonna move to a different state
hit:7488_conv:14976,utterance,speaker,"im so happy ill be leaving this state , and moving to another one and start all over"
hit:7488_conv:14976,utterance,listener,"That sounds like a great adventure, where you moving."
hit:7488_conv:14976,utterance,speaker,"to new york , my brother lives there he attends west point"
hit:7488_conv:14976,utterance,listener,"That's fun. Ever been there, it's super fun."
hit:3919_conv:7839,situation,none,I can't wait for the release of the new Super Smash Brothers game.
hit:3919_conv:7839,utterance,speaker,I can't wait for the release of the new Super Smash Brothers game.
hit:3919_conv:7839,utterance,listener,That is a really fun game.  I wonder how they will make it better than the original.
hit:3919_conv:7839,utterance,speaker,Well I hope they will find a good way because I don't want it to be similar to Smash 4.
hit:3919_conv:7839,utterance,listener,There is nothing worse than spending big money on a game it's no good.
hit:3397_conv:6794,situation,none,One of my favorite actors is doing a singing gig locally and I am going to get to go see him. I can hardly wait.
hit:3397_conv:6794,utterance,speaker,"""One of my favorite actors is doing a singing gig locally and I am going to get to go see him. I can hardly wait."
hit:3397_conv:6794,utterance,listener,That is great! What actor is it?
hit:3397_conv:6794,utterance,speaker,Someone who I have watched perform in movies and on TV and never knew he could sing.
hit:3397_conv:6794,utterance,listener,That sounds like a great time. I hope you have fun.
hit:858_conv:1717,situation,none,I cant wait for christmas. We are getting a new tree and new start!
hit:858_conv:1717,utterance,speaker,Im already getting pumped up for christmas this year...
hit:858_conv:1717,utterance,listener,I love Christmas!
hit:858_conv:1717,utterance,speaker,Me too especially this year.. new apartment for us new state. Whats your fav part of the holiday?
hit:858_conv:1717,utterance,listener,Seeing my kids open their gifts. I never make it to Christmas because I'm so excited to see them lol
hit:858_conv:1717,utterance,speaker,"Its such a good feeling right, the best! :)"
hit:858_conv:1717,utterance,listener,I never get anything but that's fine
hit:341_conv:683,situation,none,I'm going to a drink and paint party tomorrow. It should be pretty fun!
hit:341_conv:683,utterance,speaker,I have fun plans this weekend over a friends house.
hit:341_conv:683,utterance,listener,What are your plans?
hit:341_conv:683,utterance,speaker,My friend is having a drink and paint party. I've only been to one before but it was pretty fun. I can't wait.
hit:341_conv:683,utterance,listener,"Wow, that sounds like a fun and interesting time, but it sounds like there are a high chance for things to go south and be a huge mess"
hit:4555_conv:9111,situation,none,I am so thrilled about the new shark movie coming out. I got early tickets!
hit:4555_conv:9111,utterance,speaker,"I am a huge fan of sharks, and I am thrilled to go to the new shark film coming out!"
hit:4555_conv:9111,utterance,listener,me too I love them and I am very excited as well
hit:4555_conv:9111,utterance,speaker,Awesome! The movie looks quite fun and have some good effects.
hit:4555_conv:9111,utterance,listener,I know they'll make so much money from it within the first week of release
hit:9511_conv:19023,situation,none,I just won a bet against my friend while watching the horse races.
hit:9511_conv:19023,utterance,speaker,I just won a bet against my friend while watching the horse races.
hit:9511_conv:19023,utterance,listener,That's great! What did you win?
hit:9511_conv:19023,utterance,speaker,$400 thanks to Red. I opted not to bet with a big group because I don't know much about horses.
hit:9511_conv:19023,utterance,listener,"I don't blame you. I don't know anything about Horses, but congrats on winning the bet"
hit:8397_conv:16794,situation,none,I am looking forward to the end of the month. I am happy about football officially starting
hit:8397_conv:16794,utterance,speaker,I am looking forward to the end of the month. I am happy about football officially starting
hit:8397_conv:16794,utterance,listener,"Nice, how much do you bench?"
hit:8397_conv:16794,utterance,speaker,"I am not sure, I don't really bench a lot"
hit:8397_conv:16794,utterance,listener,"I see,  how many years have you been playing football/what kind of goals do you have?"
hit:4721_conv:9442,situation,none,I am really hype for the upcoming super smash bros game in december
hit:4721_conv:9442,utterance,speaker,I am really hype for the upcoming super smash bros game in december
hit:4721_conv:9442,utterance,listener,I remember playing that on the wii
hit:4721_conv:9442,utterance,speaker,"Me too, that was a great game!"
hit:4721_conv:9442,utterance,listener,Will it be available on xbox?
hit:8362_conv:16724,situation,none,I am going to be pretty happy and joyful next week thinking my next trip. We are going to asheville
hit:8362_conv:16724,utterance,speaker,I am going to be happy next week thinking about a trip I am going on. We are going to asheville.
hit:8362_conv:16724,utterance,listener,What is in Asheville?
hit:8362_conv:16724,utterance,speaker,A lot of cool breweries
hit:8362_conv:16724,utterance,listener,Oh that sounds very fun.
hit:7832_conv:15664,situation,none,"I can't wait for the new Super Smash Brothers game to be released, it seems like a lot of fun."
hit:7832_conv:15664,utterance,speaker,"I can't wait for the new Super Smash Brothers game to be released, it seems like a lot of fun."
hit:7832_conv:15664,utterance,listener,"Heck yeah! I loved that game on the n64, we used to play it all the time in college!"
hit:7832_conv:15664,utterance,speaker,"That's so cool, I'm glad you enjoyed it too! This one has a lot of new characters."
hit:7832_conv:15664,utterance,listener,"I'll be sure to check this out! My brother has a switch I can ""borrow""!"
hit:5923_conv:11847,situation,none,Friday is movie night. My kids always pick the best movies. I can't wait.
hit:5923_conv:11847,utterance,speaker,We have movie night on Friday
hit:5923_conv:11847,utterance,listener,Sounds fun! What movie are you going to watch?
hit:5923_conv:11847,utterance,speaker,I don't know yet. Its my daughter turn. The kids always pick gun movies
hit:5923_conv:11847,utterance,listener,Oh. Well that's lovely.. I suppose. Lol. Maybe you should amend the movie night rules with a different theme every time so they are more constrained to what they have to choose from! Haha!
hit:5923_conv:11847,utterance,speaker,I meant fun movies not gun movies lol
hit:6520_conv:13041,situation,none,I am taking my first ever trip to California next week. I can't wait to go! I've heard so many great things about the place!
hit:6520_conv:13041,utterance,speaker,I'm taking my first ever trip to California! I can't wait to go. I've heard so many great things about the place!
hit:6520_conv:13041,utterance,listener,Wow - I've nver been but would love to go.
hit:6520_conv:13041,utterance,speaker,Well it seems like a place everyone should check out!
hit:6520_conv:13041,utterance,listener,Definitely. And it never rains in Southern CAlifornia.
hit:6520_conv:13041,utterance,speaker,Yeah that is true from what I've heard. There's been so much rain where I am these past few weeks
hit:262_conv:524,situation,none,I remember when I won my first Starcraft match.
hit:262_conv:524,utterance,speaker,I couldn't believe it!  When the battle started to swing my way I remember starting to get that feeling that I may win.
hit:262_conv:524,utterance,listener,What battle? What were you doing?
hit:262_conv:524,utterance,speaker,I was playing 1v1 Starcraft on the competitive ladder.
hit:262_conv:524,utterance,listener,Is that a video game?
hit:8021_conv:16043,situation,none,really pumped for the broly movie
hit:8021_conv:16043,utterance,speaker,"i am a big dragon ball super fan, and im really looking forward for the new movie broly that lands on january , i cant wait !!!"
hit:8021_conv:16043,utterance,listener,Yeah me too! Are you going to go with anyone?
hit:8021_conv:16043,utterance,speaker,"probably all my friends , they are big fans too"
hit:8021_conv:16043,utterance,listener,Nice! I am sure it is going to be a ball of a time.
hit:8398_conv:16796,situation,none,i was happy to see my package arrived in the mail
hit:8398_conv:16796,utterance,speaker,i was happy to see my package arrived in the mail
hit:8398_conv:16796,utterance,listener,What did you get in the mail?
hit:8398_conv:16796,utterance,speaker,a russian tortoise
hit:8398_conv:16796,utterance,listener,"That's so cool, what is his name?"
hit:617_conv:1235,situation,none,My brother and sister in law are coming to town next week. I can't wait!
hit:617_conv:1235,utterance,speaker,I'm planning what to do when my relatives come to visit next week. It will be so nice to see them
hit:617_conv:1235,utterance,listener,"Wooow, that's nice... You all will have fun together"
hit:617_conv:1235,utterance,speaker,"Yes, I think we will.  We live near an amusement park and I'm sure we'll go there one day!"
hit:617_conv:1235,utterance,listener,Yeah for sure...  So where are they coming from??
hit:10980_conv:21961,situation,none,I can't wait to finish my degree so I can become a nurse1
hit:10980_conv:21961,utterance,speaker,I can't wait to finish my degree so I can become a nurse!
hit:10980_conv:21961,utterance,listener,What made you want to be a nurse?
hit:10980_conv:21961,utterance,speaker,I imagine that it is an incredibly fulfilling and rewarding job. It's also a very needed job so I know that I'll always find a job somewhere.
hit:10980_conv:21961,utterance,listener,"That's good, it's a lot of work, sure you are ready for that?"
hit:10980_conv:21961,utterance,speaker,"I believe so! I know it's incredibly stressful, but it must feel great to directly make a positive impact on someones life."
hit:7387_conv:14775,situation,none,i cant wait for next week!
hit:7387_conv:14775,utterance,speaker,i cant wait for next week!
hit:7387_conv:14775,utterance,listener,What's going on next week?
hit:7387_conv:14775,utterance,speaker,the kids go back to school
hit:7387_conv:14775,utterance,listener,"Oh yea, how could I forget that. How many kids do you have?"
hit:7387_conv:14775,utterance,speaker,4 of them!
hit:10897_conv:21795,situation,none,I've been saving money for a while now. I almost have enough money to put a down payment on a home.
hit:10897_conv:21795,utterance,speaker,I'm thinking about owning my first home.
hit:10897_conv:21795,utterance,listener,That's awesome! Is something holding you back?
hit:10897_conv:21795,utterance,speaker,"Well, I've been putting money away for a while now. I've almost got enough for a down payment."
hit:10897_conv:21795,utterance,listener,Buying a home can be nerve wracking but in the end it's worth it!
hit:10897_conv:21795,utterance,speaker,"Yeah, I can't wait!"
hit:10897_conv:21795,utterance,listener,Wishing you luck and here's to finding the perfect home!
hit:12198_conv:24397,situation,none,My 4 year old gets to start preschool in a week.
hit:12198_conv:24397,utterance,speaker,So my 4 year old gets to start preschool in a week.
hit:12198_conv:24397,utterance,listener,Oh how exciting! Are you at all worried how they'll take being separated?
hit:12198_conv:24397,utterance,speaker,A little. I think that's normal though. Glad he'll start to make new friends though.
hit:12198_conv:24397,utterance,listener,Definitely. It will probably be tougher on you than him. Here's to a wonderful first day of preschool for both of you!
hit:379_conv:758,situation,none,I was promoted to a managerial level in my company
hit:379_conv:758,utterance,speaker,I got the promotion letter when I least expected it
hit:379_conv:758,utterance,listener,Awesome! What type of promotion? Did you get a raise too?
hit:379_conv:758,utterance,speaker,I WS promoted to the sales manager
hit:379_conv:758,utterance,listener,Congrats for what store or company? Did you get a raise too?
hit:379_conv:758,utterance,speaker,In an insurance company with a good pay check
hit:7009_conv:14019,situation,none,My husband is going on a fishing trip with some of his friends in October.  I'm actually looking forward to it - just some time with my girls doing girl stuff!
hit:7009_conv:14019,utterance,speaker,My husband is going on a fishing trip with some of his guy friends in October.
hit:7009_conv:14019,utterance,listener,That sounds like fun. How do you feel about it?
hit:7009_conv:14019,utterance,speaker,"I'm actually looking forward to it.  A whole four days just me and my girls to do girl stuff, eat pizza, watch tear jerker movies, stay up all night talking, etc.."
hit:7009_conv:14019,utterance,listener,That sounds like a great time!
hit:4547_conv:9094,situation,none,"I'm going back to college in a few weeks. I get my own room in this really new, nice place so I'm really looking forward to it."
hit:4547_conv:9094,utterance,speaker,I'm going back to college soon and I don't have to live in the freshman dorms anymore. I'm stoked for that.
hit:4547_conv:9094,utterance,listener,Congratulations! It must be exciting to live on your own!
hit:4547_conv:9094,utterance,speaker,"Yeah it really is, though I'm living with 3 other people just that I get my own room this time around."
hit:4547_conv:9094,utterance,listener,It's nice to have company and make close friends during college.
hit:1170_conv:2341,situation,none,I am positive about my next vacation.
hit:1170_conv:2341,utterance,speaker,I am so happy about my next vacation.
hit:1170_conv:2341,utterance,listener,Awesome!  Where are you going!  I am jealous!
hit:1170_conv:2341,utterance,speaker,I am going to visit Rome for the first time.
hit:1170_conv:2341,utterance,listener,No I am really jealous!  I have wanted to go there for the longest time.  I am happy for you!
hit:9984_conv:19969,situation,none,My daughter will turn 16 next month and I cannot wait!  We are giving her a new to her car that we've been working on for almost a year now!
hit:9984_conv:19969,utterance,speaker,My daugher will turn 16 next month and I cannot wait!!
hit:9984_conv:19969,utterance,listener,Oh wow! I bet she and you are so excited about it!
hit:9984_conv:19969,utterance,speaker,"We've been working on a car for her for almost a year now, getting it ready and restoring it.  Cannot wait to give it to her."
hit:9984_conv:19969,utterance,listener,What a nice surprise that is! I bet you anticipate her to love it!
hit:3239_conv:6479,situation,none,I am so excited for this semester. I got all of the classes I wanted.
hit:3239_conv:6479,utterance,speaker,I got all the classes I wanted this semester
hit:3239_conv:6479,utterance,listener,Oh that could be tough sometimes. I'm glad you were able to get all the ones you wanted.
hit:3239_conv:6479,utterance,speaker,Yep. Last semester I wasnt so lucky
hit:3239_conv:6479,utterance,listener,It's all behind you now.
hit:391_conv:783,situation,none,"I finally got my dream car,hard work pays !"
hit:391_conv:783,utterance,speaker,Guest what? It was a Ferrari...!!!
hit:391_conv:783,utterance,listener,"I cant actually see what you put in the prompt, but man thats crazy if it was a ferrari."
hit:391_conv:783,utterance,speaker,I said guess what! A custom made Ferrari with luxurious taste
hit:391_conv:783,utterance,listener,"I love Ferraris, they are so expensive though, one day I hope to own one."
