Dialog_ID,Type,Actor,Text
hit:7319_conv:14639,situation,none,i was happy to see that i have next week off!
hit:7319_conv:14639,utterance,speaker,i was happy to see that i was off next week
hit:7319_conv:14639,utterance,listener,That's really awesome! What are you going to be doing with your time?
hit:7319_conv:14639,utterance,speaker,just chillin is about all i have planned so far.
hit:7319_conv:14639,utterance,listener,Well that's good! A little rest and relaxation is always good!
hit:1879_conv:3759,situation,none,I have received a response from a company that I had applied for a job. They are inviting me for an interview
hit:1879_conv:3759,utterance,speaker,I have received an e-mail response from a company inviting me for an interview. I am so thrilled for hearing back from them
hit:1879_conv:3759,utterance,listener,"That is great, is it far from home?"
hit:1879_conv:3759,utterance,speaker,"It is only 10 miles driving. I hope I can just go and nail the whole interview, leaving the whole crew impressed with my skills"
hit:1879_conv:3759,utterance,listener,"That is not bad at all, best of luck with that!"
hit:8185_conv:16371,situation,none,I cant wait for my trip next week!
hit:8185_conv:16371,utterance,speaker,I cant wait for my trip next week!
hit:8185_conv:16371,utterance,listener,where is your trip at? why are you so exited
hit:8185_conv:16371,utterance,speaker,its las vegas. i love being around all the excitement one mine and all the depression the next :)
hit:8185_conv:16371,utterance,listener,"wow i have always wanted to go to las vegas, good luck and dont gamble all your money haha"
hit:6340_conv:12680,situation,none,gonna try out a fried twinkie
hit:6340_conv:12680,utterance,speaker,"im finally off tomorrow long week of work, and im gonna finally gonna try a fried twinkie i am so pumped"
hit:6340_conv:12680,utterance,listener,"I love fried twinkies, you will too!"
hit:6340_conv:12680,utterance,speaker,"ive never haved one in my life , im really looking forward to it tomorrow"
hit:6340_conv:12680,utterance,listener,I am so excited for you!
hit:7852_conv:15704,situation,none,Next week I get to visit my sister and her family. I haven't seen them in a long time. I am so excited.
hit:7852_conv:15704,utterance,speaker,I can't wait until next week. I get to visit my sister and her family. I haven't seen them in a while.
hit:7852_conv:15704,utterance,listener,That's awesome that you are getting to see your family again!
hit:7852_conv:15704,utterance,speaker,Yeah I am so looking forward to it. I will have a blast with them!
hit:7852_conv:15704,utterance,listener,Well I hope that you have a great time!
hit:498_conv:997,situation,none,"I am going back to college in August and last year I stayed in the freshman dorms. This year, I'm staying in this super nice, brand new facility and I can't wait!"
hit:498_conv:997,utterance,speaker,"I'm not too excited to go back to college, but the living facility that I'm living in this year is much, much better."
hit:498_conv:997,utterance,listener,What makes your new living facility nicer?
hit:498_conv:997,utterance,speaker,"Well the freshman dorms are old and small, whereas the one that I'm living in this year is brand new and closer to an apartment."
hit:498_conv:997,utterance,listener,That is awesome. Having more space is always a plus.
hit:5866_conv:11733,situation,none,word are not enough to express how happy I am about my new car
hit:5866_conv:11733,utterance,speaker,word are not enough to express how happy I am about my new car
hit:5866_conv:11733,utterance,listener,That's great! What kind of car did you get?
hit:5866_conv:11733,utterance,speaker,GMC  Denali
hit:5866_conv:11733,utterance,listener,"Wow, that is a sweet ride!"
hit:5974_conv:11949,situation,none,I get to see my favorite band tonight. I have been following them for 10 years and this is the first time I get to see them. I cant wait.
hit:5974_conv:11949,utterance,speaker,So tonight I am seeing my favorite band for the first time ever. I have been a big fan for a while now.
hit:5974_conv:11949,utterance,listener,"Awesome, do you plan to go early to try and get autographs?"
hit:5974_conv:11949,utterance,speaker,I am so pumped up. I would love to do that. Great idea.
hit:5974_conv:11949,utterance,listener,"Enjoy yourself, if I may, refrain from recording it on your phone, just be in the moment!"
hit:3092_conv:6185,situation,none,I'm babysitting my brother's dog in 2 weeks.
hit:3092_conv:6185,utterance,speaker,I'm babysitting my brother's dog in 2 weeks
hit:3092_conv:6185,utterance,listener,I love dogs! what kind?
hit:3092_conv:6185,utterance,speaker,I think she's mixed.
hit:3092_conv:6185,utterance,listener,mutts are the most loveable.
hit:7004_conv:14008,situation,none,i have a great wife and i am so thankful for her
hit:7004_conv:14008,utterance,speaker,i have a great wife and i am so thankful for her
hit:7004_conv:14008,utterance,listener,That is nice. How long have you been married?
hit:7004_conv:14008,utterance,speaker,6 years in october
hit:7004_conv:14008,utterance,listener,That is great.
hit:897_conv:1795,situation,none,I bought a new car a few days ago. It's really sleek and fun to drive
hit:897_conv:1795,utterance,speaker,I bought a new car a few days ago. It's quite sleek and fun to drive around
hit:897_conv:1795,utterance,listener,"Wow thats awesome, what kind of car did you get?"
hit:897_conv:1795,utterance,speaker,"I got the new 2018 Honda Accord LX. Not the flashiest, but it works and it works well"
hit:897_conv:1795,utterance,listener,"That was a good choice, did you consider any other makes/models ?"
hit:8955_conv:17911,situation,none,I'm pretty stoked about this business idea that just came to mind.  If executed right my friend and I could make a ton of cash
hit:8955_conv:17911,utterance,speaker,I'm pretty stoked because I'm putting together this business idea in my head.  If done right with my friend we could rake in a ton of cash
hit:8955_conv:17911,utterance,listener,That's really cool. What is your idea?
hit:8955_conv:17911,utterance,speaker,It involves splitting up some freelancing work and maximizing productivity.
hit:8955_conv:17911,utterance,listener,That sounds like a really cool idea. I hope that it turns out well!
hit:3579_conv:7159,situation,none,"I can't wait until Halloween. I love scaring the little kids who come to my house, muhahah!"
hit:3579_conv:7159,utterance,speaker,"I can't wait until Halloween. I love scaring the little kids who come to my house, muhahah!"
hit:3579_conv:7159,utterance,listener,Ha! I've always loved the more festive Dia de los Muertos approach to the day rather than scare or gore! What's your favorite Halloween film?
hit:3579_conv:7159,utterance,speaker,"I remember learning about the Day of the Dead festivities in school, it was very fascinating. My favorite Halloween film is Halloween, lol."
hit:3579_conv:7159,utterance,listener,"SAME. Because when it came out, it felt groundbreaking! I remember being soooo scared and jumpy for weeks after seeing that."
hit:4657_conv:9315,situation,none,I am really pumped up!  I get to go horse riding this weekend with my family!
hit:4657_conv:9315,utterance,speaker,I'm really pumped!  I get to go horse back riding this weekend with my family!
hit:4657_conv:9315,utterance,listener,I love horse back riding.  Have you done it before or is this your first time?
hit:4657_conv:9315,utterance,speaker,This will be my first time but I have always wanted to!
hit:4657_conv:9315,utterance,listener,"My first time I sang the song from the movie Oklahoma called Oh, What a Beautiful Mornin'.  I'm kind of dorky though."
hit:1990_conv:3981,situation,none,I just found out that my supervisor approved a pay increase for me starting next week!  It was completely unexpected and I am elated!
hit:1990_conv:3981,utterance,speaker,I just found out that my supervisor approved a pay increase for me starting next week! It was completely unexpected and I am elated!
hit:1990_conv:3981,utterance,listener,Oh wow! What's better than a raise? A raise you didn't even expect!
hit:1990_conv:3981,utterance,speaker,That's what I am saying!  It was a great windfall!
hit:1990_conv:3981,utterance,listener,Is it a pretty substantial increase?
hit:8805_conv:17611,situation,none,I am going to Disney next week!
hit:8805_conv:17611,utterance,speaker,I am going to Disney next week!
hit:8805_conv:17611,utterance,listener,Oh how exciting!
hit:8805_conv:17611,utterance,speaker,"I have never been before, I hope it's everything I dreamed it to be!"
hit:8805_conv:17611,utterance,listener,I bet it will be a great time and fun!
hit:3033_conv:6066,situation,none,a was offered a promotion at my job
hit:3033_conv:6066,utterance,speaker,"my weeks been going great at work , how about yourself ?"
hit:3033_conv:6066,utterance,listener,It's been a mix of a rollercoaster lol.
hit:3033_conv:6066,utterance,speaker,"mine also , ive hated this job forever since they will never make me a full timer , and out the blue they offered me assistant manager"
hit:3033_conv:6066,utterance,listener,Wow! Are you going to stay now?
hit:3033_conv:6066,utterance,speaker,"Honestly im just gonna take it for the experience and eventually quit, im still salty it took this long for a promotion"
hit:3033_conv:6066,utterance,listener,I understand! I would be too!
hit:1032_conv:2064,situation,none,I was excited when my parents got me a car as a graduation gift
hit:1032_conv:2064,utterance,speaker,I was excited when my parents got me a car as a graduation gift
hit:1032_conv:2064,utterance,listener,Oh that sounds very exciting! What kind of car?
hit:1032_conv:2064,utterance,speaker,it was an 05 ford focus!
hit:1032_conv:2064,utterance,listener,That is so awesome! Happy for you!
hit:5483_conv:10966,situation,none,Rally time; time to jump on the motorcycle and go cruising!
hit:5483_conv:10966,utterance,speaker,The world famous sturgis rally is this week.  I am going for a ride on the motorcycle tonight to check it out!
hit:5483_conv:10966,utterance,listener,I have never heard of that
hit:5483_conv:10966,utterance,speaker,Huge motorcycle rally near mt rushmore in south dakota
hit:5483_conv:10966,utterance,listener,oh cool. I never been to any kind of motorcycle event
hit:8647_conv:17294,situation,none,"About a week ago, i bought myself a brand new Samsung Galaxy S9. The phone is amazing and has met all my expectations"
hit:8647_conv:17294,utterance,speaker,"A week ago, i bought a brand new Samsung Galaxy S9 for myself. Phone is incredible and all my expectations about it was met"
hit:8647_conv:17294,utterance,listener,Awesome! So you'd recommend it if I were looking for a new phone?
hit:8647_conv:17294,utterance,speaker,"Indeed. For $700, this phone is above expectations. Latest iPhone versions are becoming so overrated with inflated prices"
hit:8647_conv:17294,utterance,listener,I've never been a phone of Apple anyway. I had the first iPhone and wasn't impressed so I never tried again.
hit:4861_conv:9723,situation,none,My friend was telling me how she recently bought tickets to a festival at a discount and she offered me to purchase a ticket from her if I'm interested. It would be my first festival.
hit:4861_conv:9723,utterance,speaker,My friend was telling me how she recently bought tickets to a music festival at a discount and she offered me to buy a ticket from her if I'm interested.
hit:4861_conv:9723,utterance,listener,Oh that sounds like a good deal! It wouldn't get her in trouble or anything right?
hit:4861_conv:9723,utterance,speaker,"I don't think she will get in trouble because I won't report her, I will probably take her offer because it will be my first festival."
hit:4861_conv:9723,utterance,listener,Oh okay. Thats up to you! I just wouldn't want my friend to get in trouble!
hit:1624_conv:3249,situation,none,Just watched the trailer for Black Ops 4. This girl games!
hit:1624_conv:3249,utterance,speaker,I just saw the trailer for Black Ops 4 and preordered it immediately!
hit:1624_conv:3249,utterance,listener,"Wow, they are still making them? Only ones I enjoyed was MW1, MW2, and BO1."
hit:1624_conv:3249,utterance,speaker,Yep I get it every year. Thw last one was WWII and it was pretty good.
hit:1624_conv:3249,utterance,listener,I actually did buy that one on Steam but it barely has any players :(
hit:1624_conv:3249,utterance,speaker,I have no idea what Steam is. I have an XB1
hit:1233_conv:2466,situation,none,My friend bought me a ticket to see my favorite band Saturday night. I cannot wait.
hit:1233_conv:2466,utterance,speaker,So my friend surprised me with tickets to see my favorite band this Saturday. I thought it was sold out. I cannot wait.
hit:1233_conv:2466,utterance,listener,Thats cool! What band is it?
hit:1233_conv:2466,utterance,speaker,LCD Soundsystem. I have been a fan for a long time. Im really freaking out about going now.
hit:1233_conv:2466,utterance,listener,Fantastic! That would be so fun!
hit:4819_conv:9638,situation,none,I was anticipating the first day of school for a few days. It was going to be the first day in High school
hit:4819_conv:9638,utterance,speaker,I was anticipating the first day of school for a few days
hit:4819_conv:9638,utterance,listener,A new school year can be a pretty exciting thing.  Is it a new school year for you or your child?
hit:4819_conv:9638,utterance,speaker,"It is for me, first day at high school!"
hit:4819_conv:9638,utterance,listener,"Highschool was a long time ago for me, but from what I remember I had great times."
hit:118_conv:237,situation,none,My wife and I are going on vacation next week. We're satying in a cabin in West Virginia.
hit:118_conv:237,utterance,speaker,I'm very excited to take a vacation with my wife. We've been wanting to stay in a cabin for awhile.
hit:118_conv:237,utterance,listener,That's exciting! Cabin sounds really cozy.
hit:118_conv:237,utterance,speaker,"Yeah, we haven't gone on a romantic vacation in over a year, so I'm really looking foward to it."
hit:118_conv:237,utterance,listener,She's a lucky lady!
hit:9828_conv:19656,situation,none,I went to the circus one time. I saw some elephants and also played some games.
hit:9828_conv:19656,utterance,speaker,Have you been to a circus?
hit:9828_conv:19656,utterance,listener,"I have.  It was a long time ago.  I had a lot of fun watching it with my daughter but I always feel sad for the animals, until I found out that the circus I went to helps injured animals have a home."
hit:9828_conv:19656,utterance,speaker,operation free the circus animals!
hit:9828_conv:19656,utterance,listener,Yes!  I'm very much against animal cruelty but not every circus is bad thankfully.  Do you love the circus?
hit:9828_conv:19656,utterance,speaker,I went once and it was cool. I didn't think about animal rights back then though.
hit:1641_conv:3282,situation,none,I got a brand new computer
hit:1641_conv:3282,utterance,speaker,I got a brand new computer last month!
hit:1641_conv:3282,utterance,listener,Cool! What did you get?
hit:1641_conv:3282,utterance,speaker,"It's something brand new, and it works very fast."
hit:1641_conv:3282,utterance,listener,Well good for you!
hit:2393_conv:4786,situation,none,My dad is coming into town. Haven't seen the guy in 5 years.
hit:2393_conv:4786,utterance,speaker,My dad is coming into town. Haven't seen the guy in 5 years
hit:2393_conv:4786,utterance,listener,That should be fun.  Does he live pretty far away?
hit:2393_conv:4786,utterance,speaker,"Yea, he's some timezones away."
hit:2393_conv:4786,utterance,listener,That has to be tough
hit:5696_conv:11392,situation,none,I can't wait for our next reunion. We are going on a cruise.
hit:5696_conv:11392,utterance,speaker,I can't wait for our next reunion
hit:5696_conv:11392,utterance,listener,Those are so much fun. Family or school?
hit:5696_conv:11392,utterance,speaker,family. We a going on a cruise. I love cruises.
hit:5696_conv:11392,utterance,listener,"That will be great. Take lots of pictures, you will want to remember all of those memories you are going to make."
hit:5696_conv:11392,utterance,speaker,I know. My kids will love it too
hit:6756_conv:13512,situation,none,"The weekend is finally here, woohoo!"
hit:6756_conv:13512,utterance,speaker,"The weekend is finally here, woohoo!"
hit:6756_conv:13512,utterance,listener,Oh man truer words were never spoken! How are you gonna spend your free time this weekend?
hit:6756_conv:13512,utterance,speaker,Not sure yet but I am looking forward to sleeping in a bit
hit:6756_conv:13512,utterance,listener,That's my thought process like every week. I think I might be getting old because sometimes I like sleeping more than being awake.
hit:2175_conv:4351,situation,none,I am excited to EAT today lol. I am on keto and back to fasting.
hit:2175_conv:4351,utterance,speaker,I am happy about my first meal in a few hours. I am back on keto so I fast and then have two meals. It makes that first meal something I look forward too a lot!
hit:2175_conv:4351,utterance,listener,What do you think that you'll have ?
hit:2175_conv:4351,utterance,speaker,"Well I have a place I love where I get a salad and a piece of cheesecake and I eat that for both my meals. When I do that, I lose weight and feel so much better. Bonus is again- I look sooo forward to it and it tastes even better!"
hit:2175_conv:4351,utterance,listener,I'm glad you seem to have it all figured out.
hit:6322_conv:12645,situation,none,Tomorrow is my birthday! I am so stoked!
hit:6322_conv:12645,utterance,speaker,Tomorrow is my birthday party. I am so stoked!
hit:6322_conv:12645,utterance,listener,"Wow, how exciting!!  It's been a long time since I've had a birthday party - are you going anywhere special?"
hit:6322_conv:12645,utterance,speaker,Nope! But I am having all my friends over. Can't wait to see the cool gifts they got me!
hit:6322_conv:12645,utterance,listener,"OOOO I love gifts!!!  I know it's never ""about the gift"" but ok, it is SO nice to get presents!!"
hit:7287_conv:14575,situation,none,i cant wait for monday!
hit:7287_conv:14575,utterance,speaker,i cant wait for monday!
hit:7287_conv:14575,utterance,listener,Why's that
hit:7287_conv:14575,utterance,speaker,kids start school
hit:7287_conv:14575,utterance,listener,Oh I feel ya.  No kids yet so I'm soaking up all the freedom I can hahaha
hit:2145_conv:4290,situation,none,I am super excited to finally get some new perfume today. It's hard when you're poor.
hit:2145_conv:4290,utterance,speaker,I am super happy to be getting a new perfume today and a mostly full bottle.
hit:2145_conv:4290,utterance,listener,"oh i love perfume, whats it smell like?"
hit:2145_conv:4290,utterance,speaker,"It's more of a manly smell. It's Jimmy choo or tresor not sure which. but you know when you are poor it is hard to afford much, so I am happy I can afford a nice perfume for once"
hit:2145_conv:4290,utterance,listener,Oh for sure and its honestly insane to spend too much on a perfume! Call me cheap lol
hit:10867_conv:21734,situation,none,I found a new gym!
hit:10867_conv:21734,utterance,speaker,I found an awesome new gym by my house!
hit:10867_conv:21734,utterance,listener,"Wow,  that's lovely. So you will start keep fit"
hit:10867_conv:21734,utterance,speaker,Yes! The classes are great too! I'm thinking of trying yoga!
hit:10867_conv:21734,utterance,listener,"It will help you,  even in blood circulation"
hit:10867_conv:21734,utterance,speaker,I really want to be healthier so I think this will be great.
hit:8826_conv:17653,situation,none,"Going to an amusement park later in the week, before college semester starts back up. A little scared to get on roller coasters since I don't like heights, but kind of pumped to feel the adrenaline rush and feeling of accomplishment after doing something scary"
hit:8826_conv:17653,utterance,speaker,"Going to an amusement park later in the week, before college semester starts back up. A little scared to get on roller coasters since I don't like heights, but kind of pumped to feel the adrenaline rush and feeling of accomplishment after doing something scary"
hit:8826_conv:17653,utterance,listener,I love the feeling a rollercoaster gives. Have you gone before?
hit:8826_conv:17653,utterance,speaker,"Not to this specific one, but I've ridden some before. None that will be as big as the ones at this park though. I'm a little intimidated. The anxiety that you feel while you wait in line always gets me.. But the high you get afterwards seems worth it"
hit:8826_conv:17653,utterance,listener,Yes the juice is certainly worth the squeeze
hit:3996_conv:7993,situation,none,my friend go a new job
hit:3996_conv:7993,utterance,speaker,"my friend got a new job recently , a 2nd job if i may add and im really happy for him"
hit:3996_conv:7993,utterance,listener,"Oh wow, that's great! Only bad thing is he will be very busy with two jobs."
hit:3996_conv:7993,utterance,speaker,"yes he will be busy , but his life will also be better , im just over all really happy for him"
hit:3996_conv:7993,utterance,listener,That's great to hear!
hit:4943_conv:9887,situation,none,"I'm planning to go to Costa Rica next month! It will be my first time, I can't wait!"
hit:4943_conv:9887,utterance,speaker,I'm travelling to Costa Rica next month for the first time. It's going to be awesome!
hit:4943_conv:9887,utterance,listener,That sounds very exciting. I am sure you will have a great time.
hit:4943_conv:9887,utterance,speaker,"Yes, I can't wait. We're planning on doing some diving and hiking."
hit:4943_conv:9887,utterance,listener,Those sound like fun activities. I hope you take lots of pictures so you can remember the trip.
hit:6158_conv:12316,situation,none,I am looking forward to this weekend. We are going to play videogames
hit:6158_conv:12316,utterance,speaker,I am looking forward to this weekend. We are going to play videogames
hit:6158_conv:12316,utterance,listener,Nice! i just picked up the new madden so i will be gaming all weekend as well
hit:6158_conv:12316,utterance,speaker,"Oh man, I want to play that too"
hit:6158_conv:12316,utterance,listener,"it is really good, they fixed alot of things from last year to make it awesome"
hit:1748_conv:3497,situation,none,I feel excited that the new footbal season is about to start. I own a team in spain and want to see them do well.
hit:1748_conv:3497,utterance,speaker,I'm looking forward to the new football season starting!
hit:1748_conv:3497,utterance,listener,Really? Are you watching training?
hit:1748_conv:3497,utterance,speaker,Yeah - I co-own a team in Spain so I can access video of them preparing.
hit:1748_conv:3497,utterance,listener,Oh you mean soccer lol
hit:1748_conv:3497,utterance,speaker,"Yeah - sorry, should have explained that. I forget that in America you don't sue the right name :-)"
hit:1748_conv:3497,utterance,listener,I will agree with you there. We use whatever words we want.
hit:5815_conv:11630,situation,none,"Up extra early today, I couldn't sleep. I am starting a new job today."
hit:5815_conv:11630,utterance,speaker,"I am up way too early this morning, I couldn't sleep at all."
hit:5815_conv:11630,utterance,listener,Why?
hit:5815_conv:11630,utterance,speaker,I am full of energy as I am starting a new job today.
hit:5815_conv:11630,utterance,listener,Cool
hit:6994_conv:13988,situation,none,I am going to see Taylor Swift.
hit:6994_conv:13988,utterance,speaker,I am going to get to see Taylor Swift live for the first time.
hit:6994_conv:13988,utterance,listener,oh nice! she will be in my town this weekend
hit:6994_conv:13988,utterance,speaker,"That's cool, I heard she puts on such a good show."
hit:6994_conv:13988,utterance,listener,"i have hear so as well, i love concerts"
hit:2576_conv:5153,situation,none,I am back to work tomorrow. I am happy to go back to work.
hit:2576_conv:5153,utterance,speaker,I am back to work tomorrow. I am happy to go back to work after a good vacation.
hit:2576_conv:5153,utterance,listener,That's great! I don't know too many people who look forward to that. You must love your job
hit:2576_conv:5153,utterance,speaker,"Yes, I love my job and my coworkers. I found it challenging."
hit:2576_conv:5153,utterance,listener,Great! I wish I loved my job and work environment as much as you do
hit:9105_conv:18211,situation,none,I cant wait to go on vacation next week. Its going to be so much fun.
hit:9105_conv:18211,utterance,speaker,I cant wait to go on vacation next week. Its going to be so much fun.
hit:9105_conv:18211,utterance,listener,"That sounds awesome, were are you going if you don't mind?"
hit:9105_conv:18211,utterance,speaker,Im going to the beach with friends. Its going to be incredible.
hit:9105_conv:18211,utterance,listener,Nice! The summer is the perfect time for the beach.
hit:9275_conv:18551,situation,none,I am going to a concert this weekend.  I can't wait to go.
hit:9275_conv:18551,utterance,speaker,I am going to a concert this weekend.
hit:9275_conv:18551,utterance,listener,"Fun, what concert is it?"
hit:9275_conv:18551,utterance,speaker,It is Fallout Boy. I can't wait to go!
hit:9275_conv:18551,utterance,listener,Whoop! it's gonna be a fun time!
hit:9376_conv:18753,situation,none,going on cruise for the first time
hit:9376_conv:18753,utterance,speaker,"i am going on a cruise for my vacation next week , i cannot wait!"
hit:9376_conv:18753,utterance,listener,"I love cruises, where is your cruise headed?"
hit:9376_conv:18753,utterance,speaker,i am going to cozumel
hit:9376_conv:18753,utterance,listener,Have you ever been there before?
hit:8834_conv:17668,situation,none,I'm ready for Fall.
hit:8834_conv:17668,utterance,speaker,I can't wait to see the leaves begin to change.
hit:8834_conv:17668,utterance,listener,I just love Fall! I'm guessing that's your favorite season?
hit:8834_conv:17668,utterance,speaker,"It is, I long for it all summer."
hit:8834_conv:17668,utterance,listener,I feel you. Watching the leaves change colors makes me feel peaceful.
