Dialog_ID,Type,Actor,Text
hit:12166_conv:24333,utterance,speaker,I am going to take a test to see if I can get certified and I feel really confident. I cant wait!
hit:12166_conv:24333,utterance,listener,Great! I'm sure you've prepared a lot for it. Good luck!
hit:12166_conv:24333,utterance,speaker,I have been studying for days
hit:12166_conv:24333,utterance,listener,I'm sure you'll do well.
hit:5505_conv:11011,situation,none,"I am ready to finally leave my job, I have been here for about 3 years with no promotion, I need to get out"
hit:5505_conv:11011,utterance,speaker,"I am ready to finally leave my job, I have been here for about 3 years with no promotion, I need to get out"
hit:5505_conv:11011,utterance,listener,You sure do. You sound under appreciated
hit:5505_conv:11011,utterance,speaker,"I believe so, I have called out twice in 3 years, and cover for everyone else"
hit:5505_conv:11011,utterance,listener,You deserve better. Find something before you leave though
hit:9174_conv:18348,situation,none,I am ready for my work meeting tomorrow. I have been working on it all night
hit:9174_conv:18348,utterance,speaker,I am ready for work tomorrow and my team meeting. I have been working on it all night
hit:9174_conv:18348,utterance,listener,That's really great to hear. It's always good to prepare for big events like that. What's the meeting about?
hit:9174_conv:18348,utterance,speaker,Its just a sales meeting that we have sometimes
hit:9174_conv:18348,utterance,listener,I am sure you're going to crush it into the ground.
hit:11959_conv:23918,situation,none,I am ready for my exam next week.
hit:11959_conv:23918,utterance,speaker,I am ready for my exam next week.
hit:11959_conv:23918,utterance,listener,Good luck. What class?
hit:11959_conv:23918,utterance,speaker,It is for my finance class.
hit:11959_conv:23918,utterance,listener,Whats your major?
hit:2471_conv:4942,situation,none,I am so ready for the camping trip this coming weekend. I made a list of what I need and I'm pretty sure I'm not forgetting anything.
hit:2471_conv:4942,utterance,speaker,I am so ready for the camping trip this coming weekend. I made a list of what I need and I'm pretty sure I'm not forgetting anything.
hit:2471_conv:4942,utterance,listener,where are you going camping?
hit:2471_conv:4942,utterance,speaker,"The Great Smokey Mountains National Park, it's like 15 minutes from where I live. I am so prepared for it, it should be fun!"
hit:2471_conv:4942,utterance,listener,it must be nice to live in such a beautiful place
hit:11604_conv:23208,situation,none,I have been slaving away in the kitchen all day and my in-laws are about to arrive.  I have falafel wraps with tzaitziki and tahini dressing and a couple sides. I'm ready!
hit:11604_conv:23208,utterance,speaker,I have been slaving away in the kitchen all day and my in-laws are about to arrive. I have falafel wraps with tzaitziki and tahini dressing and a couple sides. I'm ready!
hit:11604_conv:23208,utterance,listener,"that sounds amazing, I hope they enjoy it a lot!"
hit:11604_conv:23208,utterance,speaker,I hope so too!  We love it and its all homemade.
hit:11604_conv:23208,utterance,listener,"It sounds like it will, i hope you have  a great dinner!"
hit:1982_conv:3964,situation,none,"Last year when the hurricane came, we spent weeks gathering supplies and boarding up the house."
hit:1982_conv:3964,utterance,speaker,"Last year when the hurricane came, we spent weeks gathering supplies and boarding up the house."
hit:1982_conv:3964,utterance,listener,That's sounds like a very smart and effective safety precaution. Was it enough to adequately defend your family?
hit:1982_conv:3964,utterance,speaker,It was! I was thankful we did so much in anticipation for the hurricane!
hit:1982_conv:3964,utterance,listener,Did you end up feeling like you had stronger defenses than the hurricane had strength when it reached your area? I mean in an overprotected kind of way.
hit:1671_conv:3342,situation,none,"I am ready for the winter, I bought a coat."
hit:1671_conv:3342,utterance,speaker,"I am ready for winter, I bought a coat."
hit:1671_conv:3342,utterance,listener,"I'm not too fond of winter, but what kind of coat did you buy?"
hit:1671_conv:3342,utterance,speaker,I bought a big furry one.
hit:1671_conv:3342,utterance,listener,"Awesome, I bet it's comfy! How cold does it get where you live?"
hit:228_conv:457,situation,none,When i go to conventions i always want to be ready for anything. I pack a first aid kit and a lot of food. I always want to be ready for the worse at conventions but it can happen.
hit:228_conv:457,utterance,speaker,So i like being prepared for a lot of different situations when i go to conventions.
hit:228_conv:457,utterance,listener,True ! Conventions give you an opportunity to learn as you never know what kind of situations will prop up
hit:228_conv:457,utterance,speaker,"Yeah, I think the most important thing to me is the first aid kit."
hit:228_conv:457,utterance,listener,Do you have a professional degree in first aid?
hit:2122_conv:4245,situation,none,"when I was a teenager my mother always tried to get me to be ready for being sexually active, and I knew what to do and where to go to get birth control."
hit:2122_conv:4245,utterance,speaker,"when I was a teenager my mother always tried to get me to be ready for being sexually active, and I knew what to do and where to go to get birth control."
hit:2122_conv:4245,utterance,listener,I bet that was an awkward conversation. Did you feel embarassed?
hit:2122_conv:4245,utterance,speaker,"I did a little bit but my mom is pretty cool. I can appreciate it now, I felt ready for anything, you know?"
hit:2122_conv:4245,utterance,listener,"Well that is good she prepared you, most parents just avoid the topic."
hit:2111_conv:4222,situation,none,I was finally organized for teaching school this year
hit:2111_conv:4222,utterance,speaker,I am so happy that I have finally gotten a head start on being organized to teach this year
hit:2111_conv:4222,utterance,listener,"This is so good, well done"
hit:2111_conv:4222,utterance,speaker,Thank you. There is so much to do when you are teaching multiple grades
hit:2111_conv:4222,utterance,listener,How long have you been on this?
hit:10200_conv:20400,situation,none,"When I went in for my first professional interview, I was ready for anything. I practiced interview questions, had a great resume, and a pretty snazzy outfit."
hit:10200_conv:20400,utterance,speaker,I had my first professional interview recently!
hit:10200_conv:20400,utterance,listener,"congrats, how did you handle the pressure?"
hit:10200_conv:20400,utterance,speaker,"Pretty well I think! I had a solid resume, and I practiced ahead of time. It still isn't the same though when you're right there in the room and they're looking at you lol."
hit:10200_conv:20400,utterance,listener,"It can be pretty nerve racking, but it is always great practice. You will only get better."
hit:118_conv:236,situation,none,We have a work presentation coming up soon. I think we've got everything to present.
hit:118_conv:236,utterance,speaker,We have a work presentation coming up soon. I think we've got everything to present.
hit:118_conv:236,utterance,listener,That's good. Preperation is the first step in having a good presentation.
hit:118_conv:236,utterance,speaker,Yea. I hope we didn't miss anything. We spent a lot of time on it.
hit:118_conv:236,utterance,listener,"Fingers crossed, I hope the presentation goes well."
hit:6307_conv:12615,situation,none,I have a big test to take tomorrow.  I am so ready for it.
hit:6307_conv:12615,utterance,speaker,I have a big test to take tomorrow.
hit:6307_conv:12615,utterance,listener,Do you feel as prepared as you can be for it?
hit:6307_conv:12615,utterance,speaker,I am so ready to take it.
hit:6307_conv:12615,utterance,listener,"Well that is a great attitude, I bet you will do amazing!!"
hit:6322_conv:12644,situation,none,We had a scheduled c-section for our 2nd child.  But my blood pressure went up and we had to have the c-section early.  But I was completely packed and had even set up a babysitter for our daughter.
hit:6322_conv:12644,utterance,speaker,"We had a scheduled c-section for our 2nd child, but that didn't go as planned."
hit:6322_conv:12644,utterance,listener,Oh wow. Did everything turn out okay?
hit:6322_conv:12644,utterance,speaker,"Yes, but I'd gone in for a check-up and my blood pressure was up, so they wanted to do the c-section then.  Thank goodness I'd already packed and arranged for childcare for our daughter just in case!"
hit:6322_conv:12644,utterance,listener,Well I am so glad it turned out okay! Especially since your daughter is healthy and kicking. Congrats :)
hit:5696_conv:11393,situation,none,I was having a party so I started getting ready for it two weeks in advance. I wanted to be ready.
hit:5696_conv:11393,utterance,speaker,I was having a party so I started getting ready for it two weeks in advance. I wanted to be ready.
hit:5696_conv:11393,utterance,listener,Makes sense
hit:5696_conv:11393,utterance,speaker,It never fails if you wait to the last minute something will go wrong.
hit:5696_conv:11393,utterance,listener,Yep. That always happens
hit:3201_conv:6402,situation,none,"College is starting in 3 weeks, and I have my apartment all settled, my classes picked out, and my student loans scheduled. I feel like I'm on track to start the semester in a way where I'm not hurried or confused, and it feels good."
hit:3201_conv:6402,utterance,speaker,"College is starting in 3 weeks, and I have my apartment all settled, my classes picked out, and my student loans scheduled. I feel like I'm on track to start the semester in a way where I'm not hurried or confused, and it feels good."
hit:3201_conv:6402,utterance,listener,That is really good.  Starting off right is one of the most important things for a successful School year.  Where are you going?
hit:3201_conv:6402,utterance,speaker,"I'm attending the University of South Carolina as a social work major. I'll be a senior, so I'm kind of excited about that. But I will have to attend graduate school after this, so I can't get that ""Almost all over with!"" feeling just yet. What about you? Did you ever attend college, or want to?"
hit:3201_conv:6402,utterance,listener,"I did attend college, but I am one of those statistics you hear about....a dropout."
hit:3201_conv:6402,utterance,speaker,Hey... that's okay. I'm 28 and just now about to finish my 4-year degree. My brother finished his at 36. There's always a reason for the path you take. Maybe it led to better things. Don't ever just consider yourself a statistic. Good luck!
hit:5755_conv:11511,situation,none,My fiancee will be home soon and I am planning a surprise dinner tonight.
hit:5755_conv:11511,utterance,speaker,My fiancee is going to be home soon and I have planned a surprise dinner tonight.
hit:5755_conv:11511,utterance,listener,What are you making for the dinner?
hit:5755_conv:11511,utterance,speaker,Made some pasta and a few vegetables as side dishes.
hit:5755_conv:11511,utterance,listener,Will you make any dessert?
hit:5755_conv:11511,utterance,speaker,Actually I was thinking about that. I might grab some cake if I have time.
hit:11665_conv:23331,situation,none,i have a fantasy football draft tomorrow. i have done my research and i'm ready to draft a great team!
hit:11665_conv:23331,utterance,speaker,"I have a fantasy football draft tomorrow, I think all of my research will benefit me!"
hit:11665_conv:23331,utterance,listener,You must feel prepared now since you've done all your planning and analysis.
hit:11665_conv:23331,utterance,speaker,I am! I would like to win the league this year.
hit:11665_conv:23331,utterance,listener,its a big ambition but you can do it with the right effort and commitment!
hit:10499_conv:20998,situation,none,The first outing after my baby was born was daunting. I was so excited when we returned home without a major catastrophe.
hit:10499_conv:20998,utterance,speaker,Going out to run errands for the first time after having a baby was scary. I was so afraid I would forget something I needed. I was so relieved when we returned home and everything went perfectly smooth.
hit:10499_conv:20998,utterance,listener,"Yeah, I probably would have to leave someone at home with the baby."
hit:10499_conv:20998,utterance,speaker,"It was overwhelming, but we made it without too much stress."
hit:10499_conv:20998,utterance,listener,"That's great, the first time for everything is scary."
hit:7691_conv:15383,situation,none,I have to make a wedding cake later.  I am so ready to bake it.
hit:7691_conv:15383,utterance,speaker,I have to make a wedding cake later.
hit:7691_conv:15383,utterance,listener,you must be excited!
hit:7691_conv:15383,utterance,speaker,"Yeah, I am so ready to bake it!"
hit:7691_conv:15383,utterance,listener,Nice. Im sure you will have lots of fun doing it.
hit:7434_conv:14868,situation,none,I am going to do well at work next week. I have been working hard on a project
hit:7434_conv:14868,utterance,speaker,"I am going to do well at work next week, I have been working on a project"
hit:7434_conv:14868,utterance,listener,That's great. So you are confident in the progress of it?
hit:7434_conv:14868,utterance,speaker,I just feel like its good work
hit:7434_conv:14868,utterance,listener,That's a great feeling to have. A job well done.
hit:5629_conv:11258,situation,none,Been studying for my final exam tomorrow. Never felt so ready in my life!
hit:5629_conv:11258,utterance,speaker,Been studying really hard for my final exam tomorrow. Never felt so ready!
hit:5629_conv:11258,utterance,listener,That's awesome! Good luck on your finals!
hit:5629_conv:11258,utterance,speaker,Thanks! I am sure I will crush it.
hit:5629_conv:11258,utterance,listener,Don't forget to get some rest though.
hit:727_conv:1454,situation,none,"I've bought everything I need in the house, foods, ammos, and other essentials that would last me months. That is, in event of the collapse of the government in this land of free."
hit:727_conv:1454,utterance,speaker,"I've bought everything that I need for the house: foods, ammos, and other essentials that would last me months to come."
hit:727_conv:1454,utterance,listener,Wow you sound really prepared for something.
hit:727_conv:1454,utterance,speaker,"Yes, for the event of collapse of the government."
hit:727_conv:1454,utterance,listener,"Oh no, is the end coming?"
hit:727_conv:1454,utterance,speaker,"Who knows. Pretty much about the only thing they teach you in Boy Scouts, but they don't tell you ""why"" upon its inception in 1930s."
hit:2755_conv:5511,situation,none,I felt so ready the first day at my new job.
hit:2755_conv:5511,utterance,speaker,I woke up extra early just to make sure I made it to work on time for my new job.
hit:2755_conv:5511,utterance,listener,"Did you get there on time? I do the same thing, I like to be prepared for any traffic that could pop up."
hit:2755_conv:5511,utterance,speaker,"I did yes, I felt very ready for the first day. You never know about traffic thats right! especially in the city."
hit:2755_conv:5511,utterance,listener,Something always comes up whenever you need to be somewhere! That's how life works!
hit:7033_conv:14067,situation,none,Getting ready for vacation!
hit:7033_conv:14067,utterance,speaker,I need to go buy me some new beach clothes
hit:7033_conv:14067,utterance,listener,OO are you going to the beach soon?
hit:7033_conv:14067,utterance,speaker,Yep!  In a couple weeks!  Taking the nephew with us for his first time.
hit:7033_conv:14067,utterance,listener,"That should be so much fun, seeing his face when he first puts his feet in the water will be amazing!"
hit:7033_conv:14067,utterance,speaker,Yeah!  He's so excited to go too!
hit:3367_conv:6735,situation,none,once I realized I had packed everything I needed
hit:3367_conv:6735,utterance,speaker,Once I went on a trip and realized I didnt forget a single thing.
hit:3367_conv:6735,utterance,listener,That had to make you feel good. It is so easy to forget when your trying so hard to remember. LOL
hit:3367_conv:6735,utterance,speaker,"Story of my life,  I always forget things no matter how hard I try"
hit:3367_conv:6735,utterance,listener,I always make a list before a trip and triple check it before I leave.
hit:7004_conv:14009,situation,none,"Tomorrow, I am taking my driving test. I feel ready. I have taken a lot of driving lessens"
hit:7004_conv:14009,utterance,speaker,"Tomorrow, I am taking my driving test. I feel ready. I have taken a lot of driving lessens."
hit:7004_conv:14009,utterance,listener,are you confident you will pass?
hit:7004_conv:14009,utterance,speaker,I feel totally confident that I will pass.
hit:7004_conv:14009,utterance,listener,great! i hope that you do!
hit:2133_conv:4266,situation,none,I have read alot so I know I won't fail the exam I am going for
hit:2133_conv:4266,utterance,speaker,I have read alot so I know I won't fail the exam I am going for
hit:2133_conv:4266,utterance,listener,what subject is it in?
hit:2133_conv:4266,utterance,speaker,Chemistry
hit:2133_conv:4266,utterance,listener,i hope you perform well on your exam
hit:870_conv:1741,situation,none,I was hiking in the woods a week ago and I sprained my ankle. Luckily I had supplies.
hit:870_conv:1741,utterance,speaker,"So, a week ago I was hiking alone in the mountains and I ended up spraining my ankle."
hit:870_conv:1741,utterance,listener,Oh no. I
hit:870_conv:1741,utterance,speaker,"Well, luckily I packed a first aid kit just for situations like this, so I was able to make it back and get it checked out. No service out there lol"
hit:870_conv:1741,utterance,listener,That's great. I wonder how many hikers actually keep a first aid kit?
hit:9568_conv:19136,situation,none,"I went into my closet the other day thinking I had to go buy hangers, but I found a pack I had bought years ago and forgot about."
hit:9568_conv:19136,utterance,speaker,"I went into my closet the other day thinking I had to go buy hangers, but I found a pack I had bought years ago and forgot about."
hit:9568_conv:19136,utterance,listener,"That would be a nice surprise, now you need not go buy any hangers"
hit:9568_conv:19136,utterance,speaker,It was awesome.  I love to save money I already spent in my head.
hit:9568_conv:19136,utterance,listener,Now you can take care of your close in your closet without spending any extra money. You saved time and money.
hit:5604_conv:11208,situation,none,I've been studying for my final math exam for the past two weeks. Never felt so ready!
hit:5604_conv:11208,utterance,speaker,I've been studying for my math exam for the past two weeks. Never felt so ready in my life!
hit:5604_conv:11208,utterance,listener,That is good. When do you have the exam?
hit:5604_conv:11208,utterance,speaker,I have it tomorrow! Pretty pumped to go in and crush it.
hit:5604_conv:11208,utterance,listener,Good luck.
hit:1292_conv:2584,situation,none,I stayed up all night reviewing spelling words. I was able to pass my English test easily the next day.
hit:1292_conv:2584,utterance,speaker,I had the latest night ever a few years back when I was in high school. I reviwed words all night but I aced that test.
hit:1292_conv:2584,utterance,listener,"Sweet, was it a difficult test?"
hit:1292_conv:2584,utterance,speaker,Yea the words were really long man. I don't miss those days at all.
hit:1292_conv:2584,utterance,listener,"Yea, same, it's nice to be out of school. All that learning pays off though!"
hit:524_conv:1049,situation,none,"In English last semester, I was really nervous about doing a presentation in front of the class about net neutrality. I practiced it all day beforehand and when I went in front of the class I didn't even need my notecards because I remembered everything so well. I got a really good grade on it too!"
hit:524_conv:1049,utterance,speaker,"Last semester, I was mortified about the fact that I had to go in front of the class and present about net neutrality. It went super well though."
hit:524_conv:1049,utterance,listener,Why were you mortified? I don't know too much about net neutrality.
hit:524_conv:1049,utterance,speaker,"Because I hate public speaking and I thought I would bomb it, but I did super well and memorized it all!"
hit:524_conv:1049,utterance,listener,"Oh yes I am sure you did great, public speaking is a good skill too have."
hit:2453_conv:4906,situation,none,My wedding is tomorrow and I've been practicing my vows. Feel so ready for this day!
hit:2453_conv:4906,utterance,speaker,My wedding is tomorrow and I've been going over my vows over and over. Never felt so ready!
hit:2453_conv:4906,utterance,listener,Congratulations
hit:2453_conv:4906,utterance,speaker,Thanks man. Feels like I've been preparing for this day my whole life.
hit:2453_conv:4906,utterance,listener,How long you been together?
hit:12167_conv:24334,situation,none,I am going to the beach tomorrow and I believe I have packed everything we will be needing there.
hit:12167_conv:24334,utterance,speaker,I am going to the beach tomorrow and I believe I have packed everything we will be needing there.
hit:12167_conv:24334,utterance,listener,Oh how exciting! I love the beach! Are you bringing lots of snacks and drinks?
hit:12167_conv:24334,utterance,speaker,"I am bringing some and beer too, but I hope I have remembered  all the rest like swimsuit, lifesavers, beach toys, towels, sun blocker , etc."
hit:12167_conv:24334,utterance,listener,Oh yes don't forget the sun block. Very important! Well I hope you all have fun out there! I am jealous!
hit:3974_conv:7949,situation,none,I spent the last month getting ready to go on a trip around the world.
hit:3974_conv:7949,utterance,speaker,The entire last month I was getting ready for a trip around the world. Takes a lot of planning!
hit:3974_conv:7949,utterance,listener,That does sound fun though
hit:3974_conv:7949,utterance,speaker,"Yup. Now that I'm finally ready, I'll be taking off in about a week."
hit:3974_conv:7949,utterance,listener,I hope you have fun
hit:2948_conv:5896,situation,none,The other day I was stuck on the side of the road because my car stopped working. Luckily I had a Triple A membership so I was able to get a jump start. Glad I planned ahead!
hit:2948_conv:5896,utterance,speaker,I had some car trouble the other day. My car wouldn't start and I didn't know why.
hit:2948_conv:5896,utterance,listener,What did you do?
hit:2948_conv:5896,utterance,speaker,Luckily I had Triple A membership. They came out and jumped my car and said I need a new battery. Glad I was prepared for this!
hit:2948_conv:5896,utterance,listener,Did you buy a new battery?
hit:8782_conv:17565,situation,none,3
hit:8782_conv:17565,utterance,speaker,"My mom really helps me with so much, I can leave my animals in her care if anything happens to me. That is a relief!"
hit:8782_conv:17565,utterance,listener,She sounds like a great mother! What kind of animals do you have?
hit:8782_conv:17565,utterance,speaker,"Bunnies, turtle, dogs and loads of cats :)"
hit:8782_conv:17565,utterance,listener,Wow you're running a vet clinic or something haha! Well it sounds like they are surrounded with love.
hit:8782_conv:17565,utterance,speaker,"For sure, I would do anything for them. I'm glad I have someone to rely on as well to take care of them if anything happens. I rescue everything :)"
hit:7684_conv:15369,situation,none,I have been training for months for the race.
hit:7684_conv:15369,utterance,speaker,I have been training for months for the race!
hit:7684_conv:15369,utterance,listener,"Oh, what is the race? Sounds like a lot of work!"
hit:7684_conv:15369,utterance,speaker,Its a 100m sprint. Its a lot work but it has helped me prepare well.
hit:7684_conv:15369,utterance,listener,I'm sure all the work will be worth it in the end!
hit:9174_conv:18349,situation,none,I have been studying for my final math exam all week. I have never felt so prepared in my life.
hit:9174_conv:18349,utterance,speaker,I have been studying for my math final all this week. I am going to knock it out of the park!
hit:9174_conv:18349,utterance,listener,That is great to hear. Are you good at math?
hit:9174_conv:18349,utterance,speaker,"Not so much, which is why I have been studying so hard. I'm really looking forward to this one, though, because I am so prepared."
hit:9174_conv:18349,utterance,listener,I hope you do well then
hit:6735_conv:13471,situation,none,Just got back from Freshmen Orientation at my daughter's high school.  I think we have all the information we need for next week.
hit:6735_conv:13471,utterance,speaker,My daughter and I just got home from her high school freshman orientation.
hit:6735_conv:13471,utterance,listener,Awesome! How was that? do you think she will enjoy high school?
hit:6735_conv:13471,utterance,speaker,"She got her schedule, locker and was able to figure out where her classes were.  I think we are both ready for school to start now."
hit:6735_conv:13471,utterance,listener,"I know that feeling, I'm waiting for the college to start myself!"
hit:9069_conv:18138,situation,none,I have been studying non stop for a week for this test at work.  I think I am ready for it.  As best as I can be
hit:9069_conv:18138,utterance,speaker,I think my brain is full.  I am ready as I can be!
hit:9069_conv:18138,utterance,listener,Ready for what?
hit:9069_conv:18138,utterance,speaker,I have a test at work this week.  I have been studying for like a week.  I think I am ready for it.
hit:9069_conv:18138,utterance,listener,Great. What is the test about?
hit:11663_conv:23327,situation,none,i have a fantasy football draft tomorrow. i have got all the info i need to get the perfect team.
hit:11663_conv:23327,utterance,speaker,"i have fantasy football draft tomorrow, i have got all my info together hoping for a great year"
