Dialog_ID,Type,Actor,Text
hit:12080_conv:24160,utterance,listener,"Bahamas is a nice Caribbean island, you must be really looking forward to it."
hit:12080_conv:24160,utterance,speaker,"I am very excited. And with all the packing done, I finally feel ready to go!"
hit:12080_conv:24160,utterance,listener,"I can just imagine, make sure you take lots of pictures and dress for the weather. It will be hot."
hit:5764_conv:11529,situation,none,I am ready for my fathers retirement party.
hit:5764_conv:11529,utterance,speaker,I am ready for my fathers retirement party.
hit:5764_conv:11529,utterance,listener,do you have a special plan?
hit:5764_conv:11529,utterance,speaker,We are having a big party. I am inviting all of his old coworkers.
hit:5764_conv:11529,utterance,listener,im sure he will love it!!!1
hit:8503_conv:17007,situation,none,I have gotten everything I need for graduate school ready.
hit:8503_conv:17007,utterance,speaker,I think I finally got everything together to apply to graduate school.
hit:8503_conv:17007,utterance,listener,how long is grad school?
hit:8503_conv:17007,utterance,speaker,"For my particular program, 2 years."
hit:8503_conv:17007,utterance,listener,"thats not bad, good luck"
hit:5022_conv:10045,situation,none,"with all the crime that has increased in my area, i decided to get myself a new shotgun"
hit:5022_conv:10045,utterance,speaker,i got a new shotgun the other day due to the fact crime around me is increasing
hit:5022_conv:10045,utterance,listener,That is good that you have something to protect yourself with
hit:5022_conv:10045,utterance,speaker,"its sad that we have to resort to that nowadays, but better safe than sorry"
hit:5022_conv:10045,utterance,listener,"i completly agree, specially with the crazy people there is these days"
hit:945_conv:1890,situation,none,I was working on a major project for a company and I had everything in order and ready for the presentation
hit:945_conv:1890,utterance,speaker,I had a major project and felt very ready to present it to everyone at the office
hit:945_conv:1890,utterance,listener,How'd it go
hit:945_conv:1890,utterance,speaker,"It went well, I think I gained confidence by being so prepared"
hit:945_conv:1890,utterance,listener,That's great. Do you present often?
hit:4375_conv:8751,situation,none,"I packed for a long road trip, and had everything I would need to hopefully avoid excessive stops."
hit:4375_conv:8751,utterance,speaker,"I recently went on a long trip by car. For the first time, it wasn't stressful because I packed everything I needed for it to run smoothly."
hit:4375_conv:8751,utterance,listener,That sounds great! I really pays off to be prepared.
hit:4375_conv:8751,utterance,speaker,Yes it does. I was able to eliminate several meal breaks which cut over three hours off my trip time!
hit:4375_conv:8751,utterance,listener,That sounds like some efficient planning! I hope you enjoy your trip!
hit:4375_conv:8751,utterance,speaker,Thank you!
hit:685_conv:1371,situation,none,I was ready for lunch
hit:685_conv:1371,utterance,speaker,I was really hungry and ready to eat
hit:685_conv:1371,utterance,listener,What do u want to eat?
hit:685_conv:1371,utterance,speaker,Noodles I guess
hit:685_conv:1371,utterance,listener,"Ok,have u prepared it?"
hit:7969_conv:15938,situation,none,"I had my finals last week, and i studied like crazy for it. Felt so nice walking into that room and feeling calm."
hit:7969_conv:15938,utterance,speaker,"Had my finals last week, studied really hard for them. Felt so nice walking into that room so confident and calm"
hit:7969_conv:15938,utterance,listener,"Great, when will you know your scores?"
hit:7969_conv:15938,utterance,speaker,"Thankfully i knew them right at the spot, i got a 98!"
hit:7969_conv:15938,utterance,listener,"Wow, that's fantastic."
hit:4190_conv:8380,situation,none,"I'm moving, but I've done all my research!"
hit:4190_conv:8380,utterance,speaker,"Boy, it's been a lot of owrk"
hit:4190_conv:8380,utterance,listener,Sometimes we believe is the things that happen to us ... they are many
hit:4190_conv:8380,utterance,speaker,What sort of things?
hit:4190_conv:8380,utterance,listener,I interpret the difficulties
hit:4190_conv:8380,utterance,speaker,What sort of difficulties/
hit:4190_conv:8380,utterance,listener,the lack of humor
hit:4190_conv:8380,utterance,speaker,"Ah, it's no joke is it"
hit:4190_conv:8380,utterance,listener,Ok
hit:9268_conv:18536,situation,none,I am so lucky I packed extra clothes!
hit:9268_conv:18536,utterance,speaker,I would be in bad shape if I didn't pack extra clothes.
hit:9268_conv:18536,utterance,listener,What are you packing extra clothes for? Did you go somewhere did something happen?
hit:9268_conv:18536,utterance,speaker,We went on vacation. And we all ended up with the stomach virus so you can guess from there lol
hit:9268_conv:18536,utterance,listener,What are you packing extra clothes for? Did you go somewhere did something happen?
hit:2809_conv:5618,situation,none,I have everything ready for back to school supplies for my son. I also have his outfit picked out for the first day of school.
hit:2809_conv:5618,utterance,speaker,I have everything ready for back to school supplies for my son to start school.
hit:2809_conv:5618,utterance,listener,That's good. Now you don't have to worry about it.
hit:2809_conv:5618,utterance,speaker,That is true! I also have his outfit picked out for the first day of school.
hit:2809_conv:5618,utterance,listener,"Wow, your son is lucky to have a parent who is on top of things!"
hit:10078_conv:20156,situation,none,"For my camping trip, I brought with me my tent, camping chairs, mattress, sleeping bag, pillows, med-kit, bug spray, food and beer. Never have I ever felt so ready for anything in my life."
hit:10078_conv:20156,utterance,speaker,"For my camping trip, I brought with me my tent, camping chairs, mattress, sleeping bag, pillows, med-kit, bug spray, food and beer."
hit:10078_conv:20156,utterance,listener,That sounds like quite the checklist. I'm glad you brought the beer you might need it haha!
hit:10078_conv:20156,utterance,speaker,Oh yeah definitely. Never have I ever felt so ready for anything in my life.
hit:10078_conv:20156,utterance,listener,Well I bet you're going to have a great time. With that haul I don't see how you couldn't!
hit:9333_conv:18667,situation,none,There is suppose to be a huge storm coming. I went to the store and got supplies so i am ready.
hit:9333_conv:18667,utterance,speaker,There is suppose to be a huge storm coming. I went to the store and got supplies so i am ready.
hit:9333_conv:18667,utterance,listener,That's a good idea! It's always smart to be on the safe side.
hit:9333_conv:18667,utterance,speaker,"We usually don't have horrible storms so i never do it, but i have heard this one is going to be a bad one.  i just want to be ready"
hit:9333_conv:18667,utterance,listener,I've done that as well where nothing ends up happening but I bought all this stuff. You never know what could happen though.
hit:758_conv:1517,situation,none,"I had a job interview that I did really poorly at. I went over all the questions they asked and fixed my answers. For my next interview, they asked very similar questions, and I did much better and got the job."
hit:758_conv:1517,utterance,speaker,"For my current job, I thought about interview answers that I did poorly on before. I was able to ace this interview and have been there for three years!"
hit:758_conv:1517,utterance,listener,Congratulations. Interviews can be stressful
hit:758_conv:1517,utterance,speaker,"True. The interview I had before I got this job went so, so badly. I studied some common questions so I was ready the next time."
hit:758_conv:1517,utterance,listener,Thats smart. And it worked.
hit:4383_conv:8767,situation,none,I arranged a dinner date for me and my husband for his birthday I can't wait for that night.
hit:4383_conv:8767,utterance,speaker,I have a special dinner arranged for me and my husband this week.
hit:4383_conv:8767,utterance,listener,That's wonderful. He'll be so excited when he finds out!
hit:4383_conv:8767,utterance,speaker,Yes he will it's his birthday and we can have a night alone no kids just a nice dinner.
hit:4383_conv:8767,utterance,listener,I hope you guys have a great time. Just the two of you.
hit:4383_conv:8767,utterance,speaker,We will thank you.
hit:10245_conv:20491,situation,none,One time I bought water and snacks before a hurricane came to wreck my city
hit:10245_conv:20491,utterance,speaker,One time I bought water and snacks before a hurricane came to wreck my city
hit:10245_conv:20491,utterance,listener,"oh god, how did you . have the courage to even go outside?"
hit:10245_conv:20491,utterance,speaker,My house flooded so I had to get on my roof !
hit:10245_conv:20491,utterance,listener,that sounds like an adventurous day
hit:3702_conv:7404,situation,none,remembered to bring an umbrella
hit:3702_conv:7404,utterance,speaker,I got caught in a huge rainstorm last week. It was a deludge.
hit:3702_conv:7404,utterance,listener,"Aww man, I hope you brought your raincoat."
hit:3702_conv:7404,utterance,speaker,Thankfully I had remembered to put an umbrella in my bag before I left the house.
hit:3702_conv:7404,utterance,listener,"That's good, you don't want to get soaked and catch a cold."
hit:3770_conv:7541,situation,none,I am ready to start renovating the rest of my house.
hit:3770_conv:7541,utterance,speaker,I am ready to start renovating the rest of my house.
hit:3770_conv:7541,utterance,listener,"OOO I love doing that, but not so much the upheaval in the midst of it.  What room are you going to be working on?"
hit:3770_conv:7541,utterance,speaker,"I finished my kitchen, so the next room is going to be my family room.  Just painting it really."
hit:3770_conv:7541,utterance,listener,"Still, a new color can definitely brighten up a space and make it feel all new!"
hit:3770_conv:7541,utterance,speaker,"Oh yes, we haven't decided on the color yet."
hit:6983_conv:13967,situation,none,I studied for 2 hours for an online interview. I felt confident and ready to ace it!
hit:6983_conv:13967,utterance,speaker,I spent two hours studying material for an interview.
hit:6983_conv:13967,utterance,listener,did it help?
hit:6983_conv:13967,utterance,speaker,"Definitely. I aced it, and now I'm officially in a trial period!"
hit:6983_conv:13967,utterance,listener,congrats! i hope it works out
hit:3881_conv:7762,situation,none,I have to stay on a set schedule so I have always arrange lunch for the week every Sunday night for the week.
hit:3881_conv:7762,utterance,speaker,I usually food prep for the week it is so much easier.
hit:3881_conv:7762,utterance,listener,That is a great idea
hit:3881_conv:7762,utterance,speaker,Yes it works out great saves me money and keeps my scheduled arranged and on track.
hit:3881_conv:7762,utterance,listener,Saving money is important
hit:10441_conv:20882,situation,none,exam tomorrow
hit:10441_conv:20882,utterance,speaker,i am so prepared the exam tomorrow!
hit:10441_conv:20882,utterance,listener,How hard have you been studying? Exams are extreme amounts of mental crunch time!
hit:10441_conv:20882,utterance,speaker,yup but i have been studying since for a year
hit:10441_conv:20882,utterance,listener,You sound very confident! I wish I had your confidence when I was in school.
hit:12163_conv:24327,situation,none,"The house is all cleaned and ready for my guests. Wow, I was cleaning all day!"
hit:12163_conv:24327,utterance,speaker,"The house is all cleaned and ready for my guests. Wow, I was cleaning all day!"
hit:12163_conv:24327,utterance,listener,I was doing the same thing!  Hard work but so satisfying when you see the results!  Who is coming to stay?
hit:12163_conv:24327,utterance,speaker,"Yes, there is no better satisfaction, in my opinion, than a clean house. :) My sister is visiting with her kids. They are staying for a week here at my house. I am sure the house is going to be trashed in the end."
hit:12163_conv:24327,utterance,listener,"I completely agree.  Mine can get trashed in 10 minutes flat from the kids.  ha ha. Oh, how fun!  I hope you have a wonderful time!  Yeah, you'll probably be cleaning all over again by the end of it but its worth it."
hit:11009_conv:22018,situation,none,I work in tech support and we often have complicated issues.  There was one recently where they needed to move data but I did some research before it happened and knew exactly what I needed to do to get the data over.
hit:11009_conv:22018,utterance,speaker,I work in tech support.  One issue I was given the details before and got to do research before I worked with the customer.  It was great knowing what to do before it happened.
hit:11009_conv:22018,utterance,listener,You must have been relieved you were able to help. Did all go as plan?
hit:11009_conv:22018,utterance,speaker,yeah! I pretty much knew all the steps that I needed to do before everything started and there werent any surprise issues which was awesome.
hit:11009_conv:22018,utterance,listener,That's awesome! I'm glad it went through without a hitch!
hit:7447_conv:14895,situation,none,I arranged a nice surprise dinner for my grandparent 50th anniversary last weekend.
hit:7447_conv:14895,utterance,speaker,My grandparents have been married for 50 years I hope to be like that one day.
hit:7447_conv:14895,utterance,listener,That is awesome. I never even get a second date A husband may not be in the cards lol
hit:7447_conv:14895,utterance,speaker,lol you just haven't came across the right person yet. It is incredible I arranged and had them a surprise dinner party it turned out very nice.
hit:7447_conv:14895,utterance,listener,Thats sweet. I bet they enjoyed it
hit:3893_conv:7786,situation,none,I am going on a 17 hour road trip with my husband and 4 kids.
hit:3893_conv:7786,utterance,speaker,"I am about to leave on a 17 hour car trip with my husband, our four kids, and 2 dogs. I think I have everything ready to go though"
hit:3893_conv:7786,utterance,listener,You can never be too prepared! I am sure you have got everything.
hit:3893_conv:7786,utterance,speaker,I hope so. I even portioned out each meal for our dogs in little plastic bags to make sure we have enough.
hit:3893_conv:7786,utterance,listener,That was very smart thinking on your part. Have fun on your trip!
hit:4447_conv:8895,situation,none,I am ready for school to start! I can't wait to teach my first class.
hit:4447_conv:8895,utterance,speaker,I am ready for school to start! I can't wait to teach my first class.
hit:4447_conv:8895,utterance,listener,Sounds exciting.  I wish you the best of luck!
hit:4447_conv:8895,utterance,speaker,"Thank you! I am a little nervous, but I am sure everything will be great."
hit:4447_conv:8895,utterance,listener,Don't worry everyone is nervous on the first day.
hit:6422_conv:12845,situation,none,i have an exam in september
hit:6422_conv:12845,utterance,speaker,i have an exam in the next month and am prepared for it
hit:6422_conv:12845,utterance,listener,That's good! I guess you studied a lot?
hit:6422_conv:12845,utterance,speaker,"yah, been studying for a while now."
hit:6422_conv:12845,utterance,listener,That's good. I am sure you will do great on it.
hit:6422_conv:12845,utterance,speaker,5
hit:2580_conv:5160,situation,none,I've saved up enough money to pay off all of my car payments in one fell swoop next month.
hit:2580_conv:5160,utterance,speaker,I'm so pleased with myself right now.  I saved up enough money to make all of my car payments at once next month.
hit:2580_conv:5160,utterance,listener,That's very good. It takes a disciplined person to save money
hit:2580_conv:5160,utterance,speaker,"Heh, well I didn't exactly save money that mush.  I just hunkered down and started working harder and asked for more hours."
hit:2580_conv:5160,utterance,listener,"You truely are determined to get that car, what brand is it?"
hit:2580_conv:5160,utterance,speaker,It's a Kia Soul.  I hope to trade it in someday to cover the down payment on an electric car.
hit:8080_conv:16160,situation,none,One time I bought emergency supplies before a hurricane
hit:8080_conv:16160,utterance,speaker,One time I bought emergency supplies before a hurricane
hit:8080_conv:16160,utterance,listener,That was probably a good plan to buy them ahead of time
hit:8080_conv:16160,utterance,speaker,"Yup, people started charging like $5 per bottle of water"
hit:8080_conv:16160,utterance,listener,"Wow, thats insane.  I feel like thats illegal"
hit:2832_conv:5664,situation,none,I got back into uni and am feeling more confident
hit:2832_conv:5664,utterance,speaker,I can't wait for college in the fall! I left 2 years ago and am back feeling more confident in my studying abilities.
hit:2832_conv:5664,utterance,listener,i hope you do really well
hit:2832_conv:5664,utterance,speaker,Thanks anything youre looking forward to?
hit:2832_conv:5664,utterance,listener,going to see some old friends this weekend
hit:2832_conv:5664,utterance,speaker,Cool when was the last time you saw them?
hit:3968_conv:7936,situation,none,having enough toilet paper in the house
hit:3968_conv:7936,utterance,speaker,We had a near-disaster at our house today.
hit:3968_conv:7936,utterance,listener,oh no! what happened?
hit:3968_conv:7936,utterance,speaker,"My older son called from the bathroom that we were out of toilet paper. It seemed...um...urgent....Fortunately, we had an emergency stash in the laundry room."
hit:3968_conv:7936,utterance,listener,"ah, crisis averted! that could have been a lot worse"
hit:9492_conv:18985,situation,none,I start my diet next week and I am no where near arranged to keep on schedule with my workouts or meal preps.
hit:9492_conv:18985,utterance,speaker,I start my diet Monday and let's just say I am not ready to start lol.
hit:9492_conv:18985,utterance,listener,I am never ready. which diet are you trying
hit:9492_conv:18985,utterance,speaker,The keto diet and I have started looking up meal preps and workouts but as of non I am so not arranged to start this up I need more time.
hit:9492_conv:18985,utterance,listener,I think my favorite and easiest would have to be Atkins but still alot of prep to get started
hit:9492_conv:18985,utterance,speaker,I have to look into that one never heard of it thanks.
hit:9492_conv:18985,utterance,listener,"your welcome, and I will check out Keto."
hit:740_conv:1481,situation,none,"I have done all my paper work for my exam tomorrow, now i can relax until tomorrow."
hit:740_conv:1481,utterance,speaker,"I have done all my paper work for my exam tomorrow, now i can relax until tomorrow."
hit:740_conv:1481,utterance,listener,That's amazing. It's good to give your head a rest so that you will recall all the items easily when you are at the exam center
hit:740_conv:1481,utterance,speaker,"Thanks, I think I have learnt everything because redid each past exam paper 10 times."
hit:740_conv:1481,utterance,listener,I wish you all the best in the Exam
hit:1081_conv:2163,situation,none,We all went out to dinner and my son had spaghetti and got it all over him. Luckily I brought a change of clothes with us.
hit:1081_conv:2163,utterance,speaker,My son got spaghetti all over himself at dinner at a restaurant one night.
hit:1081_conv:2163,utterance,listener,"Well he's young, so you can't really fault him."
hit:1081_conv:2163,utterance,speaker,I didn't really care too much. I had remembered to pack him an extra set of clothes though.
hit:1081_conv:2163,utterance,listener,That's good. You seem like a great parent.
hit:4173_conv:8346,situation,none,I was well prepared for my interview
hit:4173_conv:8346,utterance,speaker,I was very pleased to get this job
hit:4173_conv:8346,utterance,listener,What is the job?
hit:4173_conv:8346,utterance,speaker,I got the job has an software Analysis and that was aim
hit:4173_conv:8346,utterance,listener,"Well congrats then, I am sure that is not easy"
hit:4173_conv:8346,utterance,speaker,A little bit. But when we doing it in a rightway from our heart really it will be easy
hit:11505_conv:23010,situation,none,I am starting my exams on friday next week
hit:11505_conv:23010,utterance,speaker,I will be sitting for my nclex exam on friday
hit:11505_conv:23010,utterance,listener,I am sorry I do not know what nclex is but I wish you good luck
hit:11505_conv:23010,utterance,speaker,"Its a nursing exam, thank you"
hit:11505_conv:23010,utterance,listener,O ok I hope that everything works out for you
hit:1862_conv:3725,situation,none,"I was waiting for a subway train, but as it passed me it honked continuously, I din't move a muscle."
hit:1862_conv:3725,utterance,speaker,"I seem to be always alert, so that even something loud happens, I remain calm."
hit:1862_conv:3725,utterance,listener,i admire that
hit:1862_conv:3725,utterance,speaker,"I just wander, is this normal?"
hit:1862_conv:3725,utterance,listener,no its not
hit:6914_conv:13829,situation,none,I feel ready for the coming work week.  I have all my materials set
hit:6914_conv:13829,utterance,speaker,I feel ready for the coming work week
hit:6914_conv:13829,utterance,listener,Really? You must really like you job then
hit:6914_conv:13829,utterance,speaker,"Yeah, I think I have all my work materials set"
hit:6914_conv:13829,utterance,listener,Good for you! I hope you  have good week!
hit:8392_conv:16785,situation,none,I've spent all day getting my kit ready for the next competition this weekend. I'm exhausted.
hit:8392_conv:16785,utterance,speaker,I've spent all day getting my kit ready for the next competition this weekend. I'm exhausted.
hit:8392_conv:16785,utterance,listener,whats the competition on ?
hit:8392_conv:16785,utterance,speaker,Highland games. I throw the caber and heavy hammer.
hit:8392_conv:16785,utterance,listener,"Nice hope you win , ill be looking into this further"
hit:5813_conv:11626,situation,none,The last vacation I took I had to pack luggage for a family of 6 and get the rental car and plane and hotel arrangements and it all went smoothly
hit:5813_conv:11626,utterance,speaker,My last vacation we went to Florida and a lot of prep work went into getting everything ready
hit:5813_conv:11626,utterance,listener,You must have prepared really well. Did the trip go well?
hit:5813_conv:11626,utterance,speaker,yes the plane ride was smooth and no delay's and we got a nice rental van
hit:5813_conv:11626,utterance,listener,Sounds like the trip went well. I am glad you enjoyed it!
hit:5813_conv:11626,utterance,speaker,Thanks I hope to go again soon
hit:11280_conv:22560,situation,none,"I packed for a long road trip, and had everything I would need to hopefully avoid excessive stops."
hit:11280_conv:22560,utterance,speaker,"I packed for a long road trip, and had everything I would need to hopefully avoid excessive stops."
hit:11280_conv:22560,utterance,listener,Yeah I like going straight to the point too
hit:11280_conv:22560,utterance,speaker,Definitely. Nothing worse than dragging out a drive because you didn't pack enough food and didn't plan bathroom breaks.
hit:11280_conv:22560,utterance,listener,I like when I get places earlier than expected
hit:11189_conv:22378,situation,none,I started graduate classes today. I have all my binders ready with paper in them.  I also bought some really cute monthly calendars to put in them so I can write down when everything is due. I am ready!
hit:11189_conv:22378,utterance,speaker,Hello! I started my graduate classes today.
hit:11189_conv:22378,utterance,listener,Are you looking forward to it?
hit:11189_conv:22378,utterance,speaker,Yes. I have all my binders ready with paper and a calendar to keep track of stuff.  I'm nervous but ready!
hit:11189_conv:22378,utterance,listener,Exciting! I'm sure you'll do fine.
hit:11189_conv:22378,utterance,speaker,I hope so!  It's very different from undergraduate
hit:576_conv:1153,situation,none,Before I left the country I paid my bills and rent ahead for 2 months. Maybe I should have listed on Airbnb instead.
hit:576_conv:1153,utterance,speaker,I think I should have listed my place on Airbnb before leaving the country.
hit:576_conv:1153,utterance,listener,"Wow, what really happened?"
hit:576_conv:1153,utterance,speaker,I ended up paying rent and bills ahead 2 months instead.
hit:576_conv:1153,utterance,listener,"Oh really, that was hectic for you I guess"
hit:576_conv:1153,utterance,speaker,"It really was, and a missed opportunity to cut my costs."
hit:7050_conv:14100,situation,none,I packed a sandwich before I went to work
hit:7050_conv:14100,utterance,speaker,I packed a sandwich before I went to work
hit:7050_conv:14100,utterance,listener,Are you trying to save money by not eating out at work?
hit:7050_conv:14100,utterance,speaker,"Yup, and I am too lazy to drive out to a restaurant!"
hit:7050_conv:14100,utterance,listener,"Well, it can save you a bunch of money!  Plus you gain the time that you would normally spend going out somewhere and you can use that time to have more of a break."
hit:4625_conv:9250,situation,none,It rained so much here that our local river flooded our town. My family had spent the previous nights placing sandbags around our home.
hit:4625_conv:9250,utterance,speaker,We had record rainfall in my town this past spring causing a lot of flooding.
hit:4625_conv:9250,utterance,listener,Oh no. Floodwaters can be devastating. Was there a lot of damage?
hit:4625_conv:9250,utterance,speaker,"Yes, there was, the town was very damaged. We had sandbagged around our home and managed to save our house."
hit:4625_conv:9250,utterance,listener,Good thing you were prepared.
hit:11610_conv:23220,situation,none,i have a presentation tomorrow. I am ready for it.
hit:11610_conv:23220,utterance,speaker,i have a presentation tomorrow. I am ready for it.
hit:11610_conv:23220,utterance,listener,That's good. I assume you have studied hard and are prepared?
