Dialog_ID,Type,Actor,Text
hit:7517_conv:15035,utterance,speaker,"I was so ready for this roadtrip, all my bags were packed and I ready to go"
hit:7517_conv:15035,utterance,listener,Oh no did it get cancelled?
hit:7517_conv:15035,utterance,speaker,"No NO, I just saying how ready I am to go, I havbent left yet though"
hit:7517_conv:15035,utterance,listener,Oh sorry! I hope you have lots of fun!
hit:1273_conv:2546,situation,none,"I'm having a party this weekend, I went out and got the food ahead of time."
hit:1273_conv:2546,utterance,speaker,I'm having a party this weekend and I already got my grocery shopping done for it! I refuse to be last minute like last time.
hit:1273_conv:2546,utterance,listener,I have a friend who plans ahead like that.  I'm a last minute gal.  I think you will be less stressed by planning ahead.
hit:1273_conv:2546,utterance,speaker,I will be and be able to enjoy myself more in the days leading up to the party.
hit:1273_conv:2546,utterance,listener,"Not to mention enjoy the actual party, too!  Are you celebrating anything in particular?"
hit:11739_conv:23479,situation,none,Got everything packed and ready for my camping trip this weekend.  Should be a great time.
hit:11739_conv:23479,utterance,speaker,Got everything packed and ready for my camping trip this weekend. Should be a great time.
hit:11739_conv:23479,utterance,listener,Hey that's awesome!  Where ya going?
hit:11739_conv:23479,utterance,speaker,"Out in the woods near a friend's place, haven't been in a long time!"
hit:11739_conv:23479,utterance,listener,Yeah I haven't either.  I bet it's gonna be awesome.  Bring plenty of beer :D
hit:7708_conv:15416,situation,none,I've been training all my life for the 2020 olympic trials and feel like I'm ready to do great things there.
hit:7708_conv:15416,utterance,speaker,I've spent my entire life dedicated to this one thing
hit:7708_conv:15416,utterance,listener,And what was this thing?
hit:7708_conv:15416,utterance,speaker,the 2020 Olympic Trials . ( I'm a javelin thrower)
hit:7708_conv:15416,utterance,listener,"I see, you must be very prepared and talented to compete in such a thing."
hit:5963_conv:11927,situation,none,I've got a lot of haters so I'm ready to knock out a jealous little punk who tries crossing me at all times.
hit:5963_conv:11927,utterance,speaker,I live the life of my dreams.  As a result I've got a lot of haters so I'm always ready to knock out a jealous little punk who tries crossing me at all times
hit:5963_conv:11927,utterance,listener,"its sad but true, people dont want to see others doing well! got to be ready to protect what is yours!"
hit:5963_conv:11927,utterance,speaker,Yes I have a feeling you're gonna be a winner.
hit:5963_conv:11927,utterance,listener,"just keep working, learning and trying new things, cant go wrong like that i think!"
hit:5462_conv:10924,situation,none,I'm not an antagonistic person.  But if someone disrespects me in front of my friends or tries to start a fight I'll be ready to knock him out cold
hit:5462_conv:10924,utterance,speaker,I'm not antagonistic but if someone disrespects me in front of my friends and family or tries to start a fight I'll be ready to knock him out cold or snap his arm
hit:5462_conv:10924,utterance,listener,i get you. i hate fighting but i'm not going to be disrespected either.
hit:5462_conv:10924,utterance,speaker,Yup what goes around comes around
hit:5462_conv:10924,utterance,listener,i totally understand that.
hit:12418_conv:24836,situation,none,I am ready for vacation!
hit:12418_conv:24836,utterance,speaker,I am all packed and ready to go see my family!
hit:12418_conv:24836,utterance,listener,Are you making a trip to see your family?
hit:12418_conv:24836,utterance,speaker,Yes! We are driving up to see them on Monday.
hit:12418_conv:24836,utterance,listener,Great. It is always good to see your family. Is it very far?
hit:12418_conv:24836,utterance,speaker,It is a 7 hour drive. It takes  a little longer with bathroom breaks though.
hit:1118_conv:2237,situation,none,I felt prepared when I had to give a presentation at work
hit:1118_conv:2237,utterance,speaker,I was thankfully ready for an important presentation at work that I had to give a while back.
hit:1118_conv:2237,utterance,listener,"That is good, chance favors those who are prepared."
hit:1118_conv:2237,utterance,speaker,I agree.  It certainly helped my anxiety too.
hit:1118_conv:2237,utterance,listener,Do you take any mediciation?
hit:3361_conv:6722,situation,none,"My hard drive crashed yesterday that had many important files on it. Luckily, I decided to start daily backups a few days prior."
hit:3361_conv:6722,utterance,speaker,My hard drive crashed yesterday that had many important files on it
hit:3361_conv:6722,utterance,listener,I'm sorry to hear that. Did you have the files backed up at all?
hit:3361_conv:6722,utterance,speaker,"Yes, actually! I decided to implement daily backups a few days prior so I really lucked out"
hit:3361_conv:6722,utterance,listener,"Wow, that's so lucky! I should do that as well just in case!"
hit:1971_conv:3943,situation,none,I am all packed for my vacation.  I don't believe I have forgotten anything for the trip but you never know.
hit:1971_conv:3943,utterance,speaker,I'm leaving for my vacation soon.  I have everything all packed and ready to go.
hit:1971_conv:3943,utterance,listener,Great where are you going?
hit:1971_conv:3943,utterance,speaker,Going to see family.  I just don't want to leave anything behind that I might need on the trip.
hit:1971_conv:3943,utterance,listener,"I agree, it's better to overpack than underpack."
hit:3211_conv:6422,situation,none,I always make a schedule for tomorrows activities. It keeps me busy and I never forget anaything
hit:3211_conv:6422,utterance,speaker,I have started to makes schedules for myself everyday
hit:3211_conv:6422,utterance,listener,That's good. Are you getting the hang of it?
hit:3211_conv:6422,utterance,speaker,I am. I never forget anything now. I keep bust too
hit:3211_conv:6422,utterance,listener,It's better to write things down than try to keep things in your head.
hit:3211_conv:6422,utterance,speaker,Especially as you get older lol
hit:8947_conv:17895,situation,none,"I packed a thorough bag when I went to the hospital to have my baby.  I packed everything I'd need, far in advance.  For once, I didn't miss or forget anything!"
hit:8947_conv:17895,utterance,speaker,"I packed my bag in advance, and really thoroughly, when I went to the hospital to have my baby."
hit:8947_conv:17895,utterance,listener,It sounds you you didnt leave anything out. It feels good to bell prepared.
hit:8947_conv:17895,utterance,speaker,"I was so happy that for once, I didn't forget or miss anything"
hit:8947_conv:17895,utterance,listener,That is great especially in a time like going to the hospital.
hit:9857_conv:19715,situation,none,i was ready  for that interview last week
hit:9857_conv:19715,utterance,speaker,i was ready for that intervlew last week
hit:9857_conv:19715,utterance,listener,That's the best way to go in to an interview. How do you think it went?
hit:9857_conv:19715,utterance,speaker,i ended up getting a job offer.
hit:9857_conv:19715,utterance,listener,Oh congratulations! What kind of job?
hit:5146_conv:10293,situation,none,I had a big  presentation at this work. I was so ready for it.
hit:5146_conv:10293,utterance,speaker,I had a big presentation at work and I crushed it. I was so prepared!
hit:5146_conv:10293,utterance,listener,That's awesome to hear!
hit:5146_conv:10293,utterance,speaker,Yeah it really was great. I  might get  a promotion!
hit:5146_conv:10293,utterance,listener,That's good news. Congratulations in advance!
hit:7822_conv:15644,situation,none,I studied all year for my driver test!
hit:7822_conv:15644,utterance,speaker,I studied all year for my driver test.
hit:7822_conv:15644,utterance,listener,"Seems like you were well prepared, did you pass?"
hit:7822_conv:15644,utterance,speaker,I take it three days from the last Sunday before the month that has Christmas in it.
hit:7822_conv:15644,utterance,listener,That's a very complicated way to say November.
hit:10518_conv:21036,situation,none,"I had a party at my house recently, and I got everything ready over a week in advance!"
hit:10518_conv:21036,utterance,speaker,"I had a party last weekend, and I got everything ready a week in advance so it would go well."
hit:10518_conv:21036,utterance,listener,"Nice, gotta be prepared. Hope the party went well."
hit:10518_conv:21036,utterance,speaker,"It went very well, my guests all seemed to have a good time, and we didn't run out of booze or food the wole night!"
hit:10518_conv:21036,utterance,listener,"An endless flow of booze is the key to a successful party, sounds like it was a good time.,"
hit:2380_conv:4761,situation,none,I actualy made a list when I went grocery shopping today. I forgot nothing!
hit:2380_conv:4761,utterance,speaker,"I went grocery shopping like I usually do today, but I did something different."
hit:2380_conv:4761,utterance,listener,"Oh, that's curious... By different, what do you mean? Did you buy different stuff, or go to a different store, or what?"
hit:2380_conv:4761,utterance,speaker,"I never wanted to be the ""grocery list"" person, but I did it today and its the first time in years I didn't forget something. I shouldve beem doing this all along especially with three kids."
hit:2380_conv:4761,utterance,listener,"Oh yeah, totally. And then you don't end up buying too much or too little, and you don't waste time trying to remember things. There's also tons of little apps on your phone you can get that can make it really streamlined and convenient."
hit:2380_conv:4761,utterance,speaker,"I have so many apps, but I get frustated with technology easily. I think the list thing might work out after all"
hit:2380_conv:4761,utterance,listener,"I'm sorry to hear that. Maybe give it one more try, and if you continue to like it, that might be your sign to stick with it. Good luck!"
hit:6361_conv:12723,situation,none,The world will come to an end soon. I have a bunker and a hoard of food and supplies in it.
hit:6361_conv:12723,utterance,speaker,I know the zombie apocalypse will happen soon.
hit:6361_conv:12723,utterance,listener,it will. i hope i am long gone
hit:6361_conv:12723,utterance,speaker,I'll be in my bunker with my hoard of food and supplies!
hit:6361_conv:12723,utterance,listener,maybe i will be a zombie!
hit:8031_conv:16063,situation,none,"With the way the world has been going, I've been trying to get off the grid as much as possible. I'm investing in solar power and starting my own little farm."
hit:8031_conv:16063,utterance,speaker,"With the way the world is going right now, I've been trying to go off grid. I'm investing in solar power and starting up my own small farm."
hit:8031_conv:16063,utterance,listener,That sounds like an interesting life choice. It's probably very calming.
hit:8031_conv:16063,utterance,speaker,It's a pretty fun project! I like teaching my kids about how to be self sufficient and they enjoy gardening.
hit:8031_conv:16063,utterance,listener,It's an important tool set to have!
hit:8031_conv:16063,utterance,speaker,Absolutely! Not to mention gardening saves a ton of money in the long run.
hit:9908_conv:19816,situation,none,I have been studying for my final math test tomorrow. I've never felt so ready.
hit:9908_conv:19816,utterance,speaker,I have my final math exam tomorrow.
hit:9908_conv:19816,utterance,listener,I hope you studied for it!
hit:9908_conv:19816,utterance,speaker,I did! I spent the entire week hard at the books. I've never felt so ready for a test before.
hit:9908_conv:19816,utterance,listener,That's great! I hope you do well on your exam! Reward yourself after too
hit:10125_conv:20251,situation,none,"We are going camping next weekend and I have all the equipment to do it, so I believe we are going to be quite comfortable and safe."
hit:10125_conv:20251,utterance,speaker,"We are going camping next weekend and I have all the equipment to do it right,"
hit:10125_conv:20251,utterance,listener,Make sure to bring smores and bug spray. I hate bug bites. and love chocolate
hit:10125_conv:20251,utterance,speaker,Yes I have all of that plus everything else we will be needing.
hit:10125_conv:20251,utterance,listener,Make sure you bring something to drink as well. can get quite thirsty ya know.
hit:9817_conv:19634,situation,none,"I am ready to play the new mario party game, I wish it would hurry up and release!"
hit:9817_conv:19634,utterance,speaker,"I am ready to play the new mario party game, I wish it would hurry up and release!"
hit:9817_conv:19634,utterance,listener,I bet that will be fun. Do you do that a lot
hit:9817_conv:19634,utterance,speaker,"Play games? Yes, very often"
hit:9817_conv:19634,utterance,listener,I need to game more when I can
hit:6477_conv:12954,situation,none,I have done lots of research for a job interview I'm going for.
hit:6477_conv:12954,utterance,speaker,I have done lots of research for a job interview I have coming up.
hit:6477_conv:12954,utterance,listener,How are you feeling about the interview?
hit:6477_conv:12954,utterance,speaker,I think I am well prepared so hopefully it should be fine.
hit:6477_conv:12954,utterance,listener,What is the job?
hit:6477_conv:12954,utterance,speaker,It is in a call center
hit:5563_conv:11127,situation,none,"It's hurricane season where I live and I've been stocking up on supplies just in case a storm comes. I've bought water, canned food, batteries and led lanterns."
hit:5563_conv:11127,utterance,speaker,It's hurricane season in my area and I've been stocking up on supplies just in case a storm comes!
hit:5563_conv:11127,utterance,listener,Sounds like you're ready to ride out the storm. Are you afraid?
hit:5563_conv:11127,utterance,speaker,"No, I've been through many bad storms. I've learned to buy water, canned food, batteries and LED lanterns early in the season to beat the crowds!"
hit:5563_conv:11127,utterance,listener,True. I bet it was a mad house at the supermarket today.
hit:715_conv:1430,situation,none,I have been studying very hard for my MongoDB exams I'm ready to go take the exams
hit:715_conv:1430,utterance,speaker,Wish me luck!
hit:715_conv:1430,utterance,listener,"Hello my friend! I will gladly wish you all the luck in the world, if you would only tell me what I am wishing it for!"
hit:715_conv:1430,utterance,speaker,Good luck for my examination that is coming up in 2 days time
hit:715_conv:1430,utterance,listener,"Ah, I see! Do you feel prepared for the examination? Did you spend a lot of time hitting the books?"
hit:5706_conv:11413,situation,none,I never stop working out.
hit:5706_conv:11413,utterance,speaker,I never stop working out.
hit:5706_conv:11413,utterance,listener,I thik thats good
hit:5706_conv:11413,utterance,speaker,I try to get ready for a fight.
hit:5706_conv:11413,utterance,listener,Why do want to fight?
hit:7597_conv:15194,situation,none,I have done lots of research for a job interview this week
hit:7597_conv:15194,utterance,speaker,I have a job interview next week. I've been doing lots of research.
hit:7597_conv:15194,utterance,listener,Job interviews always make me nervous. Research is a great idea!
hit:7597_conv:15194,utterance,speaker,I hope it serves me well
hit:7597_conv:15194,utterance,listener,It definitely can't hurt. Good luck on the interview!
hit:5261_conv:10523,situation,none,I have to bake 10 cakes by tomorrow.  I am ready to do it though.
hit:5261_conv:10523,utterance,speaker,I have to bake 10 cakes by tomorrow.
hit:5261_conv:10523,utterance,listener,Oh WOW!  That is a lot of cakes!!  Will you be able to get it all done?
hit:5261_conv:10523,utterance,speaker,"Yes, I am ready to do it."
hit:5261_conv:10523,utterance,listener,Well more power to you!  I don't think I could do that in one night - you must be a good baker.
hit:10951_conv:21902,situation,none,We went through hurricane irma last year. We got everything we needed and put metal shutter on all the windows and decided to stay.
hit:10951_conv:21902,utterance,speaker,My boyfriend and I went through Hurricane Irma last year. It was pretty scary.
hit:10951_conv:21902,utterance,listener,"i must have been terrifying, I am glad you both made it through it"
hit:10951_conv:21902,utterance,speaker,Me too! We got all the supplies we needed and put up the shutters ahead of time and sat it out. I'm glad we didn't need to use any of the supplies.
hit:10951_conv:21902,utterance,listener,its nice to have another to lean on when it happened
hit:10951_conv:21902,utterance,speaker,"Yes, if I have to go through something like that I'd like him to be there."
hit:6960_conv:13921,situation,none,I've been practicing this piece for months. I think I'm ready to play it in front of everyone.
hit:6960_conv:13921,utterance,speaker,I've been practicing this piece for months. I think I'm ready to play it in front of everyone.
hit:6960_conv:13921,utterance,listener,what are you playing?
hit:6960_conv:13921,utterance,speaker,I'll be playing Tchaikovsky on piano and flute.
hit:6960_conv:13921,utterance,listener,wow that is impressive!!
hit:10463_conv:20927,situation,none,I filled out all my new patient paper work before my doctor's appointment.  The nurses commented they were so happy they didn't have to wait for me to do it in the office.
hit:10463_conv:20927,utterance,speaker,"I filled out all of my ""new patient"" paper work before my appointment with my new doctor."
hit:10463_conv:20927,utterance,listener,Did it take a long time to complete?
hit:10463_conv:20927,utterance,speaker,"Not too long, maybe 15 minutes?  The nurses commented that they were really happy they didn't have to wait on me to do it in the office lol"
hit:10463_conv:20927,utterance,listener,"That's awesome! I am glad it didn't take long, because those have been a pain in the past for me."
hit:12362_conv:24725,situation,none,"I helped my daughter prepare a project for school that had to do with picking a state and telling about it,after we got it all done she informed me that she wanted it on wheels"
hit:12362_conv:24725,utterance,speaker,"My daughter had a school project that I helped her assemble, after we was done with it she informed she wanted it on wheels. Sometimes kids can be such a pain."
hit:12362_conv:24725,utterance,listener,"Yeah, I have a doughter as well and understand.  I guess kids will be kids!"
hit:12362_conv:24725,utterance,speaker,Lol. Yes they will be. Just would have been nice to know she wanted it on wheels at the beginning of the project
hit:12362_conv:24725,utterance,listener,The things they do make no sense.  Kid logic!
hit:8676_conv:17352,situation,none,"I just bought a battery pack charger for my car, and guess what happened to me today."
hit:8676_conv:17352,utterance,speaker,"I just bought a battery pack charger for my car, and guess what happened to me today."
hit:8676_conv:17352,utterance,listener,I have no idea. What happened?
hit:8676_conv:17352,utterance,speaker,"My battery died, but I was able to just step out, hook up the pack to the battery, and in 5 minutes I was on my way to my meeting."
hit:8676_conv:17352,utterance,listener,Oh thank goodness you weren't late.
hit:2264_conv:4529,situation,none,I like collecting survival items in case of an emergency!  I will be ready for any disaster or zombie Apocalypse that comes my way!
hit:2264_conv:4529,utterance,speaker,I like collecting survival items in case of an emergency! I will be ready for any disaster or zombie Apocalypse that comes my way!
hit:2264_conv:4529,utterance,listener,What all do you have stored so far?
hit:2264_conv:4529,utterance,speaker,"Water, flashlights, food, weapons, solar panels, and on and on!  Nothing will take me by surprise!"
hit:2264_conv:4529,utterance,listener,Do you also have a go-bag?
hit:871_conv:1743,situation,none,I am getting my stuff together for a trip.  I am going to Vegas.
hit:871_conv:1743,utterance,speaker,I really should be packing right now.  I am going to Vegas tomorrow.
hit:871_conv:1743,utterance,listener,"oh, it's good. Take your all belongings without fail. Hope you'll have good journey."
hit:871_conv:1743,utterance,speaker,Thank you!  I am going to go now and finish my laundry!
hit:871_conv:1743,utterance,listener,sure. Have a good trip.
hit:4129_conv:8258,situation,none,I have never been more ready for school to start. The summer was so boring I had no choice.
hit:4129_conv:8258,utterance,speaker,I have never been more reafy for school to start.
hit:4129_conv:8258,utterance,listener,"Oh my goodness, me either!"
hit:4129_conv:8258,utterance,speaker,The summer was long a boring so all I did was prepare. I am going to kill it
hit:4129_conv:8258,utterance,listener,Are you going to a Univeristy?
hit:4129_conv:8258,utterance,speaker,Yes I a junir this uear
hit:4129_conv:8258,utterance,listener,What are you studying to be?
hit:4129_conv:8258,utterance,speaker,I want to work at the courthouse. Im not sure yet though
hit:4129_conv:8258,utterance,listener,That's interesting. A lot of cool things to learn for sure.
hit:9832_conv:19664,situation,none,"Earlier today I took the final exam for my accounting class, and I guess I did enough studying since I pulled off a 95% on it."
hit:9832_conv:19664,utterance,speaker,"I was stressing over my accounting final today, but all that stress was for nothing."
hit:9832_conv:19664,utterance,listener,I guess you got an A?
hit:9832_conv:19664,utterance,speaker,I got a 95% on it! Looks like all those extra study sessions paid off!
hit:9832_conv:19664,utterance,listener,"Well done, what other exams are left?"
hit:9832_conv:19664,utterance,speaker,"That was the last one for the summer, but then I have five more classes starting in two weeks."
hit:10643_conv:21286,situation,none,I was ready to participate in staffing at team camp when the time came. I got lots of sleep to get ready!
hit:10643_conv:21286,utterance,speaker,I went to staff at a teen camp and I had to prepare mentally and physically.
hit:10643_conv:21286,utterance,listener,"Oh, how was that? I've never been to camp. Was it fun at least?"
hit:10643_conv:21286,utterance,speaker,Yes I think it was a very rewarding experience! It was exhausting at the same time though! They have lots of activities!
hit:10643_conv:21286,utterance,listener,"That's great, I'm glad you had fun. What was your favorite activity?"
hit:11887_conv:23775,situation,none,Headed out to the campground this morning.  I have everything packed I believe.
hit:11887_conv:23775,utterance,speaker,"After a long, hard week at work, I am headed to the campground this week to disconnect."
hit:11887_conv:23775,utterance,listener,its always good to get away and reset
hit:11887_conv:23775,utterance,speaker,I am pretty certain that I have everything we need for the weekend getaway.
hit:11887_conv:23775,utterance,listener,did you make a check list and double check it?
hit:5278_conv:10556,situation,none,"We had a big storm last summer, so this year I bought a ton of supplies in case we lost power or had flooding. Last year our basement got very damaged."
hit:5278_conv:10556,utterance,speaker,"My basement got very damaged last year during a storm, so this year I decided to buy a bunch of supplies."
hit:5278_conv:10556,utterance,listener,god it repaired ?
hit:5278_conv:10556,utterance,speaker,Yeah its all repaired now. I also bought lots of food in case we loose power.
hit:5278_conv:10556,utterance,listener,thats cool.
hit:4914_conv:9829,situation,none,I'm about to move this weekend to a new city.  I have everything packed and ready to go and have already cleaned the new house.
hit:4914_conv:9829,utterance,speaker,I'm about to move this weekend to a new city. I have everything packed and ready to go and have already cleaned the new house.
hit:4914_conv:9829,utterance,listener,Well that's exciting! A fresh start is always fun. What inspired you to make such a big change?
hit:4914_conv:9829,utterance,speaker,I got a new job and have always wanted to move away from my hometown because its not that big.  I can't wait
hit:4914_conv:9829,utterance,listener,"Awesome, you'll be able to make friends at work. I wish you the best in your new city, congrats!"
hit:1912_conv:3824,situation,none,I had to speak at a meeting at work and spent a week drafting up my speech. Because of this I performed well.
hit:1912_conv:3824,utterance,speaker,I had to speak at a meeting at work and spent a week drafting up my speech. Because of this I performed well.
hit:1912_conv:3824,utterance,listener,"Seems like this speech was very important to you, why?"
hit:1912_conv:3824,utterance,speaker,Because it was a speech to our client about why they should stay with us.
hit:1912_conv:3824,utterance,listener,"Ah-ah, than it makes a lot of sense."
hit:8162_conv:16324,situation,none,My kids start school next week. We are all ready and have all their supplies.
hit:8162_conv:16324,utterance,speaker,My kids start school next week.
hit:8162_conv:16324,utterance,listener,mine started today!!
hit:8162_conv:16324,utterance,speaker,We are all ready and have all the supplies. They can't wait.
hit:8162_conv:16324,utterance,listener,thats always good when they cant wait to return
hit:8068_conv:16137,situation,none,"I'm ready for my son to start school tomorrow. We bought all of his supplies, a new backpack, shoes and clothes."
hit:8068_conv:16137,utterance,speaker,"After a week of shopping, I'm ready for my son to go back to school tomorrow!"
hit:8068_conv:16137,utterance,listener,Nice! What grade is your son in?
hit:8068_conv:16137,utterance,speaker,"He's starting eighth! We bought all of his supplies, a new backpack, shoes and a ton of clothes!"
hit:8068_conv:16137,utterance,listener,Nice! I am sure he is going to be hanging with the popular folk in no time.
