Dialog_ID,Type,Actor,Text
hit:1572_conv:3145,situation,none,My girls went on an out of town trip and I was home alone
hit:1572_conv:3145,utterance,speaker,My girls went on an out of town trip and I was home alone
hit:1572_conv:3145,utterance,listener,Oh no. Being home alone can be good though. Finally everything to yourself!
hit:1572_conv:3145,utterance,speaker,You would think but I really missed them.
hit:1572_conv:3145,utterance,listener,I feel ya. How long will they be gone for?
hit:9459_conv:18918,situation,none,I talked to my brother about our childhood the other day. It always make me happy to talk to him.
hit:9459_conv:18918,utterance,speaker,I talked to my brother the other day. We don't talk much and I miss him.
hit:9459_conv:18918,utterance,listener,"I know how you feel, my brother is my best friend but I only talk to him about once a month because he is so busy.  Where is your brother now?"
hit:9459_conv:18918,utterance,speaker,He lives a couple of states away. He is also crazy busy.
hit:9459_conv:18918,utterance,listener,"Well, I hope you get to talk to him more and maybe can get over there for a visit!"
hit:8098_conv:16196,situation,none,The backyard makes me miss my dog.
hit:8098_conv:16196,utterance,speaker,The backyard makes me miss my dog.
hit:8098_conv:16196,utterance,listener,where did he go
hit:8098_conv:16196,utterance,speaker,She passed away 2 years ago.
hit:8098_conv:16196,utterance,listener,oh sorry to hear that
hit:4437_conv:8874,situation,none,I will never forget our last good fanily photo. We were all so happy then
hit:4437_conv:8874,utterance,speaker,Our last family photo was so long ago
hit:4437_conv:8874,utterance,listener,You must have some fond memories of that.
hit:4437_conv:8874,utterance,speaker,IT was our last great family picture. We hae no more good memories
hit:4437_conv:8874,utterance,listener,I'm sorry.  Hold on to the old memories.
hit:4437_conv:8874,utterance,speaker,I will. IT is the beest we will every have
hit:5995_conv:11990,situation,none,My mother passed away a while back. I still use all of her favorite cooking pots when I cook. Its a great reminder.
hit:5995_conv:11990,utterance,speaker,I still use all of my mothers cooking pots. She passed away a few years ago. Its a great reminder of her.
hit:5995_conv:11990,utterance,listener,That is so wonderful that you have something of hers.  I'm so sorry you lost her.  That is so difficult.  Did she love cooking?
hit:5995_conv:11990,utterance,speaker,Yes and she was very good at it. I can still see her cooking my favorite dishes when I use them.
hit:5995_conv:11990,utterance,listener,You still have her right there with you!  Its wonderful to know that you're keeping her food and memories so alive!
hit:11705_conv:23411,situation,none,My son has been playing tee ball just like when I used to play.  Those were great times for me.
hit:11705_conv:23411,utterance,speaker,My son has been playing tee ball just like when I used to play. Those were great times for me.
hit:11705_conv:23411,utterance,listener,"Those are the best times,I can't wait until my son plays."
hit:11705_conv:23411,utterance,speaker,"How old is your son?  Yea, its been so fun to watch him gain confidence and help his team win and have fun."
hit:11705_conv:23411,utterance,listener,He is 2!
hit:290_conv:581,situation,none,I was going threw storage and found a tube of things my grandfather game me
hit:290_conv:581,utterance,speaker,Last night I was looking at my things I have in a storage locker and found a tub filled with my grandfathers things. The good memories came flooding back.
hit:290_conv:581,utterance,listener,Oh wow thats cool.
hit:290_conv:581,utterance,speaker,"Yes, he's been gone 10 years but I still think of him daily. It's strange how someone can make such an impact on someone for so long."
hit:290_conv:581,utterance,listener,Thats good you still think of him.
hit:290_conv:581,utterance,speaker,"Yes, he was my hero and still is I guess."
hit:12111_conv:24222,situation,none,"I ran out of laundry soap the other day and grabbed a brand I used many years ago from the store. It was so interesting that the scent of that laundry soap brought me right back to where I was all those years ago, crazy how a familiar smell can do that."
hit:12111_conv:24222,utterance,speaker,"I ran out of laundry soap the other day, when I went to the store I grabbed a brand I hadn't used in many years."
hit:12111_conv:24222,utterance,listener,How well did it work out for you?
hit:12111_conv:24222,utterance,speaker,"Oh it worked fine, but when I pulled my laundry out it surprised me how the smell of that soap reminded me of my life all those years ago when I used it regularly. Isn't it weird how scents can do that?"
hit:12111_conv:24222,utterance,listener,Wow!  That is such a great feeling!  I love when good memories come back to me!
hit:12111_conv:24222,utterance,speaker,Right? I didn't expect that could happen with laundry soap!
hit:10400_conv:20800,situation,none,when she talked about her feelings i was very emotional
hit:10400_conv:20800,utterance,speaker,"a young girl, crying, sadden by the cruelity of our elders, told me about all these feelings i began to cry and became very sentimental"
hit:10400_conv:20800,utterance,listener,....what feelings? what are you talking about
hit:10400_conv:20800,utterance,speaker,she said that the elder man approached her and told her she is dumb and that made her very sad and upset
hit:10400_conv:20800,utterance,listener,"oh man, that's rough to hear from someone older than you. is she ok?"
hit:11988_conv:23976,situation,none,When bad things happen I get too emotional. I think more than other do. Sometimes I think I am crazy.
hit:11988_conv:23976,utterance,speaker,When bad things happen I get too emotional. I think more than other do. Sometimes I think I am crazy.
hit:11988_conv:23976,utterance,listener,I'm sorry to hear that...sometime you just have stop and take a deep breathe so you don't get overwhelmed.
hit:11988_conv:23976,utterance,speaker,"Yeah, I know. But in the moment it is hard. I guess I am just a very emotional person. Maybe I need theraoy, lol."
hit:11988_conv:23976,utterance,listener,Therapy is a good thing. Its is nothing to be ashamed of.
hit:7677_conv:15355,situation,none,In 2011 I put my beautiful daughter emerson up for adoption.  THis was the hardest decision I have ever had to make.
hit:7677_conv:15355,utterance,speaker,I was in an extremely dangerous abusive relationship at the time and I knew he was intending to put her in the middle of it all.   He intended to use her for leverage over me .
hit:7677_conv:15355,utterance,listener,It sounds like you're talking about two different people there instead of just one person.  I'm a little confused.
hit:7677_conv:15355,utterance,speaker,Oh my I am getting ahead of myself.  I was referring to when I had to put my daughter emerson up for adoption in 2011.
hit:7677_conv:15355,utterance,listener,Ouch that sucks. I'm sorry to hear that.
hit:4193_conv:8387,situation,none,i feel nostalgic going through old boxes in my basement
hit:4193_conv:8387,utterance,speaker,i feel nostalgic going through old boxes in my basement
hit:4193_conv:8387,utterance,listener,What kind of stuff is in there?
hit:4193_conv:8387,utterance,speaker,just old sports uniforms and toys and stuff like that
hit:4193_conv:8387,utterance,listener,"Oh okay, I love going through my old stuff too, it is really fun"
hit:10987_conv:21975,situation,none,I had an awesome childhood. I think about it consistently.
hit:10987_conv:21975,utterance,speaker,My childhood was great. I have mainly positive memories of it.
hit:10987_conv:21975,utterance,listener,"You are very lucky my friend. There are so many children out there that cannot say the same, sadly. But so happy for you!"
hit:10987_conv:21975,utterance,speaker,Yeah life ends up pretty dark for tons of people. It's slightly absurd when you think far into it!
hit:10987_conv:21975,utterance,listener,"I guess it all comes down to karma, if you believe in that stuff...... I do. :)"
hit:7735_conv:15471,situation,none,Everytime I see the Animal Rescue commercials I get so emotional and want to cry.
hit:7735_conv:15471,utterance,speaker,I just saw a commercial about the Rescue Animals. Everytime I see it it makes me so sad.
hit:7735_conv:15471,utterance,listener,oh no. feeling empathy towards them just shows you're normal. There's a lot of people in your boat
hit:7735_conv:15471,utterance,speaker,Yea. It reminds me of my old dog that was a rescue. So many memories. I want to go get one actually.
hit:7735_conv:15471,utterance,listener,whats preventing you?
hit:7735_conv:15471,utterance,speaker,"I started nursing school and work full time, so I wont give much time to it. I want it to be a happy dog."
hit:7735_conv:15471,utterance,listener,you sound too kind. You'd be a great dog mother/father!
hit:7735_conv:15471,utterance,speaker,"Thank you! Im gonna have to not see them commercials anymore, otherwise I will cry"
hit:8390_conv:16780,situation,none,After my mom died I found all our old cassette tapes in her storage unit. It was nice to be able to revisit the music we used to listen to on road trips when I was younger.
hit:8390_conv:16780,utterance,speaker,"After my mom passed away I found all our old cassette tapes in her storage, listening to those was pretty cool."
hit:8390_conv:16780,utterance,listener,Bet that brought back good memories.
hit:8390_conv:16780,utterance,speaker,"Definitely, brought me right back to the road trips we took when I was younger."
hit:8390_conv:16780,utterance,listener,Where did you guys usually go?
hit:8390_conv:16780,utterance,speaker,Everywhere! Sometimes we just hopped in the car and went like two or three hours from home just to do something for the day.
hit:4181_conv:8362,situation,none,i felt nostalgic looking through old photos today
hit:4181_conv:8362,utterance,speaker,i felt nostalgic looking through old photos today
hit:4181_conv:8362,utterance,listener,What were the photos of?
hit:4181_conv:8362,utterance,speaker,just old family photos
hit:4181_conv:8362,utterance,listener,It is good to have those and look at once in awhile
hit:2118_conv:4236,situation,none,I was going through my cloud and found pictures of when i was little.
hit:2118_conv:4236,utterance,speaker,I was looking through my cloud and found some pics of when I was little.
hit:2118_conv:4236,utterance,listener,A walk down memory lane.
hit:2118_conv:4236,utterance,speaker,"Yeah, it makes me miss being at home and around my family."
hit:2118_conv:4236,utterance,listener,Oh I bet! It's always good to cherish those memories.
hit:11851_conv:23703,situation,none,old images from the past wall
hit:11851_conv:23703,utterance,speaker,ever feel so full of emotions when looking at old pictures?
hit:11851_conv:23703,utterance,listener,Yeah.  reminds me of the good old days!
hit:11851_conv:23703,utterance,speaker,"for me it's when you get more than just nostalgia, when you get sad, happy and sentimental"
hit:11851_conv:23703,utterance,listener,Yeah same here.  I remember one time awhile back I took some pictures of when the aliens landed in my backyard.   That was some good times!
hit:8101_conv:16203,situation,none,When I saw my mom after a long time I feel something
hit:8101_conv:16203,utterance,speaker,Do you feel when you see your mom after a long time
hit:8101_conv:16203,utterance,listener,I miss her. You haven't seen your mom in a long time?
hit:8101_conv:16203,utterance,speaker,Why! what is the reason
hit:8101_conv:16203,utterance,listener,"I'm sorry, but I can't understand what you're saying."
hit:8101_conv:16203,utterance,speaker,Are you were near to your mom
hit:2069_conv:4139,situation,none,"When we take a trip, I normally save what some may think of as trash.  I will scrapbook it later."
hit:2069_conv:4139,utterance,speaker,"Anytime we take a trip, I normally save what some people consider trash."
hit:2069_conv:4139,utterance,listener,Another man's trash is another man's treasure! What things do you save?
hit:2069_conv:4139,utterance,speaker,"Just different things that I can scrapbook, mementos from my trip."
hit:2069_conv:4139,utterance,listener,I keep a scrapbook myself! I love collecting stamps. Got any trips planned this year?
hit:4787_conv:9574,situation,none,I found an old picture of me with my grandmother. It brings back good memories.
hit:4787_conv:9574,utterance,speaker,"I was going through some boxes today, and I found a really old picture of me with my grandmother."
hit:4787_conv:9574,utterance,listener,That's nice. Are you going to hang it up?
hit:4787_conv:9574,utterance,speaker,"Yeah, definitely. It brings back really good memories."
hit:4787_conv:9574,utterance,listener,"Great, you've found an old treasure."
hit:5884_conv:11769,situation,none,recently my sister got married
hit:5884_conv:11769,utterance,speaker,one month back my sister got married and she shifted to another state along with her husband
hit:5884_conv:11769,utterance,listener,Well that is great and sad all at the same time. How far away did she move?
hit:5884_conv:11769,utterance,speaker,"we live in texas she moved to newyork area, since then i am missing her presence in the home and feeling little low"
hit:5884_conv:11769,utterance,listener,Aw well that is normal. I'm sure she didn't want to leave. Every day will get a little easier.
hit:5884_conv:11769,utterance,speaker,ya but i am getting to know day by day now that how well i am missing her company
hit:2900_conv:5801,situation,none,I was reading through some of my old school papers.  It transported me to a different time and place
hit:2900_conv:5801,utterance,speaker,I was reading through some old school papers
hit:2900_conv:5801,utterance,listener,Oh yeah? Find anything interesting?
hit:2900_conv:5801,utterance,speaker,It made me think about how far I've come since.  I also felt like I was in a different time and place reading them
hit:2900_conv:5801,utterance,listener,"Ah, nothing quite like that feeling. I remember when I was on the school newspaper. Good times."
hit:4527_conv:9054,situation,none,I wish i could see my father one more time.
hit:4527_conv:9054,utterance,speaker,I wish i could see my father one more time
hit:4527_conv:9054,utterance,listener,im glad i still have mine around.
hit:4527_conv:9054,utterance,speaker,spend as much time as you can with him. you never know when you won't be able to anymore.
hit:4527_conv:9054,utterance,listener,exactly what i do. we were never close growig up. we are now.
hit:3390_conv:6781,situation,none,When I listed to the guitar yesterday I felt some tears coming out.
hit:3390_conv:6781,utterance,speaker,"I was listening to a guitar play the other day, and it made me cry a little."
hit:3390_conv:6781,utterance,listener,Music can be so touching to the soul.
hit:3390_conv:6781,utterance,speaker,"Yes, especially when you don't expect it to be."
hit:3390_conv:6781,utterance,listener,Who was the artist of the song?
hit:3382_conv:6765,situation,none,"I was watching some stray dogs the other day, one of them was full of ticks I felt sorry for her."
hit:3382_conv:6765,utterance,speaker,"I watched a stray dog yesterday that had a lot of tick, I felt bad for her."
hit:3382_conv:6765,utterance,listener,Aw that's so sad! Did you help it?
hit:3382_conv:6765,utterance,speaker,"I didn't, I don't know why, maybe because I hate ticks."
hit:3382_conv:6765,utterance,listener,"I guess that's fair, but I probably would've taken it to the vet."
hit:2133_conv:4267,situation,none,i have good memories when i see photos of my grandmother
hit:2133_conv:4267,utterance,speaker,i have good memories when i see photos of my grandmother
hit:2133_conv:4267,utterance,listener,"Oh yea, I can relate to the good times, is she still alive?"
hit:2133_conv:4267,utterance,speaker,no unfortunately she isnt
hit:2133_conv:4267,utterance,listener,oh no. May her soul rest in peace
hit:4218_conv:8437,situation,none,I miss the days when I didn't have financial worries
hit:4218_conv:8437,utterance,speaker,"Boy, it was nice when I wasn't so poor"
hit:4218_conv:8437,utterance,listener,"Money problems are never fun. Trust me, I know."
hit:4218_conv:8437,utterance,speaker,I'm sorry to hear that :( It'd be nice if work paid better
hit:4218_conv:8437,utterance,listener,"Yeah, definitely. Have you tried asking for a raise?"
hit:6172_conv:12344,situation,none,After my granddad passed I kept his necklace it means so much to me even though I get emotional over it.
hit:6172_conv:12344,utterance,speaker,My granddad means so much to me I still wear his necklace even though he passed.
hit:6172_conv:12344,utterance,listener,"I am sorry for your loss, at least you got some time together"
hit:6172_conv:12344,utterance,speaker,Yes and thank you I know he is close in spirit I get emotional sometimes but the memories we had was great.
hit:6172_conv:12344,utterance,listener,"I feel that way about my grandma, it is sad that by the time we are born they are so old"
hit:6172_conv:12344,utterance,speaker,The time just slips away have to cherish the time we have with them.
hit:4927_conv:9855,situation,none,I'm feeling nostalgic today
hit:4927_conv:9855,utterance,speaker,I'm feeling nostalgic today
hit:4927_conv:9855,utterance,listener,Why's that?
hit:4927_conv:9855,utterance,speaker,I found some old keepsakes in the basement ealier
hit:4927_conv:9855,utterance,listener,Nostalgia is a weird feeling.
hit:10328_conv:20657,situation,none,I was doing a big clear out recently and came accross my high school year book.  It has been many years since I left school and it was wonderul to find it again.  I spent hours going through it and looking at all the people long gone from my life.  Such a feeling of nostalgia and some sadness. Though it evoked happy memories too especially of prom night and our final year leaving party.  Some stories could be told about that!
hit:10328_conv:20657,utterance,speaker,I was doing a big clear out recently and stumbled accross my old high school year book.  It is a long time since I left school and couldnt believe I even still had it.  Such a feeling of nostalgia looking at the old photos and reading the stories.
hit:10328_conv:20657,utterance,listener,Did you guys write still write notes in each others' books in high school?
hit:10328_conv:20657,utterance,speaker,"Yes!  I laughed and sometimes cried a bit reading through those, especially from some old friends that are no longer with here.  It even brought up some great memories of prom and our school leaving party."
hit:10328_conv:20657,utterance,listener,It's amazing how many feelings and memories mementos like that can bring back.
hit:10328_conv:20657,utterance,speaker,Indeed.  It definitely made my clear out day much more enjoyable.
hit:10_conv:20,situation,none,I had just moved to Texas and my boyfriend took me to Kemah boardwalk. It made me think of times I spent vacationing back home.
hit:10_conv:20,utterance,speaker,I went to the Kemah boardwalk with my boyfriend. It made me think of times I went vacationing with my family.
hit:10_conv:20,utterance,listener,My last vacation went horribly wrongQ!
hit:10_conv:20,utterance,speaker,All I thought about was being at home again and being able to relive those moments.
hit:10_conv:20,utterance,listener,Yes I love to reminice
hit:9827_conv:19655,situation,none,My husband is in the service so when he is away I sleep in his shirt to feel close to him it is so dear and tender to me.
hit:9827_conv:19655,utterance,speaker,My husband is in the service and he leaves when on active duty I be missing him so much.
hit:9827_conv:19655,utterance,listener,Have you hugged him recently?
hit:9827_conv:19655,utterance,speaker,No he has been gone for 5 months now I can't wait to hug him though so for now I sleep in his shirts it seems like the closet I can get and it is so dear to me to wear it.
hit:9827_conv:19655,utterance,listener,"I'm sorry to hear that, he is a brave man."
hit:9827_conv:19655,utterance,speaker,Thank You he is very just 2 more months and me and our kids get to see him.
hit:10075_conv:20151,situation,none,I found an old stamp booklet my girlfriend and I filled out before we started dating. I felt so warm and fuzzy on the inside.
hit:10075_conv:20151,utterance,speaker,I found an old stamp booklet my girlfriend and I filled out before we started dating.
hit:10075_conv:20151,utterance,listener,That's very sweet! I bet it brought up a lot of feelings inside you.
hit:10075_conv:20151,utterance,speaker,"Definitely. I felt so warm and fuzzy on the inside, and so did she when I sent her a snapchat of it."
hit:10075_conv:20151,utterance,listener,You guys sound like you have a solid relationship. It's always great to find those little pieces from the early days.
hit:416_conv:832,situation,none,"I was looking through some of my sons old toys, and I felt sentimental and couldn't give them away"
hit:416_conv:832,utterance,speaker,"Don't you hate when you have to give stuff away and then can't? Well, that happened to me recently. I was going to give away some of my son's old toys, but started looking at then and realized that I need to keep them for no other reason than that I was being sentimental"
hit:416_conv:832,utterance,listener,"That's too funny. You know, I'm the exact same way.. I get so nostalgic with my old things. Can never throw them away!"
hit:416_conv:832,utterance,speaker,I know! I am always like I need this notebook that has my 3rd grade handwriting back from the 90s because it will be very useful someday... lol
hit:416_conv:832,utterance,listener,"Yes, someday... Haha. I love looking back at those kinds of things. It brings back so many good memories. Such a good feeling"
hit:4680_conv:9360,situation,none,I always get sad thinking about my mom.. She passed away when i was 12.
hit:4680_conv:9360,utterance,speaker,I always feel down and blue when memories of my mom come in my mind.. she passed when i was 12
hit:4680_conv:9360,utterance,listener,I'm so sorry to hear that. Do you have things of hers that remind you of her often?
hit:4680_conv:9360,utterance,speaker,"Yeah.. i have kept a collection of her things, just so that she always stays in my life."
hit:4680_conv:9360,utterance,listener,That is beautiful that you have those things of hers. Mothers are very special people.
hit:10399_conv:20798,situation,none,I keep a stuffed animal I've had since I was young around.  It's still in pretty good condition and reminds me a lot of my childhood.
hit:10399_conv:20798,utterance,speaker,I still have a favorite stuffed animal of mine that I've had since I was young.  It's still in pretty good condition and reminds me a lot of my childhood.
hit:10399_conv:20798,utterance,listener,That is so sweet. It is wonderful to have things that bring back these beautiful memories.
hit:10399_conv:20798,utterance,speaker,"Yeah, it is.  I always like to keep things that mean a lot to me and this was a gift from my mom so it's even more special."
hit:10399_conv:20798,utterance,listener,That really does make it special. I'm glad you have that.
hit:10090_conv:20181,situation,none,I found my old yearbooks in a closet while I was packing up to move. It's weird to see how far my friends and I have come in the past years.
hit:10090_conv:20181,utterance,speaker,"I was packing up my house to move, and found my old yearbooks! It's so weird to look back and see how far everyone I knew in high school has come."
hit:10090_conv:20181,utterance,listener,"Aww, that sounds interesting!  Are you in touch with many people from high school?"
hit:10090_conv:20181,utterance,speaker,"A couple people. Fewer as the years go by, unfortunately."
hit:10090_conv:20181,utterance,listener,I get that.  It's weird when I forget the name of someone I knew for years.
hit:10713_conv:21427,situation,none,I found some pictures of my dog I had to put down. I miss her.
hit:10713_conv:21427,utterance,speaker,I  found some pictures of my dog I had to put down. I miss her
hit:10713_conv:21427,utterance,listener,"I lost my dog last year, I miss her too."
hit:10713_conv:21427,utterance,speaker,Dogs are too good to us
hit:10713_conv:21427,utterance,listener,"I agree, they are the best."
hit:10519_conv:21039,situation,none,I had a lot of feelings when I found pictures of my dog who has passed.
hit:10519_conv:21039,utterance,speaker,I had a lot of feelings when I found pictures of my dog who has passed.
hit:10519_conv:21039,utterance,listener,It's always difficult losing a pet.  I'm sure you had a flood of positive memories and sadness than they're gone
hit:10519_conv:21039,utterance,speaker,It was very bittersweet. She could not work her legs anymore due to age.
hit:10519_conv:21039,utterance,listener,You just have to remember what a good life she had with you!
hit:10503_conv:21007,situation,none,Saw an old cassette of my cousins fifteens and I saw my mother before she passed away. I felt nice seeing her again.
hit:10503_conv:21007,utterance,speaker,"Saw an old cassette of my cousins fifteens and saw my mother before she passed away, felt nice seeing her on video again."
hit:10503_conv:21007,utterance,listener,Oh I'm so sorry but I bet that was very special of you to find.
hit:10503_conv:21007,utterance,speaker,Yeah sadly we don't have many videos of her but the few we have we keep them safe and stored.
hit:10503_conv:21007,utterance,listener,I would definitely make digital copies and upload to a cloud or a disk in case something happens.
hit:9006_conv:18012,situation,none,I keep the ticket stub of my first concert in my wallet.  It reminds me of good times with my friends.
hit:9006_conv:18012,utterance,speaker,I carry around the ticket stub from the first concert I attended in my wallet.  It brings back good memories I had spending time with my friends.
hit:9006_conv:18012,utterance,listener,"Aww, that's really sweet and sentimental. I like that. Can you still read the words on it?"
