Dialog_ID,Type,Actor,Text
hit:9721_conv:19443,utterance,speaker,I visited my old high school yesterday
hit:9721_conv:19443,utterance,listener,That had to be a weird feeling.  How was it?
hit:9721_conv:19443,utterance,speaker,I was suprised. It really brought back a lot of fond memories.
hit:9721_conv:19443,utterance,listener,"I can imagine.  Ive never been back to mine, but i can still picture in my mind what it looks like"
hit:10193_conv:20386,situation,none,"When I see how quickly my son is growing, it makes me appreciate the time I have with him. I want to make the most of it."
hit:10193_conv:20386,utterance,speaker,"I have a son who's 8 months old! I get so nostalgic about how quickly time has passing, and it hasn't even been a year!"
hit:10193_conv:20386,utterance,listener,"Yeah, it's crazy how each year seems to go by faster than the last too, having kids must be surreal"
hit:10193_conv:20386,utterance,speaker,Yes they grow so fast! It really motivates me to make the most of the time we have though.
hit:10193_conv:20386,utterance,listener,"Me too, it's like you realize more and more that all you have is the present moment."
hit:4138_conv:8276,situation,none,i was looking at pictures of my kids the other day and got a little sad
hit:4138_conv:8276,utterance,speaker,i was looking at pictures of my kids the other day and got a little sad
hit:4138_conv:8276,utterance,listener,S it because they are getting bigger?
hit:4138_conv:8276,utterance,speaker,yea i wish they didnt grow up
hit:4138_conv:8276,utterance,listener,I feel you. My 13 year old is the worst.
hit:6089_conv:12179,situation,none,I saw a picture of my mom. It made me miss her
hit:6089_conv:12179,utterance,speaker,I saw a picture of my mom today. It made me miss her
hit:6089_conv:12179,utterance,listener,"Aw, yeah I've been missing my Mom lately as well."
hit:6089_conv:12179,utterance,speaker,I guess memories are always nice of them
hit:6089_conv:12179,utterance,listener,"Hopefully your mom hasn't passed away, and you just haven't visited her in a while."
hit:10063_conv:20127,situation,none,I miss my old dog. I was thinking about getting another one but it won't be the same.
hit:10063_conv:20127,utterance,speaker,"I miss my old dog, I was thinking about getting another one but I'm not sure."
hit:10063_conv:20127,utterance,listener,How long has it been since you had your old dog?
hit:10063_conv:20127,utterance,speaker,"It's been 2 years, so I'm out of the habit of walking, cleaning, etc."
hit:10063_conv:20127,utterance,listener,It might take a bit of time to get back into the swing of owning a dog. I'm sure you'll be ready soon if you still think it over.
hit:7223_conv:14447,situation,none,My dad bought me a necklace and put his 21st birthday charm on it. I wear it every single day now.
hit:7223_conv:14447,utterance,speaker,My dad gave me this necklace and I wear it every single day now.
hit:7223_conv:14447,utterance,listener,You must be very happy now.
hit:7223_conv:14447,utterance,speaker,Yeah I really like it.
hit:7223_conv:14447,utterance,listener,I hope you keep it forever.
hit:2544_conv:5088,situation,none,I found an old box with my baby's umbilical cord stump in it and it brought back memories.
hit:2544_conv:5088,utterance,speaker,I found my baby's unbmilical cord stump in an old box and it reminded me of when he was little and ne w.
hit:2544_conv:5088,utterance,listener,"Aww, that is so sweet."
hit:2544_conv:5088,utterance,speaker,"It made me feel so many memories, haha, it's always fun to feel that."
hit:2544_conv:5088,utterance,listener,You are lucky to still have that.
hit:2192_conv:4385,situation,none,I feel bad for parents who can't afford school clothes for their children.
hit:2192_conv:4385,utterance,speaker,It makees me sad that some people can't afford school clothes for their children.
hit:2192_conv:4385,utterance,listener,That makes me sad too. I wish there was more I could do to help out.
hit:2192_conv:4385,utterance,speaker,I donated supplies this year. Maybe next year I will be able to donate uniforms.
hit:2192_conv:4385,utterance,listener,That's a good idea!
hit:2192_conv:4385,utterance,speaker,"I hope I can afford it, but I definitely will if I can."
hit:7889_conv:15779,situation,none,I read the best book the other day! It made me cry so hard and I was so emotional the rest of the day!
hit:7889_conv:15779,utterance,speaker,I read the best book the other day!
hit:7889_conv:15779,utterance,listener,Awesome! What was the name of the book?
hit:7889_conv:15779,utterance,speaker,The Notebook.  It made me cry so hard and I was so emotional the rest of the day!
hit:7889_conv:15779,utterance,listener,Didn't they make a movie from that book?
hit:11018_conv:22036,situation,none,When I think about my high school days it can really bring up some fond memories.
hit:11018_conv:22036,utterance,speaker,"Hey, how's it going? I was just thinking about my highschool days & I got really emotional."
hit:11018_conv:22036,utterance,listener,"Aw, really? Was it a long time ago, or did you graduate recently?"
hit:11018_conv:22036,utterance,speaker,"Oh, it was a loooooong time ago, actually. I was just remembering all the good times when I was a cheerleader, all the games we won & lost & all the great friendships."
hit:11018_conv:22036,utterance,listener,I graduated a long time ago too -- 1985. Those were great times for me too. I feel sentimental about it.
hit:4070_conv:8141,situation,none,When I was little my grandma gave me a little ceramic cat. I still keep it on display in my room because it reminds me of her.
hit:4070_conv:8141,utterance,speaker,When I was little my grandma gave me a little ceramic cat.
hit:4070_conv:8141,utterance,listener,"That is awesome, what kind of cat was it?"
hit:4070_conv:8141,utterance,speaker,"I am not sure, just a little black and white one. I still keep it on display in my room because it reminds me of her."
hit:4070_conv:8141,utterance,listener,"That is great, make sure you pass it on to your kids as well!"
hit:11982_conv:23964,situation,none,When I came across my parents old wedding rings.
hit:11982_conv:23964,utterance,speaker,The other day I was cleaning out a bin and came across my parents wedding rings.
hit:11982_conv:23964,utterance,listener,Uh oh! That is not a good sign! Do you think they are going to call it quits?
hit:11982_conv:23964,utterance,speaker,They passed away about 8 years ago so it was just a memory that I came across of them.
hit:11982_conv:23964,utterance,listener,It is good to have these kinds of keep sakes. Maybe the rings can even be used again in a family wedding.
hit:7749_conv:15499,situation,none,"I went to St. Augustine, where I had visited as a child. It made me think of my family trip there when I was younger."
hit:7749_conv:15499,utterance,speaker,"I went to St. Augustine when I was a child. When we went back again, I really enjoyed it, especially because I kept remembering what it was like when I was a child."
hit:7749_conv:15499,utterance,listener,What did you do there?
hit:7749_conv:15499,utterance,speaker,We went to the fort and to many museums. It is a fascinating place!
hit:7749_conv:15499,utterance,listener,That sounds like a lot of fun! I have never been there
hit:4668_conv:9336,situation,none,"I get sentimental about my brothers, they are very important to me"
hit:4668_conv:9336,utterance,speaker,"I get sentimental about my brothers, they are very important to me"
hit:4668_conv:9336,utterance,listener,"I completely understand your point, even i get emotional about my family"
hit:4668_conv:9336,utterance,speaker,"I guess everyone probably does, but still"
hit:4668_conv:9336,utterance,listener,"And we should.. family comes above all, right?"
hit:9592_conv:19184,situation,none,I wa just going through some of my old things at my parents house. I cam across my old school uniform. I did not want to get rid of it.
hit:9592_conv:19184,utterance,speaker,I was getting rid of some stuff at my parents house and came across my old school uniform. I couldnt part with it.
hit:9592_conv:19184,utterance,listener,did it bring back a lot of memories?
hit:9592_conv:19184,utterance,speaker,It just reminded me of a simpler time. Just having fun with friends I made back then.
hit:9592_conv:19184,utterance,listener,yeah there's nothing like the good old days
hit:11178_conv:22357,situation,none,I recently drove past my old high school and had a nostalgic feeling. I started thinking back to when I was a teenager and memories of my old friends.
hit:11178_conv:22357,utterance,speaker,I recently had to go to my old High School. And as soon as I walked in I started thinking back to my teen years.
hit:11178_conv:22357,utterance,listener,"Very cool, was it for a high school reunion?  Hopefully it brought up good memories!"
hit:11178_conv:22357,utterance,speaker,The memories were good. I was invited by the football coach to talk to the football team.
hit:11178_conv:22357,utterance,listener,Awesome!  Hopefully you gave them the motivation they needed for the new year!
hit:11178_conv:22357,utterance,speaker,"Hopefully, and thank you!"
hit:5824_conv:11649,situation,none,I am finding it difficult to sell my old car.
hit:5824_conv:11649,utterance,speaker,"I am finding it really difficult to sell my old, vintage car."
hit:5824_conv:11649,utterance,listener,Why is that?
hit:5824_conv:11649,utterance,speaker,I think its because I am sentimentally attached to it! It belonged to my late grandfather.
hit:5824_conv:11649,utterance,listener,"I know how you feel, you don't have to sell it buddy"
hit:12131_conv:24263,situation,none,"I really miss my man, he went on a business trip to Europe. So I am here wearing his shirt."
hit:12131_conv:24263,utterance,speaker,I really miss my man. He went on a business trip to Europe so I am here in his shirt.
hit:12131_conv:24263,utterance,listener,That no good!  How long will he be gone?
hit:12131_conv:24263,utterance,speaker,He will be gone for two weeks but it feels like 2 years.
hit:12131_conv:24263,utterance,listener,Just hold on a little longer!  You will feel better when he gets back!
hit:12131_conv:24263,utterance,speaker,"Yes, absence makes the heart grows fonder."
hit:1010_conv:2021,situation,none,I miss being a kid. Adulting is terrible
hit:1010_conv:2021,utterance,speaker,I miss being a kid.
hit:1010_conv:2021,utterance,listener,"I do too honestly, I used to play all these fun games with our neighbors late summer nights, it was amazing, but I took it for granted"
hit:1010_conv:2021,utterance,speaker,I am tired of paying bills lol.
hit:1010_conv:2021,utterance,listener,"I hear you there, that is the worst part!"
hit:1010_conv:2021,utterance,speaker,Things should be cheaper
hit:1878_conv:3756,situation,none,"I get sentimental about my brothers, they are very important to me"
hit:1878_conv:3756,utterance,speaker,"I get sentimental about my brothers, they are very important to me"
hit:1878_conv:3756,utterance,listener,Blood is blood.
hit:1878_conv:3756,utterance,speaker,"That is true, it is thicker than water"
hit:1878_conv:3756,utterance,listener,That is correct. It painful to see your loved ones been hurt
hit:9549_conv:19099,situation,none,I don't want to sell my grandfathers old Cadillac
hit:9549_conv:19099,utterance,speaker,I don't want to sell my grandfathers old Cadillac for some reason.
hit:9549_conv:19099,utterance,listener,"I can understand, I'm sure it has sentimental value."
hit:9549_conv:19099,utterance,speaker,Yes I think that might be it. Its an old beater but it always reminds me of my grandfather riding around in it.
hit:9549_conv:19099,utterance,listener,"I would probably keep it if I were you, more sentimental value than cash value anyway."
hit:3068_conv:6136,situation,none,I really miss the road trips I took as a kid.
hit:3068_conv:6136,utterance,speaker,I really miss the road trips I took as a kid.
hit:3068_conv:6136,utterance,listener,"i love taking trips, where was your favorite place to go'?"
hit:3068_conv:6136,utterance,speaker,I love going to Las Vegas.
hit:3068_conv:6136,utterance,listener,ive been there several times but its not my favorite place
hit:10837_conv:21674,situation,none,I saw my stepmother for the first time in 15 years since my daddy passed away.
hit:10837_conv:21674,utterance,speaker,I saw my stepmother for the first time in 15 years since my daddy passed away. It was totally unplanned and It was quite a shock to see her.
hit:10837_conv:21674,utterance,listener,"Oh wow, It must have been quite an overwhelming experience for both of you"
hit:10837_conv:21674,utterance,speaker,Most definitely. It brought a lot of pain to the surface that I thought I had gotten past. I seem to be dwelling a bit now.
hit:10837_conv:21674,utterance,listener,Congrats because I know you will definitely overcome the pains
hit:10837_conv:21674,utterance,speaker,Eventually. There a good memories mixed in there that I can recall fondly too. Sentiment is like that...you can smile while you're crying
hit:5795_conv:11590,situation,none,I found it difficult to throw away my old cutlery collection.
hit:5795_conv:11590,utterance,speaker,"I am finding it difficult to throw away my old, antique cutlery collection."
hit:5795_conv:11590,utterance,listener,Why is that?
hit:5795_conv:11590,utterance,speaker,I guess I am just sentimentally attached to it
hit:5795_conv:11590,utterance,listener,I know how you feel. You don't have to let go of them because the value you place on them can be carried forward for generations and that will make them priceless
hit:12345_conv:24691,situation,none,My grandfather gave me a pocket watch he has had for years
hit:12345_conv:24691,utterance,speaker,My grandpa gave me his pocket watch
hit:12345_conv:24691,utterance,listener,That was very nice of him.
hit:12345_conv:24691,utterance,speaker,Yep he got it in Bangladesh in 1937
hit:12345_conv:24691,utterance,listener,"Wow, that is a wonderful keepsake from him. I bet you really cherish it."
hit:2524_conv:5049,situation,none,Got a gift from a friend from Brazil
hit:2524_conv:5049,utterance,speaker,We sent off our brazilian foreign exchange student last year.  In line at the airport she gave me her necklace to keep.
hit:2524_conv:5049,utterance,listener,That was nice of her.
hit:2524_conv:5049,utterance,speaker,Yeah we had a fun year.  I miss her :(
hit:2524_conv:5049,utterance,listener,Do you stay in touch?
hit:2524_conv:5049,utterance,speaker,Yeah we talk on the whatsapp messenger every day or so
hit:7761_conv:15523,situation,none,One of my friend shared a post of Syrian children being hit by bombs on Facebook. I feel so sad for those innocent children
hit:7761_conv:15523,utterance,speaker,I saw a Facebook post depicting suffering Syrian children that my friend shared on Facebook. I feel so sad for those innocent kids
hit:7761_conv:15523,utterance,listener,That's very sad.  Are you planning on going to syria to help them?
hit:7761_conv:15523,utterance,speaker,I am not planning at all and I do not have financial means to do so. But i hope the war would end soon and peace would bring them some relief
hit:7761_conv:15523,utterance,listener,It could end today if everyone came to an agreement.
hit:4031_conv:8062,situation,none,I opened an old box of my grandfathers possessions that I was given after he passed away and found his watch that he always wore.  I became really nostalgic and thought of all the good times I had with him.
hit:4031_conv:8062,utterance,speaker,I opened an old box of my grandfathers possessions that I was given after he passed away and found his watch that he always wore. I became really nostalgic and thought of all the good times I had with him.
hit:4031_conv:8062,utterance,listener,It is always good to take the time to reflect on happy memories.  I do that from time to time myself
hit:4031_conv:8062,utterance,speaker,"Yeah, it make me smile and appreciate the time I did have with him."
hit:4031_conv:8062,utterance,listener,I am glad you were able to look back fondly and remember that good times.
hit:3118_conv:6236,situation,none,I remember me and my sister being best friends as kids. We hardly ever speak now.
hit:3118_conv:6236,utterance,speaker,Me and my sister were so close growing up.
hit:3118_conv:6236,utterance,listener,Are you still close?
hit:3118_conv:6236,utterance,speaker,We hardly ever speak. I miss those days.
hit:3118_conv:6236,utterance,listener,That's sad. Have you reached out to her?
hit:3118_conv:6236,utterance,speaker,I see ger maybe once a month.
hit:3118_conv:6236,utterance,listener,That's not bad. I only see people in my family once ever few years.
hit:3118_conv:6236,utterance,speaker,That sucks
hit:11650_conv:23300,situation,none,seeing my son grow up is bittersweet! i want him to be little forever but its so awesome to see him grow!
hit:11650_conv:23300,utterance,speaker,"my son is growing up so fast, its bittersweet i miss my boy being little!"
hit:11650_conv:23300,utterance,listener,I understand. They are so cute when they are toddler. How old he is now?
hit:11650_conv:23300,utterance,speaker,he is about to be 2 and is getting to be a handful lo
hit:11650_conv:23300,utterance,listener,Great :)
hit:10359_conv:20718,situation,none,My father had just passed away and we were going through his things. I found a box and he had kept every single card that I had given to him since I was born.
hit:10359_conv:20718,utterance,speaker,Have you lost a parent?
hit:10359_conv:20718,utterance,listener,i have. have you?
hit:10359_conv:20718,utterance,speaker,"Yeah, I found out while going through my fathers things that he kept everything I had every handmade for him."
hit:10359_conv:20718,utterance,listener,aw that's great. you're lucky to have a father who cared like that. mine never did
hit:12302_conv:24604,situation,none,My brother got hurt badly and i felt so heartfelt for him.
hit:12302_conv:24604,utterance,speaker,My brother was hurt the other day and i felt so bad.
hit:12302_conv:24604,utterance,listener,How did he get hurt?
hit:12302_conv:24604,utterance,speaker,He fell down and busted his head open. My life kind of changed. I felt so much care for him.
hit:12302_conv:24604,utterance,listener,That happened to me a few weeks ago. I was severely dehydrated and I fainted. I hit the ground hard.
hit:12302_conv:24604,utterance,speaker,Oh no! Are you OK?
hit:12302_conv:24604,utterance,listener,I am now. Had to get stitched up.
hit:8515_conv:17031,situation,none,"I've been going through old photos and trying to figure out how to store them.  I found a lot of my kids when they were babies, I cannot believe they are 18 and 16 now!"
hit:8515_conv:17031,utterance,speaker,"I've been going through old photos and trying to figure out how to store them, but then I just spend half the time crying."
hit:8515_conv:17031,utterance,listener,brought back good memories?
hit:8515_conv:17031,utterance,speaker,"Yes, tons of photos of my girls when they were babies.  I cannot believe they are 16 and 18 now."
hit:8515_conv:17031,utterance,listener,they grow up so fast.
hit:5503_conv:11006,situation,none,I miss taking my kids for actual portraits in the studio. I love looking at those pictures and remembering the experience
hit:5503_conv:11006,utterance,speaker,I used to love taking my kids to the portrait studio.
hit:5503_conv:11006,utterance,listener,Why do you not like it anymore?
hit:5503_conv:11006,utterance,speaker,We don't have time. The pictures are great but seeing them reminds me of the experience too.
hit:5503_conv:11006,utterance,listener,"Oh, that is no fun, but at least you have the memories!"
hit:5503_conv:11006,utterance,speaker,yeah. We have a lot
hit:1899_conv:3798,situation,none,"I get sentimental about my brothers, they are very important to me"
hit:1899_conv:3798,utterance,speaker,"I get sentimental about my brothers, they are very important to me"
hit:1899_conv:3798,utterance,listener,are they alive or gone ?
hit:1899_conv:3798,utterance,speaker,"they are here, hopefully for my whole life"
hit:1899_conv:3798,utterance,listener,yes they will believe in it
hit:8007_conv:16015,situation,none,"I was looking at some of the old photos I have of my grandpa. He passed away, so I've been reminiscing over him."
hit:8007_conv:16015,utterance,speaker,"My grandfather passed away over a year ago, and I was looking at some of the older photos I have of him and I as a kid."
hit:8007_conv:16015,utterance,listener,I'm so sorry. I know that must be very difficult for you. It's nice that you have pictures to look at and remember old times together.
hit:8007_conv:16015,utterance,speaker,"I have a very bad memory, so you're right. The pictures really help me remember times I really enjoyed with my grandfather when I was young."
hit:8007_conv:16015,utterance,listener,Pictures are a great way to remember the past. I treasure every picture. Each holds a special memory.
hit:4047_conv:8095,situation,none,I got high once I was home alone. I smoked a lot of weed and I was really paranoid
hit:4047_conv:8095,utterance,speaker,I was feeling rather anxious the other day because I smoked a ton of pot
hit:4047_conv:8095,utterance,listener,Were you doing it in a public place? Weed can do that to someone.
hit:4047_conv:8095,utterance,speaker,No I was home alone. I kept on fearing that I would get caught if someone came home
hit:4047_conv:8095,utterance,listener,You may want to smoke less next time. Do it in moderation.
hit:3025_conv:6051,situation,none,I got a box of my old toys from when I was a kid.
hit:3025_conv:6051,utterance,speaker,A found a box of my old toys from when I was a kid.
hit:3025_conv:6051,utterance,listener,I bet that was fun to look through
hit:3025_conv:6051,utterance,speaker,"It was cool, I got to see a bunch of stuff I haven't looked at in decadews."
hit:3025_conv:6051,utterance,listener,That would be cool.  Are you going to keep them?
hit:3025_conv:6051,utterance,speaker,Most of them.  A few i'm going to toss.
hit:10131_conv:20263,situation,none,"As I get older, the more I remember my childhood"
hit:10131_conv:20263,utterance,speaker,"My daily life consists of getting up, going to work or going to college. I miss being young and spending my day playing videogames and playing outside"
hit:10131_conv:20263,utterance,listener,Those times seemed much simpler didn't they? Do you ever break out of the routine?
hit:10131_conv:20263,utterance,speaker,"If im not studying or working I usually go out for a run, practice piano or do surveys online to make some extra cash"
hit:10131_conv:20263,utterance,listener,I see. How do you like playing the piano?
hit:10131_conv:20263,utterance,speaker,"Its hard at first, but with practice comes perfection."
hit:10131_conv:20263,utterance,listener,That's the spirit. I bet you're a wonderful pianist.
hit:9142_conv:18285,situation,none,"I've been feeling so down, I miss my family. I think it's time to go visit."
hit:9142_conv:18285,utterance,speaker,"I've been feeling so down, I miss my family. I think it's time to go visit."
hit:9142_conv:18285,utterance,listener,"I think it is, that might make you feel better"
hit:9142_conv:18285,utterance,speaker,Yes It's been a while
hit:9142_conv:18285,utterance,listener,Its the perfect time to go see them then
hit:11656_conv:23312,situation,none,I love spending time with my family. I love them so much.
hit:11656_conv:23312,utterance,speaker,I love spending time with my family. I love them so much.
hit:11656_conv:23312,utterance,listener,That's so sweet! I love my family too! What are some things you like to do together?
hit:11656_conv:23312,utterance,speaker,"During summer, we like going to water parks, parks and we like playing soccer. And you?"
hit:11656_conv:23312,utterance,listener,That sounds like fun! We like to play baseball and go to the beach! Family time is great!
hit:8913_conv:17827,situation,none,I was going through a box with old papers in it and I found some old letter my Grandpa wrote me when I was a child.
hit:8913_conv:17827,utterance,speaker,I was going through a box with old papers in it and I found some old letter my Grandpa wrote me when I was a child.
hit:8913_conv:17827,utterance,listener,That's really cool. Did it bring back good memories?
hit:8913_conv:17827,utterance,speaker,It did! He has since passed away so it made me really miss him.
hit:8913_conv:17827,utterance,listener,I'm very sorry for your loss. I'm glad you have the letter from him though.
hit:6765_conv:13530,situation,none,When my partner bought my a birthday present it made me very emotional.
hit:6765_conv:13530,utterance,speaker,"My partner bought me a gift for my birthday, I wasn't expecting it."
hit:6765_conv:13530,utterance,listener,That is very thoughtful.  Happy Birthday! What did you get from your partner?
hit:6765_conv:13530,utterance,speaker,Thank You! They bought me an echo dot.
hit:6765_conv:13530,utterance,listener,Wow!  Now that's one cool gift if I may say so myself.
hit:1799_conv:3598,situation,none,"My grandmother is the prson that taught me how to cook. She is at the age now where she doesn't cook much anymore. Recently, she gave me all of her cookbooks and her apron."
hit:1799_conv:3598,utterance,speaker,My grandmother is the person that taught me how to cook.
hit:1799_conv:3598,utterance,listener,Nice!  What is your favorite dish that she taught you?
hit:1799_conv:3598,utterance,speaker,"Meatloaf. Sadly, she's at the age where she can't cook much anymore."
hit:1799_conv:3598,utterance,listener,Awww I am sorry.  At least she showed you how to make it!
hit:1799_conv:3598,utterance,speaker,Yeah. She recently gave me all of her cookbooks and her apron.
hit:11691_conv:23383,situation,none,I felt so good when i found out my brother will live after cancer.
hit:11691_conv:23383,utterance,speaker,My borother was able to beat cancer!
hit:11691_conv:23383,utterance,listener,"That's awesome, go him! I bet you and your family are excited."
